User,Reter,Comment,Votes,Time,Count
@亲亲我爱青青,,特别喜欢这一对，看他们甜就是了，能作的的年纪就作吧！雨我无瓜！#若风立遗嘱#,0,2019-09-21 23:31,1
@沉迷盲仔的琳琳萎,,大鼻子都这样了吗 哎 天呐 以前的落地金身卡牌我到现在都记忆犹新,0,2019-09-21 23:30,2
@最美的最棒的,,我觉得是有点早，若风一定要好好照顾自己的身体啊,1,2019-09-21 23:28,1
@酷的good,,我觉得还好吧，反正我们现在也没有多少钱,0,2019-09-21 23:28,1
@纯粹很有品的凯源呀,,我没有钱给立遗嘱，那......那我的负债有人继承吗？,0,2019-10-15 10:44,3
@汤圆是只丑猫,,我能立的大概就是：支付宝花呗xxx未还，信用卡卡号，xxx未还。我死后请注意还款,0,2019-09-23 01:05,3
@我呀旺仔,,人家立遗嘱我立债主,0,2019-09-22 20:37,3
@可可玉米茶,,哈哈哈哈哈哈遗嘱这个词 很适合出现在电视里 在病床上奄奄一息的富贵老头,0,2019-09-22 16:55,3
@贝克街旁de圆形广场,,我觉得跟几零后没关系，有钱啥时候立都行，没钱立个鸡毛,0,2019-09-22 14:18,3
@今天睡到居老师了嘛,,我的锅碗瓢盆给我爸，爸爸做饭好吃，桌椅床铺给我妈，我的床舒服，至于我弟弟，就,1,2019-09-22 14:09,4
@吃瓜群众樱桃啊,,立什么遗嘱，国家还要拿走你一半儿的税,0,2019-09-22 13:54,3
@纯粹很有品的凯源呀,,我没有钱给立遗嘱，那......那我的负债有人继承吗？,0,2019-10-15 10:44,3
@汤圆是只丑猫,,我能立的大概就是：支付宝花呗xxx未还，信用卡卡号，xxx未还。我死后请注意还款,0,2019-09-23 01:05,3
@我呀旺仔,,人家立遗嘱我立债主,0,2019-09-22 20:37,3
@可可玉米茶,,哈哈哈哈哈哈遗嘱这个词 很适合出现在电视里 在病床上奄奄一息的富贵老头,0,2019-09-22 16:55,3
@贝克街旁de圆形广场,,我觉得跟几零后没关系，有钱啥时候立都行，没钱立个鸡毛,0,2019-09-22 14:18,3
@今天睡到居老师了嘛,,我的锅碗瓢盆给我爸，爸爸做饭好吃，桌椅床铺给我妈，我的床舒服，至于我弟弟，就,1,2019-09-22 14:09,4
@吃瓜群众樱桃啊,,立什么遗嘱，国家还要拿走你一半儿的税,0,2019-09-22 13:54,3
@阳哥021,,我参与了@会火 发起的投票【你怎么看待90后立遗嘱？】，我投给了“不需要，时间还早”这个选项，你也快来表态吧~,0,2019-09-22 13:46,3