User,Reter,Comment,Votes,Time,Count
@-You-Niverse-,,谭咏麟…？我没看错吧,0,2019-09-23 22:37,1
@乐天凉粉,,这就是言论自由？香港就是笑话,0,2019-09-23 21:58,1
@云亲小栈,,你放心，以后他都别想做生意。,0,2019-09-23 21:28,1
@春城草色近却无,,封店,0,2019-09-23 20:28,1
@用户NnJm,,来大陆喝，谭爷,0,2019-09-23 20:15,1
@无敌超级不靠谱的非物质文化遗产,,做生意的做政治文章 就是脑子秀逗,0,2019-09-23 19:47,1
@风花雪月92718,,香港越作死得越快,1,2019-09-23 19:43,1
@一颗柯柯,,拉黑,0,2019-09-23 19:42,1
@CAPTAIN_ZACK,,大陆的生意绝缘了,0,2019-09-23 18:56,1
@守华护夏,,两治确保了和平收回香港，保全香港不受战火洗礼，也确保了一国关系，但不花代价的事情，永会有人不爱护，无所谓的态度和放纵暴徒的行为一样会使香港受损，早安稳早安心，港人们，擦亮你的眼睛，不再傻了，美爹很烦，英娘很忙，没人会因为你会表演个钻个火圈，贴纸条，说人话再乎你！就在外面遛弯别回来,0,2019-09-23 18:35,1
@______兔宝,,要吃啥来大陆吃！有啥了不起的,0,2019-09-23 18:31,1
@疯子眼里小丑最美iiiiiiiiiii,,继续造谣!,0,2019-09-23 17:42,1
@凄凄惨惨小子弹,,我其实有点怀疑他们怕不是被集体下降头了，不然为什么智商这么。。。。,1,2019-09-23 16:43,1
@其斤九日,,有能耐离开香港 ！那才厉害呢,0,2019-09-23 16:11,1
@loveuboat,,有没有安插进黄尸群的内线？鼓动鼓动黄尸们去这些店面的街上闹闹，让他们尝尝门可罗雀无生意可做的窘境。保管把他们治的服服帖帖的。,0,2019-09-23 15:34,1
@木子lgxhjyhhx,,黑店，小心踩雷。 评论配图,0,2019-09-23 15:25,1
@悠米酱酱紫,,又宣传了一波,0,2019-09-23 14:42,1
@HaPennG,,他们既然分得怎么清楚，我觉得还是很有必要要把他们名单列出来的。,0,2019-09-23 14:41,1
@李想的真多,,谭老师说他自己都不知道这个事情呀？他说的是没有空位，请他走的，评论的都不看图片中讲的什么东西吗？,0,2019-09-23 14:33,1
@小花朵和糖,,无非就是怕受牵连，说去港独餐厅吃饭,0,2019-09-23 14:33,1
@我也想要泡泡机,,所以香港的普通民众到底是怎么想的,0,2019-09-23 14:32,1
@余树涛428,,这叫不同政见?这叫卖国,0,2019-09-23 14:07,1
@朵朵家的喵,,支持一个中国,0,2019-09-23 14:02,1
@小新是只小吃货,,挺校长！,0,2019-09-23 13:49,1
@爆红女鞋,,这个是假新闻的，谭咏麟自己都表示不知道这件事,0,2019-09-23 13:46,1
@程顺MichaelJerry,,！！！:knnmm,0,2019-09-30 19:30,3
@程顺MichaelJerry,,！！！:knnmm,0,2019-09-30 19:30,3
@程顺MichaelJerry,,njqc n,0,2019-09-30 19:29,3
@wy吴小尤,,要地不要人，多简单嘛。,0,2019-09-29 12:40,2
@宝哩宝气zo,,这帮人真的是已经疯了，感觉现在的香港也疯了,0,2019-09-29 12:18,2
@A超复杂,,这些人有病啊！不想承认是中国人，你过其他国家去啊！这些人脑子怎么想的,0,2019-09-29 12:17,2
@完颜镇北关国,,香港这些人会为自己的行为付出代价的,0,2019-09-29 12:15,2
@月华樱712,,校长真是够爷们，真汉子,0,2019-09-29 11:59,2