User,Reter,Comment,Votes,Time
@6玛莎6拉蒂6,,反对的人应该是没妈的孩子吧,1771,2019-10-08 15:40
@BLUEMOONLIGHT-,,反对的各位，我支持美国各州独立，没意见吧。,1246,2019-10-08 16:01
@张半仙啊啊,,印象中这应该是第三次停播NBA。第一次是1999年美国轰炸我驻南联盟使馆。第二次，2008年奥运会前夕，NBA的一些人试图把苏丹达尔富尔问题与北京奥运挂钩。再算上这次火箭队的经理莫雷主动出来支持香港的暴力活动。一共三次，次次都是他们先动手，让政治、暴力和意识形态介入到体育运动当中。,670,2019-10-08 15:38
@迪亚菠萝菠萝迪亚,,这都能反对？那你爸妈离异你同意不？哦，忘了，你们没有爹妈,619,2019-10-08 16:04
@He浩源,,点反对的，你们的双亲是不是已经离世了？还是根本就没有双亲？,339,2019-10-08 16:14
@综综小迷妹,,38人反对是什么鬼？手滑吗？,148,2019-10-08 16:12
@YIimaf,,点反对的估计是走狗翻译官转世,76,2019-10-08 16:43
@LOVEINGZJL,,评论看的头疼………,3,2019-10-09 08:35
@不如归去cccc,,反对的人居心叵测,2,2019-10-10 08:06
@_KyleS,,反对的建议放弃中国国籍，当然，你们得有能拿到其他国籍的本事，要不就是弃婴了,11,2019-10-08 16:31
@北岸201606,,反对的还是中国人吗?,0,2019-10-12 18:51
@青条鱼,,首先我点的是支持，其次我觉得：观点没有对错，每个人对每一件事情都有自己的看法和选择的权利，没必要骂的那么难听，要理智,3,2019-10-09 21:45
@zyloooog未来可期,,这个投票有意义吗？,4,2019-10-08 18:15
@onedayonedayon,,干嘛要出两个选项,8,2019-10-08 16:38
@晨曦印浦江,,以此作为选择题本身就是一个很无聊的话题，如果一面倒还需要选择吗？有反对意见，立马就会跳出千军万马口诛笔伐的声讨。,0,2019-10-14 09:58
@梦想法师,,言论自由，美国的历史，我们也不太了解，是印地安人，那种不穿衣服，举着木头，吼叫的那些人吧,0,2019-10-14 08:04
@HCHUANGHUI,,反对的各位 请放弃中国国籍 你不配,0,2019-10-13 15:47
@咪哩叽哇公主,,反对的人赶紧给我死,0,2019-10-11 15:18
@-桃宝-,,点错了-_-||,0,2019-10-11 13:33
@Chen---_---,,支持央视暂停nba一切合作,0,2019-10-10 17:27
@我有一颗兔兔糖,,为啥不能直接取消呢,0,2019-10-10 02:12
@-不是山谷--,,我们可以没有NBA但我们不能没有香港！,1,2019-10-10 11:01
@HUMAN__世俊,,点反对的是在华赚钱的美国人？,1,2019-10-10 08:57
@商院张红梅,,我喜欢篮球，但我更爱国！,1,2019-10-10 08:06
@酆华正茂,,目前679人反对了，真是铁呀骂你还要看,0,2019-10-10 00:33
@J2225863643,,爱篮球，但是这个时候反对的，都想把你们心挖出来看看,1,2019-10-09 23:50
@林宇0214,,我身边就有反对的同学。我真的不知道怎么想的。很气人,1,2019-10-09 23:41
@可乐梦儿,,我为911事件喝彩，吹爆本拉登，支持美国各个州建立自己完整的国家政治体系，没意见吧@NBA @NBA火箭,2,2019-10-09 20:54
@洛神流苏,,反对的536人不是中国人？,2,2019-10-09 19:34
@啊呀-米大爷,,391个人不是中国人吧,2,2019-10-09 11:03
@风花雪月92718,,NBA前快船老板只是调侃了几句黑人。被整个联盟逼迫卖了快船球队。这时候美国人怎么不说有个人言论自由呢？现在过来跟中国人说分裂国家的言论属于自由。美国人的言论自由双标真的很严重。,2,2019-10-08 18:22
@T_DaDa,,可能是手误点成了反对,2,2019-10-08 17:55
@智虑忠纯,,支持，我看足球,0,2019-11-05 15:01
@面皮地狱,,支持的各位，现在可以去游行抗议了。,0,2019-10-15 20:06
@I小龙囡,,反对的估计都是悄悄移民叛徒吧,0,2019-10-14 12:43
@小玄子萌萌哒,,反对的，出门随便拐，走吧，,0,2019-10-14 11:38
@寂空海,,居然还有1811个反对?吃太好了闲的?,0,2019-10-14 09:42
@48K陈大仙,,腾讯恢复nba直播 良心不痛吗,0,2019-10-14 07:19
@mesa58812,,主要是封了也没用，我华夏男儿本色就是三跪九叩。,0,2019-10-14 02:51
@我叫豪豪你叫啥S,,点反对的你有爸妈么？？？,0,2019-10-13 22:14
@大也如此57014,,反对的人…,0,2019-10-13 21:54
@僵尸爱脑子,,在民族面前什么明星都是扯淡,0,2019-10-13 19:45
@涛先森7,,反对的人必没爸妈,0,2019-10-13 19:39
@某z姓国安球迷,,国家利益比爱好大的多,0,2019-10-13 18:36
@小小小灬灰灰,,反对的是中国人吗,0,2019-10-13 17:49
@与我无关i08256,,反对的那些人，心里是怎么想的？,0,2019-10-13 16:28
@小鹿儿鸣ai,,居然有人投反对？,0,2019-10-13 16:15
@Kingsiley小豪,,我点了支持，虽然我很喜欢看NBA，但是更喜欢看祖国统一繁荣,0,2019-10-13 14:13
@和你妈妈说下吧,,反对的都他妈这么想看，不看会死？,0,2019-10-13 13:58
@波力海抬,,点反对的1685个人，是怎么想的？,0,2019-10-13 13:09
@芝麻芝麻芝麻芝麻是的芝麻,,建议微博推出投票实名制,0,2019-10-13 13:05
@ArS252,,支持！,0,2019-10-13 06:40
@团子吖z,,那反对的人是憨批吧,0,2019-10-13 01:24
@是清也啊,,1552个反对的 你是孤儿还是怎么着,0,2019-10-13 00:47
@LeeChulrecharge,,反对那1000多人在想啥呢,0,2019-10-13 00:22
@是镜羽子鸭,,我tm……居然还有点反对的,0,2019-10-12 23:04
@现在我心李,,我是中国人,0,2019-10-12 22:58
@爱啃馒头的大牙君,,可以把反对的名单公布出来吧,0,2019-10-12 22:36
@木易十二HL,,别播了，美国真的一直没变，咱们真的别用这么客气,0,2019-10-12 22:14
@初白QyQ,,反对的出来打死,0,2019-10-12 22:07
@屎味大可爱-,,反对的是有什么问题吗？,0,2019-10-12 22:01
@佟光照,,为什么腾讯视频依旧在转播,0,2019-10-12 21:56
@十九岁的神,,反对的人食屎了吗？？,0,2019-10-12 19:21
@叽叽航,,我吐了那些反对的人，看来不是每个人都有妈,0,2019-10-12 18:05
@琳东东a,,反对的都是美国狗,0,2019-10-12 17:03
@・・・哈哈,,反对党滚出中国,0,2019-10-12 16:01
@猪咕哩蛋糕,,如果对方不对此事正式公开的道歉，并且肯定中国领土的完整性和尊重性，希望暂停能够一直下去，甚至可以停止合作。我参与了@沈阳晚报 发起的投票【央视暂停NBA转播以及一切合作交流，你看法如何】，我投给了“支持”这个选项，你也快来表态吧~,0,2019-10-12 15:31
@Hero04278,,那反对的1353个人是一个孤儿院长大的吗？,0,2019-10-12 14:18
@逗比男神范,,本.拉登！！！这位我想广大中国同胞都知道吧！就NBA莫雷的言论我想说的是！纪念：本.拉登！为自己而战！为圣战和美国斗争！决战终生！纪念你伟大的成就9.11！我支持你们所有的圣战士！为你们加油！我想让美国佬看到这条微博！中国人顶起来！,0,2019-10-12 13:56
@欣欣是臭猪,,居然还有一千多人反对,0,2019-10-12 13:56
@小根三,,反对的人真是厉害，,0,2019-10-12 12:43
@LUVSVCK,,你若干涉我国主权，歧视种族，就表示你选择站在我们的对立面，到时候打你就别说欺负你你了，你选的嘛，小洋鬼子！,0,2019-10-12 12:18
@飞扬薇薇奇,,中国就是家，应该牺牲一切去捍卫,0,2019-10-12 11:25
@167cc,,点错了，，，,0,2019-10-12 11:16
@大西几201401,,永远停播OK，这不是问题，你要解决,0,2019-10-12 10:57
@本宫51307,,我要坦白，我太激动，看错看成了央视要转发。。。。 我选错了，但是改不了了，，，，，,0,2019-10-12 10:57
@一只有酒窝的猫,,居然还有人反对。。。。丢人,0,2019-10-12 10:33
@iLyfor西柚子,,反对票的人可能是单纯的喜爱篮球 ，没有考虑很多，但关键时刻，抵制NBA和维护国家的尊严我选择后者。,0,2019-10-12 10:30
@一枚深海少女,,居然还有一千多位反对票,0,2019-10-12 08:56
@剑胆琴心千重劫,,点反对的人是理解能力有问题还是怎么的，还是说不同意暂停转播是和我一样希望永久停播,0,2019-10-12 00:23
@苗小豆儿,,点反对的。揪出来！,0,2019-10-12 00:01
@陈露yyoi,,妈呀手滑点错了,0,2019-10-11 21:07
@范成歪ls,,我们一定需要一个NBA吗,0,2019-10-11 20:16
@十六法爷,,反对的人，就应该把他们曝光,0,2019-10-11 18:56
@阿苏软佑柚,,为啥还有反对的?,0,2019-10-11 18:14
@Princess_grave,,直接停播就行了，不要搞什么投票。这14亿里面没有几个憨批我真以为是在天堂。,1,2019-10-11 15:28
@范范范兰兰,,跟国家相比，NBA只能算个球,0,2019-10-11 15:27
@甜诱不甜,,妈的老子手滑了,2,2019-10-11 14:35
@爱笑的羊咩咩201610,,支持，爱国从我做起！,0,2019-10-11 13:30
@林深有鹿g,,点反对的你妈是不是天天在外面mai,0,2019-10-11 12:07
@衲禾,,反对的朋友，我支持世界战争，没毛病吧，那种打的你们哭爹找娘的打法,0,2019-10-11 10:16
@无量海,,投不支持的一千个人，去给美国舔脚吧，滚出中国。我参与了@沈阳晚报 发起的投票【央视暂停NBA转播以及一切合作交流，你看法如何】，我投给了“支持”这个选项，你也快来表态吧~,0,2019-10-11 08:29
@第二十二条军令,,如果允许一个人支持港独，那就会有下一个人，也就会有下下个人，那么到那时，国何以成国?,1,2019-10-10 23:58
@丶pcx,,TMD，点错了,2,2019-10-10 23:56
@李旭xuer,,中国人要有骨气  个人与家国应该同仇敌忾  国家有尊严 国人才有尊严 国家强大 国人才不会被欺负,0,2019-10-10 23:12
@音小白Vic,,我就想知道那些反对的是不是都是孤儿,0,2019-10-10 23:01
@Murphyii,,我看见有几个反对的孤儿,0,2019-10-10 22:47
@MinFeiChen,,我希望我们的抵制NBA是一直的，而不是一时的,0,2019-10-10 22:37
@吉丽木,,九百多个人是美国安在我的国家的狗崽吧,0,2019-10-10 22:23
@小小小小哆啦a梦,,我宁愿相信点反对的，都是翻墙来的。,0,2019-10-10 22:01
@AllenKKKsu,,点反对的是不是山顶洞的孤儿？还是日本后羿？,0,2019-10-10 21:28
@shanqinga,,反对的人就应该是中国的内奸,0,2019-10-10 21:05
@h,,反对的人是没有人性的人,1,2019-10-10 20:30
@可爱的CC酱,,反对的可能都是点错了,0,2019-10-10 20:01
@么司么么,,936反对，他们是手滑吗？,1,2019-10-10 19:54
@肖玉0327,,日了狗的，是中国人吗？还有反对,1,2019-10-10 19:43
@YX_ZZhy,,可能反对的人没看这则消息点错了也很正常呀,1,2019-10-10 17:03
@健身小子Mark,,这个投票就有问题！引起内部矛盾吗？,0,2019-10-10 16:29
@公子许许,,884个反对票定不是中国人民，黑子,0,2019-10-10 16:22
@氵滴答滴,,反对的都是美籍华人吧,1,2019-10-10 14:29
@不回复傻闭与狗,,我反对,0,2019-10-10 13:58
@知言03200,,已经是第三次了，别停播了，再也不播了吧！,0,2019-10-10 13:29
@知言03200,,反对的人，就想问问，你们是中国人吗？在国家面前，只要是中国人，就应该支持,0,2019-10-10 13:26
@胤敏,,发出我们的声音来。慢慢的，是个人都来干涉中国的日子会过去。篮球还是那个篮球，不会跑掉的。,0,2019-10-10 13:19
@你不服都不行呀,,这还反对，醒醒啊。,0,2019-10-10 12:09
@鲱鱼哥哥,,反对的人 应该都是精美分子！也可能是外国人或者被老美草过的人！FUCK NBA,0,2019-10-10 12:02
@轸念201608,,居然还有一部分人反对。都什么人啊！,0,2019-10-10 00:57
@张家大少奶奶z,,点反对的这679名同志，你们是手滑还是有帕金森综合症，还是没看清上面说的是啥？很想为你们的错误找个理由，但我找不出来啊，你们绝了！,1,2019-10-10 00:33
@wuli超哥哥啊15,,那670人，没脑子吗？,0,2019-10-10 00:12
@SporZhou,,对不起，我代表那少数犬子的不逆而感动抱歉.,0,2019-10-10 00:07
@是小婷呐t,,拒绝手滑,0,2019-10-10 00:06
@豆豆怡ab,,反对的是有妈生、没爹教的孤儿？,0,2019-10-09 23:31
@MrLaneCrawford,,高度言论自由的西方社会，特朗普都可以恶搞随意调侃。天朝你调侃一个给我看看？所以~~~我爱我的祖国。,0,2019-10-09 23:14
@fudi凯,,反对那几个人的妈妈都被支持的人干,1,2019-10-09 22:50
@BELIEVELOVEU_425,,我希望有500多的人是按错才点的反对  你喜欢NBA没错  但你应该知道要有骨气  人家都骑到你头上拉屎了,1,2019-10-09 20:54
@Yoda你你你,,雾草 没看清标题。。,0,2019-10-09 20:50
@枫紫娜,,我参与了@沈阳晚报 发起的投票【央视暂停NBA转播以及一切合作交流，你看法如何】，我投给了“支持”这个选项，你也快来表态吧~ 国家利益高于一切,0,2019-10-09 20:40
@陈皮皮本皮,,想不通这560人是咋想的,0,2019-10-09 20:23
@Anita_Sze,,主权面前，nba算什么,0,2019-10-09 20:12
@NiKO魔王,,反对送马的人,0,2019-10-09 17:39
@此人正在蹦迪,,反对的这四百多人是人么,0,2019-10-09 17:33
@鱼七water,,真是太支持了,0,2019-10-09 17:22
@believer697,,400多人反对是手滑了吗？,0,2019-10-09 17:10
@晴爷vV,,支持支持支持,0,2019-10-09 13:04
@非洲黑鬼绵绵,,手滑手滑点错,0,2019-10-09 12:15
@METAL赵,,反对的是畜牲吧,0,2019-10-09 11:19
@Ania-ninini,,点了反对的人是没有妈妈吗,0,2019-10-09 07:52
@雨嫣2015,,是以后都不播了，还是道完歉就完事！如果这样没必要禁！现在禁，道完歉就开了！禁播几天有用吗？以后其他人再犯，到时候再禁！再开！真的有用吗？,1,2019-10-09 07:33
@贪吃的蚂蚁16,,反对的你们妈出门买菜必涨价，超级加倍,0,2019-10-09 03:02
@Haze铅笔的彩色天空,,我参与了@沈阳晚报 发起的投票【央视暂停NBA转播以及一切合作交流，你看法如何】，我投给了“支持”这个选项，你也快来表态吧~ 国家利益高于一切，民族尊严重于一切，,0,2019-10-09 00:40
@痞子大哥哥哥,,永久停播，中国的赞助商撤回吧,1,2019-10-09 00:32
@罗毅敏,,342人反对，估计都是孤儿或者美国人吧,1,2019-10-09 00:06
@安逸浪醉天涯,,反对的拉去浸猪笼,0,2019-10-09 00:01
@meanwhileco,,还有些人没开智,0,2019-10-08 23:43
@潇湘水木君,,不要暂停，而要永久停播，不然真像肖华说的那样只是时间问题了！,0,2019-10-08 23:24
@丨某某丨,,反对的 都是孤儿吧？你们觉着配做中国人不 赶紧滚吧 爱滚去哪滚去哪 中国不要你,0,2019-10-08 22:57
@胡萝卜Daucus,,那些点反对的滞胀们，点错了的再点一下可以取消投票,2,2019-10-08 21:57
@策划人王晓飞,,什么暂停转播，人家本来就看不起你，没把你当回事儿，我们不要道歉，打一巴掌就给人家要糖吃吗？我们不是这么没骨气，不管央视要不要永久停止转播，我们永久不看。,1,2019-10-08 21:51
@人到中年9712,,还有人反对，真不明白这些个人，是美国种子吗？,0,2019-10-08 21:49
@血腥儿残梦,,反对的268个你们滚出中国,0,2019-10-08 21:44
@瑶瑶好饿鸭,,我真的是点错了 天哪 ,0,2019-10-08 21:33
@瑶瑶好饿鸭,,我真的手一歪不小心点错了 改不了了怎么办 我想点支持的呜呜呜呜要哭了md,0,2019-10-08 21:24
@Dear西柚200612,,254个反对的人是美国派来的奸细吗,0,2019-10-08 20:48
@墨枫鸢,,反对的人数 刚好是骂他们的人数  天意,0,2019-10-08 20:34
@哈利波特别逗,,反对的都是中国人吗,0,2019-10-08 20:01
@Light-beams,,我爱篮球我爱nba！,1,2019-10-08 19:58
@80后的nono8,,反对的啥情况，是网特吗,0,2019-10-08 17:43
@公伯骏驰,,为什么会有反对这个选项？还沈阳晚报？,1,2019-10-08 17:33
@夏廷琨,,一切关于NBA的已经远离我得生活了，这就是一个中国人的态度.NBA，g!u!n!,1,2019-10-08 17:30
@快乐的西瓜06,,这个还有人点反对？除了眼花手滑我找不出其他理由给你们。,0,2019-10-08 17:12
@凤皇鸡qaq,,百分之二 这比例有点高啊,0,2019-10-08 16:57
@迷0茫0,,竟然还有人点反对的，牛逼,0,2019-10-08 16:53
@晓暗14066,,竟然有人反对，笑了。要是不匿名，你们会有多惨？b话不多说，支持加州独立,0,2019-10-08 17:30
@请叫我朗普爸爸,,区区N逼A下架算什么，想当年快播被下架，老子都挺过来了！再说了美国外籍英雄本・拉登都能被侮辱，酱鹰能干出啥公道事来？,1,2019-10-11 00:25
@DiegoWZQ,,我就在国外生活，我都不敢相信还有人投反对票？？？为了NBA当了走狗,0,2019-10-09 15:29
@七月和安先生的灵魂结合体,,昂，还有415反对票也太秀了…说起来，国外一直不明白为什么中国被称之为新市场。,0,2019-10-09 12:45
@王丶明凯,,笑死我了，那些骂反对的人们，现在你们在看nba吗？现在人均跪族蓝孩了？打脸来的太快了,0,2019-11-15 23:35
@床板挡我看屋顶63124,,你们难道就认为只有中国人其他微博吗？,0,2019-10-24 09:08
@福州老股东,,看了这么多关于这件事的报道和评论之后，突然开始理解肖华了。从当初的快船老板被驱逐出联盟到这回莫雷事件NBA官方拒不道歉，其实背后的原因很简单，都是趋利避害 为了钱罢了。总不能得罪自己的母国吧。,1,2019-10-20 23:01
@娜就是我6257284779,,1628人反对？,0,2019-10-13 10:02
@A河北唐山阿财通讯批发,,1574人反对？司马玩意？？ 从小都是孤儿吗   是非分不清？？,0,2019-10-13 02:57
@雀翎619,,我反对！因为我是跪族,0,2019-10-13 01:16
@水中hCc,,不好意思点错了,0,2019-10-12 23:14
@PEACEMINUSONE1988,,反对的都是没妈的啊 怪可怜的,0,2019-10-12 23:00
@蒂花之秀530,,反对的都是美国狗？,1,2019-10-12 20:37
@我是张子枫的先生f,,我参与了@沈阳晚报 发起的投票【央视暂停NBA转播以及一切合作交流，你看法如何】，我投给了“支持”这个选项，你也快来表态吧~ “我们不硬，他们会觉得我们很好沟通的”,0,2019-10-12 15:47
@滚筒洗衣机转啊转,,反对的请滚出中国，软蛋,0,2019-10-12 12:00
@镇魂定档再改名,,我他妈的！居然还有一千多人反对？！林子大了什么鸟都有！您真是没有祖国没有妈妈的人！,0,2019-10-12 11:10
@漏心之鱼,,不知道那些反对的能滚出中国吗？，中国不缺少人,0,2019-10-11 15:23
@比较正常人,,反对1000多人，你们干脆转国籍吧，毕竟你连一个中国人的基本义务都没有做到，你要追星麻烦你滚去其他地方，也希望你在那边别被人骂你，哦不可能其他国家也不会收下一个不会维护国家的人。态度表明，往周知,1,2019-10-11 13:20
@真是一个响亮的名字,,还能有反对？魔鬼吧都是,0,2019-10-11 09:58
@科比终身粉,,干的漂亮,0,2019-10-11 09:49
@星雨96115,,可能是抗美援朝时留下来的种。,2,2019-10-11 04:15
@高如玉,,希望点反对的都是手滑的人,2,2019-10-10 22:50
@江苏东之正阀业,,反对的人估计有个别被小孩拿手机玩按到的，还好我眼急手快，从孩子手里抢过来手机按支持,1,2019-10-10 22:03
@洪00476,,我点错了对不起对不起对不起对不起对不起对不起对不起对不起对不起对不起对不起对不起对不起对不起对不起对不起对不起对不起对不起对不起对不起对不起对不起对不起对不起对不起对不起对不起对不起对不起对不起希望祖国妈妈原谅我，我看错了真的对不起,0,2019-10-10 19:16
@J67875,,反对的人是怎么想的,2,2019-10-10 18:54
@唯一5622129848,,爱不爱国不是靠支持或反对这个来衡量的，说话尽量文明点大家,0,2019-10-10 13:21
@叫谢韩好了,,反对的很明显是美国人的走狗。,0,2019-10-10 12:56
@不算烂,,反正也不看央视,0,2019-11-19 19:39
@王丶明凯,,笑死我了，那些骂反对的人们，现在你们在看nba吗？现在人均跪族蓝孩了？打脸来的太快了,0,2019-11-15 23:35
@智虑忠纯,,支持，我看足球,0,2019-11-05 15:01
@回眸中的泪涕07474,,犯我中华者，虽远必诛。,1,2019-11-03 08:27
@床板挡我看屋顶63124,,你们难道就认为只有中国人其他微博吗？,0,2019-10-24 09:08
@福州老股东,,看了这么多关于这件事的报道和评论之后，突然开始理解肖华了。从当初的快船老板被驱逐出联盟到这回莫雷事件NBA官方拒不道歉，其实背后的原因很简单，都是趋利避害 为了钱罢了。总不能得罪自己的母国吧。,1,2019-10-20 23:01
@不算烂,,反正也不看央视,0,2019-11-19 19:39
@王丶明凯,,笑死我了，那些骂反对的人们，现在你们在看nba吗？现在人均跪族蓝孩了？打脸来的太快了,0,2019-11-15 23:35
@智虑忠纯,,支持，我看足球,0,2019-11-05 15:01
@回眸中的泪涕07474,,犯我中华者，虽远必诛。,1,2019-11-03 08:27
@床板挡我看屋顶63124,,你们难道就认为只有中国人其他微博吗？,0,2019-10-24 09:08
@福州老股东,,看了这么多关于这件事的报道和评论之后，突然开始理解肖华了。从当初的快船老板被驱逐出联盟到这回莫雷事件NBA官方拒不道歉，其实背后的原因很简单，都是趋利避害 为了钱罢了。总不能得罪自己的母国吧。,1,2019-10-20 23:01
