User,Reter,Comment,Votes,Time,Count
@古戈_,,这评论好可怕，搞的好像你们平时生活中很完美一样。,0,2019-09-10 17:51,1
@lsr红蓝向往responsibility,,不打联赛确实会影响状态,0,2019-09-10 17:41,1
@无法无天-199312,,666,0,2019-09-10 17:40,2
@空心94412,,他就这水准，不能要求太高了,0,2019-09-10 17:39,1
@嘿戳戳小酒窝,,@小鸡骑鸭,0,2019-09-10 17:39,1
@VersoYi,,....这个球商球场表现..原谅了....也改变不了什么吧,0,2019-09-10 17:38,1
@别笑laugh会长皱纹,,只想说:你能你上啊！！！,0,2019-09-10 17:37,1
@生锈的钩,,原谅不原谅他都在那儿，未来的英雄还是他。,0,2019-09-10 17:36,1
@viewheng,,闭嘴就好了,0,2019-09-10 17:36,1
@残疾人全面小康,,好像他故意打得差一样，本来就不行，有啥好原谅的,0,2019-09-10 17:36,1
@壹叶东语,,唉！但世上没有后悔药啊！,0,2019-09-10 17:35,1
@wei伟08,,那你以后就证明自己，而且不要搞不在场证明,0,2019-09-10 17:34,1
@追寻着你的梦想,,这种打球的态度就不值得原谅,0,2019-09-10 17:34,1
@秦湘豫,,这个时候找责任和找问题那个更有意义？,0,2019-09-10 17:34,1
@黑眼兜,,人总有低估但每场都低估闻所未闻，这只能说明能力有问题，除此之外想不到别的。,0,2019-09-10 17:33,1
@烈马阿增,,是个汉子就再站起来！,0,2019-09-10 17:33,1
@菲姐要l到110斤,,啥大不了的，人生路那么长，摔倒了再爬起来,0,2019-09-10 17:32,1
@阿K有焦虑,,好好练，再回来打,0,2019-09-10 17:32,1
@Lok,,周琦现在做的应该是关掉手机，狠狠练球，然后打那些喷子的脸（比如我），而不是玩手机啊。,0,2019-09-10 17:31,1
@主持人王雨轩,,骂也骂了，你周琦要是不振作起来，可就真对不起大家的骂了，,0,2019-09-10 17:31,1
@小火车小货车,,波兰人,0,2019-09-10 17:30,1
@博009,,周琦打球就像鞋底有胶似的，只是像个木头桩子一样，不跳也不抢篮板，只是傻傻的等球落到自己手里，一个内线球员不在内线打，却要到三分线附近，你是要突破还是要投三分？快别打球了。,0,2019-09-10 17:30,1
@直隶老麻,,年少成名，心态调整不好就浪费了这么好的天赋了！,0,2019-09-10 17:30,1
@亚特鲁尔,,每节上5分钟就好 体力不行就别硬撑 免得大脑受体力不支的影响,0,2019-09-10 17:30,1
@江河湖海0724,,我觉得他真的是态度问题,0,2019-09-10 17:30,1
@刺猬-的生活,,这是你的工作，你只是工作中出现了细节上的错误。而因为你工作的特殊性，影响很大。,0,2019-09-10 17:30,1
@亦无妨,,胆小鬼,0,2019-09-10 17:30,1
@skye_sci,,周琦失误造成的后果，不仅仅是一场比赛，更重要的是在场外。就事论事说，有这样的态度是对的，也是负责任的表现。希望在往后的岁月里，能扎扎实实提升自己，带领球队获取胜利！,0,2019-09-10 17:29,1
@丶栗子丶栗子丶,,颤抖得手却无法停止。。。,0,2019-09-10 17:29,1
@道静虚无,,,0,2019-09-10 17:29,1
@许小枫0,,就全当是浴火重生吧。拿出成绩来比啥都强,0,2019-09-10 17:28,1
@梅子黄时雨的杰,,菜是原罪,0,2019-09-10 17:28,1
@瑶持沛伞,,自取其辱 自欺欺人,0,2019-09-10 17:27,1
@徐哥模玩,,大家是不是都不知道中国队连落选赛都没得打,0,2019-09-10 17:27,1
@小麦色937,,没机会救赎了，指望他下一届世界杯出彩？不可能,0,2019-09-10 17:26,1
@GoingGo_Real,,不是原谅不原谅的吧 要改变自己的态度和状态啊,0,2019-09-10 17:26,1
@我S啊,,知道你尽力了 技术就这样,0,2019-09-10 17:26,1
@joejoe的奇妙冒险_,,如果能痛定思痛，把投篮练好，身体练好，态度端正，那也就没啥不可原谅的了；当然那是你的职业生涯我们也没啥好说的,0,2019-09-10 17:26,1
@笑傲茳湖骠骑大将军,,将士们，你们大的是篮球啊，不是太极。,0,2019-09-10 17:26,1
@小磊子连连,,下课,0,2019-09-23 06:27,1
@烤肉味饺子,,我参与了@头条新闻 发起的投票【周琦世界杯后首发声：不敢祈求任何原谅 你怎么看？】，我投给了“无法原谅”这个选项，你也快来表态吧~作为男篮的下一代核心领军，亚洲大魔王！打出这样的水准！你看看大姚，大致，易建联！他们这个时间段的水准,0,2019-09-17 16:18,1
@木偶先生-Hunt,,赶紧下课，给年轻球员机会，国家队要大换血！！！,0,2019-09-16 03:50,1
@米奥em米奥,,他肯定买了波兰赢,0,2019-09-16 01:29,2
@哟861204,,不会原谅他。也不对他寄予希望了。,0,2019-09-15 21:48,2
@矛与盾在2019,,抗日时候也有很多骂的。骂部队消极抵抗，绥靖政策，这些嘴炮的在骂的时候，往往也忽略了为抗日牺牲的300多万军人，一个数字而已吧，比不上骂的痛快。骂的越厉害，显得越懂篮球，越睿智。,0,2019-09-14 12:29,2
@没有时差2,,容易吗？男篮？,0,2019-09-14 07:40,1
@查拉图斯特拉就不说,,周的问题不是技术问题是态度问题。有阿联一半态度都不至于现在这样。竞技体育难免有失误。但我觉得这个人废了的原因只有他态度不端正，不够专注。老詹够有钱了吧，享受生活了吗？每天不都在坚持训练。学着点吧,0,2019-09-14 06:13,1