User,Reter,Comment,Votes,Time
@三岁似胖呀,,香港警察真的超累，很心痛也很心疼他们。本是同根生那！年轻人被米国利用的太彻底了,0,2019-09-07 23:07
@三岁似胖呀,,现在废青还在太子、沙田和警察对峙。路人也很多，部分人还支持。称年轻人是合理行为，jingcha不该用棍子打人。新闻上面这么说的,0,2019-09-07 23:04
@千与TF千寻,,政府做的不好，有意见，示威游行都没有问题。每个人都有合理表达自己思想的自由。可是这不是暴乱的理由，不是袭击的借口。想要以香港要挟国家而达到什么目的，是根本不可能的，你们香港还没有大陆的一个省大，你觉得你们能翻起什么风浪来呢？一个普普通通的大陆人都能明白的道理，你们为什么不明白呢？,0,2019-09-07 23:03
@Vivian-汤圆麻麻,,一开始zy就引导内地以及所有舆论支持警察，回头来看，实在高，早就看的通透。最难得时候也都是警察支撑着整个香港的治安和秩序。香港警察的专业和素养真是,0,2019-09-07 23:03
@小龙哥稳当地,,不成熟的孩子闹一下很正常，被 人利用也很正常，因为你们不成熟，但是你们终归要知道你的母亲谁，是怎样包容你们的！,0,2019-09-07 23:02
@我的宝贝涵仔,,香港的大部分媒体颠倒黑白，无中生有，不配为人,0,2019-09-07 23:01
@大轩小铭,,香港黑记已经没有底线了，肆意抹黑警察,0,2019-09-07 23:01
@TST庭秘密橙子团队娟子,,是没死，港警累惨了,0,2019-09-07 22:52
@Nancy阑珊,,天天都说警察杀人！ tmd你们倒是说说谁死了？？？ 死者都没说你给我说警察杀人了！,0,2019-10-07 23:23
@邂逅神兽天团萌萌哒,,分裂祖国的暴徒,0,2019-09-20 13:02
@光影狙击手d,,祸乱者死有余辜,0,2019-09-15 18:13
@用户ConnieAndrew,,香港仍然有好多市民支持警察谭ǎ,0,2019-09-15 13:33
@开启飞行的舒克哦,,所以我不明白他们在那哀悼啥？拜鬼呢？拜他们暴力示威途中踩死的蟑螂同类？,0,2019-09-13 16:55
@广东老黄,,,0,2019-09-12 20:00
@瓶中潮汐寄沧海,,“江湖又要变了。大部分人自己的欲望，给自己带来更可怕的灾难，却在灾难来临时，得不到所求时，一脸无辜的痛骂一切……”,0,2019-09-11 01:30
@Nancy阑珊,,天天都说警察杀人！ tmd你们倒是说说谁死了？？？ 死者都没说你给我说警察杀人了！,0,2019-10-07 23:23
@邂逅神兽天团萌萌哒,,分裂祖国的暴徒,0,2019-09-20 13:02
@光影狙击手d,,祸乱者死有余辜,0,2019-09-15 18:13
@用户ConnieAndrew,,香港仍然有好多市民支持警察谭ǎ,0,2019-09-15 13:33
@开启飞行的舒克哦,,所以我不明白他们在那哀悼啥？拜鬼呢？拜他们暴力示威途中踩死的蟑螂同类？,0,2019-09-13 16:55
@广东老黄,,,0,2019-09-12 20:00
@瓶中潮汐寄沧海,,“江湖又要变了。大部分人自己的欲望，给自己带来更可怕的灾难，却在灾难来临时，得不到所求时，一脸无辜的痛骂一切……”,0,2019-09-11 01:30
@杏爵2019,,没死人就是立功了吗？拖这么久不能平息动乱，只能是不合格；能不能回应下，2个多月了，为什么没有一个暴徒被绳之以法，唯一被判的一个是内地的义士；天天要大家站出来，要团结，是眼瞎吗？,0,2019-09-10 14:52
