User,Reter,Comment,Votes,Time
@___Min丶煦,,港媒：哎呀还是没污蔑成功。,7733,2019-09-07 17:43
@脱单群高个群,,香港警察已经很克制了，要是在美国不知道击毙多少了,5030,2019-09-07 17:54
@晴川姐姐,,谣言止于智者,2298,2019-09-07 17:42
@予信恋人,,谣言止于智者，好了别说了。,1116,2019-09-07 17:43
@一只猪蹄丶,,不信谣不传谣，感觉这是升级了呢。,631,2019-09-07 17:43
@脱单群高个群,,肯定“无执法致死”啊，否则怎么会拖了三个月反而越演越烈呢。好像内地爱国举动的判了，港独暴徒抓了就放，港府棒棒嗒,452,2019-09-07 17:54
@一句话入你心,,支持香港特区政府依法施政，爱祖国，爱香港@央视新闻,229,2019-09-07 17:42
@KYO-NI,,没关系，香港不听话，我们可是有深圳的,165,2019-09-07 18:03
@政和白茶-茶农,,无事生非，非奸即盗,139,2019-09-07 17:43
@脱单群高个群,,不要黑港警，那么累保护你们，受伤比你们废青还多，结果还污蔑他们过度执法，不要搞到最后自己后悔,134,2019-09-07 17:53
@陈曦骏,,废青倒是可能因赃不均 内讧死几个,113,2019-09-07 19:03
@灬半江瑟瑟半江红灬,,看到某些视频里采访香港普通市民，人家说对于抗议行为表示可以理解时，感觉香港已经没救了,71,2019-09-07 17:50
@龙行天下千万里,,每天的戏码：废青暴徒随地大小便，黄媒在一旁扇扇子向外散发熏天臭气，之后警察负责上下左右揩擦屁股，港府负责谴责谴责强烈谴责，理姐谅姐和了姐负责袖手无视或围观，歪嘴律政司负责替暴徒开脱罪责，黑法官负责放虎归山，周而复始。只哄不打，上房揭瓦。,65,2019-09-07 20:00
@宇宙男德,,支持中央,57,2019-09-07 17:43
@列宁斯基,,三个月了，真的疲了,55,2019-09-07 18:00
@总有一天会早睡的上树,,不信谣，不传谣,28,2019-09-07 17:47
@最后的一只君君,,法国短短几个月的黄背心运动却被警察打死了十几个人示威者，又没人制裁他,35,2019-09-07 17:51
@生活不易哦Z,,也就是我们中国政府能忍，换美国像香港废青那么闹，早都死几回了,26,2019-09-07 20:07
@熊熊部落,,应该严查造谣者，严惩不贷。,26,2019-09-07 17:51
@SH新柯,,这种谣言在推特上比比皆是,37,2019-09-07 17:42
@街尾转左,,不明白为什么整天黑警察，当hk真的变成无警城市，受罪的绝对是市民，到时变成罪恶之城，连伊拉克都不如,20,2019-09-07 19:35
@Carles魏,,太弱了，喝了民主的毒药，老眼昏花，神志不清，无下限纵容的结果,24,2019-09-07 18:01
@啦啦种太阳27,,下一步就是外国势力找人去香港开枪打人了，和乌克兰一模一样,29,2019-09-07 18:13
@辛巴Kitty,,这些新闻需要的接收方是香港市民 可惜香港主流媒体都不输出 再加上香港好多人选择性失明失聪,19,2019-09-07 20:10
@快乐的嘎巴豆,,不死人还不高兴了？,22,2019-09-07 17:50
@山田风来,,刚刚看优酷首页有部港剧，黄宗泽马国明都是熟悉的演员，但是听到那句我们是香港警察，看到那些枪战，只有别扭，香港这三个月闹剧真的该结束了,23,2019-09-07 18:58
@LOVE小晴天Oo,,以为港警温柔执法，大陆不参与，那些无赖就不会说你滥杀无辜了？那太低估港独和美国那些垃圾不要脸的程度啦！欲加之罪何患无辞，该亮剑啦！,14,2019-09-07 19:29
@追星有何感觉,,妖言惑众，就地正法。,16,2019-09-07 17:48
@达尔雯i,,没完没了了,20,2019-09-07 17:42
@商业解毒,,请废青提供”死者“身份证号码，香港警方全力追查”真凶“！,12,2019-09-07 20:51
@7788和8877,,颜色革命的主要步骤之一。不是早就料到他们的套路了吗,9,2019-09-07 19:20
@强哥是个兵,,相信祖国，相信政府！,11,2019-09-07 17:43
@嗦哆哆哆,,这些“新闻”只能骗醍h,7,2019-09-07 19:41
@柠檬味的夹心饼,,谣言止于智者,8,2019-09-07 17:44
@月亮上的蝴蝶t,,不造谣，他们哪来理由上街闹事，不闹事哪来的钱赚的，如果真有此事他们还不闹翻天啊，臭鸡蛋真多,5,2019-09-07 19:34
@帕格尼尼的忧伤,,过去三个月，你们的执法和谴责无效，事情还没平复，依然暴乱。应当换特首管理者,8,2019-09-07 18:34
@Jin枪鱼,,我觉得废青很有可能接下来会杀死几个人然后嫁祸给警察,6,2019-09-07 20:04
@学姐日报社,,一国两智,9,2019-09-07 17:47
@胡萝卜的八月,,真希望这些废青去美国闹闹，看看是美丽的风景线呢还是被美国警察当场击毙,6,2019-09-07 19:20
@巴古斯基,,人类几千年历史证明，过分慈悲，必遭大祸！而关键时刻敢于亮剑，敢于快刀斩乱麻的，都避免了进一步的恶化，使问题很快得到解决！从而用少数的伤亡避免了更多的无谓伤亡！,5,2019-09-07 22:00
@阿鞭先生,,有的吃多了到处造谣 b事真多,4,2019-09-07 17:43
@Seven思蒂文,,林郑不是已经撤回条例了吗？打了大陆粉红们的脸啊！,9,2019-09-07 18:55
@海南吴玉婷,,强烈否认。。。是强烈谴责的兄弟么。。。,8,2019-09-07 18:30
@是肌肉不是肥肉,,昨天我还看到一个ig的废青号说好几个人死了，时间地点和姓都有,6,2019-09-07 20:22
@邢卫刚宁夏,,这出大戏只有掏钱给废青的是凉凉的，因为三个月了，竟然还在演序幕！,3,2019-09-07 20:15
@成成林,,这些港媒都是正规的么？颠倒是非的功力一流。,5,2019-09-07 19:36
@珊珊江,,相信祖国,5,2019-09-07 19:07
@张_彩霞,,误导市民？你可拉倒吧 他们想误导全世界 搞烂香港 打击中国！！！,3,2019-09-07 21:35
@在下小左蜀黍,,换其他国家死一排了,4,2019-09-07 19:42
@一个假的理想主义者,,只要外国势力不入侵不武力干涉。香港就算砸成垃圾场大陆都不会管的，放心吧！,5,2019-09-07 19:05
@是戴维维啊,,香港废了，中央要插手了，港治不行，中央收回管理,4,2019-09-07 18:53
@腕百万,,把林郑月娥换成普京！香港的废青会怎么样,3,2019-09-07 18:22
@浅草宫主1315,,然后呢？反正香港造谣又不要成本。,2,2019-09-07 17:49
@今天拖延症依旧没好,,谣言止于智者,1,2019-09-07 17:45
@翻尾石鱼的夏天,,就跟内地一些网络谣言很像。,1,2019-09-07 17:44
@芋头粉圆冰好好吃,,[手]搞事的借口而已,1,2019-09-07 17:43
@我是那只猫啊,,那些港独都穿黑色，大家其实电视里也经常看到，黑色是代表邪恶，黑暗，本身自己也已经承认了他们是邪恶的，然而邪不压正这个道理我们应该都知道。所以我们的政府，我们的警察，终会代表正义，代表人民消灭你们。,2,2019-09-07 19:41
@韦拉luck-love,,港媒可耻！,2,2019-09-07 19:02
@Mr_______K,,我强烈建议港警也罢工，让废青闹，不是很多香港市民表示理解废青吗，让他们自己玩呗,7,2019-09-07 18:54
@雅习垃雷,,这就相当不对了嘛，都乱成这样，暴力这么升级，还没有暴力分子被击毙，香港政府根本就是默许乱港,2,2019-09-07 22:58
@TinaJiang妞妞,,嘿，打死又怎么样！发动恐怖袭击的人美国人早就毙了你了还给你留说废话的机会？,1,2019-09-07 18:59
@小峰4120,,,3,2019-09-07 17:58
@Yuan半步热,,不信谣，不传谣！,1,2019-09-07 17:43
@米斯温蒂_YW,,不是8月30号就说好了明天要死人吗？为什么过这么久才死？？严正谴责导演拖戏！！！,4,2019-09-07 19:09
@刘建刚V5,,在香港地区造谣引发社会后果不用负责吗？,3,2019-09-07 18:49
@暮影微光,,以下是香港近三个月内死亡名单（不全）：扶手电梯、智慧路灯、地砖、入闸机、售票机，更多数据仍在统计中,8,2019-09-07 18:33
@金金金金金鑫金金B,,我觉得香港市民自己都不想去拯救这个城市 不站出来说话 真的救不了,2,2019-09-08 00:35
@one版five,,香港，不用搭理它，让它自个闹吧，反正也闹不出来啥，。香港有解放军驻守，也没有那个西方国家傻到去争一个香港。国家现在也是不理，就让港人自治。真的好明智啊！！,2,2019-09-07 23:52
@左岸daily,,谣言止于公开,4,2019-09-07 22:27
@阿拉阿拉42,,哈哈哈，苍海一声笑,1,2019-09-07 17:44
@小阿衰Online,,你冤枉我执法致死了，我不能白受冤枉，搞几个致死案例。就好比萧远山跳崖不死后，就去少林寺偷学武功秘籍,1,2019-09-08 00:48
@・偶遇座头鲸,,为什么要跟暴徒讨价还价？到底有什么好商量的？直接发声明，直接依法执行！该击毙击毙，该抓的抓。到底有什么好聊的？,1,2019-09-08 00:35
@东胡同儿里,,就算警察整死几个有错吗？？哦，对了，港独害死人啦！！港独害死人啦,1,2019-09-07 23:45
@丶老猫丶,,那就让他们梦想成真,1,2019-09-07 23:24
@肥嘟嘟阿,,一天到晚香港真的看腻了，就让它作吧，作完跪着求着回到祖国怀抱,2,2019-09-07 23:22
@鸡鸣雪夜,,不再闹大点就会很尬，我懂,2,2019-09-07 22:45
@啊文豪,,香港这个事情结束后，可以拍一部电影！ 真的！,2,2019-09-07 21:38
@悲观的享乐主义者,,就三个月了,2,2019-09-07 19:57
@Mr灬XxQ,,好想看看香港法官的审判现场。就我一个人好奇吗？,1,2019-09-07 19:54
@小小风铃铃铃铃,,呵！致死才好！才能来个大洗牌！,1,2019-09-07 19:50
@喜欢幂幂彬彬热巴,,暴徒死了也活该，不作不死,1,2019-09-07 19:50
@海月十四,,出了警察还有站出来的反抗的少数群众，剩下的香港人真的是……,1,2019-09-07 19:45
@陈衍钦小号,,累了，爱咋咋咋地，港独滚，把地留下,2,2019-09-07 19:39
@狂飙这一生,,早就该击毙几个废青了,1,2019-09-07 19:34
@墨衍诶嘿嘿,,请统计一下有多少警察受伤,1,2019-09-07 19:31
@用户南山南300,,废青，辣鸡的一代,1,2019-09-07 19:29
@HE那个毛rong茸,,也不知道这个谣造的是不是他们心中所想,1,2019-09-07 19:28
@树上的男爵AJ,,废青会不会全部自杀然后嫁祸呢？,1,2019-09-07 19:22
@当云胡不喜,,谣言害死人，众志成城抵制谣言,1,2019-09-07 19:09
@vikingHIT,,造谣不用付法律责任嘛,1,2019-09-07 18:35
@OnLy_you201314,,港警太辛苦了！！！！林郑请保护港警！！,1,2019-09-07 18:20
@滴滴小窝,,不要黑港警，那么累保护你们，受伤比你们废青还多，结果还污蔑他们过度执法，不要搞到最后自己后悔,3,2019-09-07 17:47
@UNIQ-王一博的娇妻,,谣言止于智者,1,2019-09-07 17:44
@梦雨空城,,支持支持,1,2019-09-07 17:42
@赵情感头条,,压根儿就没听说过,1,2019-09-07 22:43
@kkkliao123,,香港教育局全是港独人派！教科书都全写负面。国家应该让香港教科书全部统一为人教版教科书！,2,2019-09-07 21:59
@懒散的卖酒的胖子,,就港府那些怂货还敢打死废青 完全不可能的  最可怜香港警察只有被打被欺辱,2,2019-09-07 19:19
@陌上邻家,,无事生非，不信谣，造谣传播犯法,1,2019-09-07 17:47
@光影狙击手d,,祸乱者死有余辜,0,2019-09-15 18:13
@广东老黄,,,0,2019-09-12 20:00
@心心Leo,,【香港特区政府：#香港过去三个月并无执法致死个案#】香港特区政府今天严正声明，过去三个月的执法行动中并无致命个案。至于有人称在8月31日晚上在港铁太子站冲突中有致命事件发生，政府称这是持续散播的谣言，予以强烈否认。发言人强调：“这些不负责任的谣言不断在网上散播，意图误导市民。”,0,2019-09-08 08:17
@雍正主义至上者,,沉默的大多数还不够疼呗，还有不到一个月了,0,2019-09-08 08:05
@o守己心亠,,香港知道警察是干什么的吗？感觉香港警察好可怜,0,2019-09-08 06:42
@因你而在⒐适成我,,不累吗。好几个月过去了,0,2019-09-08 02:00
@球球长刺了mer,,不想知道他们干嘛了,0,2019-09-08 01:52
@上帝是个女孩spk,,造谣可耻,0,2019-09-08 01:44
@小小草的草窝,,都是因为咱们政府把这群港独废青养的太闲日子太好过了,0,2019-09-08 01:06
@与李一起现在未来,,不信谣，不传谣，相信祖国，相信政府！,0,2019-09-08 00:29
@朝暮思卿颜,,和醍h讲人话？他们听不懂啦,0,2019-09-08 00:27
@宋城巫师,,#香港过去三个月并无执法致死个案# 香港警察，累死累活，战果不佳！,0,2019-09-07 23:35
@看过星星的兔兔,,谣言止于智者,0,2019-09-07 23:31
@刘肥不吃狗,,造谣一张嘴~辟谣跑断腿~,0,2019-09-07 23:30
@旭日潮阳,,真要死人就动手了,0,2019-09-07 23:22
@焦小迷糊,,扩散,0,2019-09-07 23:16
@叫我小立青i,,【香港特区政府：#香港过去三个月并无执法致死个案#】香港特区政府今天严正声明，过去三个月的执法行动中并无致命个案。至于有人称在8月31日晚上在港铁太子站冲突中有致命事件发生，政府称这是持续散播的谣言，予以强烈否认。发言人强调：“这些不负责任的谣言不断在网上散播，意图误导市民。”,0,2019-09-07 23:14
@亦可Y1KE,,惨还是香港警察惨，被暴徒砍，被暴徒咬短手指，被暴徒汽油弹呛，被暴徒污蔑，被暴徒造谣，.........,0,2019-09-07 22:08
@亦可Y1KE,,暴徒造谣呗,0,2019-09-07 22:06
@小凡好摄,,#支持港警依法制暴# [加油][加油][加油],0,2019-09-07 21:50
@EM85MA,,谣言止于智者,0,2019-09-07 21:39
@有缘千里来冲浪,,闹了那么久，背后的人期待的武力镇压并没有发生，准备的一系列污蔑流血事件并没有机会发动，可气了,0,2019-09-07 21:33
@许一个夏Summer,,脏水泼不上,0,2019-09-07 21:32
@xueningf,,呵呵。乱港分子是想咱们也学学美国警察执法？,0,2019-09-07 21:25
@大连突发,,,0,2019-09-07 21:15
@不负年华199904,,港媒：我太难了,0,2019-09-07 21:08
@一路向北的Kay,,造谣可是违法的喔,0,2019-09-07 20:57
@安然anning,,转发微博,0,2019-09-07 20:36
@贝bei同学,,这些乱港恶魔分子真的是够了,0,2019-09-07 20:35
@蔡唯瑜,,,0,2019-09-07 20:01
@对男神爱得深沉,,,0,2019-09-07 19:53
@粉钰寒玫,,不信谣言，不传谣言。谣言止于智者。,0,2019-09-07 19:49
@陈长飞1976,,香港谣言不用负责,0,2019-09-07 19:48
@小女兔七七,,对你们已经够容忍了，脸呢？,0,2019-09-07 19:47
@白骨精京Z,,我真的已经忍不了香港那些港青了,0,2019-09-07 19:46
@谁把流年暗偷渡丶,,就是因为这样 才让它们闹腾了这么久,0,2019-09-07 19:39
@改个微博名字真的好难喵,,一想到你我就哦豁哦哦豁,0,2019-09-07 19:32
@海梓香来,,谣言是社会公害！,0,2019-09-07 19:26
@sss嘉熙,,谣言止于智者！,1,2019-09-07 19:23
@小火柴要过司考,,谣言止于智者，不传谣，不信谣，做一个理智的人，会分析事情的真假。,0,2019-09-07 19:23
@津门玄竹,,原文转发,0,2019-09-07 19:22
@春日浮歌,,转发微博,0,2019-09-07 19:20
@是你的璇哥耶,,谣言止于智者 相信我的祖国.,0,2019-09-07 19:20
@阿yo爱脐橙,,可惜废青和假记者选择性失明,1,2019-09-07 19:13
@o_______诗酒趁年华,,对于造谣者予以强烈谴责！,0,2019-09-07 19:11
@汕尾旅行攻略,,好多香港警察受伤了!他们忍辱负重守护香港安宁!,0,2019-09-07 19:03
@才不叫益酸菌呢,,谣言止于智者,0,2019-09-07 19:01
@高闪闪呀,,微博治港 呵呵,0,2019-09-07 19:01
@VercettiKranic,,太可惜了,0,2019-09-07 19:01
@花耗子和粉猴子,,要是真死人了，就废青的演技，早就把尸体抬出大作文章了！,3,2019-09-07 18:59
@肖兔纸的等等,,谣言止于智者,0,2019-09-07 18:56
@丰胸晶晶,,谣言止于智者,0,2019-09-07 18:54
@AlyssaLaumore,,谴责维基百科，中文维基百科上他们把自杀算作政治诉求的一种方式，但是 英文维基上并未这样宣扬。,0,2019-09-07 18:51
@小词不爱吃荆芥,,谣言止于智者,0,2019-09-07 18:51
@希啊下下下夏,,不传谣 网络造谣传谣真的零成本 唉,0,2019-09-07 18:46
@一星_JK,,,0,2019-09-07 18:40
@骐霖,,这要是在我们大陆，造谣的一定能抓出来，至少行政拘留,0,2019-09-07 18:31
@Audi_ABT,,失望,0,2019-09-07 18:29
@衍棣,,乱世出严法，否则永无安宁。,1,2019-09-07 18:21
@Rani-7,,香港暴徒无所事事，无赖之途，注定是香港的悲哀,0,2019-09-07 18:17
@住在甜宝和兔宝家,,废青穷途末路，开始造谣了,0,2019-09-07 18:15
@_橙汁柠檬可乐水儿_,,,0,2019-09-07 18:11
@Eric-Hon,,谣言止于智者，好了别说了。,0,2019-09-07 18:09
@空中三轮儿,,居然还没弄死几个？？？对待暴徒这么温柔？？说好的法制呢？,0,2019-09-07 18:05
@hlyud199512,,不是撤回了吗？平台那？,2,2019-09-07 18:01
@白水晶KI,,唉不说了，辟谣了,0,2019-09-07 17:51
@荔枝橙i,,支持祖国，支持政府！,0,2019-09-07 17:49
@Zzz是个engineer,,香港这群废青 真的被惯坏了 需要严惩,0,2019-09-07 17:49
@叶立男,,作吧，不作不死，不作怎么执行全国通用法律，怎么一国一制,0,2019-09-07 17:48
@不懂老兮,,哟，还在按剧本来了啊？,0,2019-09-07 17:48
@SEO_minzhao,,@SEO_minzhao 来看看！,0,2019-09-07 17:46
@Cetacea_肖,,一国两智,0,2019-09-07 17:46
@ke爱de纯34919,,香港媒体真的不配为人,0,2019-09-07 17:45
@Asiki-,,依法施政,0,2019-09-07 17:44
@塔塔不是塔塔酱,,服了 不要造谣可以吗,0,2019-09-07 17:43
@陆拾公里,,谁死了,1,2019-09-07 22:33
@October的爱,,过去三个月香港警察都没有公休，不如趁中秋放假一周吧。报警热线也停掉算了，反正咋整都是无政府状态,1,2019-09-07 22:30
@花儿爷不解语,,香港，你最近闹得让本该火热的心都早已冷却。然而，却不自知……,1,2019-09-07 22:29
@二八分少年,,我就想知道今天猪肉多少一斤了,1,2019-09-07 22:22
@明光发布,,香港特区政府：#香港过去三个月并无执法致死个案#,1,2019-09-07 22:21
@PPPPPP魔法袋958,,港真，我比较担心执法者-警察的安危，他们才是弱势群体，被执法者一群强盗畜牲！,0,2019-09-07 20:42
@明天才是,,这港剧还要演多久,2,2019-09-07 20:19
@梦媛nml,,呵，不该死吗？,1,2019-09-07 19:28
@丁当和春天有个约会,,路牌 智慧灯 地铁购票机 地铁门禁锁 的确阵亡了,1,2019-09-07 19:21
@聪明的傻瓜嘉语嘉愿,,别有用心的造谣！多数港煤在我心中可信度已为零！包括这些家媒体以后的新闻报道我都当放p！太没职业道德了！,1,2019-09-07 19:08
@多元夸克,,如果真的开枪，暴乱早平定了。,1,2019-09-07 19:01
@感觉自己好像梁朝伟,,是时候杀几个扰乱分子了 不杀几只黄蜂，他们就以为我们捍卫祖国统一是假的。,1,2019-09-07 18:31
@雨季不再来-echo,,颜色革命的下一步不就是要出命案吗？没有也得造出,0,2019-09-07 17:52
@Nancy阑珊,,天天都说警察杀人！ tmd你们倒是说说谁死了？？？ 死者都没说你给我说警察杀人了！,0,2019-10-07 23:23
@瓶中潮汐寄沧海,,“江湖又要变了。大部分人自己的欲望，给自己带来更可怕的灾难，却在灾难来临时，得不到所求时，一脸无辜的痛骂一切……”,0,2019-09-11 01:30
@兰色夜风,,造谣不用抓？造谣不用负责？呵呵呵,0,2019-09-10 10:14
@Sinlee崇,,死了：监控机、过卡机、售票机、电视机、电梯、玻璃防护栏、垃圾桶,0,2019-09-10 07:24
@小卡卡的谜底,,看烦了,0,2019-09-09 07:32
@永远一兴,,！！！！,0,2019-09-08 20:44
@fc326,,为了香港的未来，就是死几个人算什么，搞垮香港和分裂祖国何等大罪，该出手时就出手。,0,2019-09-08 14:14
@哎呦522,,永远叫不醒傻渣,0,2019-09-08 07:56
@忆_岁月醉人,,致死都不为过好吗,0,2019-09-08 07:47
@whywoman,,说死人了，谁死了，姓名身份证号是什么？胡乱造谣。,0,2019-09-08 07:38
@萌神611,,连香港法官都是港独的人，有没有死刑港独会不知道？装什么傻,0,2019-09-08 07:36
@血腥爱情故事y,,乡岗快凉吧,0,2019-09-08 07:23
@寻找青鸟2205,,放火和搞破坏已经成了废青周末的娱乐项目了，反正做了又不用负什么责任。,0,2019-09-08 07:16
@有痣青年在刷牙,,为什么畏手畏脚的执法,0,2019-09-08 07:02
@雨的印花机,,我只想知道什么时候才能大结局,0,2019-09-08 06:48
@从来未爱你绵绵可惜我爱怀念w,,谣言止于智者  可港灿们没脑子啊,0,2019-09-08 06:31
@清明明清v,,这要是在废青眼里的自由民主美利坚还有开心快乐大不列颠，早就开枪了,0,2019-09-08 06:24
@轩轩的日常linvshuans,,重点是，香港人还真有人信了，笑话,0,2019-09-08 06:21
@繁花似锦安,,转发微博,0,2019-09-08 06:00
@粞e不你,,谣言止于智者,0,2019-09-08 05:59
@白了少年的头,,中央加油！,0,2019-09-08 05:31
@喵星在哪里,,香港政府为什么不去把造谣的人绳之以法,0,2019-09-08 04:46
@Blue扑热息痛片儿,,说实话，对于香港废青，我希望有。。。,0,2019-09-08 04:36
@阿浓啊,,法官不都给放了吗？,0,2019-09-08 04:22
@鱼吃海鲜,,香港造谣不犯法？？？在我们内地只要发现造谣者不负责滴言论，直接帮造谣者转够500次，送造谣者看守所15天游,0,2019-09-08 03:51
@randddd,,香港伦子很多的，伦子造谣很常见、会不会是伦子造的谣！,0,2019-09-08 03:34
@阿joe_阿祖,,这些反动派只是想“强行”把香港拉到颜色革命的第三步而已,0,2019-09-08 02:12
@陈医生1982,,怎Nk就怎么k，不要在意e人怎么看。正所^y世用重典，y病用猛,0,2019-09-08 01:53
@一颗修炼百年的板蓝根,,什么时候大结局啊 这马上都要国庆了,0,2019-09-08 01:49
@兔联档案部,,哎呀，死了好多醍h，我用杀虫水喷死的,0,2019-09-08 01:37
@锐丶不可挡,,,0,2019-09-08 01:29
@王大肥711,,我爱我的祖国,0,2019-09-08 01:28
@桃子媛vv,,他们好像是说有人自杀，我寻思着香港警察还要背自杀的锅？？,0,2019-09-08 01:15
@Amber-小小翠cui,,中央什么时候有行动去帮帮香港这个孩子,0,2019-09-08 01:14
@奥澳傲骜嗷,,让他知道知道他烧的不止是国旗，他烧了自己的前途和尊严,0,2019-09-08 01:13
@学尽量,,“强烈否认”？？？？,0,2019-09-08 01:07
@双慕心,,太过于心慈手软才会闹得了这么久！不判个十年八年这些暴徒不会怕！,0,2019-09-08 01:07
@Shirley的Shirley,,死了，死了上f,0,2019-09-08 00:49
@古怪的左手倒影,,在某书支持警察被禁言了7天,0,2019-09-08 00:44
@李培华li,,谁都说不好，没有亲眼看到。,0,2019-09-08 00:43
@风起伤愈79381,,有致命事件出现，就等于恐怖分子了，到时候别的国家就不能制造舆论了，那些拿美英爸爸钱的废青怎么敢搞出人命来,0,2019-09-08 00:42
@是ZHENBIN呢,,国庆快到了，该解决的早晚会解决,0,2019-09-08 00:34
@黎阳兰,,真是吃多了,0,2019-09-08 00:28
@唐加加,,不死人不出手吗,0,2019-09-08 00:28
@被窝里的小逗比,,,0,2019-09-08 00:18
@我是白白白老爷,,,0,2019-09-08 00:18
@罗忠家,,知道是谣言你么的你不追究！知道是暴徒你不判刑！！,0,2019-09-08 00:10
@sabina866,,滚出中国去,0,2019-09-08 00:08
@Freya盈盈,,#香港过去三个月并无执法致死个案# 香港警察已经很不错了，要受人身伤害家人要受威胁香港警察还能做到如此已经是不易。这要是欧美那边都不知道要死多少废青了,0,2019-09-08 00:06
@Ira_Alisa,,可笑的是废青闹事儿还总想着指着美国等西方势力来做主，真的是被殖民的脑子都没了,0,2019-09-08 00:03
@O橼32943,,到底要怎样？心累,0,2019-09-08 00:00
@哈啊比人,,香港警察辛苦了！我匠拍,0,2019-09-07 23:58
@屁屁的沙皮,,香港消息已经看累了。下一条,0,2019-09-07 23:50
@这不是我的微波,,说实在的，不死人，是解决不了问题的,0,2019-09-07 23:47
@t-正x,,看出来都喜欢打嘴炮！,0,2019-09-07 23:45
@t-正x,,还在谴责啊，你们累了吗？我看都看累了！拿出政府的气概来好吧！越软弱暴徒份子就越猖狂！每天看直播剧心累了,0,2019-09-07 23:43
@抄抄商,,港警真的是克制人性执法到了极致，再看看西方,0,2019-09-07 23:42
@小丢丢猫,,没有依法追究法律责任，那些港媒就能随便造谣污蔑，反正乱说话没成本,0,2019-09-07 23:31
@A24小时晴天,,香港自治我们尊重，但是这样无休止的这样下去只会越来越严重特区政府态度也是暧昧，废青头脑人物上午抓下午保释…,0,2019-09-07 23:30
@lzb等ni,,好幼稚，低Ｂ的做法！传谣言的人才该死,0,2019-09-07 23:26
@赵成鑫要加油啊,,就是真的致死了那也活该，咱还得办个酒席贺一贺,0,2019-09-07 23:26
@小萌同学o_O,,,0,2019-09-07 23:22
@非想飞翔119,,香港警察为什么没有国际接轨呢？,0,2019-09-07 23:20
@陕西检察,,【香港特区政府：#香港过去三个月并无执法致死个案#】香港特区政府今天严正声明，过去三个月的执法行动中并无致命个案。至于有人称在8月31日晚上在港铁太子站冲突中有致命事件发生，政府称这是持续散播的谣言，予以强烈否认。发言人强调：“这些不负责任的谣言不断在网上散播，意图误导市民。”,0,2019-09-07 23:19
@黑加白的竹几君,,香港警察:不，我一口一个人头,0,2019-09-07 23:14
@冥皇之魂,,转发微博,0,2019-09-07 23:10
@・0602,,看腻了，智只想看结局。说真的，他们这么闹腾还不如猪肉呢。,0,2019-09-07 23:09
@弯弯的小月,,只有当事人知道究竟发生了什么！,0,2019-09-07 23:08
