User,Reter,Comment,Votes,Time,Count
@佬升长谈,,连杜月笙都不如，兔子还不吃窝边草，这家伙涸泽而渔，焚林而猎,1,2019-09-13 22:40,1
@哟呵2018,,他就是幕后金主,4,2019-09-13 19:09,1
@花花世界太过美没有我踪影,,胡应湘跟李嘉诚就是最好的对比,0,2019-09-25 23:36,3
@听众9090,,资本是没有人性的，而资本家把资本的逻辑代替了做人的逻辑，所以也就没有了人性。而且他们都根深蒂固地认为追求赚钱是没有错的，人民困苦是他们不会赚钱。甚至香港的很多劳动群众也是这么认为的。他们真应该读读马克思的《资本论》，帮他们认清资本主义的本质。,0,2019-09-16 00:09,1
@摄影师Caton,,李黄瓜老了，机关算尽，算不到自己老糊涂，把真面目暴露出来了，估计是他结发妻子在庄明月楼想他了。（笑）,0,2019-09-14 11:13,1
@又是山岗上,,妈了个巴子的，都是资本家和政府没座位。,0,2019-09-14 10:46,1
@所谓红火的日子,,他可能忘了，黄氏永远不可能成为香港的统治者。护佑不了他家族的周全，继续跑，跑快点，晚点全家族都会树倒猢狲散。灭族不是因为中国的专制统治者要收拾你，而是你触犯了中国法律。资本家思维该收一收了，香港不是你的后花园。,0,2019-09-14 10:02,2
@所谓红火的日子,,还有二十年撤离香港，赶紧滚到英国去吧。李嘉诚往世界首富的路上戈然而止，现在亚洲首富都保不住，过几年香港首富都保不住了，真是老糊涂了。法律不是儿戏，不是可以讲价的，西方资本家可以控制国会，中国行不通。游行中的犯罪也是犯罪，必须绳之以法。,0,2019-09-14 09:53,2
@月华樱712,,犯了政治错误，老头这可不是随便解释解释就能了事的了,0,2019-09-14 04:59,1
@涛落沙明-,,不知道他们要这么多钱干什么，子孙好几辈（不败家的话）都应该花不完吧。只知道割韭菜不舍得施肥，终归是没有大胸怀之人。,1,2019-09-13 22:12,1
@幸福来敲门mm9,,李嘉诚的儿子李泽楷和李泽，都是加拿大和香港双重国籍。,0,2019-09-13 21:49,1
@知行一68,,唯利是图的没有爱国心的港商！香蕉人！,0,2019-09-13 21:39,1
@泽喜201507,,李嘉诚有什么产业？,0,2019-09-13 20:57,2
@泽喜201507,,要顾百姓死活也不会把房价炒这么高，看看大陆企业家，让老百信都能消费的起产品，才是有品的企业家,0,2019-09-13 20:56,2
@shihua1258,,中央政法委狠批李嘉诚是纵容犯罪，中央早该发声。这样才能依法治国依法治港。,1,2019-09-13 20:48,1
@正人君子1968,,知道分摊面积的危害性了吧！,1,2019-09-13 20:43,1
@深圳老边城,,不太有品，这词有点文艺,0,2019-09-13 20:39,1
@曾_小迪迪迪迪迪,,呵呵,0,2019-09-13 20:10,1
@橙子等水果,,不放一马，背后支持的钱款源头总会漏出端倪,1,2019-09-13 19:48,1
@稳稳60分,,李嘉诚是打算抽空香港现金了。。。,0,2019-09-13 19:19,1
@zjg000020,,李嘉诚在大陆有么产业，让它黄了就完事了！,0,2019-09-13 19:05,1
@投资小生1299,,窃听风云真实写照,0,2019-09-13 19:03,1
@Conquest天堂,,好诗,0,2019-09-16 13:28,1
@懵懂hgcv,,get,0,2019-09-15 19:54,1
@小楼今夜又东风527,,香港就是鹅城，李嘉诚就是那个黄四郎！,1,2019-09-15 08:39,1
@汉家宗祠v,,哪个政府是那么有担当的？？不能要求商人替代政府角色吧？,0,2019-09-14 17:04,1
@ok路ok,,转发微博,0,2019-09-14 14:16,1
@青山-东流,,狐狸尾巴终究藏不住。,0,2019-09-14 14:08,1
@这个社会会1,,打铁还需自身硬。,0,2019-09-14 13:54,1
@君品鉴,,闪亮的最后一句,0,2019-09-14 05:34,1
@V旗开得胜,,好诗//@520我反:黄台一百瓜，李摘九十八，而今瓜殆尽，劝汝莫摘瓜。汝欲另种瓜，派贼毁田洼，此时要擒贼，却求放过他。//@南方小剑剑:终于，与这个大奸商告别了！,1,2019-09-14 02:00,1
@小恋1990YE,,原本喜欢他，现在开始转黑粉了,0,2019-09-14 00:09,1
@优趣170,,没品,0,2019-09-13 23:43,1
@丹青不渝9999,,老狐狸终于跳到前台上了,0,2019-09-13 23:38,1
@六里桥燃灯子,,当年大陆是李黄瓜奴，现在李黄瓜是大陆奴。,0,2019-09-13 22:39,1
@博天下客,,法制未网开来面 开到坐头拉粪便 任由独虫心所欲 港府什么都别干 此类逻辑太混蛋 那个国家如此烂 美英可否有案例 谬论助推养奸汉,0,2019-09-13 22:28,1
@红猫上尉002,,为各位自称左派支招：当前形势下，“四大家族”是我们的友军，不是我们的敌人，是万万得罪不得的。知道在联合国人权理事会发言的何超琼是谁么？读过何鸿霾┦看记么？连这都不晓得，也没有资格参与讨论当前的香港问题了。切勿帮倒忙，谢谢。//@侠骨柔情的杨华://@占豪://@520我反,0,2019-09-13 22:10,1
@uryy07,@夏天大耳朵900,的确。但是问题总要解决的嘛。,0,2019-09-13 21:01,2
@一凡de天空,,以前上海人背地里管香港人叫港瘪的,1,2019-09-13 20:45,1
@陈惠琼系大琼,,当然想网开一面，不然谁来维护他的资本主义下的意识形态,0,2019-11-03 01:45,3
@风引蒲公英,,再有本事的商人，当要动摇国家根基时，也是会拿来祭旗的。,1,2019-09-29 19:58,3
@陶然居28966,,几届领导人都接见过李嘉诚，李对国内捐了几百亿港币建大学医院还有其他公益事业，投资建设港口桥梁，没有偷税漏税坑蒙拐骗弄虚作假，没有贷款欠款，没有贿赂公行，没有偷工减料，没有偷贪摘黄台之瓜，一切依法依规，每个人都明白商业风险和盈亏规则的进退。,0,2019-09-26 22:31,3
@花花世界太过美没有我踪影,,胡应湘跟李嘉诚就是最好的对比,0,2019-09-25 23:36,3
@吴小伍,,焦点转移李嘉诚,0,2019-09-24 03:56,3
@KS718,,丢尽潮人脸……,0,2019-09-23 14:32,3
@陈惠琼系大琼,,当然想网开一面，不然谁来维护他的资本主义下的意识形态,0,2019-11-03 01:45,3
@风引蒲公英,,再有本事的商人，当要动摇国家根基时，也是会拿来祭旗的。,1,2019-09-29 19:58,3
@陶然居28966,,几届领导人都接见过李嘉诚，李对国内捐了几百亿港币建大学医院还有其他公益事业，投资建设港口桥梁，没有偷税漏税坑蒙拐骗弄虚作假，没有贷款欠款，没有贿赂公行，没有偷工减料，没有偷贪摘黄台之瓜，一切依法依规，每个人都明白商业风险和盈亏规则的进退。,0,2019-09-26 22:31,3
@花花世界太过美没有我踪影,,胡应湘跟李嘉诚就是最好的对比,0,2019-09-25 23:36,3
@吴小伍,,焦点转移李嘉诚,0,2019-09-24 03:56,3
@KS718,,丢尽潮人脸……,0,2019-09-23 14:32,3
@叶小雾,,一边倒，太假了,0,2019-09-21 00:20,2