User,Reter,Comment,Votes,Time,Count
@第10086次忘记密码的张女士,,你这三条选项没有一个代表反对的你让我选啥子选,0,2019-09-25 22:23,1
@莫烦新家,,支持,0,2019-09-25 22:17,1
@你到底爱不爱吃呢,,.,0,2019-09-25 22:07,1
@我就喜欢穿貂,,2评论？,0,2019-09-25 22:02,1
@呆猪猪的贝贝o,,社会各界人士可以在2019 年9 月17日至2019 年10 月17 日期间，通过信函方式寄至合肥市庐阳区六安路221 号市司法局（立法处）或电子邮件将意见发送至1559275997@qq.com,0,2019-09-26 11:10,2
@龙象起舞,,牛、羊、猪等检疫用塑料标牌耳号牌，方便日常管理。可以采用这种方法进行管理，耳号牌智能＋GPS定位融合形式使用。二维码识别宠物各项信息，身份信息、防疫信息、以及饲养人信息等，在核心区域全面禁养，规定区域除外。还要制度相关饲养细则，包括佩戴嘴套系绳遛狗违规处罚。,0,2019-09-26 04:34,1
@Stars海心,,不支持 1、年龄问题 2、还限养一只，其他要我丢了吗,0,2019-09-26 04:18,1
@Cong的胡萝卜,,贵报要凉？,0,2019-09-26 00:13,1
@诗瑶不打烊studio,,这是什么狗屁选项。。垃圾,0,2019-09-25 23:34,1
@东风化宇,,请问你对这条规定是支持呢，还是非常支持呢？,0,2019-09-28 15:38,3
@东风化宇,,请问你对这条规定是支持呢，还是非常支持呢？,0,2019-09-28 15:38,3
@呆猪猪的贝贝o,,社会各界人士可以在2019 年9 月17日至2019 年10 月17 日期间，通过信函方式寄至合肥市庐阳区六安路221 号市司法局（立法处）或电子邮件将意见发送至1559275997@qq.com,0,2019-09-26 11:10,2
@新鲜薯条君,,智商不够禁止从事媒体工作，谁支持谁反对？,1,2019-09-26 10:14,2
@I球球-筱o,,就这样的选项  出稿前审核过么  一边倒的暗示选项意义何在 还发出来干什么  一边掐着脖子说你给我死 一边问它想不想活？,0,2019-09-26 09:23,2