User,Reter,Comment,Votes,Time
@雨Rain1816,,我就是那个带着宝宝在电梯出事的妈妈，看到自己的宝宝命悬一线被电梯夹住，我的心像刀割一样痛，宝宝一直在哭，我只能安慰宝宝，别怕，妈妈在。宝宝整整吊了一个小时才救下来,0,2019-10-01 22:16
@雨Rain1816,,我就是那个带着宝宝在电梯出事的妈妈，看到自己的宝宝命悬一线被电梯夹住，我的心像刀割一样痛，宝宝一直在哭，我只能安慰宝宝，别怕，妈妈在。宝宝整整吊了一个小时才救下来,0,2019-10-01 22:16
@雨Rain1816,,可恶的是出事的电梯维保单位和我们小区物业至今没有给我一个说法，我的宝宝还在住院，他们却在快乐着过着国庆假期！找他们谈还要等到他们八号上班！泱泱大国，社会主义国家还有这样嚣张之人！,0,2019-10-01 22:15
@雨Rain1816,,我就是那个带着宝宝在电梯出事的妈妈，看到自己的宝宝命悬一线被电梯夹住，我的心像刀割一样痛，宝宝一直在哭，我只能安慰宝宝，别怕，妈妈在。宝宝整整吊了一个小时才救下来,0,2019-10-01 22:15
@我的情歌里有你,,吓死了,1,2019-09-28 10:13
@睿色佳蓝,,,0,2019-09-27 11:01
@寇鹏电梯侠,,又是一起这样的电梯事故，再次提醒#电梯侠# 们对于守护的电梯，依据作业标准进行维修保养，不仅仅是对电梯设备的责任，我们守护的是每天无数次上上下下电梯乘客的生命安全。维护电梯世界的和平――电梯侠们[加油][加油][加油]。建议对于这样恶略的恶性电梯事故追责到底，责任企业吊销从业资质‘。,2,2019-09-27 09:06
@江边草-爱自己,,,0,2019-09-27 08:52
@胖纸阿聪,,好可怕，我好怕呀,0,2019-09-26 22:09
@小涵涵小小赵,,@普通市民213,0,2019-09-26 18:23
