User,Reter,Comment,Votes,Time
@狂征,,电影想靠节奏的变化逗人发笑，那计俩也就是我小学时候逗同桌女生的水平，看着太难受，跟老电影哪吒闹海根本没法比，老电影我能给9分，要说扯皮的俏皮话，这部片子跟很多现代电影都差得远，要说古色古香的古老神话传说，演绎得又远不能淋漓尽致，演的错乱也让我看的错乱，真的不知道是什么样的人才会被,0,2019-12-02 00:16
@小爷就是哪吒,,加油吧,0,2019-11-26 21:10
@烟圈归零,,嗨呀，你这个混账娃儿,0,2019-11-23 23:42
@王多辣WaQ,,为啥金鸡奖提名都没有小哪吒？是没有参赛吗？,0,2019-11-23 21:24
@MC冰霜018,,233,0,2019-11-22 12:25
@小何酱酱呐,,救救英专生吧，想写哪吒几个月了，开题报告要开始准备了，还没等到双语字幕的哪吒啊，咋的我都愿意啊，我就想写个毕业论文,0,2019-11-21 13:18
@小何酱酱呐,,啥时候国内出中英文字幕的哇，哭了，想写哪吒的毕业论文，这看都没看到过,1,2019-11-20 13:02
@唯ai吒儿,,自从上映天天看，一直没有停下，最爱我吒,0,2019-11-17 20:58
