User,Reter,Comment,Votes,Time
@i九霖,,现在机场和车站那个刷脸的难用死了，最重要的是把你身份证照片跟你本人一块显示在屏幕上面比较，后面人全看到了。。。。,305,2019-09-25 16:57
@大泽科技SHOW,,有机会去飞一次，可算离家近了。,118,2019-09-25 16:34
@新浪数码,,刷脸登机厉害了,82,2019-09-25 16:32
@Nikkingstar,,这也叫？广州机场有了。,50,2019-09-25 16:47
@0801耿直boy,,如果离婚结婚办证能刷脸就好了，找下一任的速度就提高了,38,2019-09-25 17:09
@人海风云_,,北京站那个刷脸的，简直难用的要死，严重影响进站效率…,46,2019-09-25 16:34
@周周周爱运动,,,8,2019-09-25 17:14
@早上的太阳阿辉,,不过刷脸速度不是很快吧,11,2019-09-25 16:47
@Barbietron,,太远了…,3,2019-09-25 19:21
@LNYODG1314,,其实这样也方便找人，查人，利用大数据,6,2019-09-25 17:15
@剑起云清,,对电子值机无影响啊,3,2019-09-25 16:56
@贫民窟女孩李宗兰_,,高铁站也是刷脸。但很多不会就会堵。,2,2019-09-25 17:29
@瑞为技术Reconova,,欢迎到大兴机场，体验瑞为全流程刷脸登机,1,2019-09-26 11:21
@我别是个程序员吧,,就是个人脸识别信息匹配，不要张嘴就是黑科技。,2,2019-09-25 17:36
@正派小老弟,,在宁夏早都有了。,6,2019-09-25 17:12
@Mandarren,,都说了 不用任何证件 直接就能刷脸通过 评论里还一堆我们哪哪早就有了...,1,2019-09-26 00:37
@ZxuuuuueH,,上学，食堂发到，出校门都是用刷脸,1,2019-09-25 21:38
@小小小丢,,如果身份证和本人差距大的，那就飞不了了,0,2019-09-26 00:04
@hakunamatata_ann,,前几天交材料，同事姐姐：这个证件照是你么？完全不像本人，这样系统可能无法通过！你平时不会被质疑证件不是本人的么？我：常常需要证明我是我，十本不同证件拿出来像一个队伍，不是一个人,0,2019-09-25 22:51
@Datrilla,,希望车站也可以跟着//@菠萝蕉与柠檬桃:亲亲 不用拿证件直接刷的那种哦,0,2019-09-25 21:02
@暖阳阿呦喂,,@平朔回忆专用小马甲,0,2019-09-25 20:20
@开封市见义勇为,,我父亲以前是浙江笕桥机场28师的飞行员,0,2019-09-25 19:49
@强哥打克充,,进飞机舱的时候，空姐还不是要看登机牌，然后告诉你座位在哪里。,0,2019-09-25 19:28
@ChelceeCcccccC,,赞～,0,2019-09-25 18:30
@德纲伴我眠,,成都车展刷脸买水的时候我就在想，要是坏蛋学电影带假皮囊顶替你会怎么样？,0,2019-09-25 17:28
@彩色小幂,,西安也有啊。。。。,2,2019-09-25 17:12
@彼岸at灰色,,这也叫黑科技？,0,2019-09-25 16:33
@hotage霍太奇,,这个乌鲁木齐早就有了,1,2019-09-25 18:07
@ins模特,,现在机场和车站那个刷脸的难用死了，最重要的是把你身份证照片跟你本人一块显示在屏幕上面比较，后面人全看到了。。。。,1,2019-09-25 17:46
@yxia,,杭州的萧山机场也是刷脸出入境……,0,2019-09-26 00:19
@Vicki阳阳,,请仔细看文案，别着急聪明伶俐,0,2019-09-25 23:07
@Sophia,,试过刷脸的  哎！！！,0,2019-09-25 17:47
@钰钰不吃鱼,,银川好像一两年前就有了...,0,2019-09-25 17:35
@柠檬味的甜美系,,我们县城的高铁站也有……,0,2019-09-25 17:31
@茜茜茜酱昂,,外国人咋办，，，,0,2019-09-25 17:24
@\唱__呢段,,银川都用了两年刷脸登机了,3,2019-09-25 17:11
@简白jianbai,,转发微博,0,2019-09-25 17:08
@苏荷岛屿,,希望以后可以更智能化，不用提前两小时到机场,1,2019-09-25 19:11
@天色渐渐亮,,好多景区都是这功能啊？为什么搞得才发明一样？不用证件直接刷脸，就是带着墨镜得取下墨镜。,0,2019-09-25 18:36
@仙女越的风骑士,,我觉得那个自动化停车场更值得吹。,1,2019-09-25 17:30
@星辰大海的星星,,河东机场早几年前就有啦，还特别好用,1,2019-09-25 17:24
@lx_Double,,高铁站火车站不早就有了？,1,2019-09-25 17:16
@我是斌斌BEN,,无需啥？读了我半天,0,2019-09-26 00:37
@陆陆陆的爱,,刷脸也叫黑科技吗？大学图书馆就有呀！,0,2019-09-26 00:12
@Therave,,哈哈哈身份证和人脸刷 整容的可能有麻烦,0,2019-09-25 23:47
@Ciel-Woody,,我真的是特别特别讨厌刷脸这个功能！你们不觉得超级危险的吗？,0,2019-09-25 23:42
@yfunzh,,广州白云机场好像也可以的,0,2019-09-25 23:39
@二萌小蓝兔,,整容了的怎么办？,0,2019-09-25 23:38
@我不常刷博,,听说厦门也要建新机场.,0,2019-09-25 23:28
@_辣条仙女AXu,,刷脸登机 银川都用好久了,0,2019-09-25 23:21
@MakeBigNews333,,收集登机牌的可怎么过 ,0,2019-09-25 23:14
@漫长的中场休息,,这只是登机，前提是先刷身份证安检采集人脸信息,0,2019-09-25 22:40
@大头派mama,,我能说我们单位大门的闸机都能直接刷脸了么。。。,0,2019-09-25 22:35
@我是李大喵i,,让双胞胎情何以堪？,0,2019-09-25 22:27
@baker55,,伦敦希思罗早就用上了………希思罗也是一个二维码走天下的机场,0,2019-09-25 21:56
@烦死了又得改名,,好烦 果然没有隐私,0,2019-09-25 21:25
@真空糯米团,,银川机场已经有了,0,2019-09-25 21:17
@哈_zZ,,看来我的盛世美颜藏不住了吗,0,2019-09-25 21:16
@锋暖暖12,,会不会很慢呀,0,2019-09-25 20:29
@你为何不留长发,,双胞胎的怎么办？,0,2019-09-25 20:08
@给我一颗西柚啊,,希望赶快都普及！！！这样回家好方便！！,0,2019-09-25 19:56
@姜花啊姜花,,@唐真甜呢- 完了,0,2019-09-25 19:56
@玟星伊的Rap丶有腔调,,,0,2019-09-25 19:36
@狂奔的芒果草,,我们坐大巴都有这设备了 有啥可炫耀的,0,2019-09-25 19:35
@鲁滨逊服饰,,每天进京都要刷脸啊,0,2019-09-25 19:23
@兔兔金BABY,,潍坊火车站进候车室都要刷脸,0,2019-09-25 18:57
@c陈胤哲,,高铁刷脸没成功过,0,2019-09-25 18:20
@19TYPES,,我们宿舍楼都已经刷脸进了,0,2019-09-25 18:12
@fivetant的学习笔记,,如果去整容完回来的，刷不了了吧,0,2019-09-25 18:09
@W简安,,那要是整过容的呢,0,2019-09-25 17:59
@稍稍安o1,,广州机场也要刷脸,0,2019-09-25 17:51
@梦气球工坊,,其实刷脸登机什么的早就有了，只是因为大兴机场的工程用了4年，所以才用，不然早就用上了,0,2019-09-25 17:49
@我爱jia,,高铁站刷脸的就经常刷不过，可能是我比身份证上照片好看,0,2019-09-25 17:44
@盐渍西瓜_x,,凡是进展指纹或者刷脸的，我没有一次进去过的。。都是最后人工查完了以后，才放我进去。。。,0,2019-09-25 17:44
@肉肉想ci肉肉,,我们学校进班还要刷脸,0,2019-09-25 17:41
@gracelllkkk,,高铁站人脸识别就从来没有识别过我的脸,0,2019-09-25 17:33
@和你在一起2啊,,高铁早就实行了,0,2019-09-25 17:29
@萍萍小天使啊,,这不是早就有了,0,2019-09-25 17:27
@轻松快乐面对一切,,嗯,0,2019-09-25 17:20
@晴转多云12摄氏度,,西安也是刷脸登记,0,2019-09-25 17:19
@瞳里放映,,~,0,2019-09-25 17:18
@小泽核桃人,,高铁不早就刷脸了？！,0,2019-09-25 17:18
@adrunkdrum,,双流机场早就是人脸识别了 经常都有人通不过堵半天,0,2019-09-25 17:15
@伊乡人,,临时被航空公司通知，明天就要去体验了，小白鼠的感觉,0,2019-09-25 17:05
@小音冲啊别害怕,,dbq我看成了，，，登脸刷机。。。,0,2019-09-25 16:56
@江海商务2019,,,0,2019-09-25 17:16
@-SayCheese-,,火车站也刷,0,2019-09-25 17:02
@知足常乐6609220913,,，,1,2019-09-25 17:21
@YY一一6027127597,,刷脸技术,0,2019-09-26 09:40
@PrimaryFlowers,,别说刷脸了，我身份证是14岁左右时候照的，当时不仅胖还不让戴眼镜，上次在机场过安检我看她对比半天纠结死了，我当场把眼镜摘了头发撸起来给她看才让我过的[左哼哼],0,2019-09-25 21:12
@双鱼懒小婷,,@KuroLight 厉害了,0,2019-09-25 18:13
@Seven_琦琦琦琦琦,,@丶赵七八 过不去 尴尬了,0,2019-09-25 18:10
@蝴蝶来过拘留,,完了，好几次人工都没识别出我和护照或者身份证照片是一个人，ai人工智能大会都是，，看来我是用不了大兴机场的飞机了,0,2019-09-25 17:30
@无忧操盘手,,#大兴机场刷脸就可坐飞机# #大兴机场首航# #大兴机场刷脸即可登机# 科技的进步！,0,2019-09-25 17:25
@GarbageCan2019,,就怕刷脸识别不了,1,2019-09-25 17:22
@梦里水乡春游客,,这是未来的科技,0,2019-09-25 17:22
@人民致富,,嗯,0,2019-09-25 17:22
@社会人杨波,,,1,2019-09-25 17:20
@备用微信2019,,666,0,2019-09-25 17:19
@羽-sky-_-,,感觉刷脸并没有提高效率，但这也是一种方式吧，可以单独开辟通道,0,2019-09-25 17:09
@带我去看星星吧小号,,牛逼了，离我好远,0,2019-09-25 17:08
@2020宇宙星辰,,火车站现在也是刷脸,0,2019-09-25 17:07
@上任村官,,刷脸需要不需要卸妆？,0,2019-09-25 17:00
@cy么么哒哒,,出个操作手册吧，我怕到时候去一脸懵逼,1,2019-09-25 16:58
@瑞为技术Reconova,,欢迎到大兴机场，体验瑞为全流程刷脸登机,1,2019-09-26 11:21
@YY一一6027127597,,刷脸技术,0,2019-09-26 09:40
@Mandarren,,都说了 不用任何证件 直接就能刷脸通过 评论里还一堆我们哪哪早就有了...,1,2019-09-26 00:37
@我是斌斌BEN,,无需啥？读了我半天,0,2019-09-26 00:37
@瑞为技术Reconova,,欢迎到大兴机场，体验瑞为全流程刷脸登机,1,2019-09-26 11:21
@YY一一6027127597,,刷脸技术,0,2019-09-26 09:40
@Mandarren,,都说了 不用任何证件 直接就能刷脸通过 评论里还一堆我们哪哪早就有了...,1,2019-09-26 00:37
@我是斌斌BEN,,无需啥？读了我半天,0,2019-09-26 00:37
@yxia,,杭州的萧山机场也是刷脸出入境……,0,2019-09-26 00:19
@陆陆陆的爱,,刷脸也叫黑科技吗？大学图书馆就有呀！,0,2019-09-26 00:12
@小小小丢,,如果身份证和本人差距大的，那就飞不了了,0,2019-09-26 00:04
@Therave,,哈哈哈身份证和人脸刷 整容的可能有麻烦,0,2019-09-25 23:47
@Ciel-Woody,,我真的是特别特别讨厌刷脸这个功能！你们不觉得超级危险的吗？,0,2019-09-25 23:42
@yfunzh,,广州白云机场好像也可以的,0,2019-09-25 23:39
