User,Reter,Comment,Votes,Time
@原来是海绵锅,,他巴西不管不顾，大家都不管不顾，那一起呗，都生活在同一颗星球，使劲败，迟早死绝！,0,2019-09-25 16:23
@炮轰平安县城,,那你是地球之肺,0,2019-09-25 16:12
@不食大蒜君,,虽然国家不怎么样，不过外交发言上很硬气啊，我觉得我们有时候太温柔了，导致其他国家都想为所欲为,0,2019-09-25 16:03
@王智O,,好一个亚马孙卧槽,0,2019-09-25 16:00
@王智O,,亚马逊！！！！！都是读书人,0,2019-09-25 15:59
@春晓不知暖,,别的国家给你帮助还能抢了你的地？,0,2019-09-25 15:58
@77mmmmm77,,太个人化了吧，环保人人有责,2,2019-09-25 18:33
@坏耳朵的兔子,,我们砍了树，现在有沙尘暴。你现在烧树，子孙就吃亏，现在我们花钱种树。大自然是最公平的，地方生态破坏，先自己遭大罪。做个人吧。,2,2019-09-25 18:07
@日月各半,,没烧当了这么多年地球之肺，烧了就赶紧否认，哎，西方总统一个个不要脸,2,2019-09-25 18:02
@像素world,,没发生火灾之前也没见你反驳这是谬论。,2,2019-09-25 17:52
@文过饰非emmm,,建议联合国灭了巴西,2,2019-09-25 17:49
@小破孩0316,,不干涉他国内政,2,2019-09-25 17:27
@Noein爱游泳,,嘛 他说得也对 地球的氧气90%来自于海洋中的藻类 陆地上的只是很少的一部分,2,2019-09-25 16:09
@金大师看盘,,互不干涉他国内政,1,2019-09-25 15:58
@不老的学长,,亚马逊雨林没了，世界也不会怎么样，人类把地球看的太脆弱了，人类自己作死没了，地球照样可以慢慢恢复，毁灭地球几万颗原子弹也是几万个坑，地球有影响么,1,2019-09-25 21:27
@烟雨江南V32,,地球绿肺是不是另外说，哪个国家没有自己的绿化？把自己的砍光了建设成了城市，要求别人必须保留，以保证他们的子孙后代,1,2019-09-25 21:22
@流星卡里,,他想保护自己的国家，说得过去，但是他放任雨林一直烧我就不懂了！！！,1,2019-09-25 20:56
@me假装在假装,,做为正经新闻媒体 连字都写错 这么不严谨,1,2019-09-25 20:47
@像个孩子一样胆怯,,巴西不是地球之肺，那么请问谁是地球之肺？,1,2019-09-25 20:24
@仙姿玉质,,都烧没了，还能是肺了么？,1,2019-09-25 19:55
@forbiddenspace,,关键是你要保护地球之肺，你倒是出钱维护啊,1,2019-09-25 18:41
@Tom_hz,,顶！地球之肺个毛线！无良媒体乱带节奏好几个月了，不能忍！我看小学科学、初高中地理生物都白教了！信不信全球森林全烧光了对氧气总量也没影响？山火是最“自然”的自然现象，只能控没法救。一帮环保恐怖分子，假科学，真扯淡！,1,2019-09-25 18:18
@我只宠那只猫,,人家说的在理，雨林在巴西境内，人家爱怎样就怎样，我们无权管人家,1,2019-09-25 18:14
@JR的飞行日志,,在这里哔哔也没用，人家不甩你你能咋,1,2019-09-25 18:08
@咸鱼把身翻,,其实也没错，其他人最多只能表示遗憾或者惋惜，没有立场指责人家,1,2019-09-25 17:55
@淼xnl,,记得地理上学的亚马逊不是亚马孙啊,1,2019-09-25 17:54
@Draganbill375,,中国改革开放发展的时候，环保就是个笑话,1,2019-09-25 17:50
@晨阳要努力努力再努力y,,How  dare you,1,2019-09-25 17:48
@彭鱼宴vv,,政绩做的再好也是你在世上，等地球因为环境问题毁灭的那一天，人们会翻牌当初就是某某总理总统分不清主次。,1,2019-09-25 17:47
@致很丧的自己,,我赞同，任何帮助或者支持的行为，必须在尊重巴西主权的基础上，否则就是赤裸裸的殖民主义思想,1,2019-09-25 17:44
@黄彬_Billy,,空洞地用道德去衡量也是无力的 巴西经济很差 民生更不行 都快吃翔了 哪里还管得了这么多。发达国家还是饱汉不知饿汉饥 全世界的国家如何能均衡发展 才是人类应该探讨的问题 人类命运共同体。既然地球是共同的地球 那么命运就是一起的,1,2019-09-25 17:41
@Boring丶dull,,,1,2019-09-25 17:38
@醉在天山,,地球之肺只是个噱头而已,1,2019-09-25 17:36
@星辰非昨夜00,,说个题外话看到评论都写的是亚马逊雨林，视频字幕亚马孙雨林，据我所知正确规范写法确实是亚马孙雨林，跟那个电商是不一样的。,1,2019-09-25 17:33
@一打锦鲤,,我严重怀疑一大堆人视频都没看完就在这里乱说,1,2019-09-25 17:32
@慢慢变好o,,一个不是就可以一概而过了吗？,1,2019-09-25 17:30
@BadBoy丶MZ,,这总统就是混吃等死之人,1,2019-09-25 17:28
@qzuser02143585,,我要是巴西人我也不乐意天天被国际上的嘴炮精说,1,2019-09-25 17:26
@年轻命硬奥力给,,人真正想表达的意思是，首先热带雨林是巴西的不是世界的。,1,2019-09-25 17:25
@小笼包夹着柠檬,,我怀疑这火就是巴西政府放的，所以才迟迟不肯灭,1,2019-09-25 17:15
@1985z氏度的植物人,,亚马孙玉林是什么鬼,1,2019-09-25 17:07
@风晓期912,,小小声的请教一下，火灭了么？？,1,2019-09-25 17:01
@林同学的2018大计划,,世界的肺，应该谁来维护呢,1,2019-09-25 17:01
@Mr丶拉布拉卡,,不知好人心 狗咬吕洞宾,1,2019-09-25 16:58
@阳光下的鱼00,,都没错啦！只不过没了亚马孙雨林，就不是在网上说说而已。就像流浪地球那句话一样。大家都觉得这些很遥远，但灾难来到你眼前后。一切都来不及了,2,2019-09-25 16:54
@一直叫逆旅以南的逆旅以南,,同意,1,2019-09-25 16:54
@小橙子巴拉巴拉,,简单，发达国家每年向巴西交呼吸费,2,2019-09-25 16:51
@蹦擦啦唬卡,,一片森林都管不好，还管理国家的人民,1,2019-09-25 16:51
@笑_咸鱼2号,,中心思想：雨林顶个肺,1,2019-09-25 16:51
@岁末的秋222333,,人家就是想烧你们还能把他咋滴,1,2019-09-25 16:44
@xx筱筱吖,,亚马孙,0,2019-10-10 23:26
@蜂蜜柚子茶里没有茶,,站的,0,2019-09-28 17:04
@Tape_five,,中国改革开放这么多年了，还有这么多人小农意识根深蒂固，仿佛从大清直接穿越过来的，粗放式经济是什么，我只晓得吃饭，什么能有我吃饭重要。,0,2019-09-26 11:42
@wanhai4423,,地球之肾在哪里,0,2019-09-26 07:16
@汪星牛,,这家伙真给巴西人民丢脸……比特朗普还不要脸,0,2019-09-26 05:55
@小樱子Kirsikkakkkk,,宁愿灭绝全人类也要同情巴西人，真的好圣母哦，你爸你妈知道你有这个孝心吗，我怕死我就让巴西保护环境咋的了圣母？,0,2019-09-26 05:34
@朵朵58726,,，,0,2019-09-26 03:27
@热带雨林-Titus5555,,每个人都想关起门来称大王，对于周围邻居关心他家天井里那口百年古井，街坊邻居试图阻止他将古井破坏掉来给自己做寿庆生的行为，很感不满。认为这是“干涉主权”，妨碍了自己关起门来做山大王的“主权”。,0,2019-09-26 03:00
@xx筱筱吖,,亚马孙,0,2019-10-10 23:26
@蜂蜜柚子茶里没有茶,,站的,0,2019-09-28 17:04
@Tape_five,,中国改革开放这么多年了，还有这么多人小农意识根深蒂固，仿佛从大清直接穿越过来的，粗放式经济是什么，我只晓得吃饭，什么能有我吃饭重要。,0,2019-09-26 11:42
@wanhai4423,,地球之肾在哪里,0,2019-09-26 07:16
@汪星牛,,这家伙真给巴西人民丢脸……比特朗普还不要脸,0,2019-09-26 05:55
@小樱子Kirsikkakkkk,,宁愿灭绝全人类也要同情巴西人，真的好圣母哦，你爸你妈知道你有这个孝心吗，我怕死我就让巴西保护环境咋的了圣母？,0,2019-09-26 05:34
@朵朵58726,,，,0,2019-09-26 03:27
@热带雨林-Titus5555,,每个人都想关起门来称大王，对于周围邻居关心他家天井里那口百年古井，街坊邻居试图阻止他将古井破坏掉来给自己做寿庆生的行为，很感不满。认为这是“干涉主权”，妨碍了自己关起门来做山大王的“主权”。,0,2019-09-26 03:00
@有卿有艺,,他的意思是亚马逊雨林不是什么地球之肺，是我们巴西之肺。亚马逊雨林出什么事儿是我们巴西的事儿，轮轮不到你们指手画脚。,0,2019-09-26 02:12
