User,Reter,Comment,Votes,Time
@Dretgher,,很正常，国家要发展，其他国家不让。立场不同而已，没有谁对谁错。,5209,2019-09-25 14:20
@歌传宣华,,关门，放瑞典抑郁症小女孩，咬他,2697,2019-09-25 14:19
@忧愁的山羊君,,我形象的解释一下：亚马逊雨林在巴西部分占国土面积的40%弱。换算到中国就是沿着黑河腾冲线往左全是雨林。 别人是你中国的新疆西藏四川云南陕西等等全是世界自然遗产？要帮忙治理？凭什么啊你谁啊！ 再往小，你家里长了一颗大榕树占满了客厅，你要砍掉他，忽然环保组织出来骂你了？喵喵喵,1949,2019-09-25 14:33
@子不语Back,,其实全世界各个国家都应该重视绿化，但是发展中国家为了更快的发展经济总是会破坏环境，有一得必有一失，我们国家很早已经意识到了，也一直在补救，相对而言，有些国家并没有能力两方面都照顾好....,1013,2019-09-25 14:21
@火锅不期待,,饱汉不知饿汉饥，别人要生存，这和西方国家说中国环保不达标是一样的,892,2019-09-25 14:24
@凯风北吹,,不管怎样，本国的利益才是根本利益！不管是美国、巴西还是中国。,519,2019-09-25 14:25
@性科普bot,,又想要钱，又不想承担 没责任感,166,2019-09-25 14:19
@阳铿,,“‘世界’的雨林”要巴西牺牲本国的发展来保护吗。我们也曾经牺牲环境发展经济。说大局观，人类未来的，不如你去给巴西拨款，你来做圣母，保护“‘世界’的雨林”。有点像国际的道德绑架了。,230,2019-09-25 14:43
@你成功路上的绊脚石,,人家说的也在理啊，你家种的树被自己砍完了，看见人家的人，就让人家保护，这不是双标吗？,187,2019-09-25 14:39
@自护,,地球氧气的制造主力是海洋藻类，所以人家总统也没说错。,148,2019-09-25 14:32
@重型飞虫,,殖民主义？巴西人的主体本来就是殖民者后裔吧？现在又开始宣誓主权了。,68,2019-09-25 14:22
@林黛玉,,没这个名衔，谁还会去帮你们啊,42,2019-09-25 14:19
@政和白茶-茶农,,本来就是伪命题，自己不种树，还指责别人砍树,44,2019-09-25 15:56
@大牙妹牙不大,,让巴西给世界养护雨林 大家得给钱啊,60,2019-09-25 14:40
@c-YiQun,,谁用了亚马逊的氧气，谁就付费呗，一些国家自己破坏环境，到处砍树，而要求巴西不能开发雨林是流氓做法。应该学中国，默默种树，不打嘴仗。,30,2019-09-25 16:46
@日常路先生,,他的言论没有错 只是都这样做 地球生态也即将不复存在  注定如此,32,2019-09-25 16:16
@大英良心汉弗莱,,就佩服现在这帮人，真是比之前那种文邹邹的装逼清新多了,22,2019-09-25 14:35
@VIRTVTEM-FORMA-DECORAT,,各怀私利明争暗斗，Human Being就应该是个灭绝的种。。。,12,2019-09-25 14:22
@你在我的夏天里missing,,这条评论下面脑残少了很多，很欣慰,15,2019-09-25 17:27
@辰辰他爹2018,,牛逼，瑞典小娘们儿得哭死了,11,2019-09-25 15:15
@王希希ss,,这个言论意料之中，一个国家的首脑嘲笑别国总统夫人，有修养的人不会拿别人的妻子来说事，何况还是一国之领袖，存亡之道在尔虞我诈之间，叫地球之肺是对亚马逊的感情，帮灭火担心侵占领土，不帮说荒谬…憨批！中国：弟弟，作为过来人，别砍树种地，过后还得补救，我们用卫星看在眼里疼在心里,13,2019-09-25 16:16
@阿鞭先生,,憨批,8,2019-09-25 14:18
@下辈子一定不读博,,这就是你放任它燃烧，不管不顾的理由？,11,2019-09-25 14:39
@独木不成林201810,,如果亚马逊雨林没有给巴西带来“理想”的实际性经济价值，迟早会被巴西本国用来经济开发的，还是毫无疑问的。,10,2019-09-25 14:24
@等待中的拉布拉多,,不想论什么圣母不圣母 ，发展经济是在破坏生态自然的前提下  总有一天 ，人类会把自己整灭绝,8,2019-09-25 16:39
@芒果要学习啊,,巴西要想经济发展肯定会破坏环境的，就像当年的我国一样，但是我国现在也在积极补救中,6,2019-09-25 14:38
@cskr,,老子就是想烧了自己家的热带雨林种田致富,7,2019-09-25 14:28
@未来星辰之路,,这明显就是准备毁灭性开发热带雨林找借口,5,2019-09-25 17:07
@甘盐顶,,巴西总统说得好，这是地球的肺那是地球的肺的说法是谬误。,6,2019-09-25 14:28
@双城的记忆,,建议发达国家先行一步，交全球环境税，给发展中国家用,5,2019-09-25 16:31
@YONOBI,,你这个只会玩女人的家伙，在危害整个地球的生命，那你去那烧一烧就知道是不是，地球的咯,5,2019-09-25 16:22
@路人癸丑,,他说的没错，不同的测试表明 50-85% 的氧气产生于海洋藻类。,8,2019-09-25 14:57
@银盐时代的摄影记者,,即使是肺，他们不照样抽烟吸毒,4,2019-09-25 14:53
@平民热血兔,,绝不能以保护环境为由自断发展前程，这个总统是对自己的国民负责,5,2019-09-25 14:24
@孙锋nj,,又想要钱，又不想承担 责任！,6,2019-09-25 14:18
@没有蜡的雕塑,,是不是的超算模拟一下不就知道了   政客 呵呵,3,2019-09-25 17:09
@Sakuragi葵,,但是森林着火了，不应该救火吗，不管其他国家有什么目的，你本国的不应该先去救火吗？,8,2019-09-25 17:05
@沫沫家的小黑,,从头到尾人家自己都没说亚马逊森林是地球之肺，从头到尾都没说要你给钱你自愿的，,2,2019-09-25 14:24
@金冰冰冰,,巴西总统应该说既然地球之肺在巴西，那地球人是不是得为了肺的健康缴点保护费啊！简单直白点多好，这样去联合国讨论一下没准真能收点钱,6,2019-09-25 16:47
@床头堆儿,,他喷的是美国吧,4,2019-09-25 14:38
@七十弦,,尊重主权不是我国的一贯主张吗？为什么到别的国家那里就不讲这个了？,5,2019-09-25 14:23
@中国民族博览杂志社,,是不是地球之肺 出事了也得管啊,3,2019-09-25 16:57
@穿越时光七十年,,说是地球之肺，是给人套上道德的高帽子。,4,2019-09-25 16:01
@中州雍人bwsy,,各国任何对雨林的帮助与支持需建立在尊重巴西主权的前提下。    这话没毛病 ！有多少国家是真的无所图的帮助的？,6,2019-09-25 14:43
@人哈呀,,别的国家为了发展把树都砍光了，经济发展起来就盯着亚马逊,4,2019-09-25 17:44
@tmeft,,他家担心林子被充公了,5,2019-09-25 14:51
@玉露滋润,,既然是地球之肺，世界各国也应为这次失火捐点什么吧,1,2019-09-25 14:30
@流浪的八音盒Gene,,本来就不是地球之肺，但它确实是一个固碳的最重要的地方,3,2019-09-25 17:56
@独行人仔,,问一句谁会愿意把自己城市的公园树木销毁,3,2019-09-25 16:40
@大程小王cw,,他敢开通微博吗？,4,2019-09-25 16:28
@梦_和远方_,,没人觉着，“地球之肺”如果是谬论的话，我们的教科书就是在误导吗,3,2019-09-25 15:23
@-----黑黑-----,,地球之肺得了肺炎,3,2019-09-25 14:32
@没有玩了1111,,这总统有什么用,2,2019-09-25 16:40
@尼古拉斯赵铁蛋子,,牺牲本地经济开发，让其他地区无偿享受，肯定不干啊，人家也想好吃好喝啊,4,2019-09-25 14:40
@独自等待的杨二,,你一个总统之前想让美军去巴西，算是尊重主权吗,3,2019-09-25 14:38
@易形人,,没毛病，你把人家当的肺，呼吸人家的氧气，那就给人家尊重和金钱。特朗普和美国也一样，你们把他当成“地球的肛门”，那就得尊重人家，乖乖听他喷听他放，还得给他鼓掌,1,2019-09-25 17:44
@在芬兰的生活,,巴西总体：巴西雨林是巴西不可分割的土地，巴西拥有永久性的自主权，不容许国外邪恶势力利用国际舆论左右巴西政策并表示强烈谴责。,1,2019-09-25 17:32
@胆大包天86,,当时国内媒体到处跟在西方后面宣传巴西是地球之肺，这个不是公然干涉别国内政么,1,2019-09-25 17:01
@润芝73385,,放屁,1,2019-09-25 16:50
@市井客,,地球之肺？闪开！我们来,1,2019-09-25 16:23
@滋滋乐美忧,,这个垃圾,1,2019-09-25 16:15
@其言于此,,可惜的是，巴西并不是很强,2,2019-09-25 16:11
@FIFRZI,,人类在作死的道路上越走越远,4,2019-09-25 15:45
@DeitySSS,,西方人告诉了世界民族的好处，中国人向世界证明了民主的不行,1,2019-09-25 19:35
@Blinhbling爱泡泡,,蚂蚁森林是中国的“地球之肺”，嗯,3,2019-09-25 19:15
@李君的世界,,"是的,所以日本人拼命捕鲸,保护海洋藻类.人家是真捕真环保",2,2019-09-25 18:47
@LittleGannic,,就算不是，也不能任意烧啊,1,2019-09-25 17:35
@北极熊共和国,,所有发展都需要建立在尊重自然的基础上，否则会造成严重后果,2,2019-09-25 17:03
@不妨一吐为快,,那些让巴西保护雨林的沙币，你们给巴西捐钱了还是帮巴西发展经济了？一样没做说你妈呢？人家国家的事情与其他国家何干?美国西部大开发没砍过树?建议巴西政府该咋办咋办，别听其他国家bb。担心雨林没了活不了的人自己种过树吗？自己天天开车排着尾气，那边让别人给你擦屁股，建议趁地球还有氧气提前自杀,6,2019-09-25 16:41
@国航今天倒闭了吗,,瞧瞧 这是人说的话吗,2,2019-09-25 16:29
@红花会-ss丨,,我家的WiFi凭啥让全村人一起用？我不用也能活你们不用也能活，非得我放家里占地方？并且交网费？,2,2019-09-25 16:15
@张士多,,你说什么就是什么好吧,1,2019-09-25 16:10
@怒江附近,,nex3 giao,1,2019-09-25 14:38
@该干嘛还有啥,,,1,2019-09-25 14:30
@文旭-柯伊伯外,,那么好的自然资源，废了,1,2019-09-25 14:18
@西山隐智,,肺结核了,0,2019-09-25 23:48
@明涛ECON,,要是我的话，你说是肺就肺吧，先让OECD所有人把过去几百年的润肺费交了再说,0,2019-09-25 21:58
@宣德,,制裁一下就乖了,0,2019-09-25 20:25
@努力的树子,@忧愁的山羊君,是我语文水平太低吗？语句通顺一点就好了，读了好几遍才明白。,0,2019-09-25 17:33
@杜尚别的奥兹贝加,,欧洲老爷们，打它，出兵巴西,0,2019-09-25 16:46
@李君的世界,,//@李正曦Sissi: //@韦恩卑鄙://@妙龄萌黄酥://@路人癸丑:他说的没错，不同的测试表明 50-85% 的氧气产生于海洋藻类。,0,2019-09-25 16:05
@李君的世界,,//@今日特价房樊元树: //@大英良心汉弗莱 :就佩服现在这帮人，真是比之前那种文邹邹的装逼清新多了,0,2019-09-25 15:02
@僵尸粉都被我拉黑了,,讲道理 亚马逊产生的氧气真没想象中那么多,0,2019-09-25 14:22
@文艺圈知名贺老师i,,骗得了我们，骗得了地球么？,2,2019-09-25 19:27
@大花洒本洒,,刚刚上完这一课森林的保护与开发跟学生说亚马孙雨林是地球之肺……巴西总统让我很尴尬,2,2019-09-25 19:20
@AnotherJayi,,貌似只有我一个发现小编写错字了吗？,2,2019-09-25 18:09
@你是八月的余香,,如果是中国 我们国家百分百会动用一切力量去救火,2,2019-09-25 17:19
@小黑炖咸鱼,,让瑞典环保小姑娘去和他闹呗,2,2019-09-25 16:49
@戳北举霾消,,最近正好高中地理学到亚马逊地区的保护,2,2019-09-25 16:40
@YHYL,,说白了，就是因为穷，没钱。要是有钱，富得流油。谁特么烧雨林。,2,2019-09-25 16:38
@Nimodip1ne,,暗示打钱,2,2019-09-25 16:30
@热爱美食的小鬼头,,关键他们自己腐败才是大问题，就算真烧没了也发展不起来了,3,2019-09-25 16:26
@整个大新闻,,评论说的很对，雨林损失使得很多只有巴西才有的物种灭绝了，你能说是全人类的损失吗？只不过是巴西人自己的损失,3,2019-09-25 16:23
@霍格沃茨学校校长,,雨林本来就不是，海洋上的海藻才是。,2,2019-09-25 15:34
@one10000,,巴西总统博索纳罗反华,3,2019-09-25 14:59
@佛系Jayco,,新疆有望成为下一个地球之肺,2,2019-09-25 14:34
@开怀自我,,所以要大力发展自己国家的绿化,2,2019-09-25 14:34
@StoffelVandoorne,,历史会证明一切,2,2019-09-25 14:31
@Frank夏天,,搞不懂，南美那么多那么好资源，居然怎么都发展不起来。,3,2019-09-25 14:31
@见性明心吧,,等你们成了沙漠就舒服，妈蛋,2,2019-09-25 14:20
@一个没有梦想的怪兽,,我怀疑这火是他们自己放的,2,2019-09-25 20:22
@小太阳暖呵呵,,保护雨林不只是氧气的原因吧，还有物种多样性，那么多动物就被烧死了。,2,2019-09-25 19:51
@小某黑,,留着开发旅游业不好吗，就像尼泊尔利用珠峰开发旅游业,1,2019-09-25 19:07
@纯洁的像张白纸,,亚马孙，，，这编辑可以,1,2019-09-25 19:05
@冷色yun,,怀疑这把火是他自己放的,2,2019-09-25 18:08
@晓来谁染双林醉_ouc,,没毛病,1,2019-09-25 18:07
@91年的16岁妙龄奔三少女,,所以雨林的火灭了吗，还剩多少了,1,2019-09-25 18:00
@从简啊琼,,不是“地球之肺”我初中都不可能知道有巴西这个国家,1,2019-09-25 17:50
@FirePig_,,应该联合起来每年给巴西一些援助,1,2019-09-25 17:45
@天天做梦睡大觉,,重点是开始各国提供军事资金支持 换谁都不回答好吧 你要是像总统说的 尊重国家主权 像汶川地震一样 每个国家只给救援队 和资金 他就巴不得了,1,2019-09-25 17:35
@蒋文旭亲爹,,关门，给我放现实版孤儿怨小女孩咬他,1,2019-09-25 17:32
@新月神殿守护者,,都不想好的话，得tm得死！,1,2019-09-25 17:29
@哔哔啵卜,,支持巴西,1,2019-09-25 17:10
@朱云说,,巴西这些白人就是殖民者，黑人是这些殖民者贩卖奴隶的产物。巴西是属于印第安人的。,1,2019-09-25 17:10
@CharlieBrown-,,？,1,2019-09-25 16:58
@冥河孤独彼岸花,,呵呵！给钱就不这么说了。,1,2019-09-25 16:57
@明夜很冷,,,1,2019-09-25 16:49
@清风徐来YL,,这可不能由他说了算啊，必须组成联合国军前去讨伐。,1,2019-09-25 16:47
@小潜艇kop,,既然拿地球之肺天天谴责，是不是地球上的国家都做点儿什么，要么接收人家国家过剩人口移民，要么大量投资高附加值产业，要么直接交税……,1,2019-09-25 16:36
@真古树红茶,,屁事管的多，说白了这就人家自己家的后花园，人爱咋整咋整，日本去别的领海捕杀鲸鱼比这凶多了，那个才叫惨,2,2019-09-25 16:32
@finy555,,你先尊重一下地球的主权吧。地球是整个人类和地球上生物共有的，放地球一口新鲜空气都没有了你的主权是啥狗屎,2,2019-09-25 16:24
@川南奥陶纪,,最近才讲到地理必修3森林的开发―以巴西热带雨林为例,1,2019-09-25 16:22
@枝芽绿,,是肝,1,2019-09-25 16:06
@不小心咕咚一声,,支持，无权插手别国,2,2019-09-25 16:05
@最辣的生姜,,我死后，哪管洪水滔天。,1,2019-09-25 16:02
@封闭货车禁止通行x,,打字都打错了。什么小编,1,2019-09-25 16:01
@showpod,,巴西总统：凭啥不让我们搞房地产？,1,2019-09-25 15:35
@老实人阿黄,,巴西也是要发展的，凭什么不给人家开发？何况地球氧气最主要来源是海里的藻类，不是巴西雨林。,2,2019-09-25 15:33
@huo小菜,,我们北方的沙漠需要各国的支援，巴西不要我们要。,1,2019-09-25 15:19
@落飞的微博,,热带雨林地面腐质的土壤和水释放的温室气体也不少。,1,2019-09-25 15:06
@天渐蓝,,确实不是地球之肺。成熟的森林已经实现了碳、氧的平衡，不会明显额外多制造。,1,2019-09-25 14:44
@李l为l什l么l那l么l白,,说你是你就是，不是也是；说不是就不是，是也不是。横批：不服试试,1,2019-09-25 14:41
@独自等待的杨二,,之前想让美军去巴西的也是这个总统吧,1,2019-09-25 14:39
@普通用户阿九,,活该。,1,2019-09-25 14:37
@TY21VA,,不许砍,1,2019-09-25 14:34
@nick-doctor2011,,政客,2,2019-09-25 14:29
@代沟与年龄无关,,国家主权和人道主义，网友选择了人道主义？,1,2019-09-25 14:27
@毛豆的小米,,联合国军进驻巴西，亚马逊国际共管,1,2019-09-25 14:27
@浙北之狼,,就是要开发热带雨林的土地，说的这么多,1,2019-09-25 14:23
@2momo永花,,巴西总统这是是你的肺，请好好珍惜,1,2019-09-25 14:21
@白浪河天降伟人,,巴西这国家没一点负责任的大国形象啊,1,2019-09-25 14:21
@输了就得喷,,那让它别呼吸呀,1,2019-09-25 14:21
@一笑而过不代表麻木不仁,,民主体制底下什么奇葩都会产生。,2,2019-09-25 14:19
@已经不在我身边你的呼吸声,,xun还是sun,1,2019-09-25 14:18
@henryhunter,,It is not.,1,2019-09-25 14:18
@wanhai4423,,地球之肾在哪里,0,2019-09-26 07:16
@朵朵58726,,，,0,2019-09-26 03:27
@有卿有艺,,他的意思是亚马逊雨林不是什么地球之肺，是我们巴西之肺。亚马逊雨林出什么事儿是我们巴西的事儿，轮轮不到你们指手画脚。,0,2019-09-26 02:12
@一7摘星8-,,不在乎雨林，物种灭绝也是问题一部分吧。雨林没了一个世纪后或许还会有，30%的物种怎么办？雨林和森林绿化也是不同的。,0,2019-09-25 22:58
@阿浪是谁,,给钱吧。,0,2019-09-25 21:35
@王衬衣的刘大宝,,不是着火没人管才是问题么，雨林巴西都砍了多少年,0,2019-09-25 21:32
@日影石澈,,发达国家忘了自己当年是怎样破坏环境的,0,2019-09-25 21:19
@真好1336486,,这个思路是真的太小人之心了，怎么当上总统的，人家帮你还净逼事,0,2019-09-25 20:25
@JACKXU1966,,同意博索纳罗总统的说法,0,2019-09-25 18:54
@陆师兄的午后时光,,先污染在治理，巴西也准备走这条多数国家都走过的发展致富之路。,0,2019-09-25 18:44
@LOL草民,,既然是地球之肺全球所有国家都应该给巴西上交环境保护费，否则巴西没义务放弃巴西人民的利益保护亚马逊雨林。而且每年花费太多国资保护雨林！全世界烧荒种地却不让巴西这么干真是双标,0,2019-09-25 18:23
@小星虫,,爱国和爱地球感觉一致性少于冲突性，事情都有多面性。,0,2019-09-25 18:19
@西里那,,烧都烧了快一半的感觉了，他肯定要这么说，掩饰自己呗,0,2019-09-25 18:13
@岳云月syy,,,0,2019-09-25 17:57
@经纬古今2016,,这不是地球仅存的一点原始森林么,0,2019-09-25 17:51
@纂香,,本来地球之肺就是人为给他安的名头，氧气百分之90多都由海洋藻类产生，有的国家发达了就不让别人家多种块田？？,0,2019-09-25 17:45
@supermomo12345,,//@驻中土常务大使:对那些一天到晚说巴西雨林是地球之肺不能碰要保护的人，只要问一句“那你给巴西人交氧气税嘛”就行了//@Dretgher:很正常，国家要发展，其他国家不让。立场不同而已，没有谁对谁错。,0,2019-09-25 17:40
@愤青小兔子,,巴西真不怪人家，西方现在过的有滋有润，非洲要求不高，能吃饱就行，但是人家巴西南美第一大经济体，工业基础也有，历史悠久但是经济十多年来没有大的增长，都赶不上意大利。,0,2019-09-25 17:40
@鲁人姓张,,腊鸡,0,2019-09-25 17:38
@罗斯玛丽的胖婴,,人类为了经济发展 不撞南墙不回头 撞了南墙也走向灭绝了,1,2019-09-25 17:31
@浅笑安然Tjq,,地球是人类共同的家,0,2019-09-25 17:25
@侑Kennedy,,巴西需要发展  没有绝对不牺牲环境的经济发展,0,2019-09-25 17:13
@吃吃吃小胖货,,,0,2019-09-25 17:12
@纪美柔,,简单说 你要求别人的时候自己也要做好 一边要求别人不要发展 不给砍树开发 自己工业发展排泄的污染却多得很 与其说别人 不如自己多做点环保绿化,1,2019-09-25 17:01
@像风一般的汉子,,确实感觉他说的也没错，人家要吃饭，要自己的百姓活，再说那是人家的主权领土，我们也无法干涉呀，唉，都难,1,2019-09-25 17:01
@佐樱zln,,早不出来说，现在才说，没有能力就会哔哔,0,2019-09-25 16:47
@随和的大米饭1987,,没办法，要生存，为了国民,0,2019-09-25 16:44
@知也未可知,,热带雨林只有有保护之心的私人化才能避免消失的命运，个人觉得世界环保组织可以与巴西洽谈热带雨林面积的保护费用，给巴西一定补偿，通过融资租赁的方式补偿多少年后归环保组织所有,1,2019-09-25 16:36
@L1uPrey,,藻类植物才是关键,0,2019-09-25 16:33
@wenterfall,,毁吧毁吧，反正最后死的都是人。,0,2019-09-25 16:27
@何来拈花指,,巴西不是美国的嘛，你说话算数？,0,2019-09-25 16:22
@山雨_语,,既然热带雨林是在巴西境内，那的确是人家的主权问题。而且说什么“地球之肺”保护地球，可笑吗，保护的是人类的自身的利息，你说是保护地球,0,2019-09-25 16:18
@流霜之华_,,那你就继续砍伐、焚烧亚马逊雨林吧！反正最大的受害者是你们巴西人民。,2,2019-09-25 16:16
@洛普忘冀莘橙,,我觉得要求面蛮对的，来我就家，先得尊重我,0,2019-09-25 16:16
@丝丹墨兰,,不是地球之肺，那你是吗？,0,2019-09-25 16:11
@高川M岚,,给全地球保肺 减自己 收入,0,2019-09-25 16:00
@柠JYN,,所以，都别管亚马逊雨林了？尊重主权吧，人类迟早要灭亡的，大家应该看通它,0,2019-09-25 15:55
@老丢打火机,,石化燃烧的废气还不如奶牛放的屁多，污染放眼大宇宙银行系，太阳系、地球连个芝麻都算不上，改变大气质量靠的是风和雨，河湖才是王道，别扯森林,0,2019-09-25 15:37
@不英俊,,你说不是就不是吧，谁又能说是呢,0,2019-09-25 15:35
@流淡定,,老子的森林爱救不救，关你鸟事,0,2019-09-25 14:53
@Klosechenlong,,很明显诸如法国之类的言论刺激了巴西，也的确不太尊重人家。不过火灾烧了那么久，巴西政府不作为也是事实，说白了，巴西这个国家或者说这届政府是没有责任心的，没有大国担当的。,0,2019-09-25 14:47
@医生说我肠胃不好要吃软饭,,巴西真的，生在生态富裕的地方啊，不应该现在这样的人均gdp。。。,0,2019-09-25 14:37
@powerman1000,,@noonnoknow 我不是 我不要 ,0,2019-09-25 14:32
@糖小糖YB,,服,0,2019-09-25 14:32
@PENG_涛涛,,猴子派来毁灭人类的,0,2019-09-25 14:28
@我爸让我改名,,一点都没说服力，好歹拿出点数据，比如占全球森林和雨林面积比例，物种数量，确实没多大比例的话，自然就信他的,0,2019-09-25 14:28
@Cheryl-鱼冻儿,,？？？,0,2019-09-25 14:26
@GZIKZIN,,所以可以烧？？？,1,2019-09-25 18:35
@王东红是是谁,,确实 人家说的也没问题 他们要发展啊 很多国家牺牲了环境发展起来 现在又指责别国 也不对吧,1,2019-09-25 18:04
@复杂的小圆,,有病，底下一堆评论的，不知道人类命运共同体么，雨林被破坏还有理了，生态系统都是一脉相连的,1,2019-09-25 17:55
@WFendiman,,国内的公知，人家国家的事关你屁事，希望某些人不要成为下一个美国警察,1,2019-09-25 17:55
@Inmetigersniffstherose,,不说肺不肺的 多少抗癌药物成分的稀有植物都烧绝了,1,2019-09-25 17:43
@一星_JK,,喔那你把地理教材也给改了吧,1,2019-09-25 17:32
@兰梦梦Lanmeng,,我只是很心疼被烧死和无家可归的动物们,1,2019-09-25 17:14
@中年油腻男的标准样本,,话都对，问题是真要较劲，那几个西方大国应该有能力让亚马逊雨林不再属于巴西,1,2019-09-25 17:02
@否极泰来蕉仙人啊,,尊重自然是要尊重的，每个国家的独立主权都是需要得到尊重的。但热带雨林是全人类的财富啊，况且退一万步讲，就算是为了其他目的，宁愿砍掉也比燃烧强啊。燃烧后所产生的烟，雾，对地球自然循环造成的影响太大了。,1,2019-09-25 16:54
@oohdl_2026,,emmmm,1,2019-09-25 16:44
@LIU-C-F,,是亚马孙还是亚马逊？？,1,2019-09-25 16:37
@其实我还好_Y,,不是就能这么烧？,1,2019-09-25 16:34
@Matt_KK,,挺矛盾的 国家发展和雨林保护 其实都对啊,1,2019-09-25 16:31
@Imfullinlov,,难道你烧完雨林 给你腾出地方发展经济 就有钱了,1,2019-09-25 16:19
@24_小姐姐想要换id,,烧呗，砍呗，没事没事，反正死不了人，地球现在不会毁灭,0,2019-09-25 21:36
@我的名字敲可爱呀,,因为不重要就可以烧掉？？？,0,2019-09-25 21:17
@欧里改,,这“亚马孙”是哪个孙子,0,2019-09-25 21:16
@没有这种东西呢,,赞同,0,2019-09-25 20:29
@丁雨苗苗苗,,就算不是肺也不可能烧着不管吧,0,2019-09-25 20:28
@奶奶农盐盐信,,憨,0,2019-09-25 19:45
@Damon_要好起来呀,,//@子不语Back:其实全世界各个国家都应该重视绿化，但是发展中国家为了更快的发展经济总是会破坏环境，有一得必有一失，我们国家很早已经意识到了，也一直在补救，相对而言，有些国家并没有能力两方面都照顾好....,0,2019-09-25 19:00
@蜜思Fula是谁呢呢呢呢,,牛逼牛逼了,0,2019-09-25 18:50
@老子每天看你微博,,这总统有魄力啊，对于本国国民来说是好事,0,2019-09-25 18:46
@全智贤同款男友,,人家也要发展啊，微博下面戾气太重,0,2019-09-25 18:32
@羽音流觞,,评论一群人支持砍伐亚马逊？欧洲各国又不是强迫，人给钱了啊，收了人钱还砍树，这不是不要脸吗…………,3,2019-09-25 18:17
@星光下的干物女,,这是什么谬论，地球的环境如果被破坏了，你巴西的主权也荡然无存。 真的是太无耻的政客，你是为自己的总统权利叫嚣吧！可怜地球越来越多的极端天气，人类最后还是自食恶果。,1,2019-09-25 17:22
@大橙今天暴富了咩,,亚马逊不是你是啊,0,2019-09-25 16:32
