User,Reter,Comment,Votes,Time,Count
@药水哥厨3世,,当然算烂尾，全网都推测是黑岛了，结果还真是。说好的令人惊讶的结局呢？,279,2019-09-08 22:08,1
@软叶高校二年A组道枝同学,,我就寻思黑岛杀人那么痛快麻利，咋还被男友家暴呢,305,2019-09-08 22:12,1
@世九_,,剧透sima,51,2019-09-08 22:12,1
@余温鸲,,不算烂尾，凶手是黑岛合情合理，就是都说最后大反转给整蒙了,203,2019-09-08 22:11,1
@Fantastic易,,不算吧，因为在之前的剧集里一直意有所指啊，不是她还能是谁，可怜了二阶堂一片真心,192,2019-09-08 22:06,1
@太白快去学习,,全网都知道了，这还是什么秘密嘛？要看有秘密的还是Godlie,180,2019-09-09 00:04,1
@我丫的想睡觉,,哇，没意思没意思，今晚只能刷Godlie来满足我的好奇心了。,184,2019-09-09 05:49,1
@山茶吗,,只有我一个人觉得这部剧难看吗,11,2019-09-08 22:14,7
@l那我就不客气了,,黑岛真的演技像木头一样……竟然是boss,50,2019-09-08 22:42,1
@番茄果仁苏打水,,烂尾啊 只是为了喜欢杀人而杀人 没有比这更套俗了,51,2019-09-08 22:14,1
@呆萌的人最可爱,,想不明白为啥她会杀那么多人,27,2019-09-08 22:13,1
@秦淮河畔夜雨霖铃,,也不算吧 我是看二阶堂那么喜欢她才猜出可能她是最后的那位boss,20,2019-09-08 22:10,1
@大树吻别小仙女,,好无语哦,54,2019-09-08 22:32,1
@乔思皮,,不算烂尾，只是大家都猜到了而已！如果不是黑岛，才是强扯蛋！何况最后还有小反转，还有人在杀人，我觉得算是不错了！！最后预告是sp，还是番外？！,54,2019-09-08 22:38,1
@只记得这首笑忘歌uuuuuuuuuuuuuu,,你们几个铁憨憨，推来推去还用AI结果还不如尾野,33,2019-09-08 22:48,1
@白桃焦冻兔子,,我觉得凶手是黑岛不算烂尾，坑没填上才是烂尾，还有就是真相揭示之后，剧情不复杂反而简答的要命，这样才是烂尾，给的太多可疑人员都是烟雾弹，还不如单独给他们安排一些命案，有复杂性。最后反转没太听懂日语，细节明天熟肉再看一下。,27,2019-09-08 22:53,1
@_我有猫饼你有吗吗吗,,关于黑岛是老太太外孙女这件事....老太太就眼睁睁的看着野生外孙女杀了自己亲生儿子然后一个人孤独的在养老院？？？？,26,2019-09-08 22:53,1
@桃花近处起长歌,,谁杀死了管理员呢？,7,2019-09-08 22:41,1
@屋檐下的燕子窝G小姐,,老太和黑岛的关系算是猜不到的吧,15,2019-09-08 22:36,1
@超级无敌俩,,黑岛只负责动手啊 老奶奶算是元凶了吧 而且结局最后老奶奶也被轮到了 所以黑幕是江藤啊 说是黑岛的都没好好看结局吧,16,2019-09-08 22:35,1
@不知道叫啥的童酱酱酱,,有病啊直接剧透,2,2019-09-08 22:43,1
@山茶吗,,只有我一个人觉得这部剧难看吗,1,2019-09-08 23:40,7
@水瓶座D-Lin,,我觉得黑岛说不定都是个打手而已,2,2019-09-08 23:00,1
@Siraku白久,,讲真的 最后老太婆的那个没有的话 我还当结局很好 在我这里不算烂尾 最后那个多出来 好奇怪,8,2019-09-08 22:34,1
@Agony_mail,,@李庚希爱吃蟹棒的圈外男友,0,2019-09-08 22:42,1
@山风不解木子,,这部剧不烂尾，真的很有看点,8,2019-09-08 22:40,1
@a我是隔壁的泰山,,不是黑岛烂尾？ 我笑了 这剧本来就是多选一的 谁做boss都可能 问题是动机过程方式！！！,3,2019-09-09 02:00,1
@小肥姬在日本,,凶手是黑岛不烂尾，烂尾的是揭开凶手是黑岛之后又硬扯上老婆婆和她的关系，然后结尾弄一个把大家搞得一脸懵逼的伏线...,7,2019-09-08 23:05,1
@菲菲菲菲菲菲你,,感觉有点雷声大雨点小的意思,5,2019-09-08 23:09,1
@利利第一可爱,,卧槽真是黑岛   编剧说好的反转呢,0,2019-09-08 22:22,1
@_馓,,剧透不好吧。,0,2019-09-09 10:00,1
@旺仔牛奶不加糖_Demon,,大结局在哪看！？？,2,2019-09-08 22:51,1
@纯情野菜,,还有反转你没看吗,2,2019-09-08 22:32,1
@Baiiiiiii_,,绝对烂尾,1,2019-09-09 07:41,1
@BALAMNA,,烂尾，全剧一直放烟雾弹最后居然这样糊弄过去了,1,2019-09-09 07:22,1
@果柠檬cf,,这个电视在哪里可以看,0,2019-09-09 07:24,1
@火星猪不是猪,,我才开始看啊啊啊，我为什么要点进来？？？？,0,2019-09-09 07:22,1
@吃好吃的吃好吃的,,为啥是烂尾？你说烂尾就烂尾？我觉得挺好的,0,2019-09-09 06:34,1
@Cerasus哦墨迹监控,,那个老太婆又吓了我一跳,0,2019-09-09 06:23,1
@Aire07,,你们都在哪里看的啊,0,2019-09-09 00:53,1
@港岛妹妹ur,,烂尾，结局一点都不吃惊，说好的反转呢？,0,2019-09-09 00:17,1
@shinenimingde,,为什么黑岛不杀尾野？？？？。。,0,2019-09-09 00:13,1
@倩倩的南瓜马车,,这么多人很认真的推理出来的，如果没猜对是显得很有逼格的样子，不显得观众像傻子吗,0,2019-09-09 00:12,1
@鸡蛋糕跟你嘴角果酱我都想要,,妈的  点进来看尾野演技  没想到被剧透了  可恶啊,0,2019-09-08 23:54,1
@如同一只猫,,我最喜欢尾野了,0,2019-09-08 23:52,2
@周星星aii,,对于你们来说符合逻辑就等于烂尾吗,0,2019-09-08 23:51,1
@去皮奶黄包,,到底谁把黑岛推下月台的啊啊啊,0,2019-09-08 23:48,1
@Elevenstory,,肯定不算啊 什么叫烂尾 就是没有逻辑 随便啦  你们知道是黑岛 都是网上那么多人分析啊 各种得出来的啊 如果说是江滕啊 别人 你们更说烂尾了吧 ,0,2019-09-08 23:44,1
@Shine格{_,,凶手不是她，最后反转了,0,2019-09-08 23:39,1
@零度浪漫0225,,应该不算烂尾，感觉即是意料之中，又是意料之外，没想到她这小身板能杀这么多人,0,2019-09-08 23:35,1
@我是另外的价钱a,,好多人都猜对啦,0,2019-09-08 23:34,1
@dffgghg1099,,我就说只能是她！,0,2019-09-08 23:30,4
@dffgghg1099,,,0,2019-09-08 23:30,4
@Amii_th_,,我以为以编剧的尿性不可能那么轻易让我们猜到是黑岛 结果……行吧,0,2019-09-08 23:30,1
@嗑糖上头,,还没看。。。不想接受,0,2019-09-08 23:25,1
@进击的小惠,,,0,2019-09-08 23:22,1
@Sunnymmbj,,卧槽我干嘛要点进来看我才看到第十集,0,2019-09-08 23:21,1
@炸虾团子,,谁有生肉啊,0,2019-09-08 23:19,1
@红糖罐少女,,烂尾了,0,2019-09-08 23:18,1
@恶龙不爱撒娇,,不算烂尾,0,2019-09-08 23:00,1
@奶茶控1006,,猜中了凶手就当做自己聪明嘛 何必这么较真,0,2019-09-08 22:50,2
@傻子jjj,,我去，这边人人还没播呢，你们就剧透,0,2019-09-08 22:49,1
@奶茶控1006,,不算吧 忽然冒出来一个出场不久或是镜头少的人不才是烂尾吗 而且主角身边的好人就是boss这个设定不就是常见剧情吗 只不过看多了没什么新鲜感而已 大骂烂尾有点过了吧,0,2019-09-08 22:49,2
@不知道是什么23333,,这个自爆没意思啊,0,2019-09-08 22:48,1
@KIWI和煎饼果子,,你们都在哪里看的,0,2019-09-08 22:46,1
@三吉妹妹_,,不是还有个反转吗？？,0,2019-09-08 22:46,1
@萌萌哒大角鹿,,那是谁推她下去的,0,2019-09-08 22:45,1
@_咕咕咕咕咕咕咕_,,我还没看完忍不住好奇心被剧透了一脸,0,2019-09-08 22:43,1
@五月的润喵,,确实烂尾了，哎,0,2019-09-08 22:41,1
@库卡索201703,,坐等番外,0,2019-09-08 22:40,1
@云挽尘,,算不上烂尾吧……硬生生乱套一个凶手才是烂尾吧……而且这不是还没讲完还有番外吗……,0,2019-09-08 22:40,1
@十载惊鸿梦,,彻底的烂尾了，就是吹了半天牛b圆不回来的感觉,2,2019-09-08 22:40,1
@6ixteen8ighteen,,最终大boss不是黑岛吧,0,2019-09-08 22:40,1
@幸那个运,,为什么热搜直接把名字打出来了，我还没看,0,2019-09-08 22:37,1
@嘻这世界,,那尼 真的是她吗！！！我马上去看,0,2019-09-08 22:36,1
@哦神呀,,还是被剧透了！！！,0,2019-09-08 22:35,1
@寻_Looking,,还有一集番外，看看真相是什么,0,2019-09-08 22:34,1
@普通用户昵称用一年,,我恨！！！你为什么剧透我,0,2019-09-08 22:34,1
@超好运豆沙君M号,,奶奶那个算啥！真是为开放结局而开放啊,0,2019-09-08 22:33,1
@喵喵头上有个角,,不算烂尾，但是真的这套路很像是柯南……,0,2019-09-08 22:33,1
@肥嘟儿家大当家,,太烂了,1,2019-09-08 22:32,1
@sakuryan,,猜到了，感觉烂尾了，不知道最后一秒还有没有翻转,0,2019-09-08 22:30,1
@名探苫以,,你看完了吗 最后boss是Julia,0,2019-09-08 22:24,1
@bobby的死亡小号,,不算吧。坑填的差不多，一共20集的剧情都比较严谨，逻辑上讲的通。而且结局一味追求牵强的反转比较烂尾吧,0,2019-09-08 22:24,1
@拥抱彩虹的小女孩,,都在哪里看的呀，别说人人影视了，得做任务才能看啊，有其他的吗,0,2019-09-08 22:42,1
@-深情鬼-,,滴滴滴@是粉红粉红的葛九日呀,0,2019-09-09 08:30,1
@佳佳佳佳佳y,,@手机用户冯yoyo,0,2019-09-09 07:26,1
@长野小道,,在？为什么剧透,0,2019-09-09 07:23,1
@胡说八道课代表,,不是因为凶手是黑岛烂尾，是因为坑没填好，所以烂尾！,0,2019-09-09 07:12,1
@木头体,,之前搜结局，电视粉都在说她演得烂。我也觉得同剧相比，眼镜小三女演得好多了。。这次黑岛还凭演技好上热搜了,1,2019-09-09 06:46,1
@婉AWY意,,怎么大家就知道结局了…,0,2019-09-08 22:42,1
@原力987,,看完轮到你了大结局啦，存在云盘，点我主y有分享,1,2019-09-08 22:14,1
@SAN_MARCOS,,算不上烂尾吧 情理之中 很多人看了解说才知道是她 以为自己很聪明了 其实自己看不一定看得出来 评论配图,1,2019-09-08 22:13,1
@一只景仔_,,不是黑岛才烂尾,4,2019-09-08 22:05,1
@Cyan_人青,,当然是烂尾了。。那么多不合理性都没有解释,0,2019-09-10 22:19,2
@你认为我没在读书吗,,是黑岛也是理所应当，可能导演觉得我们分析能力停留在石器时代，认为凶手是尾野,0,2019-09-09 16:39,2
@Cyan_人青,,当然是烂尾了。。那么多不合理性都没有解释,0,2019-09-10 22:19,2
@你认为我没在读书吗,,是黑岛也是理所应当，可能导演觉得我们分析能力停留在石器时代，认为凶手是尾野,0,2019-09-09 16:39,2