User,Reter,Comment,Votes,Time
@李盒子的大鹅,,政府都不能保证双休，很多基层单休都难  别说企业了,0,2019-09-09 15:00
@雨山冰淇淋,,周围好多私企都是单休,0,2019-09-09 14:59
@金泽与斯巴达,,用你的福报，换公司领导脸上的微笑,0,2019-09-09 14:59
@仙女棒挥一挥,,固定双休，不提倡加班,0,2019-09-09 14:59
@小龙虾爱上炖羊锅,,@深亥- 原来都违反劳动法了…,0,2019-09-09 14:56
@堂堂菇凉,,作为一个在富士康工作六年多的老油条来说，我觉得富士康挺好的，我们几乎都是说加班少，从来没有说什么加班加多了，也没有生产高峰期不能离职的说法,0,2019-09-09 14:55
@vectery,,360天无休,0,2019-09-09 14:54
@funcove,,微博不等于中国,0,2019-09-09 14:53
@Calvan5,,至少人家不是白加班  白加班的多了去了,0,2019-09-09 14:52
@biubiubiubieba,,和我加班差不多馁,0,2019-09-09 14:51
@落笔画西西,,这就是大多数中国人的现状，只有进入体制内才有机会改变命运。,0,2019-09-09 14:50
@鸭梨山楂_ya,,我们加班外，回到家有客户问题还得在家里搞。真是……周末有时候也得这样。这种隐形的工作更惨,0,2019-09-09 14:47
@游藏之心,,这个都是看个人的吧，你想挣加班费就不要那么多事，当然，强制加班的另说,0,2019-09-09 14:47
@烟小城,,856,0,2019-09-09 14:45
@小雨叮咚下,@一猫小串饮酒醉,好像……没有,0,2019-09-09 14:44
@Hiddleston_177,,说得好像中国所有企业都符合劳动法一样，搞笑，怎么不去看看那些私企？,0,2019-09-09 14:42
@李妨,,如果我语文及格的话，这个新闻的标题不应该是富士康违反劳动法，或者苹果供应商违反劳动法……吗……,0,2019-09-09 14:37
@偏苦,,中国哪个企业不违法劳动法？？？,0,2019-09-09 14:37
@小花v_,,公务员加班没有加班费 那请假扣钱吗？ 我这些普通群众节假日没有多倍工资还要无偿加班 两次不加班就可以打包走人了 请假一天当三天扣 合同什么时候要用什么时候盖章 有跟没有无区别,0,2019-09-09 14:36
@乾隆c,,我休息上班不定时，我已经休息了一个多礼拜了,0,2019-09-09 14:36
@颖颖颖颖颖的|,,中国联通强制加班都没加班费,0,2019-09-09 14:34
@-设计制作L-,,还双休，我一个月就休一天，工资还低,0,2019-09-09 14:29
@陶樱柠-小格格,,996算什么？我们都是007，24H手机待机，国家总统都没我们忙,0,2019-09-09 14:28
@噢吼噢吼-,,加班没有加班费。国定节假日还要用用后面的休息补回来。过年没有啥都不发。,0,2019-09-09 14:27
@晚梓歆,,单休都没有，一个月两天不能再多了，还要请假。活动各种加班，没有加班费。影楼简直是可怕,0,2019-09-09 14:27
@74746一,,违反劳动法的企业多了去了，员工始终处于劣势地位，要么忍者干要么走人，当然了也有人会说人家有能力的去哪里都会怎样怎样，可是多数人都是普通人被家庭等等各种原因束缚，无语,0,2019-09-09 14:26
@血染桃花坞,,看了这个投票结果我可能生活在假的中国吧，,0,2019-09-09 14:26
@对方向你扔去一只鹅,,双休？？你别说企业公司，事业单位公务员加班都没有加班费，我们一周休一天，夜班费一晚上10块钱,0,2019-09-09 14:23
@这pgju,,中国公司加班制度和高三初三简直就是一个模子刻出来了，一样的嘴脸,0,2019-09-09 14:23
@不良少年阳,,我一个月要上360个小时班，我叫过吗？工资6k，工厂上班，每月休一天，劳动法管吗？都不管叫个jb！,0,2019-09-09 14:19
@刀光淡蓝,,一年365天有350天在上班，每天工作超过八小时，不能保证加班费能全部拿到手……,0,2019-09-09 14:18
@空沉寂,,中国有世界上最细致的管理部门，却在很多时候都是靠外部曝光问题,0,2019-09-09 14:17
@阳阳丑八怪,,中国工厂都这样的好吧,0,2019-09-09 14:16
@Wellesley2019,,感觉这新闻就是高级黑啊,0,2019-09-09 14:15
@Earl刘颖,,6月份时候，去街道办投诉我们公司了。然后，现在三个月了，每个月工资2300。,0,2019-09-09 14:13
@人家是小乖锐酱啦,,中国是个很神奇的国家，刚刚看一个新闻评论，你会觉得一个月五千是穷人。现在你再看，又发现三千就不少了。中国有很大一部分人，在吹牛逼上有特别的天赋。实打实的做自己不好吗？我是不懂在网上装富亦或装穷有啥意义。,0,2019-09-09 14:13
@guy_yy,,月加班加班超过100个小时的单位海了去了，有加班费还行，有的加班费都没有，晚上11，12点下班打车也不报销连地铁都没有就自己掏钱打车,0,2019-09-09 14:12
@你看见我家豆豆了吗,,我单休，但是我特别希望双休，因为周六来上班，事情也不多，基本就是摸鱼的！还不如在家休息！,0,2019-09-09 14:12
@你爹林尧,,高三一天都没有,0,2019-09-09 14:12
@Manalgo,,高一到高三每周也就休息个一天,1,2019-09-09 14:11
@黄金第十三宫,,中国工人在资本家面前没有议价能力，把全世界工人工资和待遇都拉低了，中国的技术产业工人跟全世界的同行相比，没法比,0,2019-09-09 14:11
@路慢慢兮吾修远,,别闹了，真当钱那么好赚吗？打工的不就想着多加班能多挣点，你跟打工的说双休？,0,2019-09-09 14:10
@月亮之上qin尼泊尔,,还记得深圳富士康的十四连跳吗,0,2019-09-09 14:05
@你的秘密szzy,,我们是一个月两天,0,2019-09-09 14:04
@时光何以满尘埃,,9  9 330 剩下的35基本上是年底和法休,0,2019-09-09 14:04
@我推荐你玩丐帮,,,0,2019-09-09 14:02
@普雅熙熙熙熙熙熙熙熙,,我们干工程的，哪有双休月休，所有休息都得请假！最长的假期是过年的两个星期！,0,2019-09-09 14:00
@_Ares丶z,,国家的劳动法大概也就是和字典一样，看看就好,0,2019-09-09 13:59
@叫我酷祺,,月休10天,0,2019-09-09 13:57
@_同一种调调,,中国的事业单位临时工最多吧，因为一出事，媒体报道出来的总是&quot;临时工干的&quot;(比如交警 城管等等),0,2019-09-09 13:54
@睡在被遗忘的角落里,,学生保证假期,0,2019-09-09 13:53
@君侯2019,,什么调查？双休还能不休？基本保证？如果加班，要双倍工资哦！老板也不愿意！,0,2019-09-09 13:51
@Hey_还好吧,,二胎产假一个月，了解一下！,0,2019-09-09 13:48
@susbejdnekdnrj_,,我明白内幕,0,2019-09-09 13:45
@悠乐猫YOLOCAT,,中国只是保护资本家和资本企业的，谁会重视屁民,0,2019-09-09 13:44
@痴梦咋醒,,那些有双休的人，到底是什么职业,0,2019-09-09 13:43
@华夏芳菲,,政府和医院也有临时工，同工不同酬，资本家式的剥削。你敢说他违反劳动法吗,0,2019-11-01 18:43
@爱生活爱敏敏啵,,996是福报，你们这些人，要懂得知足,1,2019-10-12 11:20
@see-nleaguetrash,,某些资本家还鼓吹996，资本家凌驾于劳动法?还要警察法院做什么?,0,2019-10-11 10:00
@峰哥000007,,基本没有不违法的，各种监管不到位睁一只眼闭一只眼，大多每天工作12小时左右，谁来管，谁去管，基本藐视法律打擦边球，工人有苦难言,0,2019-09-25 22:36
@健身的晶宝,,之前公司一周工作72小时以上，无社保，压榨员工，简直就是吸人血馒头，我连辞职不干了居然还不让走，故意扣押工资，让我走上讨薪之路。想问问网友，中国有守法的公司吗？,0,2019-09-13 16:00
@是个好人旭,,来湖北雄韬看看，有员工月工时300多，还被扣40多个工时，我很有幸来到了工程部，本来大学学的是机电，结果一个月只允许你休息两天，而且动不动义务加班没有钱的那种，经理会逼着你加班。@人民日报 @荆门新闻网 @京山检察院,0,2019-09-12 17:52
@天之御中,,今年做为暑假工在武汉富士康科技园干活，连续好几个星期没有调休，还不让随便离职,0,2019-09-11 17:53
@ZSir记录仪,,大城市的人绕开 请不要在我们跟前显摆！！！,0,2019-09-11 08:40
@喵了个咪June,,加班没有加班费是不是最惨的呢,0,2019-09-11 08:00
