User,Reter,Comment,Votes,Time
@一猫小串饮酒醉,,中国有公司不违反劳动法吗,901,2019-09-09 13:12
@LA2024,,中国工厂发生的事，首先由外媒爆出来，国内一直把工人当机器且无任何人权保障,560,2019-09-09 13:12
@冬天爷爷丶,,国家的劳动法在资本家面前就是个p以后都让你们996,366,2019-09-09 13:13
@陈少举,,996不是福报么？ ,319,2019-09-09 13:14
@刘禅后人,,富士康员工全靠加班赚钱，你让他们不加班，就是在限制他们收入。他们最不喜欢淡季，没活干，拿着一点点死工资闲着，很快就会辞职走人。,248,2019-09-09 13:14
@衢道行者,,双休在很多公司都是梦想,132,2019-09-09 13:18
@一亩八七,,底层员工不靠加班哪里来的高工资,118,2019-09-09 13:19
@你知不知道的事我不知道,,说别人的时候能不能先想想自己？大陆企业应该没有不违反劳动法的吧？,69,2019-09-09 13:45
@Cuber_李,,资本家眼里怎么会有劳动法？有几个私企不加班，又有多大私企能保证周末双休。私企只会变本加厉的压榨职工的剩余价值罢了。,40,2019-09-09 13:41
@八千里路雾生海丶Jason,,中国的工资水平有待提高,34,2019-09-09 13:18
@a李丰泽,,签劳动合同的时候，每周不得上班超过四十个小时，每次加班不得超过一小时，实际上每周上班七十个小时还不算加班,29,2019-09-09 13:25
@自谎,,在工厂都是靠加班费过活的。要么就提高工人工资取消超时加班。,19,2019-09-09 13:15
@亓纪的想法,,如果苹果和富士康承认了，能否出示一下视频或书面证据，这是应该的吧，毕竟空口无凭。如果有违法了就该依法惩戒，绝不姑息。对于加班，以前互联网公司的996算不算违法？据我了解，富士康加班费和各种福利都比大部分公司要高，很多员工愿意加班挣加班费的，不加班工资很少的。互联网公司谁做到了。,17,2019-09-09 13:21
@巴黎铁塔反转再反转再反转,,国企加班也差不多这样，就不用说别的了！工会通过的综合工时制度了解一下，按年计算工时，旺季一个月往死里加班，淡季给你拼命放假，一年内加班只要不超出范围合法合规！,13,2019-09-09 13:24
@滕条焖猪肉,,国内的工厂都一样，能认已是很好了,11,2019-09-09 14:06
@无蛋白酸奶vik,,董明珠：年轻人要有吃苦精神，不要以自我为中心！,15,2019-09-09 13:24
@5Hertz-7,,先管管中国公司吧！劳动法呢！,9,2019-09-09 15:48
@前沿科技哥,,美国工厂第二部已经开播。,4,2019-09-09 17:48
@Julie丶Smith,,工地777路过，为什么这么多人都有双休,5,2019-09-09 14:50
@wuliwsssw,,苹果一发布新手机，负面新闻就多了，所以苹果决定不发布了,5,2019-09-09 13:18
@郭郭航春,,我们工地上班7x24有谁会管会问,2,2019-09-09 13:44
@约翰尼德凡,,所以呢？违反了结果如何？员工自己想维权吗？需要专业指导可以去法加法律咨询找律师帮忙，违反劳动法的还少吗,1,2019-09-09 16:24
@宇宙巅峰草chw_1511X,,有关部门是企业违法行为的纵容者！！！它们认为，保护劳动者的合法权益，是给企业找麻烦，会影响招商引资，觉得只要有工作干就应该谢天谢地了……劳动者面对强大的企业，软弱的执法，只能自己被剥削，维权成本太高！,1,2019-09-09 14:42
@zjlsGaoSir,,是不是伪命题，如果一直加班的人可能刷不到这个统计，能刷到大多还是有一定休息时间的吧,3,2019-09-09 13:46
@沉默是金198888,,现实是制造业底层工人就靠加班费过日子呢,5,2019-09-09 13:37
@木木aCQ,,还有一个月休两天的呢节假日不放假的那种,5,2019-09-09 13:16
@月球寂静海,,外资企业和台湾企业算好的了 在国内企业面前真是小儿科,4,2019-09-09 13:53
@Cocodlir,,我已经50天没休息了,3,2019-09-09 14:54
@加油嗷铁汁,,你别那么多收钱的批话  老子过两天照样买苹果,3,2019-09-09 14:26
@你的爱像彩虹,,……我一周休4天半选哪个,1,2019-09-09 15:43
@阿波洛夫斯基,,996每天超出8小时部分1.5倍、周六2倍工资我可以接受，问题是不给加班费你劳动保护法到底在保护谁？,2,2019-09-09 15:43
@阿波洛夫斯基,,加班超过100小时？你去问问工人是不是加的很开心。出门打工都想多赚钱，周末双休每天8小时工人就不乐意了。,1,2019-09-09 15:28
@平生路,,开出租有双休吗,1,2019-09-09 15:12
@町薇汀雨,,一个月28天 无节假日 什么水平,1,2019-09-09 14:59
@D女郎_雅儒,,投票有啥用的？啥意义,1,2019-09-09 14:22
@只是躺枪,,不加班怎么挣钱,0,2019-09-09 14:16
@Silent_All_These_Year,,一大堆，或者说大多数都是违规的,1,2019-09-09 14:01
@Chloe_O6,,昆山联滔生产airports和iwatch无线充电线也是这样啊,0,2019-09-09 20:06
@净翻白眼,,加班不算钱，请假扣钱是什么操作,0,2019-09-09 18:08
@啊古古怪怪古古怪怪,,台美一锅端,0,2019-09-09 17:11
@张珍梅99187,,没事 中国低层劳动力多的很,0,2019-09-09 17:00
@BattlefieldZZP,,上四休三,0,2019-09-09 16:58
@取什么蛇皮,,1个月2天，法定假放3天我们放1天，然后那个月就只有一天假了,0,2019-09-09 16:20
@阿波洛夫斯基,,万恶的美帝啊！中国企业一定都是遵纪守法的吧,2,2019-09-09 15:44
@浅陌安然逸,,进厂都怕了,0,2019-09-09 15:33
@cobet丶,,每周三天半休息的路过,0,2019-09-09 14:57
@汤豪-,,897了解一下   8点上班   9点下班  一周7天,0,2019-09-09 14:48
@天牛网服务号,,有双休的企业说出去感觉自己在做慈善一样，我都双休了你还想高薪？,1,2019-09-09 14:26
@世事繁华皆是空,,平时看情况，偶尔双休，中秋节只放一天，年后果断跑路。,0,2019-09-09 14:25
@来一盘洋芋炒土豆,,工地小哥表示一个月没一天休息时间，早上七点上班。,1,2019-09-09 14:23
@环华骑行的飞哥,,现在876，而且没有完整的法定节假日，端午2天，据说中秋也2天，国庆3天，真是这样我要告发了，,0,2019-09-09 13:58
@家虎妈咪叫权嫂,,每周一天半,0,2019-09-09 13:52
@古古木风,,苹果发布前连续发黑,0,2019-09-09 13:51
@IsYujian,,富士康要滚蛋了,0,2019-09-09 13:19
@唇养青苔,,劳动法确实是个屁。以后等矛盾加剧了 搞个工会出来吧,0,2019-09-09 13:18
@AzusaTsang,,怎么没三休选项,0,2019-09-09 13:16
@ItsMeRaymond,,？？是富士康违反劳动合同法，为什么感觉是苹果在违反。,0,2019-09-09 13:16
@一一蔡徐坤的球迷,,苹果要发布新品了，这几天的热搜给渣浪带来了不少流量啊,1,2019-09-09 13:44
@格子丸儿,,已经四周没有休息了哦,0,2019-09-10 09:43
@做游戏的差不多酱,,中国压根没有劳动法。。。社会主义国家劳动人民被资本疯狂压榨，想想都神奇,0,2019-09-10 09:23
@本大王叫满天,,我们银行经常一个月休不上,0,2019-09-09 22:45
@nocrossty,,没效益没本事的企业才不加班,0,2019-09-09 20:38
@以浪制暴,,我觉得厨房有必要 管理下 厨师真的是累,0,2019-09-09 18:45
@仓嘎子与小胡儿,,怎么这么多人基本保证双休…是啥工作可以说说嘛…,0,2019-09-09 18:36
@不值得吧,,,0,2019-09-09 17:32
@Eagle小暖,,双休超额……,0,2019-09-09 17:10
@12306和谐号,,我参与了@新浪科技 发起的投票【你每周有双休吗？】，我投给了“一周休一天差不多”这个选项，你也快来表态吧~,0,2019-09-09 17:08
@茶语温情,,劳动法在工厂管过用吗,0,2019-09-09 17:04
@止盈大魔王,,真是搞笑  国内有几个单位可以正常双休的,0,2019-09-09 16:40
@治痘治斑博主,,这种事情在中国很多好吗？比如美晨通讯公司,0,2019-09-09 16:08
@奉旨上班啊,@一猫小串饮酒醉,中国有不违反劳动法的公司吗,0,2019-09-09 15:44
@CC罗R,,呵呵 富士康员工是都争着抢着加班！不是苹果逼的…因为不加班就没什么钱，基本工资！,0,2019-09-09 15:40
@最爱喝可乐阔乐,,我就不明白了 996不好嘛 我们干工程的没有假期 每天加班加到死 还没加班费,0,2019-09-09 15:38
@乔小婷有强迫症,,我们公司自称外企，老板的澳洲华人，周末加班92元一天，晚上五块钱一个小时，一到有工商局来验厂领导就让我们装双休,0,2019-09-09 15:07
@那年春夏,,我基本双休   如果有钱赚我也爱加班,0,2019-09-09 15:05
@兴柠萌200010,,关注这些大企业同时也来看看国内的小企业吧，我一个民营企业上班的，连正常的单休，社保和假期都没法保证，我能说啥呢,0,2019-09-09 15:00
@安九炫,,我们一周单休一周双休，没选项,0,2019-09-09 14:57
@小兔崽子_zz,,关心一下施工单位,0,2019-09-09 14:47
@GANTZ_O,,@妮妮妮妮Nini_,1,2019-09-09 14:33
@在下游游,,现在大部分小型电商公司也没有双休,0,2019-09-09 14:22
@688村有矿快来,,快递员一年四季没休息我说话了吗,0,2019-09-09 14:12
@鸽子家的美饰美屋,,刷微博的都是闲人，所以双休评分高,0,2019-09-09 14:04
@炒疙瘩儿,,现在不少公司已经有条不紊的在开拓非洲和东南亚市场了 没看不少产地都换了吗 迟早会搬离的,0,2019-09-09 13:57
@_刘没谱儿,,我每周固定歇3天,0,2019-09-09 13:56
@我不是夏目啊,,每周上5.5天，我都不知道周六上那半天，意义何在！,0,2019-09-09 13:53
@疯狂的圆轱辘,,评论里一群伪君子，又想双休不加班，又想高工资，自己当老板吧，别打工了,0,2019-09-09 13:53
@艾拉蜜妮,,呵呵,0,2019-09-09 13:48
@不吃萝卜垂耳兔,,好多人跟我一样莫得周末,0,2019-09-09 13:43
@软绵绵的小玉酱xy,,某些公司 国家法定节假日都克扣 甚至休一天 上一天 休一天  绝了,0,2019-09-09 13:42
@一身矫qing味儿,,同样的工作内容，上班时间不一样，休息时间不一样。没法说,0,2019-09-09 13:29
@旅拍,,有点标题党的感觉 富士康是富士康哎,0,2019-09-09 13:22
@清央恋,,中国所有的企业，机关单位都是违法的，违犯劳动法，呵呵,2,2019-09-09 14:07
@失去正义,,各位理性网友怎么干了苹果公关部的活了，苹果说不得？我们说他违反是客观事实，你们一个个反驳说国内企业也这样，TM?国内企业这样就对了？国内企业这样就意味着国外这么做是合理的了？DISS 996的时候你们也没站出来说国内苹果也这样啊。到底是国人爱国贼还是有的蠢人屁股坐歪，心里有点数好吗？,1,2019-09-09 13:24
@中山左岸灯饰工厂,,实行双休和8小时工作制度 是美国对中国贸易战一种手段 西方就是实行这种制度才导致竞争力没有中国 现在网上喷子一点不懂世界局势美国一直指责中国反WTO劳动法规则,1,2019-09-10 03:27
@留不住的黑豆,,有时候挺羡慕一些企业白领的，加班还有加班费,1,2019-09-09 20:33
@木大5258,,无良媒体！你敢不敢把“某调查”的具体公司或组织在哪一时间  对多少人进行调查进行公布，怕不是不敢，而是自己都不确定有没有这个调查吧，怎么能这样引导舆论？,1,2019-09-09 17:30
@乙卯壬寅,,你知道维权有多困难吗？,0,2019-09-09 17:22
@一多愁善感的人儿,,主要是国内大部分公司自己都是单休，这才是没人去反对的很重要的一点原因吧。。。,1,2019-09-09 16:59
@一颗上荣耀的心,,国家稍微重视一下工程单位休假制度、也不至于离婚率那么高,2,2019-09-09 16:59
@晓兴的微博,,我本来不想双休，结果呢？硬是通知我休息，一天就看电视，打游戏，一个月少挣很多钱,1,2019-09-09 13:58
@渡鸦君,,我们做餐饮的上班基本朝九晚九，一个月4天休息，有的2天，节假日不加班不错了。对比外企酒店，人家是双休，8小时工作制。劳动法就是摆设,1,2019-09-09 13:48
@魏丶七月,,惊了，居然能保证双休的人最多，你们都这么幸福吗,1,2019-09-09 13:22
@kinghard,,身在国有企业。不知道休假是什么,1,2019-09-09 13:19
@要用魔法打败魔法Y,,因为苹果违反了劳动法，所以你是海军。,1,2019-09-09 13:13
@华夏芳菲,,政府和医院也有临时工，同工不同酬，资本家式的剥削。你敢说他违反劳动法吗,0,2019-11-01 18:43
@爱生活爱敏敏啵,,996是福报，你们这些人，要懂得知足,1,2019-10-12 11:20
@健身的晶宝,,之前公司一周工作72小时以上，无社保，压榨员工，简直就是吸人血馒头，我连辞职不干了居然还不让走，故意扣押工资，让我走上讨薪之路。想问问网友，中国有守法的公司吗？,0,2019-09-13 16:00
@天之御中,,今年做为暑假工在武汉富士康科技园干活，连续好几个星期没有调休，还不让随便离职,0,2019-09-11 17:53
@ZSir记录仪,,大城市的人绕开 请不要在我们跟前显摆！！！,0,2019-09-11 08:40
@喵了个咪June,,加班没有加班费是不是最惨的呢,0,2019-09-11 08:00
@喵了个咪June,,我靠，平安人寿违反劳动法怎么不查，比苹果厉害多了。,0,2019-09-11 08:00
@PENG先生KUN,,如果每周双休，车间的工人只能基本保证生活开支，不加班就没钱,0,2019-09-10 21:40
@mumiumumiu,,996都是好的，很多公司晚上熬到11点，周末还加班，没有加班费就给几十餐补。,0,2019-09-10 18:55
@婷婷接地气,,澳洲不仅双休，一周可以在家工作一天，一年年假两个月，病假10个工作日，产假最多一年，然而还是想回国发展,0,2019-09-10 13:23
@我叫陈陈陈陈陈陈陈,,啥时候统一一下双休,0,2019-09-10 12:22
@Max猫瞳,,我们厂   没有假  每次国定假日不放 也没有三陪工资  要么就一天  宁波这里应该常事,0,2019-09-10 12:05
@关彬是个慢性子,,几年前在上海这边的电子厂，忙的时候每月加两百小时都有,0,2019-09-10 10:50
@路西恩_真定,,中国工人的权益得靠外国人争取了，想想有点讽刺,0,2019-09-10 09:43
@Real_Sneijder,,市场经济啊大哥，不愿意做离开就行,0,2019-09-10 09:33
@空梦浮岛,,我能说我是上四十五天休息十五天吗，每十五天里可以随便拿出来一天休息！,0,2019-09-10 09:15
@扑灭火山的石油-,,这不很正常么？现在连公务员都加班。,0,2019-09-10 08:27
@程桂来,,苹果要开发布会某厂商容易沸腾，没办法。,0,2019-09-10 08:14
@西安清沣源76392,,富士康咋这么就说了实话！,0,2019-09-10 07:46
@FloraKelly,,可能有劳动者主动愿意加班，但是最大的问题是苹果及其制造供应商富士康违反中华人民共和国劳动法超量雇佣临时工，而这些临时工享受不到诸如五险一金这样的基本劳动权益，能不叫黑心工厂吗,0,2019-09-10 07:34
@暖喃x,,如果不加班我们打工的一个月两三千怎么花,0,2019-09-10 05:39
@nysq小李飞刀5706,,工厂必须有制度保证才能更好生产,0,2019-09-10 04:42
@追梦的庸才,,我兄弟2013年在深圳的工厂上班过，他说一个月上了360个小时，工资才3500！苹果这样就上新闻了，那么我兄弟真的是一肚子的委屈！,0,2019-09-10 02:55
@马了个努,,劳动力不值钱，加班只要给钱，劳动法就是个锤子！,0,2019-09-10 02:04
@ChiChiJames,,和苹果有什么关系，这不是富士康的事情吗？,0,2019-09-10 00:05
@Bandy小凝,,看美国工厂，中国在美办的工厂，聘用的美国员工一天工作八小时，还各种闹组工会提建议抗争。怎么美国在中办的工厂就要压榨中国人呢,0,2019-09-09 23:52
@t-正x,,你有病的调查！中国是劳动密集型的，世界工厂在中国明白了吗？,0,2019-09-09 23:52
@hi----果果,,公务员加班也很厉害啊～,0,2019-09-09 23:42
@旧爱看你的灵魂,,一个月休息一半，也挺无聊的！,0,2019-09-09 23:08
@zun後生呐,,看看工地再说话,0,2019-09-09 23:07
@宇宙超级无敌大狗砸,,多了去了,0,2019-09-09 22:26
@mhonest,,我们早上八点半打开，晚上五点半下班。单位说不强制加班。只不过晚上七点半之前都不算加班，早上每周一次八点晨会制度。,0,2019-09-09 22:02
@梦大鱼鱼鱼鱼,,建筑公司有假期吗？,0,2019-09-09 21:45
@SaltPanda,,@留几手 品品,0,2019-09-09 20:53
@点点星光lihuafei,,单休跟加班不冲突,0,2019-09-09 20:14
@For_Hal,,996就完事儿了,0,2019-09-09 19:32
@鹤鹤今天恰海鲜没,,一般不都是一个月休两三天的吗。。,0,2019-09-09 19:28
@周震南的小阿冰啊,,压榨员工,0,2019-09-09 19:08
@MeganWang_M,,就算是违反劳动法，还一种申报特殊工时了解一下，合法压榨？为什么劳动法会有申报特殊工时存在呢？,0,2019-09-09 19:08
@天明变成光,,国企比亚迪长城开发才是最黑心得，富士康和外资都是比较良心的了。,0,2019-09-09 18:59
@蓝丶菇,,双休的都是公务员吗？,0,2019-09-09 18:59
@一路静静的爱你,,一月两天,0,2019-09-09 18:35
@你f慧囿涞生,,我们都是一个月休一天,0,2019-09-09 18:28
@曹大毛最可爱,,这难道不是那些工人的福报吗？狗头保命，懂的都懂。马云说996是福报。,0,2019-09-09 18:27
@小苏先生苏打水,,50％临时工使用，让我对苹果手机质量表示担忧,2,2019-09-09 18:19
@再见28425,,所有人都在关注各大公司，但是有谁关注过基层干部职工么，父母辛苦养大的孩子辛苦赚钱效力国家，同样是劳动法，为什么就不能保护在基层工作的同志们,0,2019-09-09 18:09
@失宠的咩,,不加班那里来的钱,0,2019-09-09 18:08
@空格青,,我们这边的厂，每天都要上班,0,2019-09-09 18:07
@孙阳阳i,,食品行业 烘焙企业 中秋节前两个月为生产旺季，80%为临时工，部分时薪甚至达不到当地最低标准，最早晚1点下班，要7点半上班，中午无休息，半小时吃饭。中国法律？呵呵了。,0,2019-09-09 17:45
@鱼子酱_萌萌哒,,我不喜欢加班，准点下班才有盼头，但是公司给的任务量往往是不合理的，只能被迫加班，而且没加班费,0,2019-09-09 17:42
@Ronderjry,,所以我们推荐年轻人在国家机关和企事业单位工作，失业率低,0,2019-09-09 17:37
@或许你要吃胡萝卜吗x,,这个热搜有点好笑,0,2019-09-09 17:32
@为爱走天涯0101,,我们做服装的一个月加班150个小时呢,0,2019-09-09 17:26
@filmans,,垃圾中国，国内公司违反劳动法，谁出来说了？双标很厉害嘛！,0,2019-09-09 17:25
@handsomemen_李杰,,只是富士康的问题么？我不信。这是唯一有问题的工厂吗？我不信。富士康1988年进入深圳的。那么问题来了在台湾不敢，美国不敢，为什么而在中国敢呢？和谁学的呢？,0,2019-09-09 17:23
@心向往希,,,0,2019-09-09 17:19
@未富先高帅,,田野上的地鼠窜了出来，他们想去另一片沃土,0,2019-09-09 17:18
@只要有live,,原本是最后一个选项，扛不住了换了份工作，变成第一个选项,0,2019-09-09 17:16
@lk路过人间,,这个调查结果显示近三成半的人有双休，近八成的人至少每周休一天。,0,2019-09-09 17:13
@一只有蛇精病的小包子,,我男朋友国企工作，每天八点能下班算早的，周末能休一天算好的，还没有加班费,0,2019-09-09 17:13
@当我没说过啊,,这对于代工厂来说不是太正常不过的事情么？而且来打工想赚钱的就是冲着加班来的，给你5天8小时一月拿两千多你来干么！？还不就是疯狂加班赚钱啊，这就是电子代工厂啊。,0,2019-09-09 17:11
@Wang宇恒丶,,加班好歹有加班费  一分耕耘一分收获,0,2019-09-09 17:08
@垂死梦中惊复醒,,苹果比一些其他的公司不知道好到哪里去了，唉,0,2019-09-09 17:07
@小鬼头Victory,,小公司的文员休一天，,0,2019-09-09 17:04
@弥弥织颖,,强烈要求把双休普及,0,2019-09-09 17:01
@我不是骑兵,,活这么大没遇到过双休,0,2019-09-09 16:58
@好吃的摇起来了,,至少加班还有加班费，电子厂上班不加班工资就很低了。,0,2019-09-09 16:57
@屋顶上的子衿,,天天加班,0,2019-09-09 16:55
@芭比波儿奔,,求助！北京德本展示公司 欠薪怎么办？仲裁证据不全。公司咬死不发！10个月努力打水漂了。,0,2019-09-09 16:53
@危情舞蹈,,考研人哪来休息,0,2019-09-09 16:50
@阿富汗卖艺的fhgy,,加班超过100个小时那是常态，不然连4000都拿不到，工厂就是这样，工资靠的就是加班,0,2019-09-09 16:42
@把灯熄灭了,,我就在富士康上班，表示员工都巴不得加班，平时1.5倍工资，周末2倍，法定假日3倍，深圳房租物价多高，不加班吃土啊，别乱带舆论。,0,2019-09-09 16:31
@QQQWWWYoung,,昆山纬创资通的骚年们怕是每个月140+个加班,0,2019-09-09 16:26
@GerikTT,,去看看《美国工厂》就懂了,0,2019-09-09 16:25
@安吉莉娜陶寒,,严重违法,0,2019-09-09 16:25
@小黑好白好白,,007听过吗,0,2019-09-09 16:25
@自渡with,,呵呵 施工单位有休息日？？787工作制,1,2019-09-09 16:16
@我玩康娜贼溜,,我公司是886,0,2019-09-09 16:15
@宝宝浅笑123456,,270小时都是加班加出来的,0,2019-09-09 16:15
@云波升,,临时工不都是出了事才有的吗？衙门就这样做的,0,2019-09-09 16:12
@桃花醉酒寒,,资本主义势头起来了,0,2019-09-09 16:08
@你眼里还带笑么,,双休是什么？能吃吗,0,2019-09-09 16:07
@傻傻oo,,大家支持不要买了,0,2019-09-09 16:06
@握不住的时间l,,加班不给钱的咋办,0,2019-09-09 16:05
@大萌萌爱猫38051,,太多厂用的都是零时工了,0,2019-09-09 16:01
@兰子若,,羡慕啊，一个月才加班100个小时。我们做房地产的，免费义务劳动加班，平均每天加班最少5小时。,0,2019-09-09 15:58
@三番几点,,Good Timing,0,2019-09-09 15:57
@樱花飞舞集我心,,这种，施工单位都是365天，天天工作的,0,2019-09-09 15:56
@95想当00后,,我国是工人阶级领导的、以工农联盟为基础的人民民主专政的社会主义国家。就这样对待工人和农民工？,0,2019-09-09 15:55
@阿枪枪枪枪枪,,我这的城管临时工不给加班费啊,0,2019-09-09 15:53
@大王没有小蛮腰,,起码人家富士康加班给钱啊兄dei，别的企业都是义务加班好吧,0,2019-09-09 15:50
@姣姣怎么那么好看,,上一休一的， 没资格投这个票 ,0,2019-09-09 15:47
@我只路过不打扰,,劳动法就是用来看得啊，没实际用途,0,2019-09-09 15:40
@深深地插入,,你信劳动法有工资发？,0,2019-09-09 15:39
@东京re丶不热,,双休？  你问问有没有单休就不错了,0,2019-09-09 15:38
@成才的赵郑航,,中国各个行业都有各个行业的问题，虽然不能一概而论，但是你们社会中的先进人士倒是改革啊，不要求你们一年内把所有问题都解决，先解决工厂这个问题，要不然一个厂全是临时工。,0,2019-09-09 15:36
@小N不加V,,国有银行，我们领导说加班是讲奉献。,0,2019-09-09 15:34
@Me傻静,,富士康没有加班的时候都在辞职,0,2019-09-09 15:30
@别说甚是想念丶,,国庆不放假 你们知道吗,0,2019-09-09 15:28
@Whynot-Russ,,没几班一个月一千多谁还干呢？富士康为什么正式工那么少，留不住人就是没加班工资太低了。,0,2019-09-09 15:26
@O太你好,,这里违反劳动法说的是用临时工太多了！！临时工不给买社保不报交个税的！！而且你们是不懂工厂员工的心态吧，一年到头出来就怕行业惨淡没加班费赚不了钱，要是一个工厂加班得少还马上换工厂的做的，而且富士康的时薪是行业内有名的高好吧,0,2019-09-09 15:25
@王破格,,休息半个月,0,2019-09-09 15:23
@一线量天地,@LA2024,这是中国市场的竞争力，没了这条竞争力。老外还不如把岗位留在自己的国家,0,2019-09-09 15:23
@xzl的超级小粉丝,,啊！ 我一个月上4天班呢....,0,2019-09-09 15:22
@黄盖湖边举杯的唐老鸭,,生产一线的工人就是要靠加班多拿些工钱的。如果不加班收入会很低。但要是开高工资估计中国境内所有制造业都要倒闭了。,0,2019-09-09 15:22
@隔壁好老王kk,,国家又不会管这个。,0,2019-09-09 15:22
@微笑汀宝,,,0,2019-09-09 15:20
@那年那年那天那个她,,本来是有双休的，被客户逼得没有双休,0,2019-09-09 15:20
@梦的边缘025,,我觉得吗工薪得往上提一提，因为物价开始上场了，要跑赢物价嘛,0,2019-09-09 15:19
@波比大人47631,,中国竟然还是工人阶级领导的，工人的待遇竟然比资本主义国家还低，当初写明的8小时工作制呢？？？？简直就是搞笑骗民众的,0,2019-09-09 15:19
@心在流浪丶,,哪天不干12小时以上？来南京看看全是一堆中介劳务，全是血汗工厂！,0,2019-09-09 15:18
@漆敏娃,,没有单双休这个选项吗,0,2019-09-09 15:17
@鲁修sama,,……虽然很累，但是加班才有钱,0,2019-09-09 15:14
@别问啥也没有,,只要我的一天的加班工资，可以吃上一斤猪肉，我愿意天天加班,0,2019-09-09 15:14
@Syltan,,全年休息,0,2019-09-09 15:12
@蒋乐同学,,是个锤子,0,2019-09-09 15:08
@雨夜的繁星,,天天12个小时,0,2019-09-09 15:08
@晓晓晓晓晓仙女,,简直胡说八道，能不能弄清楚？是有逼着员工加班？几乎很少超100小时。高峰期不能辞职？现在都有专门绿色通道办理离职，难道自离还有人管？ 没有人逼你上班&amp;加班，申请加班也是福利，不愿意完全可以不加班。现在还有哪个良心企业给你加班费？？？,0,2019-09-09 15:03
@芽美_,,双休是什么？,0,2019-09-09 15:01
@别让我看书,,医生还有休息嘛，一年365天，在医院366天,0,2019-09-09 15:01
