User,Reter,Comment,Votes,Time,Count
@青岛啤酒大哥,,老百姓不会去堵的！！！别费力气了！老百姓要挣钱吃饭的！！！真无奈,0,2019-09-08 19:34,2
@白芍R,,废青们别为了一己私欲破坏了自己生活着和爱着的地方！,0,2019-09-08 10:29,1
@-wuchennnn-,,a,0,2019-09-08 02:09,2
@一个眼睛雪亮的群众,,我呼吁香港警方驻港军方继续保持克制,0,2019-09-07 20:39,1
@忧伤的华尔兹909,,在不收拾那些港独，暴徒，我们都没有兴趣看了,0,2019-09-07 19:55,1
@willing1705,,香港仔这回是出名了.. 还说搞啥子民主文明.. 呵呵.. 素质TTM高了.. 也不怕丢人,0,2019-09-07 19:52,1
@广汽本田Shelly,,哪里出来问题，为什么都不会停止，听到就无形心累,0,2019-09-07 19:49,1
@Cockney爱足球,,我还能说什么呢？两面人已经多到管不过来了，生日马上就到了，还不出手么？,0,2019-09-07 15:27,1
@望未来012,,这都是大爷，政府都不敢管,0,2019-09-07 15:02,1
@5638忽悠,,继续折腾吧,0,2019-09-07 14:28,1
@柠檬树下静静,,正常人是不堵，废青人才傻傻的去堵,0,2019-09-07 09:53,1
@蚂蚁耍流氓,,真是又臭又长，没完没了,0,2019-09-07 09:49,1
@丝妤的秘密,,早他妈应这样啦！早几个月就出手，就不会搞成现在这样啦！,0,2019-09-07 09:49,1
@正义下陆,,【#香港警方呼吁市民不要参与堵塞机场#】6日下午，香港警方表示，留意到有人在网上鼓吹阻塞道路，使用不同交通工具堵塞交通，来达到瘫痪香港国际机场交通和运作的目的。警方重申，如发现汽车无故停下阻路，将会从速处理，包括拖走车辆及检验。机场管理局已获得法庭颁发的机场禁制令，禁制令的范围涵盖,0,2019-09-07 09:41,1
@孙锡泉青岛大学,,这层评论值得发个央视新闻了吧？这些都是网络段子手，央视段子手@朱广权 以后亚历山大咯。//@追星有何感觉:警察抓，法官放，免费地铁走一趟。,0,2019-09-07 09:31,1
@忽而嗨哟咿呀呦,,内部消化,0,2019-09-07 09:28,1
@小猪刚刚好-678,,垃圾,0,2019-09-07 09:28,1
@Suki-Xx-w,,现在我的热情已经减退了,0,2019-09-07 09:26,1
@Panda丶熊猫哥儿,,必须坚挺,0,2019-09-07 09:22,1
@AOI小七,,呼吁没有作用。。。。这部电视剧太长了,0,2019-09-07 09:13,1
@小米加加的世界,,不用呼吁～!放心我们不会去的,0,2019-09-07 09:12,1
@鸡尾酒1888,,牛逼啊，评论区的都是北大才子级的,0,2019-09-07 09:09,1
@萌萌嗒小丸纸,,再不大结局是要烂尾吗,0,2019-09-07 08:53,1
@冯晓张,,网上一片谴责，声讨，支持香港警方，对暴徒有用吗？,0,2019-10-23 15:51,3
@白云黑星星,,抓得好,0,2019-10-22 16:01,2
@HuangWu之心,,友情提示，离国庆阅兵还有24天,0,2019-09-11 18:23,4
@Kori_813,,这可能就是龙应台喜欢的香港,0,2019-09-09 17:55,2
@上上签hxp,,哼哼哼哼哼哼,0,2019-09-09 01:34,2
@冯晓张,,网上一片谴责，声讨，支持香港警方，对暴徒有用吗？,0,2019-10-23 15:51,3
@白云黑星星,,抓得好,0,2019-10-22 16:01,2
@HuangWu之心,,友情提示，离国庆阅兵还有24天,0,2019-09-11 18:23,4
@Kori_813,,这可能就是龙应台喜欢的香港,0,2019-09-09 17:55,2
@上上签hxp,,哼哼哼哼哼哼,0,2019-09-09 01:34,2
@青岛啤酒大哥,,老百姓不会去堵的！！！别费力气了！老百姓要挣钱吃饭的！！！真无奈,0,2019-09-08 19:34,2