User,Reter,Comment,Votes,Time,Count
@阿沁沁沁泌,,把骂人当玩笑的人从小爹妈是不是双亡,0,2019-09-23 22:45,1
@德云社群粉,,嗯，差不多也是说我丑，一次在和我姐妹聊天的时候我姐妹男朋友说你长得啥样自己心里不清楚吗，我说我知道我长得不好看，普通行吗？他就超级夸张的笑了谁给你的自信，我姐妹就让他滚，他又说不好意思我不像你所谓的闺蜜来欺骗你，你就是丑，我TM当时眼泪差点下来,0,2019-09-23 22:45,2
@LT叮咚,,开不起玩笑？,0,2019-09-23 22:44,1
@给我买软糖吧,,一起工作的人打算发朋友圈说xxx你怎么还是那么胖呢,0,2019-09-23 22:35,1
@倍悠爱千玺,,相貌开玩笑的，伤自尊的，关系到父母的都不行,0,2019-09-23 22:34,1
@海绵不能没有宝宝哟,,我这个人偶尔开开玩笑没什么，如果老是跟我开玩笑的，我好友名单，为0哦,0,2019-09-23 22:34,3
@Eliaukihs,,偷拍女生在车上睡着的照片当头像,0,2019-09-23 22:34,1
@Butterrrfly,,同年级好朋友知道我是九月份的“你真的好老，你是班级里最老的女生”这种人别看我脸上还笑着我心里她已经变了一分钟孤儿了,0,2019-09-23 22:33,1
@不吃鱼zoey,,对女生的外貌或者天生的缺陷开玩笑,0,2019-09-23 22:33,1
@小葵花0521,,知道我喜欢哪个idol，然后就特意跑到我面前说他坏话，完了之后说只是开玩笑的,0,2019-09-23 22:33,1
@矜持的丸子哦,,被喜欢的人叫小姐姐，还有他年龄我比我大，忍不了太生气了,0,2019-09-23 22:33,1
@念去去洗清秋,,我们网恋吧？  我们恋爱吧？ 完了之后说我是开玩笑的，你不会当真了吧,0,2019-09-23 22:33,1
@定制设计师燕子,,至今最讨厌的是有一个摄影师帮我拍照后修图，期间不停的告诉我脸上哪里哪里的缺陷他帮我p好了。他觉得很好笑，我觉得很反感,0,2019-09-23 22:32,1
@不是薛宝钗的那个蘅芜,,你22了你好老啊,0,2019-09-23 22:32,1
@我的狗子找不着了,,你头发快秃了！,0,2019-09-23 22:31,1
@蒙马特高地的黄昏,,开学一个月了，班里一男生天天叫错我名字，今天又叫错，我说了他一句，人家倒不乐意了，这么久连别人名字都记不住，对一个人起码的尊重都没有吧！,0,2019-09-23 22:30,1
@今晚早睡好吗你这个人,,出门前开开心心收拾收拾自己，结果来一句，又没人看你,0,2019-09-23 22:30,1
@日lmh月,,刚才在闲鱼遇上一个问我多少钱卖的，骂了他，还说只是玩笑还那么容易生气,0,2019-09-23 22:28,1
@柯北屿,,别笑了，你笑起来好丑,0,2019-09-23 22:27,2
@艺心居一nice,,尤其是一天没事叭叭人家的相貌，汗毛多怎么了，搞得好像自己没有似的，什么东西,0,2019-09-23 22:26,1
@喜欢烊烊a,,开黄腔,0,2019-09-23 22:26,1
@爱吃糯米的大兔子,,你真胖，你脸真大，你腿真粗,0,2019-09-23 22:26,1
@尘苑苑,,假如你的爱豆怎么怎么样（不好的那方面）我他妈头都给你拧了,0,2019-09-23 22:24,1
@喜欢喝冰可乐呀,,我可能是个假女生,0,2019-09-23 22:24,1
@Arm我只笑笑不说话,,我喜欢你,0,2019-09-23 22:24,1
@全是油味,,关于外貌的笑话，这个真的很没有教养,0,2019-09-23 22:23,1
@可爱的人啊吖,,本来就不熟还一味地开黄腔，还说不要带着有色眼镜看他,0,2019-09-23 22:23,1
@戳朱一龙鼻孔,,说我胸小，我自己可以自嘲，但是您别觉得您可以附和。,0,2019-09-23 22:22,1
@今天打球了吗hh,,别假装矜持了好吗,0,2019-09-23 22:22,1
@云雨天青,,拿低俗当玩笑，还要怪你开不起玩笑，觉得自己是笑着说出来的就是在和你开玩笑，你不该生气,0,2019-09-23 22:22,1
@耗щ池,,开黄色玩笑我无所谓 动不动叫我发裸照 当老子是鸡？,0,2019-09-23 22:21,1
@Yoon_Seon,,图片评论 评论配图,0,2019-09-23 22:21,1
@一只喵喵叫的小兔兔,,我从小学五六年级开始到现在一直玩的好的一个好闺蜜   带着她垃圾男朋友  在很多他们同事面前说我是小黑胖子,0,2019-09-23 22:21,1
@穗和文集,,我喜欢你这句话zjs不要对我说,0,2019-09-23 22:21,1
@过期牛奶变不了酸奶,,男女相反又是一大堆,0,2019-09-23 22:20,1
@面包和咖啡和猫咪好天气,,拿身上的某些地方开玩笑，很没品,0,2019-09-23 22:20,1
@冷暖-ROY,,@刘瑞Ray丶,0,2019-09-23 22:19,1
@Kiana_什伊,,带炫富意味的玩笑比如我说想买鞋结果他给我来一句买鞋当然要买Gucci，又不贵，还在那边憨憨一样的笑,0,2019-09-23 22:19,1
@江东子D,,你胸真小，你好黑呀,0,2019-09-23 22:17,1
@笑起来特美,,在动物园看到河马 背对着我们 男“看这河马的后面 知道我想起什么吗？” 我好奇看着他 “卡戴珊” 瞬间就觉得low爆了,0,2019-09-23 22:17,1
@何一万一万,,讨厌拿女孩子的生理开玩笑，还感觉自己很幽默,1,2019-09-23 22:17,1
@啊啊噢噢147,,最讨厌的一句玩笑话：有人喜欢你,0,2019-09-23 22:16,1
@三角猫不是三脚猫,,开黄腔，自以为很有趣，很招人，其实恶心！女生真的很讨厌这种玩笑！,0,2019-09-23 22:15,1
@Mrs王先森,,不喜欢的人说什么玩笑话都反感,0,2019-09-23 22:14,1
@faner99,,你的胸像个男人(虽然很小可是不能经常说叭,0,2019-10-09 14:38,2
@faner99,,你的胸像个男人(虽然很小可是不能经常说叭,0,2019-10-09 14:38,2