User,Reter,Comment,Votes,Time,Count
@喵叔玛丽,,几号的10点上架？,0,2019-09-08 10:10,1
@一位Acer老哥,,这些人在干嘛？,0,2019-09-08 10:09,1
@鼹鼠挖掘机,,炫技加莫得感情,0,2019-09-08 10:07,1
@吃鸡蛋的下划线,,那天又看了张楚得采访…,0,2019-09-08 10:05,1
@王二德Zack,,摇滚乐队最吸引人的地方是各自乐队有各自风格，会自己创造音乐作品。这个乐队全瞎改别人作品，只不过是偶像歌手套个乐队的皮。,0,2019-09-08 10:04,1
@happy-200002,,只看有高老师的乐夏,0,2019-09-08 10:03,1
@小莫和小小莫,,看了夏天，怎么也看不进去这个！,0,2019-09-08 10:02,1
@ida_Z,,要多难听有多难听,0,2019-09-08 09:56,1
@ZHUER喵,,一起乐队吧里面的乐手们大部分都很强的，只是因为节目赛制的原因，让你们觉得凑出来的乐队不叫乐队，但请放下这些潜意识里的偏见，他们演奏出来的音乐还是很能够打动人的，如果他们自己原创编曲的话，也会非常棒的,1,2019-09-08 09:55,2
@ninikakaba,,这个节目比《乐队的夏天》差远了,0,2019-09-08 09:54,1
@-成苍,,小里小气的，好像小孩偷穿大人衣服,0,2019-09-08 09:54,1
@老麻MYH,,告儿松你为啥不用以前那个帅头像了,0,2019-09-08 09:50,1
@喂我说哎哎哎哎哎,,姐姐，中午吃啥,0,2019-09-08 09:49,1
@ZHUER喵,,经典在你们心中无法突破，但是这群年轻人各个都很有实力，不懂乐队就不要随意贬低他们,0,2019-09-08 09:49,2
@Mianto1985,,只能算是致敬！整个感觉就不对！孤独的人是可耻的弄的还行！其它两首不怎么样！,0,2019-09-08 09:47,1
@王大力Fish,,因为窦唯,0,19-12-13 15:06,3
@笨大童,,别去糟蹋！,0,2019-11-28 19:11,2
@zalaid,,怎么说呢，唱法都是一样，模仿郑钧，许巍等等。 还有民谣，唱出来都一个味。,0,2019-11-07 23:13,2
@忧伤De二爷,,翻唱下蚂蚁蚂蚁 才够劲,0,2019-11-05 21:48,3
@连毛胡9号,,主要是现在的摇滚歌曲不管精神还是词藻都无法和那个时代比了,0,2019-10-29 09:24,2
@向|[koma,,beyond,0,2019-10-18 17:20,3
@Lady如,,为什么要把张楚的婉约，强行掰直呢？,0,2019-10-05 15:02,3
@拿望远镜看未来,,有些经典是永恒的，那是时代的产物，无法复制。即使被复制也只是个外在的皮囊，没有灵魂。,0,2019-09-27 22:57,2
@颗蔚蓝,,无地自容唱的很烂,0,2019-09-27 12:08,2
@王大力Fish,,因为窦唯,0,19-12-13 15:06,3
@笨大童,,别去糟蹋！,0,2019-11-28 19:11,2
@zalaid,,怎么说呢，唱法都是一样，模仿郑钧，许巍等等。 还有民谣，唱出来都一个味。,0,2019-11-07 23:13,2
@忧伤De二爷,,翻唱下蚂蚁蚂蚁 才够劲,0,2019-11-05 21:48,3
@连毛胡9号,,主要是现在的摇滚歌曲不管精神还是词藻都无法和那个时代比了,0,2019-10-29 09:24,2
@向|[koma,,beyond,0,2019-10-18 17:20,3
@Lady如,,为什么要把张楚的婉约，强行掰直呢？,0,2019-10-05 15:02,3
@拿望远镜看未来,,有些经典是永恒的，那是时代的产物，无法复制。即使被复制也只是个外在的皮囊，没有灵魂。,0,2019-09-27 22:57,2
@颗蔚蓝,,无地自容唱的很烂,0,2019-09-27 12:08,2