User,Reter,Comment,Votes,Time
@洗头不用吹风机才怪,,我们买得起车还会关注你？你太高估你的粉丝了,103,2019-09-02 11:20
@辣条泥,,这个福利太好了！！我需要,73,2019-09-02 11:25
@山哈女孩,,哇塞太优惠了吧,72,2019-09-02 11:24
@柯南哎呦喂,,这个优惠买车太划算了！,63,2019-09-02 11:26
@霉有昀,,好优惠呀，心动心动,52,2019-09-02 11:26
@旺仔小聋包,,这力度也太大了吧,38,2019-09-02 11:30
@马哥今天直播了吗,,哈哈哈哈抽了一个12w-1.2w的券？,42,2019-09-02 11:25
@山河满目山河阿,,,40,2019-09-02 11:24
@实在不知道叫个啥昵称,,,38,2019-09-02 11:21
@翔翔翔茹茹茹,,有优惠耶,40,2019-09-02 11:25
@我弱我无礼呱呱,,我靠！我平时都在这上面买东西的啊哈哈,18,2019-09-02 11:30
@苍蓝星LL,,聚划算厉害了，这活动优惠力度诚意满满啊，不参与不行了，不多说了我搬砖存钱去了,13,2019-09-02 11:29
@g和小星欣,,,8,2019-09-02 11:24
@乔治猪是你,,这个福利也太好了吧，可惜手里的资金不够啊,5,2019-09-02 11:32
@是于不是余吖,,这么大的优惠！一定不能错过,2,2019-09-02 12:10
@喜欢小兔兔的我,,福利很棒，安排上了！,12,2019-09-02 11:24
@叫我刘夫人Yeah,,这个优惠我心动了,1,2019-09-02 12:12
@羽化残阳,,聚划算真的很划算，大家一起安排起来,2,2019-09-02 12:02
@剁椒鱼头头_,,哇塞，这个福利也太大了吧，对于我这个人来说，真的是很需要了，快买起来,1,2019-09-02 12:04
@真诚的丫头爱你,,第三大网购节开始了大家要抓住优惠呦,2,2019-09-02 11:36
@秋风揽明月,,优惠是优惠,6,2019-09-02 11:30
@Chekaxui,,哈哈哈活动明天就开始啦，超期待大福利啊！,2,2019-09-02 11:33
@伊为君漫步山水间,,简直就是大福利哦，真的不错,1,2019-09-02 11:35
@南瓜瓜瓜小姐,,这波优惠也太棒了吧,1,2019-09-02 11:24
@佩奇家族绝不认输,,哇这也太划算了吧,2,2019-09-02 11:34
@明朗的天空之城,,优惠很棒耶，不要错过了！,3,2019-09-02 11:29
@Chicly-海底月,,优惠到这个程度真的可以了,1,2019-09-02 12:14
@清美丽花瓶果,,这个活动也太棒了吧，感觉真的很便宜哦,0,2019-09-02 11:39
@兔子抱紧胡萝卜happiness,,这么优惠又厉害的活动，我要赶紧参加了 评论配图,0,2019-09-04 00:26
@姐姐今天想减肥,,又在骗我的钱了,0,2019-09-02 12:25
@小宋在线王者,,既然有福利为什么要等？赶快趁着福利买一台车吧。,0,2019-09-02 11:57
@北岛无岸,,可以考虑一下啊，优惠力度还挺大的,0,2019-09-02 11:48
@胸小平同志-,,满3万减3千 我也买不起,1,2019-09-02 11:32
@不瞎---,,这优惠券啊！这诱惑力我是抵不住,1,2019-09-02 11:34
@青霓水袖,,活动力度很大啊！满三万减三千，听听都心动！,1,2019-09-02 11:32
@一只戒糖的胖海星,,打开来没有…,0,2019-09-02 15:02
@专吃好孩子啊-,,这个程度其实相对来说真的是已经算是比较划算的了！,0,2019-09-02 12:34
@贺小梅的小跟班,,我有一张满九万减九千的,0,2019-09-02 11:49
@清汤味麻辣火锅,,伤不起真的伤不起 努力存钱吧,0,2019-09-02 11:38
@可不可以最爱我,,我看看就好，毕竟现在没钱,0,2019-09-02 11:34
@他说她叫常二宝JJ,,这样的机会真的不多了，遇到一定要把握住呢！,0,2019-09-02 11:34
@想成为你的光-,,福利阔以的，明天买起来！,0,2019-09-02 11:30
@indulge腻,,哇塞这个福利好啊,0,2019-09-02 11:31
@冰柠檬的可爱多,,这个福利真的简直了，太吸引人了呢！感觉好划算呀！ 评论配图,0,2019-09-02 11:29
@阿王真白给,,18款 国5车 清仓呢吧,0,2019-09-02 11:29
@我爱过大海和你啊,,聚划算买起来！,0,2019-09-02 11:27
@做个温柔人叭,,我已经准备好了！,0,2019-09-02 11:26
@马伊凌很nice,,这波福利我喜欢！,0,2019-09-02 11:25
@技术学院学不到技术的技术员,,这评论买的，要不要太明显,1,2019-09-02 23:27
@我快酸死了噢,,阿里巴巴真得良心，每一次活动都很优惠,1,2019-09-02 11:39
@国民偶像千堆雪爱长街,,超级大福利就在明天一起去看看吧,1,2019-09-02 11:32
@释树呀,,好棒的福利呀,1,2019-09-02 11:24
@夏天里的冰冰,,刚好想入手一辆，看这哈佛挺实惠的想买怎么办。,0,2019-09-03 23:31
@老干妈好吗,,驾照刚到手想入手一辆，看到这个活动心动了 。哈哈,0,2019-09-03 23:27
@五年five_years,,摇号摇不到,0,2019-09-03 01:03
@年前的团,,真的是聚划算啊！正好想要一辆。,0,2019-09-02 11:36
@离你最远我,,买车还是算了，什么都不允许我,0,2019-09-02 11:36
@养个蚊子过冬1,,心动不如行动，快快行动起来吧！真的太激动了！,0,2019-09-02 11:35
@--我不写作业,,好大的福利,0,2019-09-02 11:35
@酷的像光h,,这个福利太棒了吧，我也要进链接看一看,0,2019-09-02 11:35
@相思红豆忆,,哇哦，这个福利真的是太棒了吧，爱了爱了,0,2019-09-02 11:34
@霸波儿蹦蹦床,,正好要买一些东西，趁着这个机会正好,0,2019-09-02 11:33
@l不二臣li,,准备好了 这个优惠太棒了吧！,0,2019-09-02 11:33
@俊美孤立_,,哇塞 赶紧行动起来啊,0,2019-09-02 11:32
@美美哒小宝贝啊,,,0,2019-09-02 11:31
@吃肉的猴子a,,心动不如行动！！！,0,2019-09-02 11:31
@执念苏小,,哈哈啊哈家里需要买车的应该看一看啊！,0,2019-09-02 11:31
@可乐说我什么时候可以不可乐哇,,秋天买车中秋自驾游啊。优惠给的挺是时候,0,2019-09-02 11:30
@潇洒的走在江湖中,,有优惠就心动哈哈,0,2019-09-02 11:30
@球球怎么这么好看,,聚划算这波操作 666 ，反正我心动了，赶紧安利身边想买车的小伙伴们，心动不如行动,0,2019-09-02 11:30
@kakakakakaka西,,聚划算是阿里巴巴的？ 我今天现在才知道,0,2019-09-02 11:30
@可乐说我什么时候可以不可乐哇,,满三万减三千？我差的是那三千吗？,0,2019-09-02 11:29
@96年的可爱啦,,这个聚划算真的太给力了,0,2019-09-02 11:29
@我就像楼下的蚊子,,,0,2019-09-02 11:28
@酒要足够冰,,还能买车！哈哈哈这真的太牛逼了,0,2019-09-02 11:28
@我说我爱你呀你说是的你碍我了,,当初关注你好像为了省钱来着？,0,2019-09-02 11:28
@小羊羔海怪是谁,,要不是买不起我就买了,0,2019-09-02 11:27
@情深不可用,,好划算啊，这就去看看！,0,2019-09-02 11:26
@北海道下下下个夏天,,薅羊毛开始啦！又要开始剁手了,0,2019-09-02 11:26
@夏夏夏夏天最爱吃西瓜,,优惠力度太大了吧,0,2019-09-02 11:26
@歪理大师姐,,这个可以啊，给力的优惠,0,2019-09-02 11:25
@前任是个死人,,我知道了，明天！,0,2019-09-02 11:25
@宝贝不错吃,,千万不能错过了,0,2019-09-02 11:25
@榴莲班戟不好吃,,准备好啦～,0,2019-09-02 11:25
@YLP乐,,福利倒是很棒哦,0,2019-09-02 11:25
@暧昧而已不谈情,,真的好划算啊，马上准备去！,0,2019-09-02 11:25
@SkyLaiii,,我已经准备好了啦,0,2019-09-02 11:24
@师瞎闹腾钻石泪,,很不错的。,0,2019-09-02 13:42
@专杀裱子氵nan,,很不错的。,0,2019-09-02 13:39
@他是柠檬树,,我很需要这个福利，可是贫穷限制了我的生活，买不起啊,0,2019-09-02 11:34
@是Ange呀,,剁手啦,0,2019-09-02 11:34
@游走在卡冈图雅的一颗小行星,,@wigtixm,0,2019-09-02 21:35
@唯爱Jess_krys,,@别闹啊我男神在 好似好抵喔~~~,0,2019-09-02 14:09
@舒刚品,,这个必须赞一下，不然对不起自己了,0,2019-09-02 13:44
@傅游宫苍厍柳,,说实在真的不错啊,0,2019-09-02 13:44
@孰巩开腾,,不错啊宝贝，加油,0,2019-09-02 13:44
@易溥苍柯惠郭71827,,加油，不错哦！！！！！,0,2019-09-02 13:44
@孰余稳诚,,求好运,0,2019-09-02 13:43
@赵家隆夔桂茅,,太给力了！,0,2019-09-02 13:43
@索沃施都竺莘31473,,值得赞一个。,0,2019-09-02 13:42
@祥舒牡,,这个必须转啊,0,2019-09-02 13:42
@兔子抱紧胡萝卜happiness,,这么优惠又厉害的活动，我要赶紧参加了 评论配图,0,2019-09-04 00:26
@夏天里的冰冰,,刚好想入手一辆，看这哈佛挺实惠的想买怎么办。,0,2019-09-03 23:31
@我爱喝一大口水,,还没驾照呢，先看看，不过真的好划算。活动还挺人性化。,0,2019-09-03 23:30
@老干妈好吗,,驾照刚到手想入手一辆，看到这个活动心动了 。哈哈,0,2019-09-03 23:27
@任萌-,,@二号疯子 简直了,0,2019-09-03 07:13
@五年five_years,,摇号摇不到,0,2019-09-03 01:03
