User,Reter,Comment,Votes,Time,Count
@安稳6338117543,,如果出了问题可能就算酒驾了。,0,2019-10-12 08:06,1
@凶残的一比2016,,要管醉驾可以，请把小区乱停车、占到等问题同时都管起来，选择性执法就是懒政,0,2019-10-12 07:58,1
@用户somiremiredo,,喝酒上车很危险，尊重自己尊重他人生命安全。,0,2019-10-12 07:57,1
@慧用云企服,,饮酒不开车，小学生都知道,0,2019-10-12 07:47,1
@永远的一道光,,酒驾是在公共道路运行时才算。 我参与了@广州日报 发起的投票【酒后小区内挪车算不算醉驾，你怎么看？】，我投给了“2、不算”这个选项，你也快来表态吧~,0,2019-10-12 07:38,1
@ICEBIRD1978,,小区道路不是道路？浙江法制建设倒退了！这是为了哪位领导干部开的绿灯？,0,2019-10-12 07:21,1
@清情5971693118,,我参与了@广州日报 发起的投票【酒后小区内挪车算不算醉驾，你怎么看？】，我投给了“1、算”这个选项 醉驾应该不分时间、场合，没有任何条件可言，这个是原则问题。,0,2019-10-11 21:49,1
@南拥夏栀200003,,我参与了@广州日报 发起的投票【酒后小区内挪车算不算醉驾，你怎么看？】，我投给了“1、算”这个选项，你也快来表态吧~只要车动了就算,0,2019-10-11 19:54,1
@析木二哥,,肯定不算啊，醉驾属于刑法第一百三十三条之一危险驾驶罪的情形之一，法条明确写着本罪前提条件就是在道路上驾驶机动车。本来就是之前的执行不够严谨。再说了人家都说了这只是改改了认定，小区里撞死人该怎判什么罪判什么罪，反正我感觉不会比之前按醉驾算时轻。,1,2019-10-11 19:17,1
@Lanse59275,,谨防谎称喝酒拒绝挪车。,0,2019-10-11 18:57,1
@戍塞堡,,小区道路交通安全不属于交警管，因为小区内道路不具有公共人群使用的属性，在有关交通法规中早有规定，所以，酒后挪车不能算醉驾。,1,2019-10-11 18:53,1
@皓白哥哥5366,,喝酒骑自行车也算酒驾！去查查就知道了,0,2019-10-11 18:52,1
@白日梦想家的秘密1372,,喝了酒坐在主驾驶都算了,0,2019-10-11 18:52,1
@我不是苗条俊,,为什么小区里会有交警呢？,0,2019-10-11 18:50,1
@一帆过海非主流,,废话，酒后驾车就是酒驾,0,2019-10-11 18:48,1
@Raul_Jiang,,如果只是挪车我觉得可以不算，但是进小区里开车我觉得还是算酒驾。,0,2019-10-11 18:17,1
@微微一笑198904,,定义酒驾违法的意义不仅在于出了事有人赔，更重要的是未雨绸缪，避免出事！ 如果小区内不算酒驾的话，那么毫无疑问会增加小区内的事故发生率！而且因为小区内弯道多，障碍物多，玩耍的小孩更多，危险性更是成倍的增加！！,0,2019-10-11 18:15,1
@安师傅官方微博,,最安全靠谱的方法还是直接让代驾司机帮忙直接停好在车位上。,0,2019-10-11 18:13,1
@正义的梦想521,,看是不是在依法界定的道路上行l驶,0,2019-10-11 18:13,1
@zhouzx1975,,我认为小区里的路况更加的复杂，更容易发生事故,1,2019-10-11 18:10,1
@我不是渣渣超,,地方法规大还是法律大,0,2019-10-11 18:08,1
@那三年宝鑫干过的猥琐事30542,,小区应该属于封闭路段吧,0,2019-10-11 17:43,1
@蝉鸣处,,算啊，地下车库的通道都算,0,2019-10-11 17:39,1
@康康6116719693,,这是要给酒驾和醉驾松绑的节奏吗？,0,2019-10-11 17:34,1
@年年事事儿,,取决于饮酒量多少，不能一刀切,0,2019-10-11 17:32,1
@钟道治,,我参与了@广州日报 发起的投票【酒后小区内挪车算不算醉驾，你怎么看？】，我投给了“1、算”这个选项，你也快来表态吧~,0,2019-10-11 17:27,1
@我是我5587875116,,最好不要开，但是人都会有不方便的时候自己把握好就形,0,2019-10-11 17:10,1
@老康199901,,酒驾就是喝酒开车，你在火星被逮住也一样！,0,2019-10-11 17:02,1
@脑子迷信眼睛是不对的,,醉酒启动车辆就算醉驾。,0,2019-10-11 16:57,1
@神无月五,,饮酒后哪怕行驶一米也算酒后驾驶机动车 非得等意外发生？,0,2019-10-11 16:57,1
@大凯8899,,不可一概而论。,0,2019-10-11 16:47,1
@蓝天白云微风青山静静的流水,,所以挪车不叫驾驶？只要点火车动了都算驾驶，熄火滑行也算。所以只要喝酒动车都算酒驾。人就是这么不自觉，只要没有警察查的地方，找些理由搪塞，其实心里清楚得很,2,2019-10-11 16:38,1
@搞笑娱乐爆料,,小区美不算啊，因为小区是封闭式道路，不算上路,0,2019-10-12 18:52,1
@天下为公37664,,只要不是醉驾且没有造成伤害就可以不追究法律责任。我参与了@广州日报 发起的投票【酒后小区内挪车算不算醉驾，你怎么看？】，我投给了“3、评论留言”这个选项，你也快来表态吧~,0,2019-10-12 15:19,1
@风清扬8001,,砖家新招……,0,2019-10-12 14:37,1
@宋灿召,,我参与了@广州日报 发起的投票【酒后小区内挪车算不算醉驾，你怎么看？】，我投给了“1、算”这个选项，你也快来表态吧~,0,2019-10-12 13:18,1
@体贴的好男人-531,,这律师说不按刑法处理吗？那如果借着酒劲把你撞死了也可以吗？,1,2019-10-12 10:37,1
@生如夏花-200404,,小区里是真空的吗？只要喝醉酒，把发动机发动了就是醉驾！就有危险！！！,0,2019-10-12 09:32,1
@七右四分之三,,开一米和一千米是一样的，那么我喝酒开车回家应也不算酒驾。,0,2019-10-12 08:44,1
@雪名湖,,要有权威答案,0,2019-10-12 08:11,1
@-景致摄影-刘吉亮,,喝了酒车都不能摸,0,2019-10-12 07:31,1
@半个苹果1,,法律那么规定的，一切以法律为准绳，如果法律有重大失误不符合当前社会实际情况，会更改法律的，至少再未更改前就得按照法律了，法律都能随便被质疑了，还有什么能依靠的，老百姓不活了？,0,2019-10-12 00:17,1
@Hero燃烧的远征,,不算酒驾，如果撞到人，保险赔；算酒驾，撞到人，保险不赔，是要这样吗？,0,2019-10-11 20:09,1
@静夜听风1990,,这是哪个领导出台的政策？叫他出来给我们解释一下。,0,2019-10-11 18:52,1
@光明太子,,地方文件既然能凌驾于法律之上，它这连地方发都不算。三个执法部门既然行使立法权？,0,2019-10-21 12:13,3
@光明太子,,地方文件既然能凌驾于法律之上，它这连地方发都不算。三个执法部门既然行使立法权？,0,2019-10-21 12:13,3
@无暇四顾002,,要么把车扛起来走 要么爪子就别碰方向盘 没事吹牛逼一旦有事了就像癞皮狗似的哀嚎求放过 我是支持1,0,2019-10-18 22:44,3
@心尘莫染,,本来我认为醉驾针对的是醉酒驾驶车辆的行为，跟驾车时长和距离、车辆所处位置无关。但是一查，醉驾这个罪名是依据《道路交通安全法》而来的，是交通违法行为，那在小区里应该不适用这罪名吧？,0,2019-10-18 16:58,2
@烽火的云端,,法律是什么，是行为底线，难道要等造成了伤害再来理赔吗？既然这条法文存在的原则是禁止酒驾，保护人民群众生命财产安全，难道小区等封闭场所的人就不需要保护了吗？简直和国家刑法相违背。你可以在执法过程中人性化，但绝不能违背法律本来的意愿。乱弹琴，建议废止此条法规！,0,2019-10-17 11:10,2
@持笔描红颜79644,,发表下意见，喝完酒能不能开车自己很清楚。大部分投算的都是没车的，投不算的都是有车的，就这么简单。,0,2019-10-16 09:53,2
@赵磊先生在北京,,我只想说问题看似简单单一，但实际案发现场情况多变化，如交警询问过程有引导或者误导，就会与实际情况南辕北辙。请问，公平体现在哪里？,0,2019-10-15 00:47,2
@我真是一个小宝贝,,刑法将此规定为醉驾，有部分原因是为了起到刑法的威慑作用，从而预防犯罪。 所以，这种放宽并不利于法益的保护。,0,2019-10-14 15:19,2
@路人甲Ma,,酒驾对车不好 所以在小区里开也违法,0,2019-10-13 15:00,2
@touristui6221564657,,小区怎么就不算？还必须造成损失才算？都已经损失了，算醉驾不也是两边受伤害吗？醉驾啊，朋友能不能行了，只要喝醉了就不应该启动车辆，不管在哪儿，这是保护自己也是保护别人啊。,0,2019-10-13 05:40,2