User,Reter,Comment,Votes,Time,Count
@周小轩轩轩轩儿,,下面评论是认真的么,1882,2019-09-05 10:46,1
@梁Bellegarde,,啧啧啧,86,2019-09-05 10:30,1
@枫叶飘飘冉冉,,一直都很相信你，喜欢你的新歌 评论配图,54,2019-09-05 10:38,1
@柠檬糖心呀,,对以往虚假绯闻的回应和厌恶，相信自己成为自己最好的自己,40,2019-09-05 10:37,4
@我怎么辣么可爱喔,,披荆斩棘一路走来，辛苦了，你可以的,4,2019-09-05 10:43,1
@草莓味的小气泡,,遇见你是特别的开心，爱你哦 评论配图,5,2019-09-05 10:41,1
@晚安乔燃,,只要做好自己就好啦 在意别人眼光干嘛,6,2019-09-05 10:39,1
@你是吃货么,,不要过多在意别人的议论  勇敢做自己就好,6,2019-09-05 10:41,1
@我是小八妹,,相信你一定会做最好的自己的加油,4,2019-09-05 10:45,1
@程狗蛋的眉毛是弯弯的,,嘿嘿，我觉得李毓芬这个身材让人羡慕,4,2019-09-05 10:44,1
@FairyTail呢,,刚听完这首歌，感觉一张口就跪了,3,2019-09-05 10:43,1
@刘备关于大张伟,,哇偶，我觉得挺不错的，支持一下,3,2019-09-05 10:42,1
@帅气苏打水,,对呀，这就是人生的态度，还是积极一点,4,2019-09-05 10:40,1
@他说要带我私奔・,,额。。。这个姐不就是当年著名的和某台湾男星出轨的小三吗,11,2019-09-05 12:39,1
@芒果味的冰淇淋呀,,生活或者感情中很多不如意的地方，要慢慢改善,4,2019-09-05 10:40,4
@会飞的闪电皮卡丘,,好啦 已经成为我的铃声了 闹钟铃声也是这个 主要是太爱了,1,2019-09-05 10:46,1
@兔子爱吃饭丫,,人生苦短，自己开心就好,1,2019-09-05 14:23,1
@阿梓小鱼er,,我还是忘不了他和邱泽，我的糖糖,8,2019-09-05 11:45,1
@酸奶比不过纯净水,,这个造型也太性感了 真好看 评论配图,1,2019-09-05 10:56,1
@演技不够走心,,做最好的自己，不用去管别人,3,2019-09-05 10:40,1
@young逗几,,评论好恐怖啊 是认真的吗？,4,2019-09-05 13:30,1
@心苛宝贝,,歌真的是太好听了， 李毓芬自己填写的歌词,2,2019-09-05 10:47,1
@农夫很容易,,对呀，我觉得这一首歌确实挺不错的，听的出来很用心,3,2019-09-05 10:37,1
@-愿长情陪伴-,,我们一直都相信你是最棒的自己，李毓芬加油,2,2019-09-05 10:50,1
@cissy_PortraitSong,,这尼玛跳舞没力度歌词狗屁不通花多少钱买热搜我们都不买账好吗,1,2019-09-06 09:09,1
@小小徐泡泡,,能做自己真好，不要在意别人的眼光,1,2019-09-05 14:27,1
@我要贝贝加,,认真做自己就好,1,2019-09-05 14:18,1
@就是你moraynia,,她怎么那么像那个主持人。。。,3,2019-09-05 11:43,1
@南来北往不失方向,,不忘初心，放的始终，做自己，做最好的自己！,1,2019-09-05 10:59,1
@鸣琴煮铭,,从今天我要重新对李毓芬这三个字，做一下定义了,1,2019-09-05 10:54,1
@情深深天蒙蒙,,支持一下李毓芬的新歌，真的很棒,1,2019-09-05 10:49,1
@爷不高兴了爷有小情绪了啊啊啊,,我觉得李毓芬还是挺有才华的，支持一下,1,2019-09-05 10:45,1
@站在风口的佩琪,,芒果爸爸，她是谁？长得有点像和怪物在海洋里亲嘴掉了红皮鞋的那个不会说话的阿姨。。。,1,2019-09-05 19:10,1
@遥遥令,,还以为是朱迅，太像了吧,2,2019-09-05 11:26,1
@芒果味的冰淇淋呀,,相信成为更好的自己，那些声音你都不要去理会他,0,2019-09-06 21:40,4
@拉拉蕾丶,,夸的为啥都是铁粉,0,2019-09-06 09:18,1
@Alice是许墨夫人,,之前邱泽和唐嫣谈恋爱的时候，她当小三,0,2019-09-06 08:57,1
@体贴的兔子大军,,我怎么看成了性冷淡。,1,2019-09-05 18:35,1
@XXXu_CC,,转发微博,0,2019-09-05 14:50,2
@胖子味的瘦子,,人总要经过各种坎坷，一定可以成功度过,1,2019-09-05 10:56,1
@灵气十足的象可爱,,生活是自己的，不要在意别人的看法，你可以活出自己的精彩人生,0,2019-09-05 10:44,1
@南城花已开hhh,,跳起舞来的你真的是超有魅力，爱你哦,0,2019-09-05 10:43,1
@一直努力变成自己喜欢的样子,,喜欢你对生活的态度做好自己就好 评论配图,0,2019-09-05 10:43,1
@柠檬奶茶有点甜,,支持姐姐，新歌《相信你》我很喜欢 评论配图,0,2019-09-05 10:42,1
@难醒,,明明就是小三啊  怎么洗白了  不就是跟邱泽搞在一起的那个女的吗？,2,2019-09-06 00:37,1
@二次元蒙小宝2006,,难听死了，只听到电音没有听到人唱歌的声音,3,2019-09-05 12:47,1
@一羽归尘,,怎怎么感觉和以前长得不一样了,3,2019-09-05 11:31,1
@卟啉卟啉木鱼姬,,这里的评论是认真的吗,4,2019-09-05 11:29,1
@倾城有风来,,这首歌真的非常好听，大家一定要去听听,1,2019-09-05 10:43,1
@咩咩本质真香怪,,只是觉得动图里的舞蹈动作太眼熟,2,2019-09-05 10:41,1
@Xiu咕噜噜99,,老老实实的当个模特不好吗？,1,2019-09-06 07:14,1
@因为体重飞不上天的肥鹤儿,,她是谁啊 是谁的小三是不是啊,0,2019-09-05 23:58,1
@花儿要茁壮生长,,怎么长得像艾怡良了。,1,2019-09-05 23:41,1
@迷你阿发,,点进来之前我还以为是艳芬的妹妹,1,2019-09-05 21:57,1
@幻想_派,,评论好可怕,0,2019-09-05 21:26,1
@吉娘娘Giselle,,不认识，不好听，舞蹈也一般！,1,2019-09-05 21:20,1
@赵小渔,,小三确实性感,2,2019-09-05 16:38,1
@小圆子0620,,emmm......欺负大家睡午觉没起来哦,1,2019-09-05 13:49,1
@UKey要走遍整张世界地图,,越来越像朱迅,3,2019-09-05 12:57,1
@冷静冷静冷静冷冷静不起来,,怎么感觉长得不太一样了？,2,2019-09-05 11:23,1
@_Mign0n,,评论是认真的？？,5,2019-09-05 10:55,1
@哆啦A梦的小疯子,,这种性感美还是非常大气的，一直觉得她有自己独特的风格,0,2019-09-06 21:43,3
@柠檬糖心呀,,生活或者感情中有很多不好的声音，但是自己可以加油克服,0,2019-09-06 21:41,4
@芒果妹妹啦,,以前觉得这个女孩好漂亮 现在怎么变这样了,0,2019-09-06 09:09,1
@爱上秋刀鱼的猫-o,,好像董卿哦,0,2019-09-06 08:12,1
@抽烟真爽,,图四动作咋看着那么眼熟,0,2019-09-06 05:51,1
@木鱼脑壳想不出情话给fb,,和那个时候看旋风管家的时候长得不太像了,0,2019-09-06 01:51,1
@HO美丽,,一个台湾人管我们什么事,0,2019-09-05 23:58,1
@神奇宝贝橘小龙,,最近湾湾明星狂刷存在感,0,2019-09-05 22:12,1
@小福胡同学啊,,突如其来的性感,0,2019-09-05 20:38,1
@加油站里点蜡烛,,每个人都有属于自己的未来，加油，走自己的路让别人说去吧,0,2019-09-05 19:06,1
@荔枝葡萄籽,,以前看康熙还是漂亮的，这是崩了吗,0,2019-09-05 17:21,1
@冲浪低手蛋某人,,只要我们努力，不要去听那些流言蜚语，相信自己一定可以成功。,0,2019-09-05 11:24,1
@别动我的鱼丸粗面,,听了真的是满满的感动了，感觉到了你对我们的鼓励。,0,2019-09-05 11:23,1
@暴躁易怒大师,,歌词你真的都是想要说的话 有在听,0,2019-09-05 11:22,1
@矮胖小红,,耐下性子来听听这首歌 真的有不一样的感觉,0,2019-09-05 11:21,1
@坂口李桑,,你开心就好 活的就是让自己舒服,0,2019-09-05 11:20,1
@土豆菠萝酱,,还是那句话 不要太在意别人的看法,0,2019-09-05 11:19,1
@一风之音随你,,李毓芬的创作风格还不错的啊！挺好的感觉,0,2019-09-05 11:05,1
@小仙女的守护者逆风,,单曲循环了，感觉很不错的啊！喜欢了,0,2019-09-05 11:02,1
@反义词CH,,李毓芬以前听说过，如果我没猜错的话，她已经34了吧，不过还是好漂亮啊！,0,2019-09-05 11:02,1
@四块五的他,,做最好的自己就好，看到的都是表面儿的你。,0,2019-09-05 10:58,1
@喜欢你是笑,,歌词我也喜欢 也是很不错的,0,2019-09-05 10:58,1
@唯有心静则凉,,这歌词真的唱出了人的心里，加油，做最好的自己[加油],0,2019-09-05 10:51,1
@爱_记忆定格,,很有才华的一位歌手，被你圈粉,0,2019-09-05 10:51,1
@挽留一份真情,,准备去一直单曲循环这首,0,2019-09-05 10:50,1
@猫猫的心动,,一路被黑，却越黑越勇，加油相信你成为自己最好的自己,0,2019-09-05 10:49,1
@为你撑起这边天,,不必要太过意在乎别人,0,2019-09-05 10:49,1
@阿十又八玖,,歌词真的很好颜值才华都在线 我的女神,0,2019-09-05 10:48,1
@我真的不皮好么,,很喜欢这个坚强的你，不惧困难，勇往直前,0,2019-09-05 10:48,1
@我的热爱还在,,做好自己最重要了 加油！也会更好的,0,2019-09-05 10:48,1
@百岁山威尔,,嘿嘿，我觉得这首歌真的挺感人的,1,2019-09-05 10:48,1
@陪我到西里西,,这首新歌是对自己的肯定，也回应了以往的那些质疑，继续加油。,1,2019-09-05 10:47,1
@蔡邬融,,嘿嘿，我觉得李毓芬真的很厉害,0,2019-09-05 10:47,1
@最爱喝奶盖茶,,李毓芬小姐姐的身材管理做的也太棒了吧，这次新歌mv的热舞也让人眼前一亮。歌也很好听。,0,2019-09-05 10:46,1
@百思不得show,,努力一起去成为优秀的自己,0,2019-09-05 10:46,1
@一点寒芒出现,,生活中总会遇到不好的事，不要放在心上，加油，你是最棒上，去听新歌啦,0,2019-09-05 10:45,1
@一掷千金归来息,,李毓芬自己填写的歌词，太棒了，真的很喜欢 评论配图,0,2019-09-05 10:44,1
@恰似厝ing,,好好听啊啊啊  而且歌词很有意思,0,2019-09-05 10:44,1
@我说我想吃西瓜,,好听，真的是太有魔力了一听就停不下来,0,2019-09-05 10:43,1
@橘子女孩偶,,要相信自己啊，一定可以成为最好的自己,0,2019-09-05 10:42,1
@乖巧小妹子,,好听  而且填词很有自己的想法,0,2019-09-05 10:42,1
@叶落梧桐听雨声,,mv拍的很棒，舞跳很让人惊艳,0,2019-09-05 10:42,1
@青柠味的冰可乐,,姐姐声音还是那么好听，《相信你》单曲循环了,1,2019-09-05 10:41,1
@昵称叫什么比较可爱啊,,真的是太喜欢了，李毓芬加油[加油],1,2019-09-05 10:41,1
@周枷郝,,真的特别的好听，我决定我的车载U盘里要进军这首歌曲,1,2019-09-05 10:41,1
@MiraSofia-,,我们都要相信自己可以成为更好的自己,1,2019-09-05 10:41,1
@淡淡的菲儿,,对呀，生活中肯定不是一帆风顺的，我们要加油,1,2019-09-05 10:40,1
@再下杨一勺,,啊，她还是那么好看，甜甜的长相进化成了酷酷的长相,1,2019-09-05 10:40,1
@爱猫咪快乐平安,,听了这首歌了，好听，喜欢。,1,2019-09-05 10:40,1
@五味思者,,喜欢你在舞台上的表现，很性感,0,2019-09-05 10:39,1
@我究竟有多爱你呢,,冷性格style，真的是太好听了,0,2019-09-05 10:39,1
@飞飞拳,,我们都在努力成为那个最优秀的自己 评论配图,1,2019-09-05 10:37,1
@熙罗罗,,热搜从昨天到现在认真的吗,0,2019-09-06 09:50,1
@你的名字有我中二吗,,这个女的很老了啊，还走这种路线，00后都出来了啊，,0,2019-09-06 09:49,1
@俺不立无爆,,看成李毓芬式性冷淡的有没有,0,2019-09-06 09:40,1
@爱自己的白,,朱迅？！,0,2019-09-06 09:24,1
@juice_liyii,,她长得好像中央电视台有个女主持人…忘记叫啥了,0,2019-09-06 08:44,1
@樱桃一米芒,,get不到她的美,0,2019-09-06 08:40,1
@就撒撒野^不折腰,,一张脸看出多个明星的影子，底下的评论大清早当笑话看了,0,2019-09-06 08:19,1
@鬲布哒,,这舞蹈和这歌一点都不搭啊，这到底宣传歌还是宣传身材,0,2019-09-06 06:21,1
@非Charmaine不可,,她是谁？,0,2019-09-06 03:10,1
@心疆奇产,,美,0,2019-09-06 02:23,15
@今天路知知回复我了吗,,你们到底去哪里赚钱的,0,2019-09-06 00:32,1
@熊猫妹屠鸭号,,看得我尴尬,0,2019-09-06 00:03,1
@-头发富人周市民,,李毓芬？？好熟悉的名字。。柯震东那个？？,0,2019-09-05 23:51,1
@喵喵银饭团,,湾湾是没人了吗？,0,2019-09-05 23:26,1
@这是哪个小可爱,,为啥小图像by2？？？,0,2019-09-05 23:23,1
@CccckKL,,她不是小3吗,0,2019-09-05 22:58,1
@Shanism-Any,,十八线跑来买热搜真是不要脸，忘记自己以前干的事了？,1,2019-09-05 22:21,1
@哈特嘟嘟,,评论里各位可以拉我进群吗？有钱一起赚啊,0,2019-09-05 22:20,1
@谨芍司,,看差了，以为是李毓芬是性冷淡。。。,0,2019-09-05 21:53,1
@知世甜茶,,(无恶意)谁是李毓芬呀……,0,2019-09-05 21:51,1
@iwatingfordeath,,她是不是还当过三？好像记得台媒说过,0,2019-09-05 21:44,1
@汴喜胖秋,,这是谁？,0,2019-09-05 21:37,1
@冒泡的小梨涡,,去看了，真的一般，别喷我。,0,2019-09-05 21:33,1
@亲爱的摘星诗人,,努古赛哟,0,2019-09-05 21:29,2
@WuLi心爱的美人,,我看成了李毓芬式性冷淡,0,2019-09-05 21:07,1
@我在六里桥卖切糕,,以前觉得她好漂亮，一丢丢徐若u的感觉，但是感觉更美艳一些，现在看为何蜜汁黄雅莉,0,2019-09-05 20:52,1
@_拉提子柚子西瓜的拖拉机,,我也想被雇控评,0,2019-09-05 20:47,1
@了个,,当年是不是邱泽劈腿和她在一起？,0,2019-09-05 20:37,1
@-Duying-,,,0,2019-09-05 19:56,1
@]],,？他咋长成这样了,0,2019-09-05 19:38,1
@余下之年,,怎么上的热搜,0,2019-09-05 19:23,1
@叶子柒,,都只提ty的事…不知道小S老公也拍到过吗…,0,2019-09-05 19:12,1
@WengWnn,,她不是插足唐嫣邱泽的那个女的吗。。（小声bb,0,2019-09-05 19:11,1
@・TonyStark・,,我记得她以前，好像不是长这样的。。,0,2019-09-05 19:10,1
@小女子不才3748521,,这个女人不是做过小三吗？还是让唐嫣伤心流泪的那个第三者！被拍到了还不承认！,1,2019-09-05 18:51,1
@你爱吃的小熊软糖,,绿茶脸男人喜欢 女人翻白眼的那种长相 真的 男人太喜欢这种了,0,2019-09-05 18:41,2
@卷卷是最好的卷卷,,她是谁的小三来着...,0,2019-09-05 18:06,1
@婧婧婧王殿下,,好尴尬，我把冷性感三个字看错了……,0,2019-09-05 18:04,1
@荼苜,,？？？哪里可以赚钱，带上我行不行,0,2019-09-05 17:55,1
@---杨正翎,,哈哈哈哈哈，真的觉得好听嘛？？？,0,2019-09-05 17:52,1
@LeeAreumBLUE,,很喜欢她的歌,0,2019-09-05 17:46,1
@J是JAY的J,,以前看我型我秀觉得她可好看了，现在咋这样了,0,2019-09-05 17:23,1
@在蹦是我的哈哈哈,,这个热搜尬的一批,0,2019-09-05 17:23,1
@天D伍,,yu芬 还是shu芬,0,2019-09-05 17:21,1
@梦醒处泪落颊,,好美呀，美丽大方，单纯善良的姐姐，我们爱你（五元一条）,0,2019-09-05 17:17,1
@甜的丸子,,她是老了吗。。整个脸垮下来,0,2019-09-05 16:58,1
@吃水果的金主baba,,,0,2019-09-05 16:53,1
@陆存存小仙女丶再烦我就捏死你,,3突然买热搜？,0,2019-09-05 16:44,1
@Jacky女孩宇宙最美_,,她好像朱迅啊！,0,2019-09-05 15:58,1
@是皮卡丘乒乓兵,,谁？,0,2019-09-05 15:29,1
@我叫笨笨大灰狼,,这种队形让我想起了一个叫做王龙华的演重耳传奇的男人，你们去他评论里看看，我也很着急，这种挣钱活不找我,0,2019-09-05 15:18,1
@QueenWong_Julia,,@B_B 我怎么记得以前这个和雪芙什么的还有团体,0,2019-09-05 14:39,1
@倔强排骨,,@LowKey洛基 好爱这个发型,0,2019-09-05 14:27,1
@不食大蒜君,,湾湾真的有很多女艺人都长这种类型啊……这是为啥啊,0,2019-09-05 14:26,1
@不精致的强迫症,,@酸奶oh,0,2019-09-05 14:16,1
@jessie89_,,热搜都买了 是不是签了内地公司,0,2019-09-05 13:30,6
@茶煮串串,,,0,2019-09-05 13:25,1
@NiuLul,,小三,0,2019-09-05 13:03,1
@软妹酱_,,看到这清一色夸她的评论 我忍不住吐了,0,2019-09-05 13:02,1
@伊莎贝拉11,,脸崩了,0,2019-09-05 12:56,1
@水冰月和小小兔,,刘涛，李毓芬，傻傻分不清楚,0,2019-09-05 10:59,1
@小小莹子love,,不仅人美歌还唱的那么好，最重要的是跳舞跳的好妖娆，太美了 评论配图,0,2019-09-05 10:50,1
@幸福316_12357,,我晕，我看错了,0,2019-09-05 10:46,1
@午高,,相信自己，成为心目中的自己,0,2019-09-05 10:37,1
@一位不愿意透露姓名的冲浪网友,,长得像by2,1,2019-09-06 10:01,3
@Heroaxxx,,,1,2019-09-06 09:23,3
@蕾小雅oO小雅蕾,,长得也不好看啊，呃，好吧我没有欣赏能力,1,2019-09-06 09:06,1
@呱呱很可爱哦,,我要反思反思，这么挣钱的机会为啥不找我,1,2019-09-06 09:04,1
@_Lyrain,,果然自己写的词 怪不得这么尬 她估计自己都不知道自己在唱啥跳啥 真的好尴尬啊,1,2019-09-06 08:30,1
@林溪-Liu,,长得好像央视主持人朱迅,1,2019-09-06 08:05,1
@本命貂蝉小姐姐,,我觉得郭雪芙比她好看。。。,1,2019-09-06 00:36,1
@自己的小小天地不需要别人打扰,,长得有点像中央电视台主持人朱迅,1,2019-09-05 22:13,1
@熊呀么呀么呀么,,好像朱迅啊,1,2019-09-05 21:38,1
@Adam范的丞星,,哇噻，我以为就演戏好而已，没想到唱歌也这么好听诶！,1,2019-09-05 21:22,1
@五毒大萝卜,,我要是没记错的话，有个主持人叫朱迅的和她也太像了吧,1,2019-09-05 21:18,1
@SO-熙-LO,,09年的时候参加过内地的选秀 …,1,2019-09-05 20:37,1
@一只可爱的机器人,,朱迅老师 是你吗？,1,2019-09-05 20:29,1
@-梦游书,,我觉得是不是 有点像朱迅？,1,2019-09-05 20:20,1
@黄景瑜的Lucida,,以前像徐若u现在越来越像朱迅,1,2019-09-05 20:20,1
@蜜柚酥sukey,,绿了糖糖那个？,1,2019-09-05 20:09,1
@・Mmm・,,买热sou？！,0,2019-09-05 19:06,1
@垂杨低映木兰舟,,互联网是拥有记忆的,1,2019-09-05 18:22,1
@阿肥阿肥脚蹬三轮,,这热搜买的太尴尬了吧 谁啊,1,2019-09-05 17:17,1
@twice1235,,小三,1,2019-09-05 17:17,1
@楠慕小湮,,这姐姐怎么跟之前康熙来了中的长相不大一样了…是保质期到了嘛,1,2019-09-05 17:17,1
@Sam-mi,,难道不像郭敬明？,1,2019-09-05 16:37,1
@狐狸和喵咪子,,哈哈，难道只有我一个人看成“李毓芬式性冷淡”么,1,2019-09-05 16:24,1
@二小梁,,这个热搜是买的吗,1,2019-09-05 16:03,1
@Miss_Chen2012,,她不是已经凉凉了吗？,1,2019-09-05 16:00,1
@Mary-sen,,还是忘不了她当邱泽小三那段...,1,2019-09-05 15:43,1
@miss开慧,,我不知道有没有记错，这女的拆散过台湾好几对情侣吧，是惯三,1,2019-09-05 15:21,1
@杜不若西施,,夸她的都关注了王皓轩超话,1,2019-09-05 14:23,1
@Jane_啦啦啦啦,,长得好像朱迅啊,1,2019-09-05 13:26,1
@大嘴静静,,好像当时和罗志祥有绯闻,1,2019-09-05 12:51,1
@夏晓秋-,,看了看热评和我想得不太一样哦，,1,2019-09-05 12:34,1
@oneVhml_,,她要在内地发展吗，突然买热搜？这位是唐嫣邱泽的小三啊,1,2019-09-05 12:22,1
@Yuriyn,,她怎么越长越像朱迅了,1,2019-09-05 11:46,1
@鹿柒弋,,没记错的话不是小三吗…,2,2019-09-05 11:42,1
@roke4,,乍一看热搜以为是秃子媳妇了，后来发现他媳妇叫李佳芬,1,2019-09-05 10:43,1
@Capitano10,,以前还蛮好看的 现在感觉变了,0,2019-09-06 10:12,3
@罗猫腻,,说实话  真没旁边伴舞姐姐跳的好,0,2019-09-06 09:53,2
@无敌xiao潘潘,,买评论了吗,0,2019-09-06 09:50,1
@自成一派shushu,,长得有点像钟楚红啊,0,2019-09-06 09:49,1
@庄殷雅,,说真的，李毓芬长的像朱迅,0,2019-09-06 09:41,1
@是kiwi10-s,,不想看她，滚出，我要是有钱我就给她降热搜,0,2019-09-06 09:36,1
@大月呀呀呀呀,,买的热搜？,0,2019-09-06 09:30,1
@Unna_aa,,这是谁,0,2019-09-06 09:28,1
@Heroaxxx,,,0,2019-09-06 09:22,3
@我是你的温柔本身,,这好听吗 ,0,2019-09-06 09:16,1
@YTTLuvu,,有点像朱迅？,0,2019-09-06 09:15,1
@s沐町,,,0,2019-09-06 09:12,1
@晓宇的猪,,这个热搜我看成了李毓婷性冷淡,0,2019-09-06 09:08,1
@牵着乌龟去散步喽,,有钱一起赚,0,2019-09-06 09:07,1
@草莓馥芮白milchtee,,哇 小三上热搜了 我也想赚零花钱诶 多少钱一条@小羽毛_冰羽爱睡觉,0,2019-09-06 09:05,1
@Cinderellakwon,,多少钱一条？拉我进群,0,2019-09-06 09:03,1
@可乐还是个baby,,这张脸越来越不好看了,0,2019-09-06 09:01,1
@purelandLD,,这人谁啊，湾湾也开始买热搜了？,0,2019-09-06 09:01,1
@Daimying,,咋觉得她长变了,0,2019-09-06 09:00,1
@爱吃薯条的兔纸,,这个发型真的不适合她,0,2019-09-06 08:55,1
@DO如意糕,,额,0,2019-09-06 08:51,1
@东塘主,,这真的不是萧敬腾吗？,0,2019-09-06 08:47,1
@Rabbit菟小爷,,朱迅,0,2019-09-06 08:45,1
@Def-Uni,,控评了吗 没看出什么冷性感 就是搔首弄姿啊,0,2019-09-06 08:44,1
@喵小奇zz,,无好感，十八线突然上热搜也是呵呵了,0,2019-09-06 08:39,1
@Rebecca_芯,,怎么整的跟周迅一样,0,2019-09-06 08:37,1
@YOONA_安小木,,三到四次的上热搜，不要买了好么,0,2019-09-06 08:35,1
@唉嘛是白坑坑啊,,这个rs读了半天都没念顺，以前看康熙的时候还挺哈这个小姐姐的颜，记得没错的话应该是个模特吧,0,2019-09-06 08:29,1
@MikyF_999,,糊咖,0,2019-09-06 08:25,1
@请我潇⑿〗,,原来觉得她往徐若u整得 怎么现在看起来又这么蔡依林？,0,2019-09-06 08:16,1
@断舍黎,,那个。。图七蛮像萧敬腾？,0,2019-09-06 08:09,1
@方果果爱吃果果,,不是 刚开始mv跟snsd catch me if u can 太像了叭！ 湾湾也愿意扒mv噢,0,2019-09-06 08:09,1
@今天伦伦有来娶我么,,这下面的评论真的都是认真的么？？满满的控评痕迹,0,2019-09-06 08:08,1
@h_h_阿哩哩,,舞蹈有点眼熟,0,2019-09-06 07:56,1
@林奈x,,要回炉重造了呀,0,2019-09-06 07:47,1
@三六桥,,我的了大爷，虽然不认识这个人是谁，但把文字看成了“李毓芬式性冷淡”，还纳闷了一下，这也能上热搜,0,2019-09-06 07:30,1
@胡感感,,十八线艺人血本热搜？,0,2019-09-06 07:03,1
@陈家lovely佳33,,图一很像阚清子。不要骂我,0,2019-09-06 06:51,1
@半小尺,,她的发际线感觉好奇怪 不像是天生的,0,2019-09-06 06:48,1
@快乐乐嘟嘟呵呵,,@芒果娱乐 能不能有点专业的样子，就这个还评控?,0,2019-09-06 06:48,1
@恒温BeasTie丶,,,0,2019-09-06 06:41,1
@silver_Nebula,,一般吧……,0,2019-09-06 05:37,1
@一个善变的月亮,,玉芬儿,0,2019-09-06 05:25,1
@喾骰81050,,脸怪怪的，和年轻的时候不一样了，是整的后遗症出来了么？,0,2019-09-06 04:56,1
@llour,,我认不出她了。。。。,0,2019-09-06 03:41,1
@今天小颖瘦了吗,,这是绿了唐嫣的那个？？？,0,2019-09-06 03:39,1
@h是命啊,,只有我一个人看成了性冷淡吗,0,2019-09-06 03:19,1
@辣糖0814,,看成性冷淡,0,2019-09-06 00:40,1
@哆啦A梦的小疯子,,这种性感美还是非常大气的，一直觉得她有自己独特的风格,0,2019-09-06 21:43,3
@柠檬糖心呀,,生活或者感情中有很多不好的声音，但是自己可以加油克服,0,2019-09-06 21:41,4
@芒果味的冰淇淋呀,,相信成为更好的自己，那些声音你都不要去理会他,0,2019-09-06 21:40,4
@Ivy超级喜欢吃火锅,,这几下划拉的 后面伴舞甩她十八条街,0,2019-09-06 13:59,2
@真的好没道理啊,,哪里好看,1,2019-09-06 11:12,2
@Capitano10,,以前还蛮好看的 现在感觉变了,0,2019-09-06 10:12,3
@一位不愿意透露姓名的冲浪网友,,长得像by2,1,2019-09-06 10:01,3
@哆啦A梦的小疯子,,这种性感美还是非常大气的，一直觉得她有自己独特的风格,0,2019-09-06 21:43,3
@柠檬糖心呀,,生活或者感情中有很多不好的声音，但是自己可以加油克服,0,2019-09-06 21:41,4
@芒果味的冰淇淋呀,,相信成为更好的自己，那些声音你都不要去理会他,0,2019-09-06 21:40,4
@Ivy超级喜欢吃火锅,,这几下划拉的 后面伴舞甩她十八条街,0,2019-09-06 13:59,2
@真的好没道理啊,,哪里好看,1,2019-09-06 11:12,2
@Capitano10,,以前还蛮好看的 现在感觉变了,0,2019-09-06 10:12,3
@一位不愿意透露姓名的冲浪网友,,长得像by2,1,2019-09-06 10:01,3
@罗猫腻,,说实话  真没旁边伴舞姐姐跳的好,0,2019-09-06 09:53,2