User,Reter,Comment,Votes,Time
@D傅九云的笛子C,,他在努力，我们也能够看到他的进步，未来可期,9168,2019-09-14 12:16
@北吖北鸦,,天，终于有人帮他说话了吗,8237,2019-09-14 12:17
@星星好看嘛_,,演员肖战越来越好,7151,2019-09-14 12:16
@only三明治,,他在努力磨练演技，我们接受不同的声音，演员都是一步步成长的，给他一些时间，希望他会越来越好,6523,2019-09-14 12:17
@M顺心意M,,是的！肖战接这部戏不过是个小透明啊，做到这样真的很不错了，他会更好的,5794,2019-09-14 12:16
@可dd-,,你好好发光我好好努力，你万丈光芒我努力跟上,3917,2019-09-14 12:16
@肖兔子的胡萝卜yy,,未来可期@X玖少年团肖战DAYTOY ,2590,2019-09-14 12:16
@大橙今天吃饱了嘛L,,肖战真的很棒！！！ 评论配图,2019,2019-09-14 12:15
@JJ960320JJ,,演员肖战，未来可期！会越来越好的@X玖少年团肖战DAYTOY,1751,2019-09-14 12:16
@梦梦今天见到肖兔兔了吗,,谦虚善良，温和有礼貌，知道自己要什麽、什麽是对的，哪有什麽一步登天，一切都是厚积薄发，努力充实自己，不管是歌手或演员，他都热爱并且用心做到最好，三年前的肖战说过：&quot;既然已经来了，那就努力的把它做好。&quot;作为他的粉丝，我骄傲！,1641,2019-09-14 12:18
@梦梦今天见到肖兔兔了吗,,演员肖战，未来可期！,1373,2019-09-14 12:17
@海盐味赞比,,被更多人喜欢 关注是好事，接受它，去成为更好的自己，演员肖战冲鸭,1276,2019-09-14 12:17
@only三明治,,保持清醒，脚踏实地，演员肖战需要时间成长，期待他用更多的作品证明自己,1253,2019-09-14 12:19
@就爱吃兔兔啊,,在有些人眼里怎么样都是肖战的错，扑了就是肖战虚红扛不起票房营销咖，破亿就是粉丝电影三国太子,1071,2019-09-14 12:25
@小兔萝萝o,,肖战未来可期,848,2019-09-14 12:17
@战肖为名,,承认新人有演技是很难的事情吗 肖战在接这部剧时还是十八线 有戏拍就不错了 算不上流量 而且张小凡他确实演到位了 剧情不好不是大部分国产剧的通病吗 豆瓣没看过的都可以评分哪里来的专业度,774,2019-09-14 12:32
@小嗲精i,,提到流量就想骂人，每次都是流量否认所有，无语，真心无语,751,2019-09-14 12:18
@9・万事可乐,,肖战诛仙超棒,649,2019-09-14 12:16
@记得那时初见,,哥，加油！！！@X玖少年团肖战DAYTOY,413,2019-09-14 13:12
@喵口ss,,期待演员肖战更多好的作品,579,2019-09-14 12:16
@L亭swag,,拍诛仙的时候他还没有火，的确不是因为流量才找的他,556,2019-09-14 12:25
@有钱有戏,,小透明时接下这部电影被群嘲，现在票房不错又嘲是流量，双标真的不太好哦。作为演员他有自己的目标并努力着，我们接受一切客观评价，相信他会越来越好的,482,2019-09-14 12:35
@樱辞野_,,小赞哥哥很用心很努力，来日方长，未来可期！,380,2019-09-14 12:17
@理鸽鸽,,以前不知道什么叫流量电影，现在自己成了粉丝，更加不清楚什么叫流量电影了。战未来可期，用好作品证明自己就好了，何必管别人给自己徒增烦恼呢。娱乐圈最需要时间来证明一切了r（s＿t）q,393,2019-09-14 12:33
@LAY_朝哥家小朋友_祢羡honey,,摘下眼镜，正常看待流量,489,2019-09-14 12:18
@DAYTOY敏,,粉丝多也是肖战实打实的优秀啊，哪个明星没有粉丝,350,2019-09-14 12:35
@肖战DAYTOY肖章,,肖战未来可期，努力的人永远不会被辜负 评论配图,308,2019-09-14 12:21
@Y-y宇,,说的对    他接这部戏的时候还是个小透明    凭什么要赖在他身上    换句话说    要不是有肖战   这个电影都未必有现在的热度     怎么反过来电影不好却赖他了？,285,2019-09-14 12:35
@Clover010698,,肖战,130,2019-09-14 13:49
@雨佐杉,,我们支持你，演员肖战！,223,2019-09-14 12:20
@是我爱的肖战呀,,你说得对，我不懂为什么每次电影不好都要甩锅给主演的流量，我寻思着肖战也才一千八百万的粉丝，流量很大吗？,139,2019-09-14 12:32
@蒙奇奇是个小公举,,小赞哥哥未来可期,151,2019-09-14 12:21
@战虾锁死,,我们是怎么定义流量小生的？一般都是年少成名 男团出身 先于影视作品之前 已有各类代言推广在身 对粉丝有一呼百应的能力.但严格意义上来说 xz走的并不是流量的路 毕竟他的男团不火 出道后接剧资源不好 代言推广时尚资源 陈情令之前几乎是没有的 xz 是在这样的情况下演了诛仙I.,123,2019-09-14 12:41
@静静静静静静静安静的静,,谦虚善良，温和有礼貌，知道自己要什麽、什麽是对的，哪有什麽一步登天，一切都是厚积薄发，努力充实自己，不管是歌手或演员，他都热爱并且用心做到最好，三年前的肖战说过：&quot;既然已经来了，那就努力的把它做好。&quot;作为他的粉丝，我骄傲！,99,2019-09-14 12:42
@嘉平月三啾,,张口闭口就是流量毁剧毁票房，没有流量我就问你们这些人会看吗？装的比谁都高尚其实自己腐烂到骨子里。一竿子打死所有人，流量不应该成为贬义词，别说什么都是那些演员惹的祸，谁惹的祸你找谁去，流量这个词本就无罪。他背上了你们流量的骂名却从来没有享受过流量的待遇，你们这些人说话真的没有心。,163,2019-09-14 12:34
@1514c,,他在努力，也会更好,72,2019-09-14 12:37
@Smile洋芋,,#肖战# 外面的声音很多，我们所能做的就是接纳理智的声音，而不是和带着偏见与傲慢的人争辩。我们无法平息别人的愤怒和嫉妒之心。小飞侠们，我们所能做的就是接纳不足的同时继续相信肖战。未来他会用他的实力交上一份满意的答卷。未来路还很长，这只是开始。,78,2019-09-14 12:38
@家稼,,以前不知道什么叫流量电影，现在自己成了粉丝，更加不清楚什么叫流量电影了。战未来可期，用好作品证明自己就好了，何必管别人给自己徒增烦恼呢。娱乐圈最需要时间来证明一切了r（s＿t）q,43,2019-09-14 12:41
@子衿木子李,,承认新人有演技是很难的事情吗 肖战在接这部剧时还是十八线 有戏拍就不错了 算不上流量 而且张小凡他确实演到位了 剧情不好不是大部分国产剧的通病吗 豆瓣没看过的都可以评分哪里来的专业度,40,2019-09-14 12:48
@无花不渡,,说实在的 身边看了电影的朋友大部分也只在说剧情问题 他们没觉得肖战演技有问题,40,2019-09-14 12:39
@DAYTOY-芯,,支持肖战，他的进步大家有目共睹,31,2019-09-14 12:40
@肖战的坚果辣,,保护肖战,32,2019-09-14 12:29
@X玖少年团肖战DAYTOY大老婆,,他是因为演技圈粉的啊，粉丝多了就被划分到了流量明星？？,51,2019-09-14 12:23
@喂喂_ming,,努力就好！大家有目共睹,31,2019-09-14 12:33
@一战到底R向披靡,,本来就是，那会儿肖战十八线，难道导演和制片能预测未来 评论配图,48,2019-09-14 12:18
@星羽千泷,,我的天没享受流量的命，倒是接受流量费嘲讽了，实惨,38,2019-09-14 12:41
@家稼,,演员肖战未来可期,26,2019-09-14 12:35
@一个嗲精DayToy,,我且不说流量和演技本身就不冲突，那会真的不认识他！是多大流量我个天天泡在微博的人都不认识呀！,29,2019-09-14 12:33
@肖战家的1025号肥虾,,新人演员，还在努力进步中，请多指教!,23,2019-09-14 12:38
@慕璃儿DAYTOY,,小透明时接下这部电影被群嘲，现在票房不错又嘲是流量，双标真的不太好哦。作为演员他有自己的目标并努力着，我们接受一切客观评价，相信他会越来越好的,24,2019-09-14 12:54
@冒芽小豆子,,nsdd 有些人总拿流量否决别人,22,2019-09-14 12:19
@比虚幻更美好的真实-,,分享看到的一段话，肖战最不幸的地方就在于，莫名其妙的就跟流量挂上了勾，流量的福利还没享受到，大众的偏见倒已经接踵而至”,25,2019-09-14 12:55
@可颂Dt,,肖战在努力，他可以更好,14,2019-09-14 12:46
@肖战专属小飞侠1005,,流量不是原罪，这部电影每一位主演都付出了努力，或许哥哥还存在不足，但我相信未来他会更好，期待未来光芒万丈更加优秀的他,18,2019-09-14 12:41
@迷路的猫猫2019,,说的一点都没错，别拿这事说事！演员的付出大家心里都清楚！,20,2019-09-14 12:34
@一只7鹿呀,,因为流量而否定所有我觉得不行 刚接这部电影的时候他还没有很火他的努力不应该因为现在的流量而被全盘否定 只能说他真的很努力他的努力得到了回报 肖战值得 未来可期,14,2019-09-14 12:51
@心之R向心之R往,,真正认识肖战超过三个月的都没多少啊，拍诛仙时候还是小透明呢,22,2019-09-14 12:22
@披萨甜酱,,不是他们三个的粉也不是书粉，昨天和家人一起去的感觉还不错啊合家欢型挺欢快搞笑的，家里人都觉得还不错 没有那么差啊，肖战加油,24,2019-09-14 12:41
@过好自己的生活先,,接这剧还是个18线  电影一出就给贴上个流量明星电影的的标签,18,2019-09-14 12:41
@来一杯零度热苏打,,肖战！未来可期,16,2019-09-14 12:16
@顾魏你啥时候来,,,8,2019-09-14 12:41
@苡女开,,他在努力磨练演技，我们接受不同的声音，演员都是一步步成长的，给他一些时间，希望他会越来越好,9,2019-09-14 12:48
@吴海洋洋洋_,,赞赞赞赞赞赞赞赞赞赞赞,8,2019-09-14 12:16
@TO-me似水流年,,他是演员身份出现在我面前的，不是流量！也从未享受过流量的待遇！不过最近收到的关注比较大而已,7,2019-09-14 13:24
@洁巴子加油向前冲,,是的，一直在努力，一直在进步，永无止境！加油！！！而且如果真的中肯就不是现在这种黑，演技，颜值，大家都还是不错，而且流量明星怎么了吗？也是不乏演技在线的呀！中肯影评不要针对演员,9,2019-09-14 12:43
@掌心的小羽毛,,肖战演技其实已经没得挑了，所以开始在流量字眼上做文章了。一部电影最终评分是否是一个演员所能决定？肖战还在努力，成绩也不错，这就够了。希望大家心中多一点点阳光，不要总是活在阴暗里。,10,2019-09-14 12:46
@嘿兔兔兔,,人生清醒！！！,6,2019-09-14 12:47
@小辛辛哇,,我一直都相信他，没有人可以打击到我。只要他一直在一直努力，我就一直支持他。对我来说，他是不是流量无所谓，我是不是流量粉也无所谓。他能走到现在，有这样的成绩，能够一直保持初心，磨炼演技，能够虚心接受客观评论。我想没有人有资格，来否定他的一切。就一句话，只要他在，我就不丧,10,2019-09-14 12:46
@迷路咪06706,,加油加油加油，新人演员肖战@X玖少年团肖战DAYTOY,5,2019-09-14 12:52
@满满星河_,,新人演员肖战会继续踏实演戏努力提高自己，来日方长敬请期待@X玖少年团肖战DAYTOY,6,2019-09-14 12:45
@kobiey2,,网友写的，公道自在人心 评论配图,6,2019-09-14 16:28
@Summerforsean,,他在不断地进步，在认真努力地琢磨演技，用心对待每个自己演绎的角色，我们接受不同的声音，希望大家也可以给肖战多一点时间，期待肖战成为越来越好的演员。,4,2019-09-14 13:55
@菲菲很怕热,,他的演技一直有在提高，努力的人会越来越成功，我会一直支持你，守护你,7,2019-09-14 12:50
@从不改名Uv,,那大家还是多看看买了票的观众的评价吧哈,5,2019-09-14 12:39
@0824smile,,搞不懂没看过的为什么有资格评分，这些评分软件一点信服力都没有，一群跟风黑的，真是对电影的侮辱,8,2019-09-14 12:23
@肖老师的小尾巴,,我对他的期待，永远都是下一部作品，演员就是要拿作品说话,8,2019-09-14 12:22
@疯子的二货生活,,流量不是原罪，偏见才是毒药。,3,2019-09-14 16:28
@顾容衍,,清清醒醒肖 活得明白  战,3,2019-09-15 19:55
@郑哈哈sara,,流量怎么了，关注的人多怎么了，他的流量是天上掉下来的吗？还不是因为作品才吸引了那么多流量，那些一天到晚拿流量说事的人就是吃不到葡萄说葡萄酸，有本事自己去搏一身流量啊,3,2019-09-14 14:54
@一碗大肥鸭,,他在谦虚又真诚的前行，也请摘下有色眼镜。,4,2019-09-14 12:53
@迷路咪06706,,张小凡@X玖少年团肖战DAYTOY ，你很好 评论配图,7,2019-09-14 12:52
@小阿深cry,,演员肖战，未来可期！会越来越好的@X玖少年团肖战DAYTOY,5,2019-09-14 12:46
@九妖二喵,,演员肖战，未来可期@X玖少年团肖战DAYTOY,5,2019-09-14 12:43
@苏栀很nice,,演员真的很努力了 拍的时候还真没有几个人知道肖战 现在被贴上“只有流量”的标签怕不是太过分了？谁当时拍的时候会想到用流量圈粉这种事????,7,2019-09-14 12:53
@哗啦啦ed雨吖,,努力不负,4,2019-09-14 12:42
@X七月七号是小暑Z,,别人努力上进得到的成绩，不是你张嘴一句流量就能否定的，有流量，说明哥哥红，有商业价值，数据耐艹，并且流量≠没实力,2,2019-09-15 13:20
@肖战的小宝贝陌离,,肖战一直在努力，，一直在磨炼，他说过他不想是昙花一现，所以要更加倍努力，不要一句话就抹掉了他的所有好吗？？接诛仙的时候还没有火，还是小透明，以前黑子不承认他是流量，现在又以流量来压他，话都让你们说了，戏精学院毕业的吗？,3,2019-09-14 13:33
@陈筱亦123,,他是演戏大家才熟知的他啊！诛仙拍摄的时候还没火就是一个新人，为什么要把他称为流量？诛仙还没上映的时候其他家粉丝都觉得他不是流量有很多嘲他的，现在诛仙有成绩了就把它归功于流量电影,6,2019-09-14 12:58
@茉墨栗子,,肖战在努力，在进步，现在的这些是他用努力换来的，而且他在接拍电影时还未大火，哪来的流量之称，他用努力换来的成果并不能用流量一次来否定,3,2019-09-14 12:56
@盏月月,,他一直不曾停歇的再努力往前一步步的走 眼下的路也才刚起头 恳请路人老爷网络友人多些理解 先请不要就给他强下定义拷枷锁。,3,2019-09-14 12:56
@杨羊DAYTOY,,流量不是原罪,5,2019-09-14 12:55
@容小和yao,,流量不敢当，善意批评接受，小赞会努力，用作品说话！@X玖少年团肖战DAYTOY,4,2019-09-14 12:55
@费渡长庚我心中的白月光,,我就是喜欢肖战，我就是觉得他演技好、感人。你不喜欢可以不看，别一张口就流量，流量怎么了？你谁呀？你还没流量呢！,4,2019-09-14 14:26
@蓝翼陌,,同意，他在进步了，在电影中真的没有出戏感，演的不错，他会越来好的，未来可期！,3,2019-09-14 13:55
@是十一不是一,,都是为了黑而黑的一群人 别人挡你道了是吗 承认别人优秀有那么难吗,4,2019-09-14 13:37
@有钱的抱米花,,流量不是原罪，请客观看待《诛仙》。最重要的是，不看没有发言权,5,2019-09-14 12:58
@超级可爱的胖宇吖,,看了这么多，就想说，肖战是个流量，哪里需要哪里搬,6,2019-09-14 12:56
@DAYTOY222清,,战哥加油，在这条布满荆棘的路上，小飞侠会一直陪着你哦！@X玖少年团肖战DAYTOY,2,2019-09-14 13:20
@是慕慕慕啊,,“肖战最不幸的地方就在于，莫名其妙的就跟流量挂上了勾，流量的福利还没享受到，大众的偏见倒已经接踵而至”,2,2019-09-15 00:46
@马楠楠daytoy,,好清醒一男的 。 三观正于五官  ,1,2019-09-14 23:07
@春日部部长Voeu,,流量成了贬义词,3,2019-09-14 22:18
@春日部部长Voeu,,肖战拍诛仙的时候还没大火，而且演得真的挺好的，笑点也很多，安利诛仙！！//@tf6015:#程青松怼诛仙主演# 打击正在努力提升自己的演员，真low,1,2019-09-14 22:06
@demi5520,,他在努力磨练演技，我们接受不同的声音，演员都是一步步成长的，给他一些时间，希望他会越来越好,1,2019-09-14 14:16
@dear肖兔兔,,加油,1,2019-09-14 14:09
@佳屿啊,,演员的生命在于作品,1,2019-09-14 13:52
@重庆快快下雪吧,,哥哥加油呀@X玖少年团肖战DAYTOY,1,2019-09-14 13:45
@奶黄月饼饼,,重点诛仙里表现的真不错,1,2019-09-14 13:44
@嘎吱脆的薯片,,一路走来，相信大家看到了他的演技，他的努力值得被肯定，演员肖战未来可期@X玖少年团肖战DAYTOY,1,2019-09-14 13:43
@絮语盟,,我哥会继续努力,1,2019-09-14 13:42
@小赵妹妹xxi,,肖战加油,1,2019-09-14 13:32
@李馨宁_,,真的好喜欢星闻揭秘哦 每次评价都很中肯 不会像其他yxh 一味尬黑,1,2019-09-14 13:17
@重庆快快下雪吧,,肖战未来可期！！@X玖少年团肖战DAYTOY,1,2019-09-14 13:12
@橘子汽水哎呀,,演员肖战未来可期,1,2019-09-14 13:12
@羡羡战博,,真的是人红是非多，哥哥在没拍《陈情令》的时候有谁知道世界上有个肖战。因为阿令火了又说哥哥是流量明星，流量不是原罪。 未来可期，哥哥加油。@X玖少年团肖战DAYTOY,2,2019-09-14 13:12
@不问归期lmr,,永远清醒着向前走,1,2019-09-14 13:11
@是一杯热苏打吖,,他在努力@X玖少年团肖战DAYTOY,1,2019-09-14 13:06
@XFX青柠,,肖战一直在努力的路上奔跑,3,2019-09-14 12:48
@是一颗橘子喂,,希望肖战越来越好,2,2019-09-14 12:48
@清荷v-v,,我们才刚刚开始呢 哥哥加油,3,2019-09-14 12:48
@恋廷小洋人,,肖战加油！未来可期,2,2019-09-14 12:47
@丽颖,,他一直在努力！未来可期@X玖少年团肖战DAYTOY,2,2019-09-14 12:47
@菱兔兔,,肖战加油！！！,2,2019-09-14 12:46
@薰,,肖战真的真的很棒！！！@X玖少年团肖战DAYTOY,1,2019-09-14 12:46
@爱你的小肥虾,,都是他自己用的努力换来的，我们不卑不亢，他值得,2,2019-09-14 12:44
@稻香小荷,,战战在水里泡的很累，你让他上岸好吗？！,2,2019-09-14 12:42
@jjjj小麋鹿昊,,粉丝和肖战接受一切客观评价，有部分不理智粉丝想要和路人辩驳我们也不可控。新人演员第一次以主演登上电影大屏幕不足之处欢迎大家指出以便改正精进。但不接受尬黑跟风黑。电影配音特效服道化作为粉丝的我看了也不敢恭维。但主演的演技我觉得能及格,3,2019-09-14 12:42
@战战我本命啊,,我很不理解，如果票房不好谁背锅？肖战暑假流量不行！票房好了你就是流量电影！！！请给新人一次成长的机会好吗？？？有流量说明演员本身也是有些优点被人喜欢的，演技也在磨炼和提升！请给予中肯的评价，不要针对演员！！！,5,2019-09-14 12:41
@火乐火乐就是很快乐,,看过了吗，就嘲，他们的演技都没有问题，我真不了解尬嘲什么劲！,2,2019-09-14 12:41
@殇璃墨兰,,他会越来越好  我们相信他,2,2019-09-14 12:41
@沙鸥罐罐,,肖战没问题，而且他会一直努力，不断进步的，粉丝对他充满了信心。,2,2019-09-14 12:41
@超级可爱的胖宇吖,,他一定会越来越好的,2,2019-09-14 12:39
@Q清酒酒酒,,只要内心澄净，就不必在意任何不值得的人[带着微博去旅行] 小飞侠永相随，未来可期，肖战值得,3,2019-09-14 12:33
@LAYAMIHA,,他一直很清醒，他依然是肖战,5,2019-09-14 12:24
@Z顾,,肖战未来可期,3,2019-09-14 12:20
@爱洋咩咩的金梅,,肖战加油，肖战冲鸭,2,2019-09-14 14:46
@2222小赞赞赞赞赞,,18线小透明都开始背流量的锅了，肖战这一千多万的粉丝在微博上称得上流量吗？随便一个普通演员粉丝都过两千万吧,3,2019-09-14 14:40
@鹅兔早升天,,谢谢认可，哥哥太南了,1,2019-09-14 14:54
@SHOUSEN_sukids,,谢谢认可，他值得,1,2019-09-14 14:54
@坂田家的小卷子,,星姐说得好,1,2019-09-14 14:54
@Today阿也出镜否,,诛仙上映时间太好了,1,2019-09-14 14:53
@Mictoriaaaaaa,,“红都是一阵一阵的” “这才哪儿到哪儿呀，未来长着呢” “演员还是得用作品说话” “不要捧杀我，就只是个上进的普通青年而已”,1,2019-09-14 14:52
@XIA_了一年的雨,,他在努力，我们一直都知道。现在所有的不好的声音，我们都接受，希望他以后会更好,1,2019-09-14 14:52
@一个没有感情的k糖机器,,啊啊啊啊啊啊。哥哥。。。 评论配图,1,2019-09-14 14:51
@莫倾城DAYTOY,,小战比任何人都清楚自己在做什么，自己要努力的方向，我们能做的就是支持,1,2019-09-14 14:47
@来一碗星辰,,#程青松怼诛仙主演#  我相信上天会厚待这个男孩 我们只需陪他跨过所有的荆棘 和他分享所有的荣光就够了,1,2019-09-14 14:46
@红豆草莓大福,,别的都不说，就看看这些所谓的老艺术家的思想境界。呵呵^_^那么多流量明星就追着我哥下刀，怕不是想蹭一波热度吧?,3,2019-09-14 14:44
@Lolita-,,流量不是原罪！更何r接拍D仙I的r候是小透明呢！[I],1,2019-09-14 13:44
@pinkpig2047,,三观太正了，演员用作品说话，努力吧演员肖战！[加油][加油][勰][勰]@X玖少年团肖战DAYTOY,1,2019-09-14 13:27
@金屋藏娇易文泽,,换个角度来说，把流量的标签安在肖战头上，不也是说明喜欢肖战的人比较多吗,1,2019-09-14 13:20
@竹西饮茗,,人气仿佛是原罪是的，如果这个时候还是糊咖应该就不会被嘲了吧,1,2019-09-14 13:18
@123zhrmmg,,他一直都这么清醒,1,2019-09-14 13:09
@刘A娴,,想到黄渤老师之前的采访说到：当你最弱的时候，世界上的坏人最多，也最容易受委屈。当你强大，整个世界才会对你和颜悦色！@X玖少年团肖战DAYTOY 我们继续加油,5,2019-09-14 12:42
@四季快乐不限夏天,,小透明的时候接的这部电影，他都可以认真对待，专注演技，面对这些成绩也能放平心态，期待演员肖战更多的可能吧，希望他可以改进自身的不足，保持清醒的头脑，一直往前走！,4,2019-09-14 12:41
@菌仔_,,他演这部电影的时候根本就没火啊 唉,5,2019-09-14 12:41
@婉华灿,,肖战值得他这样火！诛仙首日破亿不仅仅是粉丝为偶像买单的能力，更多的是大家对肖战的认可和好奇。肖战为人谦虚谨慎，他认真做好自己的本职工作，把演好戏作为首要任务，真的很值得肯定。他为演戏付出的一切观众都会看到，就算诛仙披麻袋涂黑脸，没有魏无羡的英俊潇洒，他依然演活了张小凡#肖战[超话]#,5,2019-09-14 12:35
@甜甜甜甜的酷盖,,流量不是原罪，肖战自己也说刚刚起步，演技就算不吹也绝没有说的那么差，而且拍的时候还是十八线小明星，红了真的就要遭受这些嘛,5,2019-09-14 12:34
@幸得识卿桃花面啊,,他的演技是真的还可以啊…眼睛也真的有灵气,4,2019-09-14 12:33
@斯塔万格奇迹夜,,战哥真的惨，没享受过流量带来的好处却要因为流量被怼 真的无语 阿弥陀佛 我爱战哥,4,2019-09-14 12:25
@当然阿囡,,都宽容点吧，肖战只是个努力上进的演员而已，有粉丝喜欢也有错吗。也不知道挡多少人路。,3,2019-09-14 15:52
@忠于野草,,他火了有鲜花和掌声自然也就有相反的声音如洪水猛兽般一拥而至 既然你不了解他就请不要随意评价他 《诛仙1》要不是那么多人看以为粉丝流量就可以撑起票房  不要太看得起我们 他一路跑龙套到配角男二到男主他不靠任何人不要以为他火了就可随意捧杀他  他才刚开始起步善良一点     请“人”放过他,3,2019-09-14 15:17
@浩肖博的大腿挂件,,他才刚起步，才走到哪儿呢？接受批评也接受指点，希望他以后走得更坚定,3,2019-09-14 14:55
@今天也是很困的小黄,,#程青松怼诛仙主演# 我不知道为什么对他要有这样偏激的批评，我觉得你可以说他的演技还没到达那么细致的一个点。但你不能说他没演技。如果没有演技，我们不会去支持他，去喜欢他。他不可能仅仅凭着一张帅气的脸爆红，正确的批评我们会接受，但是也希望不要因为他很红就戴着有色眼镜去看待他的作品。,2,2019-09-14 14:54
@哎哟美伢,,@小竹竿呀 战哥很清醒,2,2019-09-14 14:45
@你是笨蛋吧T_T,,来日方长,1,2019-09-14 14:07
@passionful016,,最好的肖战，最好的哥哥！他很努力，他的努力有目共睹！,1,2019-09-14 14:07
@十六画是心上人,,肖战未来可期,1,2019-09-14 13:49
@呆桃的胡萝卜,,尽自己最大努力做到最好，无愧于心。害！人总是会成长的嘛,1,2019-09-14 13:46
@战哥的啵啵奶盖满分甜,,感谢对电影和艺人的批评指正，好的不好的声音都是我们要承受的，这是成长的路。谢谢大家并肩一起面对,3,2019-09-14 13:28
@别嫌年下奶,,还没接受流量带来的好处 却要先接受流量带来的质疑 然而没有人在乎他的流量也是因为他的演技带来的,3,2019-09-14 13:13
@九月授人衣,,肖战从来都是一步一步来，脚踏实地，现在已经很棒了，以后也会越来越好，路会越走越远，我们有信心,2,2019-09-14 13:07
@山海渡宴仙,,没有用流量拿到影片资源，现在来说他靠流量？？只要火一点的明星，都能被打上流量，然后他们的作品都可以被批评，毕竟流量即原罪。,3,2019-09-14 13:06
@豆丁白兔子,,新人演员一直在努力，大家都是看见的，不说什么捧杀的话，只是希望肖战会越来越好，能力越来越高。（顺便解释下，当初拍诛仙时，肖战还不是流量哟）,4,2019-09-14 12:55
