User,Reter,Comment,Votes,Time
@无脚鸟飞行日记,,清醒谦逊难得。特别是在浮浮沉沉的娱乐圈，会说漂亮话和空有一副好皮囊的人太多了，步履不停是你给出最好的答案。,3,2019-09-14 12:51
@leehi碎碎念,,史上最强流量，1.7个亿都是粉丝看的。9月之前是虚火网剧咖，9月一场电影就流量能控制DB微博票房的神人。人嘴两张皮。,3,2019-09-14 12:50
@阳shirley,,他在进步，我们也接受不同的声音，我们和他一起走,2,2019-09-14 12:48
@XZ,,从过去到现在，他一直在磨练演技，也很清楚自己的定位，也很明白当下要走的路就是脚踏实地。,3,2019-09-14 12:46
@是玉儿的小鹿呀,,他用了心，也一直在努力，流量不是原罪。,2,2019-09-14 12:44
@肖肖肖肖肖肖肖肖赞,,我且不说流量和演技本身就不冲突，那会真的不认识他！是多大流量我个天天泡在微博的人都不认识呀！,4,2019-09-14 12:34
@cla向着光亮奔跑吧,,他说过流量只是说明有一个群体喜欢他，而他该做的是努力对得起这份喜欢。,3,2019-09-14 12:30
@想买一个半岛铁盒,,小赞接诛仙的时候还是18线糊咖 毕竟谁也不知道陈情令能播出来 最后还火了 不要一骂电影就说到流量,3,2019-09-14 12:24
@HoLinG・,,明明很励志啊！但每次看到哥哥的这种采访就莫名流泪，他真的默默一人承受了很多，才有面对爆红时这样稳重向前的心吧…祝愿哥哥的未来能顺遂圆满，得偿所愿,3,2019-09-15 00:56
@Taurusxz,,我们应该明白肖战就是刚刚起步，他没有对不起任何角色，我说的任何，包括张小凡，他就是做到了契合，我绝对没有夸大其词的成分。以后的路还很长，诛仙在我看很棒！整个电影看下来我就是没出戏，没有出戏！期待他的余生和更多作品，怎么样不重要，他努力我就给他足够的后盾，我希望他的小飞侠守护好他,2,2019-09-14 22:26
@莎莎是个小女孩儿,,新人演员肖战愿意接受指点，但是不接受指指点点，请多给新人一些时间，他在进步，我们都能看见@X玖少年团肖战DAYTOY,1,2019-09-14 18:49
@当然阿囡,,都宽容点吧，肖战只是个努力上进的演员而已，有粉丝喜欢也有错吗。也不知道挡多少人路，都善良点。,2,2019-09-14 15:55
@2222小赞赞赞赞赞,,我就奇怪了，在微博上随便点开一个明星的微博，粉丝都是至少2千万，肖战一个只有一千多万粉丝的小演员，怎么就被抗上流量这个大旗了呢，现在流量的标准这么低的吗？,2,2019-09-14 15:51
@不归人已归95,,谢谢，有人说句公道话。,4,2019-09-14 15:14
@可爱三秒的小妞,,支付努力，并付出心血的肖战就对啦[加油][加油],2,2019-09-14 14:55
@肖战GG家的,,相信肖战回越来越好！,2,2019-09-14 14:55
@放开那个狗崽崽,,这是想说什么就是什么，啥心态！哥哥演技大家有目共睹，真的是，剧本不行，怪哥哥有流量？什么人呀！,2,2019-09-14 14:45
@一只迷路的麋鹿在迷路,,搞不懂有些人为什么对新人演员心存恶意，大牌演员也是从新人时期过来的，谁能说自己出来就演技满分？众多影帝影后也不会吧,2,2019-09-14 14:44
@YIBO-七,,哥哥一直是个很谦卑很努力的人，面对粉丝的吹捧总是在强调不要捧杀我，很客观地在审视自身的问题。从设计师到明星是个很大胆的选择，哥哥会继续努力进步的！,2,2019-09-14 14:07
@tgoooooodp,,肖战认认真真对待每一部剧和从来不喜欢捧杀 也请各位大V放过我们这位十八线演员,2,2019-09-14 14:07
@_Somerset,,流量不是原罪，没有演技才是，没有态度才是，肖战的演技虽然远远比不上老戏骨，但也不至于被黑得一无是处，肖战对演戏的态度也是有目共睹的。电影的希望不在于嘲讽新人，不在于指指点点，更不在于倚老卖老，而是在于态度。,2,2019-09-14 13:59
@呆桃的桃,,他在努力，在成长，给他一些时间，他会更加挺拔的出现。我们会接受不同的声音，但是请不要用“流量”这个词否定他的成绩，接诛仙的时候还是个小透明，所以现在拥有的说明他打实的优秀。演员肖战，未来可期，加油@X玖少年团肖战DAYTOY,2,2019-09-14 13:43
@葵儿粉色超烈,,别酸好嘛？肖战之前演了那么多角色，即便不是最好的演员，但他的态度努力决定现在的人气，流量不是最终评判一个人的标准，也别急忙否定他是否适合演戏是否接戏，更何况他不是本科出身，演技有待提高，但他的演技还是不错的好嘛！！,2,2019-09-14 13:43
@谁敢跟我叫一样,,别吵了，都去看诛仙吧！蛮好看的电影,1,2019-09-14 13:22
@乐极生欢DAYTOY,,肖战加油,1,2019-09-14 13:22
@洛琦不悔,,不需要捧杀，粉丝也不要捧杀。但是希望战哥也可以得到演技上的指导，如有请教请详细说明哪些地方不好需要精进。而不是总是用流量来圈套他，拍这电影的时候他是个十八线。流量标签不必要贴，谢谢,2,2019-09-14 13:21
@肖君媚,,啥也不说了！看剧去吧『诛仙l』和『陈情令』，『未知全貌 不予置评』，这个什么导演哪里来的都不知道！看过作品在说话吧！中秋佳节共赏诛仙！团团圆圆阖家欢,2,2019-09-14 13:20
@轶晨是个二傻,,赞同!! 别总拿“流量”来怼人，只有努力上进的演员才会带来越来越多的流量!,2,2019-09-14 13:20
@蜜果呆桃,,之前他籍籍无名的时候嘲他糊 现在有点成绩又嘲他流量 在某些人眼里 横竖我们都是错,2,2019-09-14 13:02
@兔子想有钱DAYTOY,,流量不是贬义词，肖老师亲口说过，他是代表着有很多人喜欢你，流量和演员不冲突，不要随意去毁掉一个词和一个人,2,2019-09-14 12:55
@每一天都要快乐呀-9,,说的对，一起努力，时间会证明一切,1,2019-09-14 12:49
@肖战一级颜狗,,up,1,2019-09-14 12:44
@Cyue_Lee,,你说的对，他在努力，请黑子们不要这样过分伤害,2,2019-09-14 12:44
@仙女味橘虞,,他在变优秀,2,2019-09-14 12:44
@今听雨哈,,对啊，肖战只是想好好演戏，为啥想这么多,0,2019-09-14 12:36
@YANG~千汐,,陈情令是去年拍的,1,2019-09-15 12:20
@小曼yjm,,很好奇有粉丝支持的都叫流量?那么多明星哪个没有点粉丝?演员嘛，注重的是什么，演技啊，看剧就看剧，不要老拿流量说事，有本事你点评作品，不要动不动就说人家流量，不要随便就去否定别人的努力和付出！！！嚼舌根真的是。。。佩服了。,1,2019-09-15 01:50
@YB的朋友呢,,我记得他还演过一个很群众的角色 很久之后看到有人发gif才注意到原来他也在电影里 努力真的不是一句流量就能概括的 有缺点接受批评会认会改 但是不需要莫须有的诋毁,1,2019-09-15 01:29
@泡芙好次么,,肖战！,1,2019-09-15 00:53
@特乖的小开酱,,哥哥超级努力啊啊!小飞侠会支持你的!继续加油喔! ,1,2019-09-14 22:56
@你看苏忱是否欢喜,,只想对这位姓程的说:不要在网上哔哔赖赖，不如现实碰一碰，看我扎不扎你。,1,2019-09-14 22:31
@InspiritDaytoy,,他接这个戏的时候都还没红起来好吧  有些人没事别蹭热度好吗  尊重一下演员的努力   是  他确实有许多进步的空间 还请您多多指点,1,2019-09-14 20:44
@心清静静,,加油,1,2019-09-14 20:13
@护主小飞侠,,肖战等人演技上热搜我认为是因为他们是新人，而新人能演到这个程度真的是很棒他们上热搜也是对他们的一种鼓励和支持希望他们越来越好，而那些演技的“老人”没热搜是因为我们一直都知道他们演技好还能天天热搜啊?况且肖战拍摄《诛仙》时还未火他一直都很努力也一直很谦虚他能火明明是他靠自己实力来的,1,2019-09-14 17:47
@Agness_Eve,,这电影我认为还可以的啊。。。没有必要为了黑而黑吧,1,2019-09-14 17:27
@X-DAYJOY,,这只是开始，未来可期，我们一直陪着他,1,2019-09-14 17:05
@钱苏呀,,害！这才哪到哪呀，我们战战会越来越好的,1,2019-09-14 16:54
@哥哥有钱_,,啥也不说了！看剧去吧『诛仙l』和『陈情令』，『未知全貌 不予置评』，这个什么导演哪里来的都不知道！看过作品在说话吧！中秋佳节共赏诛仙！团团圆圆阖家欢,1,2019-09-14 16:27
@蔓-M,,他很认真，很努力，别总用流量来给他下定义好吗？他是个很好的男孩子，可以不爱，请别伤害,1,2019-09-14 15:49
@心漫sara,,分享看到的一段话，肖战最不幸的地方就在于，莫名其妙的就跟流量挂上了勾，流量的福利还没享受到，大众的偏见倒已经接踵而至”,1,2019-09-14 15:36
@围栏小赞,,演员肖战，他会越来越好@X玖少年团肖战DAYTOY,1,2019-09-14 15:11
@天空我的爱100,,认认真真演戏的人值得尊重,1,2019-09-14 14:46
@触不到的落日浮光18580,,加油,1,2019-09-14 14:46
@是肖战啊R,,肖战未来可期,1,2019-09-14 14:12
@naddgz,,加油！战战，未来可期！,1,2019-09-14 14:09
@汪喳喳de,,肖战加油！会越来越好的！,1,2019-09-14 14:07
@汪喳喳de,,给他时间，给他空间，慢慢进步,1,2019-09-14 14:07
@王甜甜的小飞侠吖,,未来可期，期待哥哥的每一部作品。,1,2019-09-14 13:56
@不可以不可以都不可以,,是的，当时他还是一个小透明，他真的很努力！！,1,2019-09-14 13:48
@sigrid6,,搞不懂那些戏精什么意思，现在就是为了黑而黑，@程青松同志 是谁,1,2019-09-14 13:46
@语笑嫣2014,,肖战未来可期,1,2019-09-14 13:40
@美丽腰麦07206,,肖战加油！我们会支持你的！,1,2019-12-01 07:53
@杨一37210,,妞妞，？肖战？,0,2019-12-01 16:06
@君莫笑20191101,,演的差，没有问题。演的差还吹演技，才让人受不了。 关键是，粉丝还去豆瓣刷分。不可忍,0,2019-11-21 18:25
@杨一37210,,妞妞，？肖战？,0,2019-12-01 16:06
@美丽腰麦07206,,肖战加油！我们会支持你的！,1,2019-12-01 07:53
@君莫笑20191101,,演的差，没有问题。演的差还吹演技，才让人受不了。 关键是，粉丝还去豆瓣刷分。不可忍,0,2019-11-21 18:25
