User,Reter,Comment,Votes,Time
@一条无辜的生命,,好电影蹭是锦上添花。烂电影蹭，会被万人骂。 何况哪吒一直都是古代传说里面的红人，哪有什么“哪吒最近火了”的说法。,2,2019-09-16 11:59
@甜酒C_,,无限 无限帅！！！,2,2019-09-16 11:52
@懒懒的毛虫,,被撤掉的哪吒的部分一定要放出来呀！什么时候都可以！好想看！,2,2019-09-15 21:28
@我是贝贝她老娘,,他们有孙悟空串门，你们有哪吒串门，很可爱啊。以后说不定有妖精的电影，罗小黑可以串门。国漫真可爱。,2,2019-09-15 20:55
@呢呢呐呐6699,,我两部都看了都，国漫进步不小，希望不要理那些别有用心的人挑拨的话,2,2019-09-15 20:23
@K-axe,,对了，把tv里面的哪吒设定拿放出来,2,2019-09-15 19:47
@魍魉魅魈魑,,叫 无限的粉红小摩托  怎么样？,2,2019-09-15 19:38
@ZYJ-HOME,,为什么会被骂呢？谁那么无耻！闭着眼睛不说人话！我就喜欢木头的哪吒！NASA,2,2019-09-15 19:28
@欧辰昊,,无限今天报名某厨师学院了么？,2,2019-09-15 18:57
@傻小白甜,,动画制作周期很长，不可能蹭魔童的热度，只能说哪吒这个角色自带热度，导演使用这个角色是没错的,2,2019-09-16 17:56
@Ciaoyr_0贰拾贰,,哪吒本身就是很有讨论热度的国民角色啊，只不过最近有了更新的动漫形象而已。我觉得不管是罗吒还是魔吒，都帅！都有个性！就是不一样的审美（烟熏风vs运动风）一样的帅气！别说不可能蹭，就是蹭又怎么了，两部都是优秀的国漫，两个都是成功塑造又独立的好吒，就该蹭一下哪吒热度带一下小黑！！（急死人,2,2019-09-16 14:27
@枪指预言家,,谁骂我罗小黑蹭热度 我 查看图片,2,2019-09-16 14:02
@莲哥洒的吧,,咱不用回避啊，一群人甚至连看都没看，就听到个哪吒就跟风喊蹭热度，趁机让他们去电影院看啊！卖了票咱好做动画，争取日更啊,2,2019-09-16 13:51
@佳佳佳文-ooo,,想有个无限这样的师傅,2,2019-09-16 13:51
@土星上的彩虹球,,哈哈哈哈哈哈 空间系真是烦死啦！,2,2019-09-16 13:51
@萤火小巷子,,有些粉真的太爱玩粉圈那一套了 哪吒也只是个动画人物 重要的难道不是传播的文化吗 公共版权人物谁都有权利去塑造 要是塑造的不好可以打可以骂 说蹭热度真的没有必要,2,2019-09-16 11:23
@东京Aeko,,不用多说啦，懂的人自然懂。赶紧更新29~50才是正事~,2,2019-09-16 06:54
@喻清-Live,,是这样的！木头导演三观很正啊,1,2019-09-20 23:56
@柏螂,,据调查统计，网民有百分之90是大学以下文化水平，无知无畏无脸无皮，不为别的就是想让你死的人很多很多。不必在意，因为木头JJ是谦逊勤恳努力善良温柔阳光能给大家带来笑容和爱的创作者，任何诋毁污蔑重伤讽刺恶语相向无理栽赃都抵不住你带来的那抹阳光。感谢你让我走进你的世界,2,2019-09-19 23:45
@fly小柒的小逗逗,,无限这是什么鸟,1,2019-09-19 13:22
@可是我只想用一个字,,看完这段话我好喜欢你啊木头！！,1,2019-09-18 10:46
@-拿出来吃,,不管怎么说 期待藕霸的下一部！！还有 tv版也多多更新叭木头,1,2019-09-18 10:33
@达哥是传说,,@达哥是传说: 肯定不是临时蹭热度加的人物，但是宣发有没有蹭是不是就是另一回事了。这次找的宣发真的不怎么样。两年停更我一直都认为是错误的决定。我真希望这次电影可以分到的1个多亿可以好好想一想该怎么继续，把这些钱花在什么上。,1,2019-09-18 10:00
@芒果捞娱妹,,大家快去电影院康康罗小黑吧！它值得更好的票房！里面的哪吒也是真的超可爱！把小揪揪拔下来的那一刻真的笑喷了！,1,2019-09-18 09:35
@菲菲菲菲菲常喜欢H-MAX,,我不管 反正我超喜欢 超喜欢小黑 喜欢无限 喜欢哪吒大人,1,2019-09-16 17:19
@一只哈士奇70966,,“这是我的哪吒。没什么见不得人的，他是我的孩子” 这句竟然看的想哭,3,2019-09-16 16:51
@阳光-影子-味道,,这个哪咤也很棒，不同的风格，加油！,1,2019-09-16 16:48
@筱~-love,,没想到吧，木头大大自己上热搜了哈哈哈哈,3,2019-09-16 16:01
@琪琪死单纯,,而且哪咤大人一出场燃炸了，那个音乐，和酷酷的感觉。,2,2019-09-16 15:51
@肥宅阿夭awa,,#美女师傅无限# 就这个吧,1,2019-09-16 15:47
@莫笙mom,,风息，无限，其实都可以上热搜的，木头大大你们的宣传真是有点上不去啊,2,2019-09-16 15:44
@FangTii,,“这是我的哪吒。没什么见不得人的，他是我的孩子。”…我想哭,1,2019-09-16 15:32
@夜斗是我的,,那么问题来了，无限大人啥时候上热搜,2,2019-09-16 15:09
@农的芝麻包,,就知道有人会这么说……喜欢小黑这么些年也知道姐姐有多懒了,1,2019-09-16 13:31
@仙女儿同意了,,这是我的哪吒。没什么见不得人的，他是我的孩子。哇这句话真的爆哭,2,2019-09-16 13:23
@花花花花酒辞,,两个哪吒我都好喜欢！！！ 国漫加油！！！,1,2019-09-16 13:16
@鹤金-,,支持你！,1,2019-09-16 13:14
@风间学长的阿海,,好温柔的导演啊，支持小黑,2,2019-09-16 13:07
@不愿透露姓名的艺术家,,划重点！！下一部！！！,2,2019-09-16 12:58
@双玄什么时候甜,,无限大人被叫美女,1,2019-09-16 12:54
@chu_uuuu,,对于两个naza我都很喜欢！风格各有特色！上映期的问题，把两个naza联系起来也很正常。说明两个naza在大家心里都有一定的特别印象！反正我支持木头姐姐！我是脑残粉！你可以骂我了！,2,2019-09-16 12:39
@・oayu・,,木头你真的上热搜了哈哈哈哈哈哈哈哈,1,2019-09-16 12:35
@几夜萧萧雨,,热搜就叫：无限又没上热搜吗？,2,2019-09-16 12:28
@绘梨衣的_小鸭子,,没必diss谁吧，小英雄哪吒，哪吒闹海，非人哉的藕霸，十万个冷笑话里的金刚芭比，魔童降世的魔丸，罗小黑里的罗吒，还有大圣嘴里的女的【不是】，原型都是封神榜里的三太子哪吒，没有谁比谁高贵，没必要说蹭热度什么的，与其诋毁别人，我们更希望能出个联动,2,2019-09-16 12:28
@小年糕-吴小墨,,对呀 哪有什么见不得人的。创作出来的作品能够得到大家认可和喜爱 是很棒的事情,1,2019-09-16 11:57
@晓奕911,,支持木头、另外咱们29集啥时候安排上,1,2019-09-16 11:56
@四小姐家全球购,,我就觉得罗小黑好看 是来自心灵的治愈 这个社会太浮躁 看看觉得很不错的 暖心,1,2019-09-16 11:55
@芝士酱哦丶,,您怎么这么可爱呀哈哈,1,2019-09-16 11:55
@-念未央-,,内心坦荡，自然无谓，大方从容，支持你！,2,2019-09-16 11:53
@ShutUpBiuBiuBiu你哦,,重点：下一部,1,2019-09-16 11:47
@兔耳萝卜汤,,看个动画还把饭圈那套拿出来舞简直病态！！票吧现在真是一群神经病,1,2019-09-16 11:39
@盒子是也,,小黑：原来哪吒是男孩纸,1,2019-09-16 11:38
@行走的ORZ,,哪吒脑海，哪吒传奇，莲花童子哪吒，封神榜哪吒，非人哉哪吒，十万个冷笑话哪吒，大圣归来哪吒，魔童哪吒，罗吒，哪吒本来就是话题度很高的神话人物，应该除了大圣外就是哪吒和杨戬了，然后是封神榜这个大IP里面还有几个很出彩的人物，哪里来的什么蹭热度，真不要拿粉圈的做法进漫圈，我们很和谐的[微,2,2019-09-16 11:37
@kielo_kettunen,,真棒。就喜欢这种坦坦荡荡的回应。不一样的动画带给人不一样的体悟和感动。不管是哪些作品里的“哪吒”我都喜欢,1,2019-09-16 11:32
@无限大人么么哒,,加油,0,2019-10-29 00:31
@该用户不存在_30710,,嗯。。。。按下来的哪吒海报。。。可以放出来了吗？,2,2019-10-25 14:51
