User,Reter,Comment,Votes,Time,Count
@天凉好个秋lo,,理智追星，拒绝ss,0,2019-09-14 23:36,1
@现哥喜欢什么瓜,,理智追星,0,2019-09-14 23:36,2
@现哥喜欢什么瓜,,抵制私生,0,2019-09-14 23:36,2
@南方姑娘131,,私生不是粉，李现粉丝坚决抵制私生行为！让我们共同抵制私生行为！理智追星，给哥哥空间,0,2019-09-14 23:36,1
@Morningair_初,,理智追星，抵制私生 评论配图,0,2019-09-14 23:36,1
@爆料大赏,,李现粉丝点赞的脱单又暴富,0,2019-09-14 23:36,2
@陈粞思,,私生不是饭 抵制私生！,0,2019-09-14 23:36,2
@・啾咪啾咪・,,私生不是粉！抵制私生！请给他空间,0,2019-09-14 23:36,1
@现在要喝养乐多ing,,抵制私生，理智追星！,0,2019-09-14 23:36,1
@CJ我就是静静,,理智爱护哥哥，拒绝私生@李现ing,1,2019-09-15 00:39,1
@李松鼠ing,,禁跟车、蹲守酒店住所、跟踪私人行程等一切私生行为，请在合理、安全范围内追星。请多多关注作品…… 评论配图,1,2019-09-15 00:24,1
@今天也要多爱欢欢一点,,私生bissxx,1,2019-09-15 00:24,1
@ayan_李现1991,,李现和李现粉丝不提倡任何干扰公共秩序及影响公共安全的行为，希望大家关注角色和作品来。理智追星 ！！离作品近一点 ！！离生活和本人远一点！！！希望大家多多期待未来的作品 《剑王朝》《中国机长》《恋曲1980》《抵达之谜》《春江花月夜》和大家见面！！,1,2019-09-15 00:17,1
@小琳儿可奶可仙,,学会尊重  抵制ssf,1,2019-09-15 00:13,1
@Xianbrielle,,私生跟踪似为流氓,1,2019-09-15 00:12,1
@沐沐芊,,ss们能给他点自由吗？他的工作是演员，但他的日常只是一个二十多岁的青年啊！能别当他是神，什么时候都普渡你吗？！,1,2019-09-15 00:06,1
@健康快乐就好吖,,真正的粉丝朋友支持他的作品，而私生只关注他背后的私生活；真正的粉丝尊重他的意愿，而私生只想满足自己的私欲。我们作为李现@李现ing 的粉丝朋友，同李现站在一起，抵制私生、理智追星！,1,2019-09-15 00:05,1
@半喜春夏cx,,坚决抵制私生行为，理智追星,1,2019-09-15 00:04,1
@S-芥末麻糖,,保护我方李演员，坚决抵制ss行为，呼吁理智追星，爱他请尊重他！,1,2019-09-14 23:52,1
@YoYo-绮梦,,关注作品    远离生活         拒绝私生                     你是最棒的@李现ing,1,2019-09-14 23:48,1
@水流L_Monologue,,请理智追星。,1,2019-09-14 23:47,1
@moonintheshadow,,我和我的爱豆不提倡任何干扰公共秩序及影响公共安全的行为 评论配图,1,2019-09-14 23:46,1
@李随缘11,,抵制私生，理智追星,1,2019-09-14 23:45,1
@现女友禄丸肥肥,,私生饭 不是饭 并不能代表我们 希望ss能够放过哥哥  理智追星 抵制ss 离作品近一点 离生活和本人远一点,1,2019-09-14 23:44,1
@黛儿ing11,,理智追星，关注作品，远离生活,1,2019-09-14 23:43,1
@一只灌子,,坚决抵制私生！！请离他们生活远一点。多多关注作品。,1,2019-09-14 23:42,1
@张张张张张_91,,抵制私生，理性追星,1,2019-09-14 23:40,1
@李现是怪瘦,,抵制私生,1,2019-09-14 23:40,1
@F男友super,,抵制私生，理智追星!喜欢现哥，就离他的作品近一些，离他的生活远一些。不要给他带去困扰，给他空间,1,2019-09-14 23:40,1
@给儿你脸了,,李现及李现粉丝朋友坚决抵制私生行为，请离作品近一点，离生活远一点。理智追星，拒绝私生！！！,1,2019-09-14 23:39,1
@我们不该这样00,,辣鸡,0,2019-10-17 18:59,2
@潘朵拉盒子里的少女,,这样看郭天王的女儿好像很漂亮诶。,0,2019-09-16 18:47,2
@偷亲妃哥,,私生饭太可怕了吧 我现哥都没有隐私了,0,2019-09-16 13:39,2
@2017小果子2019,,理智追星,0,2019-09-16 03:41,2
@现先生的小迷妹,,ssf不是粉，请理智追星，离生活远一点，给艺人多些自己的空间,0,2019-09-15 17:14,2
@天现宝宝爱李现LX,,私生饭 不是饭 并不能代表我们 希望ss能够放过哥哥  理智追星 抵制ss 离作品近一点 离生活和本人远一点,1,2019-09-15 14:19,2
@是会无畏打怪兽的女青年L呀,,@怡HQY：李现先生及其他的粉丝朋友坚决抵制私生行为，请离作品近一点，离生活远一点，理智追星。,0,2019-09-15 12:49,2
@流浪狗任,,不错,0,2019-09-15 11:16,2
@M摇风,,跟岳哥合影的才不是粉丝，只是个普通没素质的人罢了,1,2019-09-15 10:56,3
@我们不该这样00,,辣鸡,0,2019-10-17 18:59,2
@潘朵拉盒子里的少女,,这样看郭天王的女儿好像很漂亮诶。,0,2019-09-16 18:47,2
@偷亲妃哥,,私生饭太可怕了吧 我现哥都没有隐私了,0,2019-09-16 13:39,2
@2017小果子2019,,理智追星,0,2019-09-16 03:41,2
@现先生的小迷妹,,ssf不是粉，请理智追星，离生活远一点，给艺人多些自己的空间,0,2019-09-15 17:14,2
@天现宝宝爱李现LX,,私生饭 不是饭 并不能代表我们 希望ss能够放过哥哥  理智追星 抵制ss 离作品近一点 离生活和本人远一点,1,2019-09-15 14:19,2
@是会无畏打怪兽的女青年L呀,,@怡HQY：李现先生及其他的粉丝朋友坚决抵制私生行为，请离作品近一点，离生活远一点，理智追星。,0,2019-09-15 12:49,2
@流浪狗任,,不错,0,2019-09-15 11:16,2
@M摇风,,跟岳哥合影的才不是粉丝，只是个普通没素质的人罢了,1,2019-09-15 10:56,3