User,Reter,Comment,Votes,Time,Count
@魏兄,,怎么？学校为交不起电费找理由？,0,2019-09-26 20:34,1
@没用的胖仔,,河北的大学一言难尽啊,0,2019-09-26 20:34,1
@狄尔摩斯大侦探,,我曾经河北工业大学东校区三宿的说啥了,0,2019-09-26 20:34,1
@盗猎小女孩,,？河北外国语学院根本没电呀，我们也想限电,0,2019-09-26 20:33,1
@睡不醒的刘奶奶,,不好意思，我在13号宿舍楼，有电梯，很干净！床也很好！柜子也很好！桌子也很好！哪里都很好！,0,2019-09-26 20:33,1
@甜小彤的微博,,学姐已笑趴！哈哈哈哈哈哈哈哈哈哈 你们后悔吗，来到这样的学校！！！,1,2019-09-26 20:33,1
@斗柄之南,,这规定真的太奇葩了吧,1,2019-09-26 20:32,1
@别动我的糖灬,,新疆全区的高校都这样怎么说？,1,2019-09-26 20:31,1
@齐kaka1221,,14级老学姐飘过，表示一定要反抗，加油,2,2019-09-26 20:31,1
@亮爹King丶Zz,,我们学校白天也限电,0,2019-09-26 20:19,1
@圆圆小天王,,我上学那会儿还是四人间,0,2019-09-26 20:18,1
@魔法沈腾,,这说的不是烟台大学嘛？？？除了白天限电我们几乎都一样,0,2019-09-26 20:18,1
@王皮皮小P,,哇喔，幸亏毕业的早,0,2019-09-26 20:16,1
@薛肉丸丸,,@王肉饼 还好我毕业了,0,2019-09-26 20:16,1
@一个很有文采的名字,,和我们学校一比 感觉挺正常的,0,2019-09-26 20:15,1
@逗阳阳被发现了快跑,,有病？手机不充电？,0,2019-09-26 20:15,1
@C-pop的魔仙小女王,,我们十一个人一间宿舍！空调还是我们来了才装的！课室，图书馆饭堂没有空调！请注意，我是大学生！这里的占地面积比普通高中还要小！,0,2019-09-26 20:15,1
@龙舌兰日出了,,可以退学了,0,2019-09-26 20:15,1
@蒋凤微博,,一定别来,0,2019-09-26 20:13,3
@蒋凤微博,,一定不能来呀,0,2019-09-26 20:13,3
@一碗炒饭不够吃,,天呐 看着也太没人性了吧,1,2019-09-26 20:13,1
@卢利萨,,公寓限电很正常吧，上课期间期间不限电，难道在宿舍睡觉？有意见？,0,2019-09-26 20:12,1
@芒果酱33,,我们学校之前限水,0,2019-09-26 20:12,1
@北流活活2012,,沙雕学校欢乐多,1,2019-09-26 20:12,1
@蒋凤微博,,拉不出屎还怪地球没有吸引力,1,2019-09-26 20:11,3
@青春正春,,母校竟然上热搜了,0,2019-09-26 20:10,1
@嚼土豆片的地瓜蛋儿,,上下铺木板床很常见啊。。。。,0,2019-09-26 20:10,1
@德云女孩_小青山,,现在才发？姐妹，你太晚了,0,2019-09-26 19:38,1
@cx-cHeN,,美好的大学生活,0,2019-09-26 19:03,1
@今夜星星都亮了,,#衡水学院白天限电# ,0,2019-09-26 18:54,1
@半个城市HSH,,我们赢了,0,2019-09-26 18:20,1
@李女士的未婚夫,,身为衡水人都替你们难受,0,2019-09-26 21:22,1
@请禁止耽改剧,,我们宿舍白天一整天都没有电，电灯都是晚上统一开的,1,2019-09-26 20:14,1
@一个星期就好了嘛,,来武汉吧，很多学校都是四人间加空调,1,2019-09-26 21:19,1
@pick翰哥的那个努力的我,,衡水中学校长有病思想有病，就应该关闭我去呵呵,2,2019-09-26 20:40,1
@小金药业,,我们学校上课时间宿舍没电,0,2019-09-26 21:47,1
@金九爷是聪明蛋,,太惨了吧,0,2019-09-26 18:19,1
@我自带王者气息,,如果你是这个学校的，你这样说会显得没素质，如果你不是这个学校的，请不要随便评论,2,2019-09-26 22:52,1
@不打算跟我说晚安吗,,团体操 也就只有我们中文系和体育系的 太惨了真的。,3,2019-09-26 20:23,1
@怂出新境界,,可能我见过垃圾的吧，就初中住宿，直接十几个人一间房子，房子给我的感觉就是住了20年以上租赁出去的地下室，没空调好像电扇也没有的样子，屋内没厕所，旁边屋是油炸食品零食店，地都是脏黑的，冬天洗漱也用冷水，连个打热水的地都没有，我没住但见过，我以为所以宿舍都这个水平,0,2019-09-27 11:08,2
@ML332655658705406,,表示我们学校周一到周五白天一直限电，而且我们并没有阳台,0,2019-09-27 07:11,1
@吴晓轲24061,,@河北共青团,0,2019-09-26 23:23,2
@啾啾312,,我们也是，宿舍没空调，教学楼没有空调，还好我计算机系的教室有空调，不过食堂有呀,1,2019-09-26 21:53,1
@我是小硕吖吖,,这学校也是够了，晚上限电不说，白天还限，只有下午几个小时的来电时间，请问该怎么充电？！省钱也不至于这样吧,0,2019-09-26 21:45,1
@元夕2019,,你们可别说了，你们还有桌子还有阳台还有电扇呢，我们可是正儿八经的只有床和柜子，而且也是八人间……,0,2019-09-26 21:31,1
@竹林听雨真是蕙质兰心满腹经纶啊,,额从小到大我住的都是木板床啊,0,2019-09-26 21:30,2
@竹林听雨真是蕙质兰心满腹经纶啊,,额我们学校连阳台还没有呢,0,2019-09-26 21:28,2
@走桩,,还以为衡水中学。。。原来是大学，溜了溜了,0,2019-09-26 21:24,1
@尽职的米妮1234,,我以为衡水中学,0,2019-09-26 21:11,1
@孙培硕,,我去过一次，根本就是贫民窟,0,2019-09-26 21:00,1
@衡水妙音文化传媒,,速看http://t.cn/AirCBasQ,0,2019-11-14 12:39,3
@Comodo何强大,,@做一只傲娇的KONI @一颗心_BELoNGTo_一个人 @邓北北的小花痴 @Dw说好我们会有个小王八 @蒋梦笛,0,2019-09-27 10:02,1
@嘻嘻hape,,各种宿舍整理骚操作不说，团体操非要拉大三的干啥？教资考研最重要的时期，难道不知道？过不了谁负责？时间的确是挤出来的，挤出来的时间都给练操了，晚上加班学？又练操又上课，我不休息吗？难道学校没人了吗？,1,2019-09-27 00:04,1
@吴晓轲24061,,@河北新闻,0,2019-09-26 23:23,2
@番茄V鸡蛋,,太难了吧，比我大学还艰苦,0,2019-09-26 22:33,1
@星星触及月光的故事,,突然觉得我们学校好好,0,2019-09-26 22:24,1
@刘胖胖n_n,,@超级无敌宇宙大英雄 有比你们还艰苦的,0,2019-09-26 22:17,1
@天真Prince,,@Eric加油鸭  emmmm王哥我没太懂，那啥，我们不也是白天寝室不给电，宿舍教室没空调，寝室不给挂床帘吗,0,2019-09-26 22:13,1
@何苦19013,,社会主义初级阶段，忍忍吧，还有好几十年呢！,0,2019-11-27 22:29,2
@衡水妙音文化传媒,,速看http://t.cn/AirCBasQ,0,2019-11-14 12:39,3
@交游天下2019,,有什么好奇怪的，大多数学校都这样了,0,2019-09-28 10:23,6
@交游天下2019,,为什么要截那么多张，不都是一样的内容吗？如果要引起重视，同样的发三张图就够了！,0,2019-09-28 10:22,6
@最爱61的小甜豆,,破学校不咋滴，屁事可他妈多了。,1,2019-09-27 14:47,3
@卟呤卟呤的兔砸,,女生表示十号楼当初答应我们住13号公寓有阳台，但是来了这说变卦就变卦十号公寓厕所漏水，没阳台一个在窗户外边的小铁杆一晾衣服就掉下去,1,2019-09-27 13:44,3
@何苦19013,,社会主义初级阶段，忍忍吧，还有好几十年呢！,0,2019-11-27 22:29,2
@衡水妙音文化传媒,,速看http://t.cn/AirCBasQ,0,2019-11-14 12:39,3
@交游天下2019,,有什么好奇怪的，大多数学校都这样了,0,2019-09-28 10:23,6
@交游天下2019,,为什么要截那么多张，不都是一样的内容吗？如果要引起重视，同样的发三张图就够了！,0,2019-09-28 10:22,6
@最爱61的小甜豆,,破学校不咋滴，屁事可他妈多了。,1,2019-09-27 14:47,3
@卟呤卟呤的兔砸,,女生表示十号楼当初答应我们住13号公寓有阳台，但是来了这说变卦就变卦十号公寓厕所漏水，没阳台一个在窗户外边的小铁杆一晾衣服就掉下去,1,2019-09-27 13:44,3
@怂出新境界,,可能我见过垃圾的吧，就初中住宿，直接十几个人一间房子，房子给我的感觉就是住了20年以上租赁出去的地下室，没空调好像电扇也没有的样子，屋内没厕所，旁边屋是油炸食品零食店，地都是脏黑的，冬天洗漱也用冷水，连个打热水的地都没有，我没住但见过，我以为所以宿舍都这个水平,0,2019-09-27 11:08,2