User,Reter,Comment,Votes,Time
@-兴尽晚回舟_,,大型谈恋爱现场,25,2019-10-01 12:49
@阿园园园圆滚滚,,北京奥运会的时候，我还在小学,20,2019-10-01 12:41
@我是花露水阿,,我的眼泪反反复复出来了好几次,14,2019-10-01 12:57
@天使白雪,,好感动,8,2019-10-01 12:29
@XXXX_啦啦啦啦啦,,是真的，看着真的感动，虽然我不是那个年代的人，想想自己的父母曾经历过这样的场景，太浪漫了,8,2019-10-01 13:01
@张盟吖,,青春万岁,0,2019-10-01 13:21
@已至半山,,我的妈看这段我都想哭,2,2019-10-01 13:43
@zhanyitingnb,,这还是我们的二八加重,1,2019-10-01 13:06
@简简什么时候90斤呢,,真的，朝气蓬勃,1,2019-10-01 13:06
@leng飞白,,一开始我就想哭。。,1,2019-10-01 12:55
@二月水木,,@馒头烤久了会变饼干 这个太好了,0,2019-10-01 14:49
@就素小桃桃哇,,看完自行车方阵 我似乎理解了妈妈们为什么这么爱丝巾,2,2019-10-01 14:37
@空穿石,,转发微博,0,2019-10-01 13:06
@空穿石,,真哭了,0,2019-10-01 13:06
@ooo橙ooo,,我们家乡有搞这个自行车的活动来着，感觉很自豪,2,2019-10-01 12:58
@阿莹哥的双下巴_Ss,,对对对 同样的点 虽然没有经历过 但那一瞬间就是很想哭,0,2019-10-01 15:55
@吃定彩虹D,,,0,2019-10-01 15:24
@柚十二柚十二,,超级棒,0,2019-10-01 15:12
@杨叶嗄,,这也太感动了吧,0,2019-10-01 15:09
@敏倪smile,,心里哭了，眼睛流泪了，祖国会越来越好，越来越强,0,2019-10-01 15:03
@吃我一记菁也,,@会唱歌的快乐小猫,0,2019-10-01 14:37
@听说我是三千,,就是这种感觉,0,2019-10-01 14:36
@kwonbaey,,哭一上午 上微博又接着哭,0,2019-10-01 14:33
@w_刘洋名,,喜欢欢喜,0,2019-10-01 14:12
@雪碧面条不加糖,,我妈说在我很小的时候，大概我几个月大吧，我家有辆这种自行车，但是后来被偷走了,0,2019-10-01 14:10
@伞下的泪珠,,太感动了,0,2019-10-01 14:08
@舔舔我的猫,,是时代的回忆,0,2019-10-01 14:01
@青木子・周,,今天真的太好哭了,0,2019-10-01 14:01
@洛小狸,,,0,2019-10-01 14:01
@Carpenters49,,虽然不在现场，但在屏幕面前的我已经泪目，这种不可言说喜悦感染着我，中华儿女在这一天同乐同欢笑，祖国母亲我爱您，生日快乐,0,2019-10-01 13:42
@微笑淡然了忧伤,,超赞 现在又看重播,0,2019-10-01 13:41
@你的浅浅,,真的好有年代感,0,2019-10-01 13:35
@入鹿心,,我好喜欢,0,2019-10-01 13:29
@哎哟是10倩,,一边看鼻子一边酸,0,2019-10-01 13:29
@郑大考研宋小剑,,青春期的中国，多浪漫多迷人。,0,2019-10-01 13:29
@LHkaL,,找到了，好喜欢这里,0,2019-10-01 13:28
@Jeannie海外代购,,是小时候的味道,0,2019-10-01 13:28
@高瑞婷diamond,,看哭好几次,0,2019-10-01 13:20
@是谁这么坏唉,,最喜欢这个！！！,0,2019-10-01 13:06
@今天你成精了吗,,我也最爱这个方阵 现代人没有的浪漫了,3,2019-10-01 13:06
@柿子饼198112,,仿佛看到了，一代人专属的青春记忆,3,2019-10-01 13:04
@Leejunyeh,,[I][I][I][I]啊 是青春呀,0,2019-10-01 12:59
@sTaringU,,艰苦奋斗的年代 一只脚踏起的自行车,0,2019-10-01 12:58
@伦家陈18,,这衣服 这自行车 真的绝了,0,2019-10-01 12:58
@Mengjia_R,,@果蔬蓉,0,2019-10-01 12:58
@雨落倾淋,,那些夏天，像青春一样回不来……,3,2019-10-01 12:58
@银河系的肉酱,,眼泪就没停过,0,2019-10-01 12:57
@兔牙姐姐不吃鱼,,最喜欢的方阵 又青春又浪漫,0,2019-10-01 12:57
@蓝water-,,看到这个画面第一想到的就是爷爷奶奶年轻时候的年代,0,2019-10-01 12:56
@夜夏半凉Hugh,,确实很好看,0,2019-10-01 12:56
@奶酪小樱花,,这个出来真的好触动！,0,2019-10-01 12:49
@猫猫狗狗的尾巴,,喜欢他们的裙子,0,2019-10-01 12:47
@-珠珠不是猪猪-,,恰同学少年，风华正茂,0,2019-10-01 12:47
@琪琪到此一游,,真的真的！！,0,2019-10-01 12:43
@莫漓安,,青春洋溢,0,2019-10-01 12:43
@子非鱼Alone,,我不是想哭，我是哭了几遍了,0,2019-10-01 12:42
@-你啧啧,,太美好了,0,2019-10-01 12:41
@jianghuixuanna,,音乐一响起就开始流泪,0,2019-10-01 12:40
@三水猎奇无昔,,真的无敌喜欢这个方阵,0,2019-10-01 12:40
@有幸於你,,太感动了   特别是胡主席一出来看到他头发白了不少  真的震惊到我了  岁月不饶人啊,3,2019-10-01 12:40
@2026夏的那阵风,,中国 我爱你,0,2019-10-01 12:32
@桃花依旧hong,,看了真的是特别感动,0,2019-10-01 12:29
@实现梦想_奋斗,,感动的稀里哗啦！,0,2019-10-01 12:29
@肖战今天我中了,,去了我怕被摔,0,2019-10-01 12:29
@影子kuroki_hikari,,“自行车方阵真的青春又极具浪漫 ，像是新中国的青春期，美好而懵懂，处处都充满着希望，是太阳，是光芒。 ”,3,2019-10-01 13:02
@王阿豆儿_,,花环，二八杠自行车，史诗级的浪漫～惊艳了，阅兵式中的一股清流,3,2019-10-01 13:00
@猪蹄啦啦啦,,咱也不知道这两天是咋了 听主题曲也哭 看电影也哭 看阅兵又哭 我们终于不用竭尽全力的证明我们强 而是轻描淡写肆意挥洒自由和青春 这是属于中国的时代 这是我们的时代 为阿中哥哥努力做个有用的人 未来可期,3,2019-10-01 12:46
@远方一样柴米油盐,,长辈们可能更能感觉到一路走来的艰辛和不易，我爸看哭了,1,2019-10-01 14:33
@女性解放的进程,,接地气的才是感动人心的。,1,2019-10-01 14:04
@克力斯提马,,这个部分真的好赞，好评,1,2019-10-01 13:34
@小溪流是小蜗牛,,我表弟读二年级，看到国旗和国徽出来的时候自己说了一句“我要哭了”，然后我看到了他悄悄擦了眼泪，这个宝贝太棒了,1,2019-10-01 13:31
@still__summer,,不自觉的眼泪就往下流,1,2019-10-01 13:21
@elva陈雪,,80后的青春美好岁月,0,2019-10-01 13:14
@瘦纸胖纸,,他们在天安门广场谈恋爱,2,2019-10-01 13:10
@旖旎5818,,除了大阅兵，最喜欢自行车方队，他提醒我也曾年轻过，虽然我已经五十岁了…,1,2019-10-01 13:06
@道友上酒,,哭的稀里哗啦的。饱经风霜，一路走过来真的太不容易了，中国，我为你自豪！,1,2019-10-01 13:06
@phoenixinsky,,浑身泪点,0,2019-10-02 12:32
@塔院苏大强,,大型违章现场,0,2019-10-02 12:21
@agfjhgfghvj,,国庆阅兵中，最喜欢这自行车篇章……那年代感……青春……浪漫气息,0,2019-10-02 11:31
@狗子哥啊_,,哈哈哈，男的骑大梁自行车，女的跑着,0,2019-10-01 22:13
@hhuala,,自行车方阵真的好温柔，,0,2019-10-01 22:08
@Lavender梁祝,,莫名的就看着画面眼泪止不住,0,2019-10-01 21:52
@前所未有_小渣男,,想起爸妈年轻时候的样子,0,2019-10-01 19:38
@Merci_Cherie,,这段配乐是什么？,0,2019-10-01 18:52
@野猪小美酱,,@_狼嗷嗷,0,2019-10-01 18:46
@云江一梦,,北体的,0,2019-10-01 17:02
@Umybest,,真羡慕这些会骑自行车的,0,2019-10-01 16:57
@我是羡羡的腿毛,,真的，群众游行最喜欢这个part，很青春,0,2019-10-01 16:55
@回忆or奋斗,,满满的感觉,0,2019-10-01 16:54
@一杯玫瑰,,我看到一个小哥哥最后差点被女孩子们围住  挤不出来,0,2019-10-01 16:50
@wyqlfp,,美好少年,0,2019-10-01 16:38
@潇然在路上_,,转发微博,0,2019-10-01 16:34
@是维维S子呀,,最喜欢这个方阵了！,0,2019-10-01 16:24
@嗷Mryang吼,,卧槽，我看到了我高中同学，那个自行车方阵的，好羡慕!!,0,2019-10-01 16:18
@不陌汐酣,,特别喜欢啊,0,2019-10-01 16:15
@yh,,很喜欢看这个方阵的表演,0,2019-10-01 16:14
@馨予颜,,莫名戳中泪点,0,2019-10-01 16:05
@邓伦永远睡不到的女人,,让我想到了五四运动,0,2019-10-01 16:03
@一只桢同学,,我超级喜欢这个方阵！！！,0,2019-10-01 16:01
@铁锤妹妹啊嘤嘤嘤,,我种草了各位小姐姐的小裙子,0,2019-10-01 16:00
@Kobe甘露,,这是属于爸妈的浪漫年代,0,2019-10-01 15:46
@就叫平湖秋月吧,,跟我同事说:我好想穿花裙子骑自行车拍一张,0,2019-10-01 15:44
@究极暗罗刹,,这也太浪漫了叭,0,2019-10-01 15:41
@水镜淑子,,很喜欢这个方阵,0,2019-10-01 15:36
@_兴兴超级酷,,我也是啊，足足有一百多张不重复，祖国的昌盛啊#看阅兵一直在截图#,0,2019-10-01 15:32
@木子奶奶・,,我没有经历过那个年代，也没有经历过先辈们打下江山成立新中国的那一个，我只是一个普通的01年女孩，我看个阅兵一直在哭，此生不悔入华夏，来生还做中国人,0,2019-10-01 15:29
@花熊Flower,,这个地方，车铃响的时候，我就哭了,0,2019-10-01 15:28
@babyAnby,,能理解那种感觉，虽然没哭出来，但就是满腔骄傲激动自豪，眼圈红了好几次,0,2019-10-01 15:27
@原来是小可爱啊1,,在上班的我根本不敢看，哭出来多丢人,0,2019-10-01 15:27
@胖崇崇,,不是感动的想哭，而是已经哭了，哭了好多次，很开心我是中国人,0,2019-10-01 15:24
@加油西柚君,,那句 今生有幸入华夏 一直在哭,0,2019-10-01 15:23
@美好时光14328,,真的看哭了！就在想我的泪点咋这么低！,0,2019-10-01 15:23
@好烦什么昵称都不可用,,啊 我也觉得这个情景式的方阵让人印象深刻 很喜欢 觉得仿佛好像真的回到那个年代 奋发 向上 又浪漫,0,2019-10-01 15:19
@M_见贤思齐焉,,别问！问就是热泪盈眶！在公交车上看个动图都飙泪,0,2019-10-01 15:19
@南风知我意qi,,图三的小哥哥，等等！！带上后面的姑娘,0,2019-10-01 15:15
@1mUrPapa,,尤其是这个上车姿势,0,2019-10-01 15:10
@素年换你瑾时,,我们这一辈人 是父母的自行车上驮着长大的,0,2019-10-01 15:09
@偷腥喵-,,凡是和祖国有关的热搜都让我流泪,0,2019-10-01 15:08
@晴shy,,年代感一下子出来，活泼又浪漫，一出来我爸妈跟屏幕里镜头转到的那群叔叔阿姨一样激动，都在讨论那个时候他们是什么样的，虽然没经历过，但是就是觉得特别青春活泼,0,2019-10-01 15:07
@狗血小公主VI,,奔波在高速上，和同事一起看的。几次都看的我热泪盈眶，但是又怕被同事看见，使劲憋回去。,0,2019-10-01 15:06
@刘小鹏-,,热泪盈眶,0,2019-10-01 15:05
@天越黑__星越靓__,,真的眼泪忍不住的就就下来了,0,2019-10-01 15:03
@夏天还没来呀,,鸡皮疙瘩一身头皮发麻 忍不住想哭,1,2019-10-01 15:01
@风和日丽qq紫罗兰,,又回到年青年代,0,2019-10-01 14:58
@悄悄说话没人听号小船,,我们爸爸妈妈年轻的时候就是这个样子吧,0,2019-10-01 14:58
@神采奕奕的小龙,,我好羡慕这个方阵,0,2019-10-01 14:56
@寒烟浅,,我也是看到自行车这里就好激动啊 就好像自己去经历过一样,0,2019-10-01 14:55
@TimeS-媛,,是青春的气息,0,2019-10-01 14:54
@有梦想的兔兔,,看哭好几次,0,2019-10-01 14:53
@迷妮小酒窝,,我也曾是骑自行车的一员，很赞,0,2019-10-01 14:52
@长沙小酷酷酷酷,,我爱你 中国,0,2019-10-01 14:38
@Zhan琼,,如今的中国已强大起来 我们的国家会越来越好的 繁荣昌盛 祖国母亲 我爱你,0,2019-10-01 14:34
@无知let,,这就是爱吧,0,2019-10-01 14:33
@五彩斑斓的兔,,早已告别自行车年代,0,2019-10-01 14:32
@欢崽呀-,,这个骑自行车的动作特别有年代感,0,2019-10-01 14:32
@林亦今天变欧了嘛,,我太爱这个了，扑面而来的青春气息,0,2019-10-01 14:32
@美小眯iiiiii,,而且音乐也超好听！！！,0,2019-10-01 14:31
@霁晗yeri,,不是想哭，是已经哭了,0,2019-10-01 14:31
@是Zrrrrr啊,,不是想哭 我已经哭的不行了,0,2019-10-01 14:31
@小锅米线hhh,,首先你们要学会单手骑车,0,2019-10-01 14:30
@尼呢泥吖,,我哭了  虽然这个时代自己没有经历过  但看到这样的场面 觉得祖国实在是太强大了 阿中哥哥实在是太厉害了  我爱我的国,0,2019-10-01 14:29
@123微博用户程某某,,青春万岁,0,2019-10-01 14:08
@白鸽与骑士,,才想？我都哭了,0,2019-10-01 14:07
@Amour_大宝,,青春的味道。,0,2019-10-01 14:06
@刚落地的小番茄_boom,,我喜欢的自行车方阵,0,2019-10-01 14:05
@李冰stan,,原来她妈的不是我一个人！,0,2019-10-01 14:00
@你的大宝贝甜蜜饯儿,,爷爷踩了一辈子的“二八杠”凤凰单车. 先助跑几步，再利用惯性起步的细节也是很好地还原了,0,2019-10-01 13:58
@slhrhi-kfj,,北体!,0,2019-10-01 13:55
@向日葵殿下2015,,这些特色方阵从希望的田野开始就感动的热泪盈眶。时代感太强了,0,2019-10-01 13:53
@Velvet_Light,,挺好 就是国外无知的人看到了又要说咱中国竟然还在骑单车了,0,2019-10-01 13:51
@予君知,,真的 我也觉得这个特别好 一出来眼前一亮的感觉！,0,2019-10-01 13:50
@饺子加油鸭,,群众方阵是真的有特色,0,2019-10-01 13:48
@幸福元宝宝,,群众游行真的是感动到我了，他们内心的激动骄傲和幸福我真的感受到了,0,2019-10-01 13:32
@灵灵芝芝草草,,啊啊啊，我的青春年华,0,2019-10-01 13:32
@橙子菠萝糖甜甜,,我哇的一声就哭了出来！风华正茂的我们！风华正茂的祖国！,0,2019-10-01 13:32
@BRAVEchenn_,,今年的创意真好 方方面面 代表了各个组织阶层的人民,0,2019-10-01 13:31
@鸢尾草未开,,风华正茂 这段真的太浪漫,0,2019-10-01 13:31
@阿may不想吃凤梨,,不知道为什么一看就泪目了，我一个21岁的老年人,0,2019-10-01 13:31
@怪拗Sueno,,盛世在，他们便在,0,2019-10-01 13:30
@凌-xp,,喜极而泣,0,2019-10-01 13:30
@小潘潘1030,,都差不多用完半卷纸了  真的 不知道的一种情绪,0,2019-10-01 13:30
@是春岩啊,,这也太80年代的浪漫了吧～,0,2019-10-01 13:30
@Girlfeelingss,,真的热泪盈眶,0,2019-10-01 13:29
@Jane的幸福生活,,一直在哭,0,2019-10-01 13:29
@梦娜娜tan,,我想买辆自行车,0,2019-10-01 13:29
@牛奶味的张大福,,眼泪不自觉就掉下来，一会哭一会笑的,0,2019-10-01 13:29
@锅开心和花喜庆,,我哭了好多次，看了微博又哭了一次,0,2019-10-01 13:29
@学滑板的酷崽崽,,你懂那种感觉吗 我们并没有经历过先辈们打下江山成立新中国的那一刻 但是仿佛就是与生俱来的 一看到阅兵这种特别庄重的仪式我就感动的想哭,0,2019-10-01 13:28
@小馒头140919,,国富民强！！！,0,2019-10-01 13:28
@fjg432哈,,这么大的庆典，有我们的青春记忆，我爱你，中国！青春万岁，祖国万岁！,0,2019-10-01 13:27
@天骄-miss,,真的，尤其老兵所在的方阵一出来，莫名泪目，太不容易了,0,2019-10-01 13:27
@6桃花依旧笑春风6,,这个方阵我太喜欢了。,0,2019-10-01 13:27
@Yoke线,,我哭了两个多小时,0,2019-10-01 13:27
@iroiro-77,,自豪感动,0,2019-10-01 13:27
@从此唯愿江湖不再见,,真的看的热泪盈眶,0,2019-10-01 13:27
@白芍1240,,感觉在看电影,0,2019-10-01 13:27
@楚,,我在现场！坐标北京火车站，每当一排飞机飞过大家一起高呼，鼓掌，大喊祖国加油，我真的感动的眼泪都要流下来,0,2019-10-01 13:27
@糖豆儿龙,,我果然是老了,0,2019-10-01 13:26
@上岸的sj,,已经看哭了,0,2019-10-01 13:26
@金民律是小可爱,,每次看每次哭。就觉得中国人不容易,0,2019-10-01 13:26
@露baby丶,,是的，莫名的热泪盈眶。这一刻同样是,0,2019-10-01 13:26
@一个积极努力的光明女孩纸,,默默泪目,0,2019-10-01 13:26
@TiAmo-XZDAYTOY,,有幸童年时期坐过老式的自行车，小小的细节载着满满的泪点,0,2019-10-01 13:26
@Olivia紫璇,,每次在学校升国旗唱国歌我都想哭,0,2019-10-01 13:26
@爱看书de桑葚子,,一切那么好,0,2019-10-01 13:26
@飞摩哦哦哦,,真的想哭，太感动了,0,2019-10-01 13:26
@Blair-HY,,这次后面的花车很中国！每一个方阵都很独特很有意义，而且真的热热闹闹，就是普天同庆大欢乐呀,0,2019-10-01 13:26
@大shi要发奋,,真的，会看得热泪盈眶,0,2019-10-01 13:25
@天马行空FWL,,我哭了,0,2019-10-01 13:25
@SexyFreeSingleSs,,根本止不住了 好嘛…,0,2019-10-01 13:25
@苓术参甘,,被场上谁掉的一只鞋子吸引，后半场没法专心看一直在找鞋,0,2019-10-01 13:25
@小明家的韦香主,,我也是，不知道为什么，反正就想哭,0,2019-10-01 13:25
@小酌nora,,哭的稀里哗啦的,0,2019-10-01 13:25
@天空下的Qi,,真的是会哭,0,2019-10-01 13:25
@橘子味的小蜜蜂,,可别再说了，都成泪人了,0,2019-10-01 13:25
@H森系女孩H,,真的是感动到哭啊,0,2019-10-01 13:25
@Blues豆子,,漂亮又浪漫,0,2019-10-01 13:24
@小沈小刘美出天际,,加一,0,2019-10-01 13:24
@穿过指缝的岁月,,为什么只想哭，我几乎全程热泪盈眶，眼睛一直湿润，太震撼太感动激动，不懂形容了,0,2019-10-01 13:23
@Blues豆子,,白衬衣、花裙子、自行车,0,2019-10-01 13:23
@lsyzzj,,我也好爱自行车方阵啊啊啊啊,0,2019-10-01 13:23
@七荤八素X,,不是感动得想哭、眼泪不自主的就流下来了、特别感动.,0,2019-10-01 13:23
@长点心--吧,,哇，真的这个车铃声响彻大脑，印象深刻啊,0,2019-10-01 13:16
@傲子玄,,很好奇万一摔了咋办,0,2019-10-01 13:16
@土豆味的橙子,,是北体大的！是北体大的！是北体大的！,0,2019-10-01 13:15
@30号兔子小姐,,立刻就哭出来了,0,2019-10-01 13:14
@的吖,,女排最后出来的时候，眼泪都掉下来了,0,2019-10-01 13:14
@我爱你的距离,,自行车方阵真“青春之歌”，青春洋溢极了,0,2019-10-01 13:14
@刘睿华hua,,突然好想去天安门,0,2019-10-01 13:14
@ASHI91,,外网有些人说中国不好，中国人哪里来的自信，每个国家都有好坏，都有各种问题，我们的自信就是一直坚信我们的国家越来越好！,0,2019-10-01 13:14
@significantly,,看到胡主席白发苍苍突然泪目了。祝福祖国越来越好。,0,2019-10-01 13:14
@淡淡vs翩跹,,当年我外公就是在街上骑着这种单车跟我打招呼，可惜现在再也看不到了,0,2019-10-01 13:14
@phoenixinsky,,浑身泪点,0,2019-10-02 12:32
@塔院苏大强,,大型违章现场,0,2019-10-02 12:21
@agfjhgfghvj,,国庆阅兵中，最喜欢这自行车篇章……那年代感……青春……浪漫气息,0,2019-10-02 11:31
@狗子哥啊_,,哈哈哈，男的骑大梁自行车，女的跑着,0,2019-10-01 22:13
@hhuala,,自行车方阵真的好温柔，,0,2019-10-01 22:08
@Lavender梁祝,,莫名的就看着画面眼泪止不住,0,2019-10-01 21:52
@铃铛里的叶子,,又看到这个热搜了，当时看到这些方队的时候，我以为我穿越回了90年代。,0,2019-10-01 21:28
@前所未有_小渣男,,想起爸妈年轻时候的样子,0,2019-10-01 19:38
@Merci_Cherie,,这段配乐是什么？,0,2019-10-01 18:52
