User,Reter,Comment,Votes,Time
@千与,,po下你的衣柜 想康康,286,2019-09-19 09:13
@长安又满城雪啊,,月月穷年年穷,4662,2019-09-18 18:20
@少女怀春Aaa,,柜子都满了然后扔衣服腾地儿买,3697,2019-09-18 20:31
@沙雕萌鹅,,一年就几件选手有无,2568,2019-09-18 18:21
@神奇的咚咚33锵,,一天换两套衣服，季节过了，衣服有的还没有穿过,2402,2019-09-19 00:15
@习惯就好95785,,同一个款式的衣服几个不同的颜色都买回家,1311,2019-09-19 00:17
@日常甜分,,姐妹们我们要不要搞个衣服闲置群鸭,535,2019-09-19 10:11
@十里无你・,,应该是天天都感觉缺衣服,1192,2019-09-18 18:23
@梦中故事・,,穿衣服的时候最好看  穿两次就成了旧的 再买新的 死循环   第一次手洗 后边全扔洗衣机,768,2019-09-19 00:27
@少女淼Miao,,大概是这样吧 评论配图,233,2019-09-18 18:28
@BabyCattttttt,,一个柜子里全部都是我的衣服。所有能放的地方都是我的衣服。,278,2019-09-18 18:51
@Czztop,,姐妹们我们要不搞个闲置群？,190,2019-09-19 07:57
@_DaisyxUe,,我妈天天说我衣服比服装店还多， 但其实我每天还是没有衣服穿,286,2019-09-19 08:01
@多肉葡萄没有肉,,就是自己感觉我明明一直没有买衣服,190,2019-09-19 07:51
@山月不知心底事T,,我想问又能买衣服又能吃的女生什么体验,147,2019-09-19 00:24
@ytw7991,,从刚开始衣服只能存活一个季节到拍过照就不想穿了,124,2019-09-19 07:22
@不爱聊天-,,上过镜的都不能穿了,106,2019-09-19 09:58
@李小丢575,,恕我直言 本人无此体验！,107,2019-09-18 18:33
@aaaaaaqc-,,衣柜一点位置不剩 剩下的新买的扔床上也快成山了 主要是有些旧衣服很好看也舍不得扔哇,97,2019-09-19 03:27
@乖孩子面壁去,,寝室柜子被我装满后开始自己买小箱子装衣服，也装不下了以后开始买编织袋装衣服，我室友都喊我不要买了，地方都被我占完了,57,2019-09-19 00:31
@WheelCheung,,数了一下，但是日常连衣裙都100多件……还没算上礼服和半身裙……,48,2019-09-19 00:24
@雍禾植发刘洋,,也就刚买的那几天觉得自己有衣服穿，新鲜劲过了还是一整个衣柜都挑不出一件能穿的，继续买买买,58,2019-09-19 10:23
@漫漫看天,,我从来都不觉得自己买衣服买到满足过,47,2019-09-19 01:26
@Rhea_xxysel,,拿出去年标签还没拆的衣服,47,2019-09-19 10:08
@CrazyM君,,哈哈，大概是衣柜堆不下，还整天觉得自己没有衣服穿吧。。女生岂止是太能买衣服，护肤品啊小饰品啊，总结下来，女孩子对美的东西永远都是无底洞,42,2019-09-19 06:30
@今日宝藏,,衣服永远比衣架多,23,2019-09-19 14:40
@是你的易只烊啊,,同事问我为什么可以一周衣服不重样,35,2019-09-19 10:15
@窝爱呢,,感觉没有衣服穿一直买买买,35,2019-09-18 18:22
@Cjin的玄学7和七,,有姐妹像我一样的嘛……出门旅游必逛商场必买衣服。,30,2019-09-19 09:14
@阿梦阿v,,一直买一直不知道怎么搭配,22,2019-09-19 00:13
@喊我兔牙,,没有穿过第二次,16,2019-09-19 00:29
@小白qianqian,,康康我的小裙子啊 评论配图,15,2019-09-19 11:09
@山山有点酸,,只要拍过照 衣服基本是陈放了,12,2019-09-19 09:59
@七分肉感-,,穿过一次拍过照片就不穿了,7,2019-09-19 10:05
@秦秦楚楚伊伊,,一降温就搞手脚不赢的买买买,12,2019-09-19 00:48
@机械设计clong,,哈哈哈 月光呗,9,2019-09-18 18:25
@shy努力努力再努力,,买很多穿的就那几件,9,2019-09-19 10:44
@玖梦酱,,在？看看衣柜 评论配图,12,2019-09-19 11:15
@檬瓜酱,,翻到去年买的好多衣服吊牌还没剪,8,2019-09-19 10:14
@那样的雪,,不管买多少她们都会觉得没衣服穿,8,2019-09-19 09:05
@我的奔奔是天狗,,@GIngerSugark @Otto0220,0,2019-09-19 08:45
@甜心糕圆圆,,全是衣服,13,2019-09-19 02:55
@糖炒小星球,,每到换季整衣柜的时候都要疯掉,8,2019-09-19 10:47
@咬你了哦,,大概就是这样 评论配图,4,2019-09-19 11:25
@月初光美少女,,隔半个月就要买衣架……,5,2019-09-19 08:34
@张珂Sarina,,@王可CoC 男朋友天天说我臭美,0,2019-09-19 04:04
@猪猪耳朵-,,每次扔掉的衣服基本都是新的,3,2019-09-19 11:24
@莹莹不是胖子,,光是半身裙这个夏天我就买了30＋件,3,2019-09-19 11:23
@慕知音,,放咸鱼清，然后再买,3,2019-09-19 10:35
@追剧小神棍,,年年新风尚 比如今年就是这种oversize风格呀~ 评论配图,1,2019-09-19 10:14
@城上清笳城下杵,,昨天收拾衣柜发现还有好几件没摘牌的裙子 可是夏天已经过完了 ,3,2019-09-19 09:27
@姜少侠丶,,像吸毒一样？有瘾！看着了就得买，不买不行,5,2019-09-19 09:57
@乾坤大挪移闪到小蛮腰zzz,,@七英清_,1,2019-09-19 00:27
@陌小七1110,,一直买一直穷一直穷一直买,4,2019-09-19 00:27
@贪玩又贪吃的小瘦子_xO,,连续三个月衣服不重样…,1,2019-09-19 15:53
@ELF_hee,,请问大家可以在这条下面分享一下自己的宝藏店铺吗？我真不知道买什么？感觉大家都好会买,0,2019-09-19 13:42
@blingbling-ba,,刚下单又退款了,0,2019-09-19 11:42
@rrrrrrrrrrrrr睿睿崽-,,满衣柜的衣服都是带标签的 每天衣服不可能重样 甚至一天换两套 家里 北京的家 哥哥家 姐姐家 男朋友家 到处都是我的衣服也放不下 每年好几次打包好多衣服送姐姐 送朋友 捐出去 基本全新 然而还是每天在买 不买衣服是不可能的 再难受也要买衣服 如果现在停止购买 现有的新衣服至少还够我再穿五年 查看图片,1,2019-09-19 11:35
@一颗行走的种草君,,说时迟那时快。。刚刚又剁手买了三件卫衣,2,2019-09-19 11:18
@哥哥雪_Marzel,,给女朋友收拾衣服，明明只有三分之二个衣柜，但是拿出来堆满了整个宿舍。,3,2019-09-19 10:44
@杭州电子科技大学知名废物,,我的已经买了三件羊毛大衣两件卫衣一件薄外套一条围巾一双鞋就等着过冬,3,2019-09-19 10:01
@LirAnXXX,,一整面墙大的衣柜，把门挤得掉下来了……,4,2019-09-19 01:54
@爱情的帅气骗子,,@火锅芝士和你我都爱,0,2019-09-19 01:13
@菁菁张,,穿着拍过照的衣服就不能第二次上镜了 永远都是新的最好看 穿过两次后就又没有新衣服了 就陷入了没有衣服穿的死循环 结果有的衣服标签都还没拆,2,2019-09-19 16:15
@熬夜冠军jjy,,不瞒你说，我姐妹们都不逛街了，改来我家挑衣服了,2,2019-09-19 13:13
@大花洒本洒,,穷 于工资而言我就是客栈般的存在 她是我的过客,2,2019-09-19 13:00
@橘稚Cynthia,,收拾完衣服 “诶？我多了几个衣架！我得买几件衣服把它挂满！” 逛完淘宝待发货*n “呀，衣架不够了我得再买一点” 买衣架*n “诶？我多了几个衣架！我得买几件衣服把它挂满！” ...... 评论配图,2,2019-09-19 11:11
@瘦的bamboo,,有人出闲置吗 我们组个群呀 别人的群满了,2,2019-09-19 10:45
@糖美咩,,闲置、送人、扔掉的衣服堆里好多都全新带着吊牌,2,2019-09-19 10:18
@TT-布兰妮,,只要是自己看对眼的衣服都会买，各种款，有些穿搭起来繁琐一点的衣服买来也就穿一两次太麻烦，最后穿得最多的还是基础穿搭风格,2,2019-09-19 10:14
@嗑瓜玩家,,大概感受一下,3,2019-09-19 10:13
@大杯乌龙奶茶去冰加波霸七分糖,,女生买点衣服打扮自己怎么了？,2,2019-09-19 10:09
@o林崽崽o,,穷的一批,2,2019-09-19 10:05
@blingbling爱买买啊,,永远都在清衣柜,2,2019-09-19 09:59
@工一乙,,变穷了！,2,2019-09-19 00:59
@小小咩yy,,哎 评论配图,1,2019-09-19 17:12
@闷声做大事-,,漂亮衣服买了一堆没机会穿，天天穿t恤。,1,2019-09-19 15:46
@亓岁_,,嘻嘻我同事说就没看过我穿重复的衣服,1,2019-09-19 15:35
@小雪糕的小话筒,,昨天刚被姐们谈话了,1,2019-09-19 15:34
@关你屁事儿呗,,只是夏天的很少一部分,1,2019-09-19 15:24
@开心也太自律了_,,没地方放衣服,1,2019-09-19 15:18
@金棣棠,,那真是太爽了 一大爱好帮女生挑衣服,1,2019-09-19 15:03
@Mmmm______,,我去年夏天买的衣服还都没拆吊牌 买过的衣服也根本想不起来 所以每天都不知道穿什么,1,2019-09-19 14:39
@无与伦比SJAY,,衣柜里有很多衣服袋子没打开，去年这个时候买的衣服还没拿出来，已经不喜欢了！,1,2019-09-19 13:01
@谭雨璐,,从来不穿重复的衣服,1,2019-09-19 12:41
@Marlene-DAYTOY,,钱都花在了衣服包包化妆品和鞋子上,1,2019-09-19 12:29
@开心小杨yi_,,大概是每天都觉得没衣服穿～,1,2019-09-19 12:28
@刘艺烊,,我可以不吃不喝  但是不能不买衣服,1,2019-09-19 12:14
@MMMqq-,,@S-sudo,1,2019-09-19 11:52
@汤珊Honey,,快递都来不及拆,1,2019-09-19 11:51
@糖糖就是于失业,,真的没衣服穿,1,2019-09-19 11:51
@miss耶耶叶,,同款n个色都买，优衣库女孩，我,1,2019-09-19 11:51
@世界第一懒r,,天气都变冷了夏天买的新衣服还没穿遍,1,2019-09-19 11:49
@小琳Brynn,,总感觉我的衣柜少了好多衣服，到底少什么呢，买了还是少,1,2019-09-19 11:47
@紫薯奶黄包_,,hhh学校所有取快递的站点都认识我了 每次都不用说名字 直接刷脸,1,2019-09-19 11:45
@李辣辣儿,,我的衣柜太满了吧 评论配图,1,2019-09-19 11:32
@YoCky_阿芙,,宿舍衣柜因为衣服多塌了………我却还每天都觉得没衣服穿,1,2019-09-19 11:22
@Kinoko_渡x良生,,每年都要捐好几个纸箱的衣服,1,2019-09-19 11:16
@东方若曦177,,是我本人了,1,2019-09-19 11:16
@呼呼一只猪,,一件衣服只穿一次,1,2019-09-19 10:59
@Ireyas,,看我微博就知道了,1,2019-09-19 10:55
@今天你换衣服了吗,,满柜子的衣服还是觉得没衣服穿,1,2019-09-19 10:50
@__StubbornSoul,,拉个闲置群有人来吗 卖衣服就别来啦,1,2019-09-19 10:44
@_ikun的小迷妹,,因为胖要买一波衣服，因为瘦要买一波衣服,1,2019-09-19 10:44
@田阿甜甜,,现在衣柜里还有没上身的新衣服,1,2019-09-19 10:43
@-胖儿头鱼,,省饭钱为了买买买,1,2019-09-19 10:39
@甜溺owo,,才刚开学我就穷了,1,2019-09-19 10:37
@有钱少女呀,,搞个闲置群怎么样姐妹们?,1,2019-09-19 10:26
@德纲的黑鹿方,,吊牌还没拆已经换季了,1,2019-09-19 10:23
@没有饭吃的伤心辣条,,柜子永远不够用 快递路上永远有衣架,1,2019-09-19 10:22
@唐十七BF丶,,整理衣柜的时候想掐死自己,1,2019-09-19 10:20
@稀粥的软软,,看了评论 果然只有我是穷人,1,2019-09-19 10:16
@fangf放,,在家衣服需要装进行李箱,1,2019-09-19 10:14
@今天为张颜齐着迷了吗,,衣柜装不下,1,2019-09-19 10:13
@酒窝骗子别骗我,,衣柜放不下呗，衣架不够用呗,1,2019-09-19 10:12
@哇偶Berlin,,就算衣柜都满了还是选择继续买  每天打开衣柜的时候还是觉得自己没衣服穿,1,2019-09-19 10:01
@少女心呐i,,一天内只要出门就要换不同的衣服,1,2019-09-19 09:57
@消了个停,,不买衣服就觉得自己要裸奔了,1,2019-09-19 09:31
@北长尾山雀-,,宿舍里面空间有限  但是我的衣服还是堆满了三个行李箱和一个大衣柜,1,2019-09-19 08:46
@没想法的胖咸鱼,,上班绝对不穿重复的衣服    重复的话要考虑很久   换个搭配,3,2019-09-19 08:04
@___Konie,,所以我就开始自己卖衣服了，可以拿好多好多衣服穿,1,2019-09-19 07:29
@雯雯今天发微博了没,,破产三坑啊,2,2019-09-19 07:05
@是只发福蝶,,@汪七七七,1,2019-09-19 01:39
@气鼓鼓的气鼓鼓的鼓鼓,,这两天搬家衣服装了六大袋子！那种搬家用的大袋子！,1,2019-09-19 01:22
@小帅杨y,,换季就得买衣服,1,2019-09-19 00:53
@草莓橙子猕猴桃-,,夏天已经结束了，吊牌还没有拆完,1,2019-09-19 16:39
@WLL515,,两套衣服换着穿一个夏天,0,2019-09-19 16:03
@玉面浪里小白马,,店主劝我过两天再来,1,2019-09-19 15:55
@0818Liang,,说吧你们买衣服的店铺名字发给我,0,2019-09-19 15:47
@CarissaJones,,这题答不了，我是真的没衣服穿,1,2019-09-19 14:51
@迟小池-soso店,,最后开了一家服装店,1,2019-09-19 13:42
@诗诗崽o,,因为衣服太多,1,2019-09-19 13:38
@A夏天ing,,去年生日，学生给我写的贺卡里说，老师，你的衣服也太多了吧，每天不重样,1,2019-09-19 13:33
@易烊安安安安安,,看到有眼缘的就想买，买了又不穿,0,2019-09-19 11:13
@孙小倩呀08256,,每天买…有两家固定上新店铺，都是每个月上新两次，每次必买6件左右，昨天刚在其中一家买了11件，都至尊vip，还有其他的就是搜一搜看一看，喜欢就买，很多衣服穿一次就扔了，我家保洁把我衣服给她儿媳妇儿和儿媳妇儿的朋友们,0,2019-09-19 11:07
@今天索隆迷路了吗_,,穿着三千多的裙子喝超市的特价酸奶,2,2019-09-19 10:59
@9号同学呀,,衣服永远都有，就是没有刚买的时候这么喜欢，还越看越穿越不顺眼，然后又买,0,2019-09-19 10:54
@开心开开心心每一天,,我是换季了买两套衣服不过还不穿，放着留着出去玩的时候穿有时候看看就不想穿了还想买，我妈都讨厌我这样,0,2019-09-19 10:22
@chx哟,,两百多个衣架的置物架，两个250l的大收纳箱，外加两个120l的小收纳箱。,0,2019-09-19 09:47
@W-热心市民王同学,,@Seaccc- ,0,2019-09-19 09:37
@Porunacabeza2333,,@拯救发际线的脱发少女 是你了,0,2019-09-19 08:31
@娃娃姑娘呀,,@鹿头上的逗点 来回答,0,2019-09-19 07:43
@百分之百的天空,,上了两个月班，买了快2k块钱的衣服,0,2019-09-19 07:08
@清醒璐,,总觉得太早买秋装也没得穿 好不容易熬到了立秋 马上买了十件 结果到现在都没得穿,2,2019-09-19 06:16
@一杯牛奶农,,每买的一件都是我的心头肉 穿不过来也不想闲置,1,2019-09-19 10:09
@周杰伦等你下课哦,,衣柜放不下＋穷,1,2019-09-19 10:05
@梨味的梨,,这个衣服我可以不穿！但是我必须要有！我天天挂衣柜里看着我也高兴,2,2019-09-19 09:59
@温温与酒与猫不语,,自己逛街可以半个小时买四件,1,2019-09-19 08:13
@冲浪路过---,,比如说衣服脏了，没换洗的衣服了，首先想到的是买衣服，而不是洗衣服,1,2019-09-19 07:58
@长乘九九,,,1,2019-09-19 01:23
@爱吃芝士的七柒,,月月穷，再穷都还要买,1,2019-09-19 00:36
@混混日大魔王,,我和衣服一起睡觉,1,2019-09-19 00:27
@邱王木木是双鱼座呀,,感觉家里被衣服淹了 每天还不知道穿什么,0,2019-10-06 17:29
@今年改什么呢,,@Sprit-E1 看评论,0,2019-09-19 22:30
@徐以叙,,暖暖？,0,2019-09-19 22:17
@innnnnnnG,,怕失眠，一失眠就买买买,0,2019-09-19 21:10
@冷暖分人,,@是喵喵呀y 进来回答,0,2019-09-19 20:11
@吾见禅骨枯,,图片评论 评论配图,0,2019-09-19 18:16
@一颗跳跳糖喵喵,,其实到了公司就要换统一的服装，可是上下班的半个小时时间还要穿自己的衣服 ，每天也就早餐时间去停车场的时间能秀一下衣服包包，然后还要每天不重样的换…,0,2019-09-19 16:49
@一颗跳跳糖喵喵,,每次换季不是在扩充后宫，而是在重建后宫，好像去年这个时候是裸奔来的……,0,2019-09-19 16:45
@_Kkong-,,不能逛街 陪别人买衣服 自己整了几件,0,2019-09-19 16:39
@嗝儿_I,,为上班提供动力......,0,2019-09-19 16:38
@柠檬你个思密达lr,,衣柜快关不上了 支付的时候才发现花呗额度不够了,0,2019-09-19 16:37
@番和,,看了大家的衣柜 我觉得自己根本没衣服穿,0,2019-09-19 16:32
@Miokuu-701,,我衣服太少了！衣柜太小了,0,2019-09-19 16:28
@阡妍呀,,越来越好看,0,2019-09-19 16:15
@庆山的墨脱,,因为没穿过搁置了，整理衣柜的时候费劲脑汁想这谁的衣服,0,2019-09-19 16:07
@小狮子麦琪,,就是去年买的新衣服没穿完 今年拿出来穿,0,2019-09-19 16:05
@__宁XX_,,闲鱼上挂满了衣服,0,2019-09-19 16:00
@由南・,,我来答题了！今年夏天的格裙～ 评论配图,0,2019-09-19 15:59
@小千与,,哈哈哈哈千与,0,2019-09-19 15:59
@吾悦有个易小咪,,衣服都保护得很好，需要一个30平的衣帽间才能装完。一个月的衣服都可以不重复,0,2019-09-19 15:57
@刍隹田,,买是买的多 但是好比短袖买回来一半还没穿就得穿长袖了,0,2019-09-19 15:57
@阮九酒,,天气冷了啊，该买衣服了,0,2019-09-19 15:52
@Reliable_W,,@堆积在一起 就是有的衣服买回来到现在还没穿过,0,2019-09-19 15:52
@快乐女孩_2019,,一天穿一套一年不重样，甚至有的穿不上，有点吊牌都没拆完,0,2019-09-19 15:46
@月亮有我好看么,,一年到头衣服买了一大堆却还是觉得没得穿 衣柜装不下就把觉得没那个好看了的衣服捐了或者送人 然后继续买,0,2019-09-19 15:42
@一只鱼呀一只鱼,,衣服是买的多，但是穿来穿去总是那么几件…,1,2019-09-19 15:40
@浪子阿邱,,@Neuny  进来康康,0,2019-09-19 15:40
@爱xiao的仙女呀,,就是每天对着衣柜发呆，又没衣服穿了！特别是现在换季的时候,1,2019-09-19 15:39
@TTTTiffanyyy,,每天都在收快递，试衣服中度过,1,2019-09-19 15:39
@大喜宝在路上,,衣服还没穿一遍就过季了,0,2019-09-19 15:39
@可爱味的甜,,就是买了新衣服觉得还要有别的新衣服来配它！但是等我过几天我就不爱它了……我就需要重新买衣服了……,1,2019-09-19 15:37
@王啊眯,,没钱都要借钱买，这是病！,0,2019-09-19 15:33
@雪若卿M,,返利都说我是它旗下下单前十名还说要给我们搞个抽奖活动什么的。。。,0,2019-09-19 15:32
@你看见我的翅膀了么,,作为东北女孩，一天换一套每个季节都有好多衣服临幸不到，唉,1,2019-09-19 15:31
@全全cium,,永远觉得少一件衣服,0,2019-09-19 15:30
@朱一龙的表妹,,穷呗,0,2019-09-19 15:27
@坎侬,,就是有一种钱老是不够花的感觉,0,2019-09-19 15:26
@哦我醒来,,感觉在座的衣服都没我的多。。。,0,2019-09-19 15:25
@暇_~度假ing,,我舍友那样拿麻袋装！！！上次搬宿舍简直要她命！哈哈哈哈哈,1,2019-09-19 15:21
@Hushnowcx,,放不下衣柜,0,2019-09-19 15:18
@全世界最美最瘦的女人,,意味着有工资也相当于没工资,0,2019-09-19 15:18
@咸鱼小姐ronin,,美丽,0,2019-09-19 15:17
@一棵甜柠檬-,,总觉得衣柜缺了点什么,0,2019-09-19 15:17
@圈圈圆圆小妞妞,,恨不得全部买下来,0,2019-09-19 15:16
@M_小馒头,,天天纠结穿什么 不知道穿啥 觉得还不够,0,2019-09-19 15:16
@醉是人生好r,,姐妹们的闲置群～～好没满！快加！ 评论配图,0,2019-09-19 15:15
@圆脸小珍妮,,这题我跟我妈一定要站出来了！不管房子多小，都一定要辟一个房间出来做衣帽间...,0,2019-09-19 15:14
@刘大黑gg,,你们都是卖衣服的吧,0,2019-09-19 15:12
@真的从来不生气,,@MonGkisubi,0,2019-09-19 15:11
@发福的美少女战士four,,总觉得没有新衣服穿,0,2019-09-19 15:10
@今天也要爱着有钱哥哥,,我看见好看衣服就想买，买回来有的不适合自己，但是又特别喜欢，就留着想着以后穿,0,2019-09-19 15:10
@你的柠檬・,,出去吃饭啊 不去  去逛街啊 走,0,2019-09-19 15:08
@你的柠檬・,,拍过照片的衣服就算旧衣服,0,2019-09-19 15:05
@再简单一些-,,虽然衣柜满了但是依旧没衣服,0,2019-09-19 15:01
@取啥名字啊烦死了,,每次家里请别人吃饭或别人家里请吃饭我都觉得没合适的衣服,0,2019-09-19 15:01
@祁朵Keeny,,永远卡里都没钱,0,2019-09-19 14:57
@灵动妖精吖,,lo娘应该有姓名,0,2019-09-19 14:55
@Zmhnjlzmkn,,@Dsysmhgd 看看！,0,2019-09-19 14:55
@Janine-wow,,没钱都想买漂亮新衣服啊，反正也存着页不够买房买车，不如享受这种小小的喜悦,0,2019-09-19 14:55
@木已成山,,@丸鱼墨,0,2019-09-19 14:53
@_Hello迪迪_,,穿过次数多了几次的衣服，就会感觉它好旧好旧好旧好久啊，需要买新衣新生报到调和一下气氛，才会顺眼点，不然感觉真的不爱了，它不属于我也不属于别人的那种feel,0,2019-09-19 14:50
@我和你拼了阿,,四个月没买过衣服了,0,2019-09-19 14:45
@喵爷世界第一,,我买衣服一般就是能穿的穿起来不太丑的全买了……,0,2019-09-19 14:41
@Aha筱彭友,,@garish,0,2019-09-19 14:39
@小金鱼MLML,,要不要搞一个闲置群呀,0,2019-09-19 14:38
@爱十八起点,,反正柜子是放不下了，但是还是嫌弃没有衣服穿,0,2019-09-19 14:37
@阿崽越瘦越开心,,@由南・ 应该献出你的备忘录了,0,2019-09-19 14:37
@咕咕嘎嘎嘎_,,图片评论 评论配图,0,2019-09-19 14:37
@你如熠熠天际,,衣柜里大概还有50多件衣服还没拆标签 买了几个大的收纳箱装衣服 好看的衣服都会忍不住买下来,0,2019-09-19 14:36
@Drinkthasoda,,控制不住自己,0,2019-09-19 14:35
@雪桃儿dp,,倾家荡产的感觉,0,2019-09-19 14:30
@东村大队会计-小王,,不停的买收纳箱，不停的扔,0,2019-09-19 14:00
@陈坤的粉棉袄,,你看另一个热搜，糖果色卫衣 看见的那一刻我就想入一件了,0,2019-09-19 13:57
@更声,,没吸过毒但同样能体会到“上瘾”,0,2019-09-19 13:56
@YuFionaFiFi,,@是周同学啦,0,2019-09-19 13:54
@王大帅_,,新买了衣服，轮到穿它的时候发现过季了,0,2019-09-19 13:49
@密斯王嘉,,喜新厌旧！！！恨不得天天买衣服！！,0,2019-09-19 13:48
@暖心小乔巴,,这题超纲了 下一个,0,2019-09-19 13:46
@Evelyn小明,,总觉得自己没衣服穿其实是衣服太多收起来了就再也不拿出来了然后再买相同的衣服,0,2019-09-19 13:46
@作为游者_,,我的衣服全在椅子上,0,2019-09-19 13:46
@K小憨要做果断勇敢的人儿,,搬家比别人废点劲,0,2019-09-19 13:45
@凄凉永远是生还者的事,,没钱,0,2019-09-19 13:45
@是一只长颈鹿吗_,,大家都是有钱人,0,2019-09-19 13:41
@凡间清露,,简易衣柜被压塌了,0,2019-09-19 13:37
@瑶瑶瑶哦,,啥都能买！不止衣服 看见zfb账单都懵逼,0,2019-09-19 13:35
@失落一季光明,,没衣服穿，没衣服穿,0,2019-09-19 13:34
@齐天大圣不怕紧箍咒,,刚买完新衣服的我穿一次：唉  没有衣服穿,0,2019-09-19 13:33
@呵一气,,衣柜早就炸了，一张照片是容不下的。比如毛衣就能塞满一个柜子，大概一个季节里每天一套，过季了都穿不完，且时常更新地买,0,2019-09-19 13:33
@sekyanlll,,@该,0,2019-09-19 13:32
@萌萌今天欧了吗,,我昨天从衣柜里翻出了一件不知道什么时候买的吊带裙,0,2019-09-19 13:31
@换个名字要疯,,自己柜子装不下了，侵占我妈柜子，再塞不下，扔旧衣服买新衣服。,0,2019-09-19 13:30
@菠萝派兔叽BJT,,导致我柜子里还有一大半的衣服穿都没穿过，甚至我早就忘了它们是什么时候到我衣柜里来的。。。,0,2019-09-19 13:29
@肥柴小王,,买了穿几次拍过照发了朋友圈就不想穿了 衣柜塞不下了也觉得没衣服穿 不穿的衣服也不舍得扔 总觉得这是我花钱买的 扔衣服就是扔钱 可放着也不想穿 好纠结哦,0,2019-09-19 13:29
@一把年纪,,来吧姐妹 评论配图,0,2019-09-19 13:27
@雷雨茜茜,,永远怀疑上个季节的自己是裸奔过来的,0,2019-09-19 13:25
@晋某人呐,,比如我昨天拍视频说买了件牛仔外套，以前都穿男朋友的，打开衣柜发现今年春天也买了牛仔外套，完全不记得,0,2019-09-19 13:24
@是快返拇蠓,,我觉得淘宝里我看上的衣服都是为我量身定做的,0,2019-09-19 13:24
@体坛饮水机,,我每天看到的都是不一样的女朋友 天天不重复,0,2019-09-19 13:23
@淙淙大佬儿,,一天三身换不完,0,2019-09-19 13:21
@Nininias,,不爱买包就爱买衣服每天买，,0,2019-09-19 13:19
@chocolco,,不算还剩多少钱 看中喜欢的就想买 不知道哪来的胆子就很敢买,0,2019-09-19 13:16
@1999-09-05,,明明贼爱买贼多衣服但是穿过一遍就不爱了想全部扔了又没有衣服穿,0,2019-09-19 13:16
@____半个西瓜半个夏,,看评论@yyyyy如果我们不曾相遇,0,2019-11-15 17:45
@超凶滴小蛋黄,,看到什么都想买 ! !,0,2019-10-12 23:53
@超凶滴小蛋黄,,一直处于缺钱中ing,0,2019-10-12 23:52
@小日记末,,每年换季在,0,2019-10-06 22:47
@邱王木木是双鱼座呀,,感觉家里被衣服淹了 每天还不知道穿什么,0,2019-10-06 17:29
@MM易燃易爆炸,,还没换季 换季衣服已经买全了,0,2019-10-02 21:32
@579YSL,,每套衣服一拍完照就,0,2019-09-27 18:39
@____半个西瓜半个夏,,看评论@yyyyy如果我们不曾相遇,0,2019-11-15 17:45
@超凶滴小蛋黄,,看到什么都想买 ! !,0,2019-10-12 23:53
@超凶滴小蛋黄,,一直处于缺钱中ing,0,2019-10-12 23:52
@小日记末,,每年换季在,0,2019-10-06 22:47
@邱王木木是双鱼座呀,,感觉家里被衣服淹了 每天还不知道穿什么,0,2019-10-06 17:29
@MM易燃易爆炸,,还没换季 换季衣服已经买全了,0,2019-10-02 21:32
@579YSL,,每套衣服一拍完照就,0,2019-09-27 18:39
