User,Reter,Comment,Votes,Time
@白日梦太多脑子已内存不足,,别说公众人物，就是普通人闹也要被拘留,0,2019-09-19 13:23
@老人与海的传说,,双方都的注意，不然国家要民主干嘛,0,2019-09-19 13:20
@AdrianHU,,选项2是犯蠢么？,0,2019-09-19 13:20
@Z流火如夏,,是个人都得注意吧？！什么傻问题,0,2019-09-19 13:14
@zzLzsj,,刘露真情演出，真情刘露,0,2019-09-19 13:12
@青木如夏i,,其实我觉得，不管是不是公众人物，都应该注意自己的言行举止。活成自己的样子，更多的是有自己的个性，思想独立，而不是想怎样就怎样。,0,2019-09-19 13:10
@鄂人殷金安今生有你,,现在真的成了公众人物，可惜是反面的！,0,2019-09-19 13:10
@德云社大大大大少奶奶康枕巾,,谁是刘露？,0,2019-09-19 13:09
@老实敦厚的蓝宝,,您可以活成自己的样子，不过后果您要自己承担,0,2019-09-19 13:08
@菲涅尔的肺,,现在很多狗过马路都走人行道了,0,2019-09-19 13:08
@小罗的记账本,,但是这件事未免也太放大了，不知道的，还以为这个女的范了十恶不赦的事情,0,2019-09-19 13:08
@小罗的记账本,,是需要注意,0,2019-09-19 13:07
@g心之智,,先做人 再学艺,0,2019-09-19 13:07
@CXTtonn,,这也配称为公众人物吗,0,2019-09-19 13:07
@姜南子,,是个人就该活得体面一些,0,2019-09-19 13:06
@秦瑞繁34763,,一个都没有听过的明星，估计是炒作，想红吧！！,0,2019-09-19 13:03
@大铁棍子医院童主任,,前有曾铁可后又出这么个货，怎么线数越高越上天是吗,0,2019-09-19 13:01
@渐忘时空,,任何人都要注意。公众人物包含在内，怎么能不注意??,0,2019-09-19 12:54
@梦雨夜思,,他算啥公众人物,0,2019-09-19 12:47
@猪猪妹子,,她已经凉凉了,0,2019-09-19 12:46
@小象LXJ,,一定需要，作为一个明星，就要有个人素养，如果没有，那么请退出娱乐圈,0,2019-09-19 12:44
@苏木-浅浅,,我觉得 做自己就好，市场自会给予评判和教育。,0,2019-09-19 12:43
@腐18,,散了散了 让她人生中最红的时间在狱中度过 出来接着默默无闻吧,0,2019-09-19 12:42
@hoolwei,,公众人物负能量会给人一种负能量流行的错觉,0,2019-09-19 12:38
@爱沙龙发型设计,,做错事情就道歉，有用吗,0,2019-09-19 12:32
@废纸工程师,,活成自己的样子也得遵纪守法啊,0,2019-09-19 12:30
@雨灬点灬儿,,跟公众人物没关系，即使是个普通老百姓，也要遵守法律法规,0,2019-09-19 12:30
@1号投手上杉,,能不能不要再发这种低级炒作了,0,2019-09-19 12:29
@你那么美你那么魅,,新京报怎么发出这么白痴问题，还投票呢,0,2019-09-19 12:22
@_木曼_,,这已经不是注不注意的问题了，而是文不文明的问题。每一个人都不应该作出违反法律规定的行为,0,2019-09-19 12:19
@心向太平l,,今天把某没一个名不见经传的人吹捧成人气偶像小鲜肉，过一夜又把他吹成实力舞台王者，歌词还没小学生写的好，唱的歌吊儿郎当，个人行为其实可以用学渣。娱乐就是娱乐庸俗大众，芒果tv找戏做炒作才是内幕。,0,2019-09-19 12:17
@白味-Lu,,不是公众人物也不能这样啊,0,2019-09-19 12:11
@又那么好,,真的是废话发问,0,2019-09-19 12:11
@心向太平l,,芒果tv又一个想红想疯炒作狗，芒果tv怎么总签些张狂的艺人。法制社会，现在某些搞娱乐艺人经纪公司也够狂妄自大点了吧！,0,2019-09-19 12:06
@花花不语vV,,能不要捧她吗 她个纵火未遂犯 算哪个公众人物啊 连个人都算不上,0,2019-09-19 12:05
@喜欢王俊凯的啦啦啦略略略兰,,每个人都要注意自己形象，不论公众人物还是啥,0,2019-09-19 11:59
@啊啊啊我的猫呢,,不管是不是公众人物都应该注意自己的言行举止,0,2019-09-19 11:57
@Simplsaaa,,选二选三的是,0,2019-09-19 11:55
@是王宛不是女宛,,为什么没有雨女无瓜这个选项,0,2019-09-19 11:53
@席丫丫51675,,普通人都得注意何况是公众人物，多培养这帮艺人的素养教育问题吧，太低龄化不成熟不理智这样的艺人真的好吗？真的不怕教坏小孩？,0,2019-09-19 11:49
@Evonne_Vi,,那个公众人物敢这样,0,2019-12-03 21:00
@西瓜6157775582,,周润发过安检都没这么大架子,0,2019-11-16 21:31
@喜欢悠哉独自在Joker,,第一次看见所谓的公众人物对警察说你完了,0,2019-11-10 09:03
@DDFRESH,,谁？？,0,2019-10-22 21:28
@小啊美吖,,像你这种没素质的人还好意思发微博 有什么资格去说别人大闹火车站  请你先照照镜子看看自己什么样吧,0,2019-10-22 02:36
@孙植贤贤贤,,这年头，越是不知名的演员就越喜欢大闹火车站，扰乱公共乘车秩序，滋扰其他乘客。唉，爱洒狗血应该去拍《监狱风云》《古惑仔》呀。建议大家下次再看到这种情况，直接报警处理，寻衅滋事的行为是可以处以行政处罚的。说一下要打人，给把刀能杀人了是吧，有暴力倾向的人必须远离，关起来判刑就老实了。,0,2019-10-19 14:56
@Evonne_Vi,,那个公众人物敢这样,0,2019-12-03 21:00
@西瓜6157775582,,周润发过安检都没这么大架子,0,2019-11-16 21:31
@喜欢悠哉独自在Joker,,第一次看见所谓的公众人物对警察说你完了,0,2019-11-10 09:03
@DDFRESH,,谁？？,0,2019-10-22 21:28
@小啊美吖,,像你这种没素质的人还好意思发微博 有什么资格去说别人大闹火车站  请你先照照镜子看看自己什么样吧,0,2019-10-22 02:36
@孙植贤贤贤,,这年头，越是不知名的演员就越喜欢大闹火车站，扰乱公共乘车秩序，滋扰其他乘客。唉，爱洒狗血应该去拍《监狱风云》《古惑仔》呀。建议大家下次再看到这种情况，直接报警处理，寻衅滋事的行为是可以处以行政处罚的。说一下要打人，给把刀能杀人了是吧，有暴力倾向的人必须远离，关起来判刑就老实了。,0,2019-10-19 14:56
@三日战神-骨灰扬诺夫,,给源子哥整只好烟,0,2019-10-03 19:01
