User,Reter,Comment,Votes,Time
@幽篁君,,自己作自己,79,2019-09-19 10:11
@渡你眉眼与川,,你不闹我还真不知道谁完了,83,2019-09-19 10:11
@一罐笑颜,,还嚣张吗？你完了？,22,2019-09-19 10:12
@Vincialign达芬奇,,反向营销，高，实在是高,20,2019-09-19 10:10
@庸行丶小心丶近思,,这三个我都想选，咋办,8,2019-09-19 10:11
@暴走萝莉克丝,,三个都对啊,5,2019-09-19 10:16
@我此生不肯解连环,,黑流量，脸都不要了，破罐子破摔，令人作呕,5,2019-09-19 10:11
@吴锐同学,,我觉得作为公众人物更应该注意自己的言行举止，更应该遵守各项法律法规，一点点不恰当的言论表现都会给社会和他人造成严重的影响和后果，虽说明星大腕儿也是人也有情绪和脾气，但是身在这一行业拥有超强的承受和克制力才是作为公众人物最基本的心理素质。,2,2019-09-20 10:08
@II空心菜lI,,艺人？拍过一个网剧就能被称为艺人，网友对她是有多宽容,10,2019-09-19 10:41
@不愿透露姓名的老李丶,,通过这个事件，让我知道了：还有这么一个叫。。。叫什么来着,2,2019-09-19 11:25
@我要像蜡笔小新一样快乐,,呵呵让别人丢了工作,1,2019-09-19 10:10
@誓B俊宇,,出大新闻了，能不解约嘛,2,2019-09-19 13:03
@大t精\074,,不解约，留着过年啊！,1,2019-09-19 13:15
@MagallanesCheung,,明星这个词不严谨吧？这只能说演员。明星还不够资格,0,2019-09-19 10:57
@Wendy驼驼,,影视公司还怕少一个艺人吗？作死,0,2019-09-19 14:18
@MeanCoder,,名气不大，脾气不小,1,2019-09-19 13:09
@扎西拉姆・曼茹,,呵呵,0,2019-09-19 12:02
@子媚初晴,,德艺双馨，德才兼备。,1,2019-09-19 10:57
@恒博植发刘医生,,现在才真的是“公众人物”了！实红・・・・・・・・・・・・・・・,0,2019-09-19 10:16
@憨现,,不会做人，注定糊!,0,2019-09-19 10:15
@律师都燕果,,理所应当对自己的所作所为负责。,0,2019-09-19 10:15
@紫罗兰sunlight,,为了火真的是脸都不要了,0,2019-09-19 10:14
@琪雅林雅琪,,人行榕c他人oP不一概而,0,2019-09-19 10:13
@YangD_an,,做人基本都没有了，永远不能公众上。,1,2019-09-19 10:13
@朴猖骥,,就这种人，她能有多敬业？以后真火了，也是耍大牌的,1,2019-09-19 10:11
@刘小强同学想做个读书人,,嗯哼，公众人物？,0,2019-09-19 10:11
@快乐收集站ll,,先做人,0,2019-09-19 10:10
@gbh_930808,,普遍文化水平低,3,2019-09-19 10:19
@杨柏林瑞,,不认识，她的戏一个没听过没看过,1,2019-09-19 12:09
@橘子味的小腮帮,,,1,2019-09-19 10:23
@致良知・道明居士,,现代人浮躁不安,0,2019-09-19 23:17
@楼上看球赛的小王,,这和是不是艺人，没多大关系。不管是谁，首先要先学会做人,0,2019-09-19 22:49
@高知晏,,现在什么阿猫阿狗都可以当艺人了,0,2019-09-19 16:42
@DM吕轻侯,,做自己,0,2019-09-19 15:28
@代号幽狼QinBo,,不得不说芒果台真的是&quot;广罗天下奇才&quot;,0,2019-09-19 15:17
@特雷T稀饭,,活该！,0,2019-09-19 14:36
@越音族长,,请大家捧红我，我要进入演艺圈要红遍网络，我要在娱乐圈里面树立好榜样，我这个人什么都能忍受，脾气很好，很善良，娱乐圈里不应该有脾气暴躁无视法律的人存在，娱乐圈里需要满满正能量,0,2019-09-19 14:19
@奶奶的甜蛋,,年轻一个小女孩，素质太差。不遵守规章制度！口出狂言，影响太不好。这样的演员表演不真实！,0,2019-09-19 12:17
@二次元的小黑狗,,部分艺人真的是满满优越感,0,2019-09-19 12:13
@蓝枫文化传媒,,肯定会唱狮子座,0,2019-09-19 11:55
@1原来我不帅呀,,完了完了这下真的让我知道了一个叫刘璐的人了,0,2019-09-19 11:54
@深蓝色的海23,,不好意思  作为一个宜昌人 这个人没听说过 。,0,2019-09-19 11:41
@小曲[唱,,这回真玩完了。,0,2019-09-19 11:27
@马骝骝骝骝,,艺人就是艺人，用演技赚钱的普通人，都把这些人吹上天了还弄个“明星”这词。,0,2019-09-19 11:26
@坛旺,,这是明星吗？原来不是，现在是了。,0,2019-09-19 11:22
@Slap丶L,,以前完全这人是谁,0,2019-09-19 11:06
@奈绪媳妇儿,,就不能全选？,0,2019-09-19 10:58
@冷艳星语,,恭喜自己把自己做死了,0,2019-09-19 10:54
@gxwoo,,你完了！,0,2019-09-19 10:42
@点点星光lihuafei,,我能怎么看？就是撒泼撒出街上来了……,0,2019-09-19 10:41
@华服是汉服,,我参与了@中国新闻网 发起的投票【你怎么看？】，我投给了“明星艺人学艺前先学会做人”这个选项，你也快来表态吧~,0,2019-09-19 10:40
@画地为牢人,,这会真完了,0,2019-09-19 10:40
@Cherry甜心不婉约,,这人也不能说是演员吧，网红顶多了，都先回家学学做人吧,0,2019-09-19 10:40
@橙花味的阳光,,以被解约的代价，她现在终于知道什么是公众人物了。,0,2019-09-19 10:39
@myself-float,,白白被别人水了,0,2019-09-19 10:37
@守护天使fair,,没红，脾气还大，如果没这件事儿，就算她红了，那得害多少人，就应该解除经纪合约，哪家也别签她，让她消失,0,2019-09-19 10:35
@湖中一小舟,,该，思想道德标准应该放在第一位,0,2019-09-19 10:34
@佛山肯麦,,闷声大发财，高声大作死！成功把自己放在放大镜下，引来大众的聚焦，化为乌有！,0,2019-09-19 10:32
@坚强的小罗归来,,18线小明星的自生自灭,0,2019-09-19 10:30
@小莹子要去何方,,要先学会做人,0,2019-09-19 10:29
@艾斯维尔Syl,,我就奇怪各媒体公众平台什么的，签约所谓工作人员，尤其是“公众人员”的时候，都不对这人进行思想道德政治素质审查的么？只看脸？不审脑吗？（想想香港那群不带脑的废青公务员…）再不然，签约了也要负责多教育培训吧…，难道出事了开除就OK了？我们职工出事了还要追究单位管理责任呢！,0,2019-09-19 10:29
@Mumu-Winters,,谁？,0,2019-09-19 10:29
@不成肌霸不改名,,哈哈哈,0,2019-09-19 10:29
@Z晓舟先生S,,刘露是谁？,0,2019-09-19 10:26
@快活的酋长,,我估计所谓“刘露”也就是艺名吧？能披露此人的真实姓名吗？,0,2019-09-19 10:25
@辉95495,,戏精本色,0,2019-09-19 10:25
@琴棋书画独无画,,不作不死,0,2019-09-19 10:25
@挥霍青春爱你阁,,这还是个艺人？我操我都不认识,0,2019-09-19 10:24
@风和晴天吖,,宜昌东站也跟着火了,1,2019-09-19 10:24
@顺手牵羊步步为营,,嗯！你完鸟！,0,2019-09-19 10:21
@就这样安靖着,,三个都选,0,2019-09-19 10:20
@草莓爱上猫916,,一个十八线不到的不知名的艺人这么嚣张给她成名还得了,0,2019-09-19 10:19
@你如我抓不住的风,,这是谁？不认识,0,2019-09-19 10:14
@魏芷夫,,睡呀?不认识……,0,2019-09-19 10:14
@20160601丫丫,,你完了！,0,2019-09-19 10:14
@软饭硬口乞曹达华,,让人感觉她没有妈的样子,0,2019-09-19 10:13
@大芬儿大芬儿,,先做人后做事,0,2019-09-19 10:12
@警营君,,转发微博,0,2019-09-19 10:12
@清漓茉夏Ritanliya,,现在明星本人的性格和电视角色的性格，就像是得了人格分裂症了！,0,2019-09-19 10:12
@青曼201903,,干嘛呀这是？一天天戏比谁都多？,0,2019-09-19 10:11
@水晶之魔法,,那个公众人物啊就是她啊,0,2019-09-19 10:10
@读云舒墨,,我参与了@中国新闻网 发起的投票【你怎么看？】，我投给了“明星艺人学艺前先学会做人”这个选项，你也快来表态吧~明星X淼目h，~混s。但凡漂亮的的都想M啡Α,0,2019-09-19 16:20
@薇薇最努力,,明星？这也算一个明星吗,0,2019-09-19 16:14
@风月de死神镰刀,,以后可以考虑走网红这条路了,0,2019-09-19 16:04
@风凉H,,这家伙，凉了,0,2019-09-19 14:11
@稚终101,,刘露，芒果TV签约艺人，20岁花季演员，因作品《一瓶压缩气罐的故事》火边大江南北！其参演作品还有 《扰乱秩序的是你不是我》《我是公众人物》《我需要一双袜子》《你完了》等…… 近期正在参演的《派出所五日游》，23号会顺利杀青！ 各位粉丝敬请期待……,3,2019-09-19 14:03
@李要胖儿,,阿猫阿狗都是明星了我也是醉,0,2019-09-19 13:32
@韩叶叶耶耶耶,,哎，真的希望人品不好的不要让他进圈，明星偶像是能有很大影响的人，希望带来的都是积极正能量的影响,0,2019-09-19 13:12
@ice六出冰花,,没有人品，粉丝们还不越学越坏，对于人品不好的人，我很无视,0,2019-09-19 12:24
@紫苏寒月,,我参与了@中国新闻网 发起的投票【你怎么看？】，我投给了“明星艺人学艺前先学会做人”这个选项，你也快来表态吧~,0,2019-09-19 11:19
@稚终101,,滚,1,2019-09-19 14:03
@玫开妍笑,,湖南卫视不要以为简单解约就完事，当引以为戒，深刻反思。,1,2019-09-19 13:38
@556656女侠林香,,不仅演员，所有职业都应该先学会做人，突然好喜欢我高中学校的校训――先成人，后成才！,1,2019-09-19 12:18
@一许彼岸花,,先学会怎么做一个遵纪守法，有素质有教养的人吧。能公然威胁警察，对警察说“你完了”这种话，可见多么目中无人，狂妄自大。规则面前，明星没有特权，公众人物并不是你耀武扬威的保护伞，从艺先从德,1,2019-09-19 11:56
@哈尼不甜,,不解约等着倒闭？？？？这种人也配当明星？,1,2019-09-19 10:13
@一凡得爸爸,,泉州觅鲤文创园多方联合起来诈骗老百姓血汉钱，只因诈骗成本低！坦言只需承担失信人员名单（黑簦，妄图通过法律漏洞逃避法律责任，企图以合法的形式掩盖其非法侵占我等租户财产的非法目的！硬是要把我们老百姓逼上决路！！置我们老百姓性命不顾！求转发,0,2019-10-02 21:47
@太有野性了,,@刘露becky- 欢迎大家去吐槽他去,0,2019-09-24 00:42
@斯人独憔悴mars,,可以学学公开阻碍执行职务和辱骂执法人员的周某伦，倒了歉还能是优质偶像。,0,2019-09-23 12:23
@521honey丹丹,,硬是把喷雾说成气压罐！一个女孩子没事带个气压罐干啥？可能她着急赶高铁情绪有些激动吧 口气也不太好！但也不至于把事情闹着么大！让人以后还怎么在圈子混哟！,1,2019-09-20 15:01
@堰田农夫,,我参与了@中国新闻网 发起的投票【你怎么看？】，我投给了“明星艺人学艺前先学会做人”这个选项，你也快来表态吧~,0,2019-09-20 12:36
@浅景记忆,,这也算明星艺人？来搞笑的吧,0,2019-09-20 11:12
@MaomaxM,,牛露是谁？,0,2019-09-20 10:44
@守得住你,,只对人类发表看法，其他生物一概过滤,0,2019-09-20 10:31
@幽灵薇薇安,,这算什么明星，从来没听过,0,2019-09-20 04:00
@百里悔约,,这素质和情商、智商，要当艺人也是扶不起的阿斗,0,2019-09-19 17:57
@最嚣张的鲲鲲,,这其实是他们拍的综艺节目。,0,2019-09-19 17:49
@章丘检察,,,0,2019-09-19 17:01
@拉菲德堡国际家居生活馆,,没有素质的垃圾艺人,0,2019-09-19 17:00
@冰镇可乐配万物,,还有2368人投(明星艺人人品与演技无关)？？？？？没事吧？就不说明星艺人，首先作为一个人那也得先学品吧？？,0,2019-09-19 16:16
@方脸瑶,,不是作为艺人应该先学做人，无论从事任何职业，都要懂得做人。,0,2019-09-19 16:08
@大城里小憩,,她是没素质,0,2019-09-19 15:30
@太不巧就是ME,,长脑子了么？这都不是个例了，太多太多总跟法规较劲，搞不明白怎么想的呢？演艺路是彻底断了～,0,2019-09-19 15:27
@X-倩miss,,学艺先学德 做戏先做人,0,2019-09-19 15:21
@A_不俞,,真不知道刘露是谁,0,2019-09-19 15:11
@哟系智斌,,我还以为选二的人会多  没想到是一   现在的人负能量还是比较重的   哎,0,2019-09-19 14:59
@妙语30137,,什么明星压根不认识,0,2019-09-19 14:57
@方梓儿,,自作自受，不作就不会死。什么毛病全是惯出来的。还不如一个小孩子懂！,0,2019-09-19 14:41
@谢耳朵xfy,,她是不是不看社会新闻啊，不知道这是什么行为吗？没文化真可怕,0,2019-09-19 14:39
@J安,,我三个都想选,0,2019-09-19 14:21
@考研出国日大洋马,,这个女的的脚很香，我舔过，混合着美女特有的汉香和一些淡淡的酸味和皮革味，让人心潮荡漾，涂着指甲油的脚趾在嘴里翻滚着，舔她脚心的时候我不禁对她说：以后别不穿袜子了，你穿丝袜更性感，她说：快给老娘穿袜，5000块受不起，我反手就是一巴掌“你这是欠抽”,0,2019-09-19 14:20
@我not是歌手2019,,这算哪门子的艺人，根本没看过也不知道她的作品，更不知道这个人的存在好吗？,0,2019-09-19 14:14
@最爱happy肥宅水,,芒果不会选人了吗？那么多美丽的小姐姐。。,0,2019-09-19 14:05
@小可耐和小领带,,还没火就开始作啊,0,2019-09-19 13:52
@Cool庞帅,,必须严肃处理，广电总局必须对芒果TV进行查处,0,2019-09-19 13:51
@你笑我天诛地灭,,还好意思说对方完了，自己先完咯～ 笑死人了,0,2019-09-19 13:51
@拉帝慈,,辣眼睛辣耳朵,0,2019-09-19 13:43
@我在很认真的想昵称中,,做任何职业前首先得学会做人才是最正确的，职业有划分，可做人应该是每个人都应该学到的,0,2019-09-19 13:38
@晗姑娘__,,还没红就凉凉了,0,2019-09-19 13:35
@AI86_,,打自己的脸,0,2019-09-19 13:32
@冰封岁月2017,,朕只是个演员,0,2019-09-19 13:27
@Venus欣囝,,封杀吧，十八线的小小小演员就这么大架子了，万一哪天红了，连车站都是她的了,0,2019-09-19 13:15
@搁浅了lNZ言,,我去，5000块钱一双鞋子！故意说出来显摆呀？故意说出来你的身价很高吗？多少钱身价？？？20岁小姑娘你还嫩了点！不知天高地厚的！谁都不认识你还公众人物呢！你谁呀？张曼玉？还是张柏芝，刘嘉林？他们这些才是真正的公众人物。受人尊重，你算什么公众人物？赚点卖艺的钱就这么牛逼哄哄的这么嚣张？,0,2019-09-19 13:15
@watermelon-zzzz,,就觉得这小姑娘太没脑子了,0,2019-09-19 13:13
@Bridget--Y,,我以为演员都坐飞机呢,0,2019-09-19 13:12
@腐乳也渣,,本来背靠大树不愁资源的,0,2019-09-19 13:08
@小丸子cheers,,这个压缩气罐是干嘛的,0,2019-09-19 13:03
@清风不留白,,这下是真出名，真完了,0,2019-09-19 12:56
@心向太平l,,芒果专出耍大牌,0,2019-09-19 12:55
@心向太平l,,芒果好戏做,0,2019-09-19 12:53
@Americanbeauty1920,,不认识,0,2019-09-19 12:52
@菁Zoe,,有些明星被爆出来又怎样？还不是像以前一样,0,2019-09-19 12:47
@大马哥789,,好来屋，有意和刘路签约啦！,0,2019-09-19 12:44
@Muradil_S_,,现在谁完了？,0,2019-09-19 12:42
@芥菜种R,,这话题名字起得也任性h,0,2019-09-19 12:40
@ok雪一飘,,有毛病,0,2019-09-19 12:36
@把手交与我丶cc,,这让我想起了张大大和沈梦辰,0,2019-09-19 12:35
@阮语侬,,不知道你们有没有感觉，我怎么觉得象吸毒失常一样，建议做下毒测,0,2019-09-19 12:30
@小朋友不准乱说话,,至少现在是知名了,0,2019-09-19 12:25
@jonijiao,,芒果台早干嘛去了@芒果TV,0,2019-09-19 12:24
@manifhvnj,,不作死就不会死，把自己给弄死了。,0,2019-09-19 11:57
@别来教育谢谢不需要,,她这样闹，说这样的话我觉得好尴尬,0,2019-09-19 11:44
@小黑妞GluTotNy,,手误了,0,2019-09-19 11:35
@八宝肥鸭,,德为先,0,2019-09-19 11:24
@The靳,,桶台最喜欢炒作了,0,2019-09-19 11:23
@开会员只是为了改昵称,,艺人门槛这么低吗，最起码的素质都没有,0,2019-09-19 11:23
@想是偷走时间的贼,,公然挑战社会秩序,0,2019-09-19 11:14
@Amy-Z懒人,,身为公众人物，正面形象很重要，既然要吃这碗饭，就把碗端好了，人设不要蹦。,0,2019-09-19 11:14
@爱艺术更爱生活,,国家就是应该大力整治演艺公司和明星艺人！太泛滥了，什么人都能成公众人物！,0,2019-09-19 11:06
@Andy_94211,,本来就是这种18线艺人素质没得说,0,2019-09-19 10:57
@T・一米距离,,第四个选项：根本就不认识这个人,0,2019-09-19 10:53
@红烧排骨Lyu,,像芒果娱乐这种类型的传媒公司 签约艺人之前都不看人品和素质的吗？是不是只要长的好看的身材不错的又有才艺的苗子就都签,0,2019-09-19 10:50
@乘风侠士,,笑话，还以为自己是大明星呀？作什么呀？,0,2019-09-19 10:40
@小君君大本事,,像这种情商不高，智商堪忧的十八线小演员，芒果台迫于舆论压力也能用她呀,0,2019-09-19 10:38
@Augustwillcome,,她不配叫做演员,0,2019-09-19 10:37
@狄更斯的风夜书茶,,这不神经病么,0,2019-09-19 10:35
@贰世元年柒月,,脾气比名气大,0,2019-09-19 10:32
@-Thanx,,难不成是变相想和公司解约的套路？？？哈哈哈哈 不过这么一闹 估计圈里要被黑一圈了 谁还用她,0,2019-09-19 10:32
@风和晴天吖,,演绎之路还没开始就葬送了,0,2019-09-19 10:25
@QuiteYoungcLown,,这不是个例，明星的文化课成绩要求也该上调了，我是亲眼见到曾经在高中就厮混堕胎的人跟风成了萝莉主播也有了人气，你永远不知道你喜欢的明星之前是否不堪,0,2019-09-19 10:25
@慢慢成长的丑小鸭,,这份公告垫脚，应该能配上你5000块的鞋子了。,0,2019-09-19 10:21
@92C94Z,,垃圾哈。没人品,0,2019-09-19 10:16
@幻影似镜,,列入黑名单吧！这样的致歉信哪有几分悔改，都是套路，能不能真诚一点啊，继续拽才符合人设，反正洗不白。这也算是火了一把，都上热搜了，毕竟在这之前还不知道她是谁！,0,2019-09-19 10:15
@A股独角兽,,芒果TV也不是什么好鸟，成天宣扬拜金、炫富、负能量的东西。你崇尚什么样的价值观就会培养出什么样的艺人。,2,2019-09-19 12:24
@甜酒冲汤圆,,还有一个张大大，我湖南人，只想说芒果台真的是垃圾台！,1,2019-09-19 11:05
@多加一份芝士谢谢,,芒果台这个垃圾场,1,2019-09-19 11:04
@月夕花朝xiaoyu,,娱乐圈有模仿效应，不只是对粉丝传播三观，对娱乐圈新人同理，那种人品，或者那种方式火，都会成为没底线或者搏出位的模式。分分钟有人可以放弃底线。,0,2019-09-20 06:40
@星尘幻月舞,,感觉就是为了蹭热度，不然谁认识她,0,2019-09-19 11:49
@疯狂的运转,,解约是第一步，第二步应该要封杀，这涉及到素质和修养，一个所谓的公众人物口出狂言，导致拘留，不封杀她封杀哪个,0,2019-09-19 10:26
@臭臭粑粑麻麻,,芒果台就喜欢找这些没文化，低素质的人,2,2019-09-19 10:20
@一刀一个小屁孩,,是什么让她有那种超越别人的自我优越感？这个值得深思,1,2019-09-19 10:24
@球球说团队,,情绪没控制好，应该是被冤枉了,0,2019-09-23 10:42
@小月亮1226,,明星去掉我可以选择下,0,2019-09-22 12:46
@墨子鬼痕,,公众人物是人，但也是导向，应该注意,0,2019-09-20 00:29
@顺其自然7285513710,,这次全国出名了,0,2019-09-19 22:44
@晓琴兄,,就因为她带黑了那么多明星。。。,0,2019-09-19 21:32
@爱张颜齐啦啦啦,,还没火就凉了。,0,2019-09-19 14:04
@田村美久,,演员？不受次序没公德的戏子而已！别侮辱其他演员了！,0,2019-09-19 13:11
@西儿在看,,这人真的猖狂，不知天高地厚，学校应该对它违法行为进行处理，开除吧！,0,2019-09-19 12:59
@选择快乐66,,卧槽，我头一天知道她还是个人,0,2019-09-19 12:35
@CC老鹰,,因为没钱所以我计较那一瓶防洒 但我就要计较啊 中国太安全,0,2019-09-19 12:31
@如花你很美,,是我孤陋寡闻了吗？刘露是谁,0,2019-09-19 12:12
@邯郸类2952479271,,五千块的鞋很重要,0,2019-09-19 12:01
@朝阳烈土,,这种人是不会认为自己错的，她敢这么做首先认为法律秩序就是儿戏，钱才是万能的，装模做样发个声明就了事。现在的艺人都是这种素质？,0,2019-09-19 11:36
@颦花汀草_56536,,这下真的完了,0,2019-09-19 11:04
@严惩骗子0,,,0,2019-09-19 10:52
@七彩八色九,,把娱乐卷的叫明星、真是侮辱明星这词,0,2019-09-19 10:39
@盈盈199311,,为了骂你我下载了微博,0,2019-09-19 10:37
@予渔鱼娱_86866,,王子犯法，与庶民同罪，但为什么七十年代没有这样安检，是坏人多了？身为中国人，哪个人没在基层组织中，是我们的基层组织不作为，还是他们没办法作为？,0,2019-09-19 10:24
@zf1300,,做人太夸张了，又不是十恶不赦，尊重秩序就行。,0,2019-09-19 10:17
@本已逝去,,不要让群众通过这一斑毁了整个艺考生形象。,0,2019-09-19 10:13
@捕风的laowai,,有没你完了的表情包,0,2019-09-20 23:15
@你的爱咯,,明星有个屁用,0,2019-09-20 08:34
@清清周围,,况且还算不上明星吧,0,2019-09-19 15:45
@The-big-fly,@萌宠贩卖,一坨不知道从哪里冒出来的所谓艺人,0,2019-09-19 14:08
@我在泰国天气晴1208,,这种人叫明星？污辱大家吧。,0,2019-09-19 14:08
@粉象生活APP网购省钱,,爆出来就解约，没爆出来就捧，反正能挣钱就行，管她德行如何，现在不都是这样么,0,2019-09-19 13:54
@如琳心成,,艺人有什么好牛逼的，哪里来的自信高人一等？在古代戏子可上不了台面，如今真正的名门看不上戏子。,0,2019-09-19 13:28
@诺飞亚,,作死没商量,0,2019-09-19 13:21
@王大喵就是喵大王,,我参与了@中国新闻网 发起的投票【你怎么看？】，我投给了“明星艺人学艺前先学会做人”这个选项，你也快来表态吧~,0,2019-09-19 12:03
@晓晓琴琴w,,应该多读书。[加油][加油][加油],0,2019-09-19 11:37
@徐阿卿,,我参与了@中国新闻网 发起的投票【你怎么看？】，我投给了“明星艺人学艺前先学会做人”这个选项，你也快来表态吧~,0,2019-09-19 11:10
@拂晓神剑之星,,哈哈哈哈哈哈，引起舒适,0,2019-09-19 10:25
@静能生慧旗飘杨,,这都什么玩意儿,1,2019-09-19 10:22
@爱神吐槽,,芒果台今后签约可得好好把把脉，不能什么菜都可劲往自己篮子里装，否则一粒那什么毁了一锅汤就得不偿失了。,0,2019-09-19 10:18
@悠闲依然88,,名人没有自我约束，再大的腕“也会丢人现眼演大戏”！,0,2019-09-19 10:17
@啵唧一口小甜饼,,知道自己公众人物还这么嚣张，那不是自己作死吗,0,2019-09-19 10:17
@GA4346,,我参与了@中国新闻网 发起的投票【你怎么看？】，我投给了“明星艺人学艺前先学会做人”这个选项，你也快来表态吧~,0,2019-09-19 10:13
@一凡得爸爸,,泉州觅鲤文创园多方联合起来诈骗老百姓血汉钱，只因诈骗成本低！坦言只需承担失信人员名单（黑簦，妄图通过法律漏洞逃避法律责任，企图以合法的形式掩盖其非法侵占我等租户财产的非法目的！硬是要把我们老百姓逼上决路！！置我们老百姓性命不顾！求转发,0,2019-10-02 21:47
@太有野性了,,@刘露becky- 欢迎大家去吐槽他去,0,2019-09-24 00:42
@一凡得爸爸,,泉州觅鲤文创园多方联合起来诈骗老百姓血汉钱，只因诈骗成本低！坦言只需承担失信人员名单（黑簦，妄图通过法律漏洞逃避法律责任，企图以合法的形式掩盖其非法侵占我等租户财产的非法目的！硬是要把我们老百姓逼上决路！！置我们老百姓性命不顾！求转发,0,2019-10-02 21:47
@太有野性了,,@刘露becky- 欢迎大家去吐槽他去,0,2019-09-24 00:42
@斯人独憔悴mars,,可以学学公开阻碍执行职务和辱骂执法人员的周某伦，倒了歉还能是优质偶像。,0,2019-09-23 12:23
@球球说团队,,情绪没控制好，应该是被冤枉了,0,2019-09-23 10:42
@小月亮1226,,明星去掉我可以选择下,0,2019-09-22 12:46
