User,Reter,Comment,Votes,Time,Count
@浅笑醉今夏,,如果莫雷不解职呢，中国的球迷们，你们能不能有点刚，拒绝NBA，，一场篮球赛，和祖国的尊严，孰轻孰重？让他们知道莫雷这条鱼腥了一锅汤，让所有人不敢抱侥幸心理，挑衅我们的底线,0,2019-10-07 16:30,1
@羡言微,,夷狄不可以中国之治治也。都别气了，赖着你们太把他们当个人了。他们对中国早就双重标准了，只有中国人还想着以德服人感化他们。醒醒吧。德以柔中国，邢以威四夷，真肯受感化，无来由的哪来对中国的这么多的误解是非啊。,0,2019-10-07 16:25,1
@守得云开w,,让他卷铺盖滚  道歉？像钱道歉吧？,0,2019-10-07 16:23,2
@睡前法国人,,这一千多个铁憨憨是在想什么,0,2019-10-07 16:15,1
@我是-周周呀,,如果道歉有用的话还要警察干嘛,0,2019-10-07 16:13,1
@是我恿饲了心,,1.2万憨批狗，国家主权不容挑战。。。。。战起来,0,2019-10-15 11:01,2
@是我恿饲了心,,1.2万憨批狗，国家主权不容挑战。。。。。战起来,0,2019-10-15 11:01,2
@Double贤,,不知道什么时候自动帮我投了个没用，不过我想说:干得漂亮,0,2019-10-14 18:15,2
@艾弗森雪,,我也想投有用，一看评论哈哈害怕,0,2019-10-14 16:11,2
@YasmineYuan,,道歉有用的话，要警察做什么,0,2019-10-14 00:21,2
@一只光光光光光,,没用但必须道歉,0,2019-10-13 14:05,2
@AK-小公主的骑士仙,,没用，但还是得道歉,0,2019-10-13 13:21,4
@天上全是树毛,,有没有用也没用，今天球赛不还是那死出？,0,2019-10-10 23:30,2
@TheKyoto,,道歉有用的话 要警察干嘛,0,2019-10-10 19:21,1