User,Reter,Comment,Votes,Time,Count
@鹿哥依旧酷炫狂霸拽,,我很想知道投有用的那三百多个憨批是怎么想的,869,2019-10-07 15:36,1
@当作人间四月天,,他根本没有道歉。其次，我尊重他的自由，他也应该尊重我们的自由，我们讨厌他也是我们的自由啊。。,478,2019-10-07 15:20,1
@射手格的彼得潘,,第一 :他道歉也没有用了 第二 :他根本就没道歉,444,2019-10-07 15:43,1
@池简栀,,虽然没用，但还是得道歉,145,2019-10-07 15:33,1
@土申申_0726,,没用,59,2019-10-07 15:14,1
@绿兮衣兮1绿衣黄裳,,就算道歉了没用，不道歉岂不是更恶劣,38,2019-10-07 15:47,1
@一坨吴彦祖,,选有用的5000多人是瞎了吗,10,2019-10-07 19:32,1
@小章鱼三三,,把nba一锅端了，以后不许老百姓看nba，如果有谁偷偷看，抓起来拘留！就是要给他们颜色看看，让他们知道没有中国观众，他们球都打不好！钱也挣不到！我们看篮球只能看cba！,7,2019-10-07 16:09,1
@猫咪最爱的兔子,,点赞有用的是港独吗？！,4,2019-10-07 15:52,1
@jajyoyhng,,当然要道歉呀  但我们接不接受是另外一回事，这是我们的自由。,2,2019-10-09 14:30,1
@更好的刍耳儿,,舆论或许可以改变言论但是不会改变一个人，垃圾就是垃圾,2,2019-10-09 09:57,1
@刹那芳小华,,唉，一失手点了个有用，其实我想说的是，有用个屁,3,2019-10-07 17:23,1
@幸福摩天轮jet,,开除 解雇就行了 人家美国籍 道不道歉无关紧要,1,2019-10-07 20:34,1
@张小杰的小丁,,首先，如果道歉有用，那之后将会出现很多个莫雷，其次，他还没道歉呢,1,2019-10-07 18:40,1
@你好臭屁,,他道歉了？,2,2019-10-07 16:54,1
@HttpError410Gone,,那2600个人是休斯顿人？,2,2019-10-07 16:58,1
@青春过往不去,,道歉是没有用的,1,2019-10-10 17:39,1
@昱明卿,,他能发出这句话是不是能从侧面代表他心里也是这样想的呢,1,2019-10-08 18:22,1
@AK-小公主的骑士仙,,没用，但还是得道歉,0,2019-10-13 13:21,4
@I包包,,就算最后道歉了也觉得是被逼的，何必呢？又不缺这么个言不由衷的道歉。抵制nba就完了。,0,2019-10-09 13:16,1
@JA_Makeup,,我都械猛镀绷,0,2019-10-09 09:45,2
@naivewv,,说出的话是真心的 现在道歉绝对不是真心的 滚吧 不原谅,0,2019-10-09 09:35,1
@希希全宇宙最可爱,,没用 ，必须以死谢罪！,0,2019-10-09 09:15,1
@RoRo恋妆,,为什么执着于道歉？强硬的逼迫反而激起世界上那些不明真相的普通民众更严重的反弹！莫雷算个屁，不看，不买，不关心才是最好的方法,0,2019-10-08 18:40,1
@李现是我的心脏,,道歉要有用要他们的上帝干嘛,0,2019-10-08 16:34,1
@你爸比,,我点错了,0,2019-10-08 07:30,1
@耶栎栎,,我参与了@成都高新 发起的【你觉得莫雷道歉有用吗？】我投给了“没用”这个选项，你也快来表态吧~道歉有用的话要警察干嘛，莫雷你最好滚,0,2019-10-08 07:07,1
@A蕊蕊I,,道歉是必须的，不是有没有用的问题！但是他的道歉毫无诚意，我们不接受！！,1,2019-10-07 21:15,1
@一S泡面,,涉及国家主权问题，没有讨价还价余地,5,2019-10-07 20:07,1
@是谁注册走了我的风油精,,不用奢望美国人能一下就理解尊重我们的价值观。我觉得如果能通过一系列官方手段，加上强烈的舆论反响，最终能让他们怕我们就行，怕失去中国的数亿球迷，怕失去庞大的中国市场，怕失去巨大的中国赞助。你可以心里有你的美国价值观，但是我让你不敢表达。将来，从怕到敬畏，再到尊敬，再到理解。就够了。,3,2019-10-07 20:03,1
@钟爱的热爱的,,道歉没用了，哪来回哪去吧,0,2019-10-07 18:45,1
@Koey--冰儿,,没用，但必须道歉！就是选择原不原谅是我们的事，但道歉是必须的事！,1,2019-10-07 17:51,1
@李离梨子,,莫雷是谁,0,2019-10-07 17:43,1
@会游泳的喵哦,,他也没道歉,0,2019-10-07 17:16,1
@小静庄庄,,这个言论自由，说出来这个话，不赚中国的钱就行，那么牛掰，就不要解释，为了利益而强压着低头，心口都不会服，不让他们赚钱就行,0,2019-10-07 17:03,1
@许桉XX,,有没有用他都得道歉 这就不是有没有用的问题,1,2019-10-07 16:28,1
@甜心卉卉酱,,道不道歉是一回事，但我们可以选择不原谅,1,2019-10-09 14:11,1
@潇湘xhj,,为什么没有其他呢？我觉得没用，但是必须道歉,1,2019-10-09 14:06,1
@大爱9只,,必须道歉，虽然没用，我们不接受,1,2019-10-09 13:58,1
@许然,,excuse me,1,2019-10-08 11:18,4
@godess_BJT,,如果在第一时间道歉，我们可能会接受，可惜现在他已经错过了这个机会,1,2019-10-08 09:58,1
@杰5201987,,道歉有用要警察干嘛,1,2019-10-07 19:35,1
@他轻吟,,这叫道歉？,1,2019-10-07 15:47,1
@心恋小仙女姐姐,,滚！,1,2019-10-07 15:40,1
@伯贤媳妇儿__QAQ,,他们外国一直说言论自由，那你看，如果他说的是支持苏格兰独立，不跟英国一起脱欧，又是什么情况，凭什么不拿我们中国当回事？？因为我们太善良了，道个歉就能原谅？？,1,2019-10-07 15:33,1
@Double贤,,不知道什么时候自动帮我投了个没用，不过我想说:干得漂亮,0,2019-10-14 18:15,2
@艾弗森雪,,我也想投有用，一看评论哈哈害怕,0,2019-10-14 16:11,2
@YasmineYuan,,道歉有用的话，要警察做什么,0,2019-10-14 00:21,2
@一只光光光光光,,没用但必须道歉,0,2019-10-13 14:05,2
@天上全是树毛,,有没有用也没用，今天球赛不还是那死出？,0,2019-10-10 23:30,2
@Pandada小怪兽,,都到现在了，还有什么用，怎么想的还没点逼数？,0,2019-10-10 18:07,1
@茶不思fan,,这不是莫雷的事了，肖华道歉都没用,0,2019-10-10 08:17,1
@好名字都被别人霸占去了,,话糙理不糙 你TM不能吃着我们的还骂我们的。,0,2019-10-09 18:06,1
@橘子味热干面,,为啥还有一万多人觉得他道歉有用我呸,0,2019-10-09 16:14,1
@皋城一家亲,,自作孽不可活，这是莫雷和NBA应该付出的代价！,0,2019-10-09 14:28,1
@wapYANNG晓萱,,滚出中国  鬼才接受他们的道歉呢,0,2019-10-09 13:26,1
@羊咩LAY,,我觉得我们国家很自由，该管的管。难道要想某些国家可以持枪就是自由了？？？,0,2019-10-09 13:04,1
@豆芽的妈妈是个小仙女,,点错了,0,2019-10-09 12:58,1
@事先张扬的减肥事件,,没用了，现在大老板接盘，轮不到他了,0,2019-10-09 11:32,1
@长安有故里YL,,一开始直接道歉还行。现在道歉，呵呵。,0,2019-10-09 11:26,1
@图南之翼w,,道歉有用还要警察干嘛？,0,2019-10-09 11:05,1
@川上富江r_,,没道歉。,0,2019-10-09 10:10,1
@你怪我任性,,虽然没用，但还得道歉！,0,2019-10-09 09:48,1
@梦醉华尔街,,有用   因为道歉了也不会原谅他，但是必须道歉,0,2019-10-09 09:32,1
@右看向左,,我选择第三个:有个鸡儿用,0,2019-10-09 09:03,1
@叫我刘浩然,,道歉有个屁用，他应该剖腹自尽,0,2019-10-09 08:33,1
@一诚-阿杜,,先让他口服，再让他心服,0,2019-10-09 08:28,1
@泡菜的咕噜吧啦的心,,道歉也可能就是口头道歉，没必要。,0,2019-10-09 08:19,1
@老太太的孙女,,你们是指哪方面有用哪方面没用啊,0,2019-10-09 08:00,1
@幸梁啊,,此时需要道明寺出场代表发言,0,2019-10-09 05:02,1
@松鼠菲,,其实讲真一句如果中国没有了经济，西方国家怎么可能在中国继续合作，对他们自由的人来说在中国被捆绑着，不是因为市场大他们不削来中国的。。。毕竟制度法律什么都不一样。,0,2019-10-09 04:33,2
@松鼠菲,,他不可能的道歉的。。。因为在西方他们的思想太自由了想说什么说什么，而且背后那么多民众在支持,0,2019-10-09 04:31,2
@L_vtDsD,,有个屁用，哪回不是表面功夫，以前别欺负惯了，现在坚决不行！有本事别赚中国人钱,0,2019-10-09 04:18,1
@Monica眈眈,,我希望他不要道歉，因为我不喜欢我老公总是看NBA 很烦 来来回回就那么几个队 天天打,0,2019-10-09 02:07,1
@李比希希儿,,我投错了,0,2019-10-09 01:38,1
@smile_nm,,这种人道歉也是向钱低头，中国的敌人,0,2019-10-09 00:26,1
@总攻比苏奎,,投有用的九百多近一万人???脑子里都是废料吗？,0,2019-10-08 23:59,1
@不过法考不改名2020,,必须让他痛，痛的难受,0,2019-10-08 23:55,1
@一RG川,,我投有用的意思是说 他道歉能让我们有稍微爽点的作用  其他的作用没有了 想要再次把门打开 可能是想多了,0,2019-10-08 23:48,1
@衣如继往,,莫雷有必要道歉，虽然没啥用,0,2019-10-08 23:19,1
@原嘉昊monliny,,这TM就是一头猪,0,2019-10-08 23:18,1
@Usamonn,,发现损失大了就会道歉吧,0,2019-10-08 23:13,1
@小铺右拐围城,,已经好多年不看nba 了,0,2019-10-08 23:08,1
@notsecretloser,,我感觉不管别人怎么说。。。官方的手段要直接强硬啊,0,2019-10-08 22:59,1
@亲爱吴小姐,,我参与了@成都高新 发起的投票【你觉得莫雷道歉有用吗？】，我投给了“没用”这个选项，你也快来表态吧~道歉有用的话还要警察干嘛？,0,2019-10-08 22:17,1
@笑出人鱼线233,,我感觉我们是不是太玻璃心,0,2019-10-08 21:24,1
@Crush-ywx,,我把你暴揍一顿，然后对不起哦,0,2019-10-08 21:18,1
@石记鞭三饭,,建议他直接原地去世。,0,2019-10-08 21:08,1
@至王小伟,,有没有用，是我们百姓能说了算的？,0,2019-10-08 20:43,1
@柴亚飞,,他不会道歉的,0,2019-10-08 19:57,1
@十一,,我道歉，我手滑点错了。呜呜呜！,0,2019-10-08 19:38,1
@库超人,,道歉有用的话，还要警察干啥,0,2019-10-08 19:30,1
@笨笨向前看,,看了看这个结果，抬头又看了看夜空。。。,0,2019-10-08 19:18,1
@这是一个作到死的女生,,没用 但必须道歉！,0,2019-10-08 18:41,1
@cy-哇塞,,你这个投票也是个脑残,0,2019-10-08 18:30,1
@我的名字里有个萱,,可以滚了,0,2019-10-08 16:31,1
@小冰糖Da,,一个成年人，应该管好自己的嘴。,0,2019-10-08 15:34,1
@一只神经的狍子很讨厌,,讲三国的那个老师说的，中国人其实从来不接受道歉的,0,2019-10-08 15:33,1
@遥清小公子,,道不道歉和道歉有没有用是两回事 首先你得道歉,0,2019-10-08 15:29,1
@黄色派大星-,,没用但是还是要道歉,0,2019-10-08 15:01,1
@小轩窗1130,,它就死就好了，完事。,0,2019-10-08 14:32,1
@魅影-ELENA,,人家言论自由我们不看自由，道歉干啥，跟逼人家似的多不道德！,0,2019-10-08 14:29,1
@樱花树下的蓝色天空,,必须拒绝NBA,0,2019-10-08 14:16,1
@breathlesser-,,首先他没有道歉,0,2019-10-08 13:47,1
@小木08,,他要是道歉，道歉也根本没有真心的  这个莫雷真是垃圾不值得一提起,0,2019-10-08 13:11,1
@鸨爷要重新做人,,虽然道歉也不会原谅他，但是不代表不需要道歉,0,2019-10-08 13:02,1
@赌博的命运,,跪下砘蛟S可以考],0,2019-10-08 12:56,1
@蚂蚁花的你让蚂蚁还啊干嘛要我还,,他没道歉啊   哪里看出他道歉了  他在发表个人观点,0,2019-10-08 12:33,1
@火火赵明明,,如果道歉有用的话，还要警察做什么。,0,2019-10-08 12:32,1
@夕何夕兮,,我只希望他能gun,0,2019-10-08 12:19,1
@陈陈陈陈陈陈陈CHEN_Y,,道歉？在哪儿？我怎么没看到？,0,2019-10-08 12:14,1
@CV-爱心小可,,国家面前无小事，欺负我可以，欺负我的祖国，不行,0,2019-10-08 12:11,1
@怯777,,没必要了，NBA直接滚出去就行,0,2019-10-08 12:06,1
@Diamond_晨醋,,七千多个憨货,0,2019-10-08 11:59,1
@容嬷嬷吓走了冬天暖了自己,,他那个像道歉吗？？？,0,2019-10-08 11:56,1
@璇子闪闪会发光,,人家没道歉，人家只是解释一下,1,2019-10-08 11:45,1
@叽里咕噜几句话,,我觉得他没有必要道歉，就算道歉也不是真心的。他可以有自己的想法，我们也有自己的不理解，道不同不相为谋。不看不听不买不理会就是我们的态度。,0,2019-10-08 11:43,1
@龙卷风吹走了层轮,,道歉有用的话还要警察干什么,0,2019-10-08 11:16,1
@Mr李小阳,,说有用的人都是猪么,0,2019-10-08 11:14,1
@琳的龙哥哥,,道歉有用的话，要警察干什么,0,2019-10-08 11:09,1
@叶湘伦44593,,中国不看NBA，抵制肖华、莫雷，你们看这两个名字真矬。肖华――笑话，莫雷――抹泪。你们就是悲剧结尾，命中注定的。,0,2019-10-08 10:35,1
@三井寿司彡,,不会道歉的，总裁都支持他,0,2019-10-08 09:58,1
@你比七月动人,,第一：就算道歉了，也未必心口合一。第二：他也不怎么想道歉。所以没有必要等他道歉了！,0,2019-10-08 09:48,1
@小娃崽的妈妈,,他哪是道歉啊，跟他老板都只是声明而已，哪里看出道歉了？,0,2019-10-08 09:15,1
@-W-微微而已,,道歉没用也得道歉！,0,2019-10-08 08:53,1
@神奇的胡一刀,,道歉干嘛？直接全国地址美国就行了。中美都在贸易战了，还关心什么莫雷？火箭？？？？,0,2019-10-08 08:52,1
@南W方,,大早上起来没看清，摁岔了,0,2019-10-08 08:09,1
@有家的慧哥哥今天跑火了,,他没道歉好吧,0,2019-10-08 07:45,1
@带风小飞i,,烂泥扶不上墙,0,2019-10-08 07:38,1
@非典型小金牛,,说道歉有用的可以去找美国爹了。,0,2019-10-08 07:36,1
@禁彦不语的咖啡豆,,没用、但有区别,0,2019-10-08 05:43,1
@亲回头看,,我觉得道歉是有必要的，因为首先要认识到自己的错误，不道歉也没事，中国也不可能因为你一个人而放弃一个中国的原则，道歉是对自己的灵魂的救赎，不道歉则是被玷污肮脏不堪的一个不可饶恕的心灵，上帝说，解救你自己的心灵吧，主会善待你的。,2,2019-10-08 02:22,1
@Fall飘,,不好意思点错了,0,2019-10-08 01:21,1
@哆啦A梦和佩奇,,不接受道歉的话，那这件事怎么收场，解雇，并道歉,0,2019-10-08 01:02,1
@鄙人没有感觉,,1.不需要他道歉，道歉也不是他真实的想法。2.我把这个行为视作敌意，不会接受道歉，对敌人没有妥协。哪有被扇一巴掌，说我没想打疼你就过去的事。3. 我是姚明，才支持火箭，姚退役后早就看火箭不顺眼，现在不是不是路转黑，是从黑转到无视，火箭队？武藏小次郎么？,0,2019-10-07 23:52,1
@大猴马,,让他道歉是让他明白他说的不对！道歉也没用是因为他是为了钱，别哔哔说我凭什么认为他是为了钱，他妈的就是为了钱！但凡有丁点脑子的人都不会看不出！,0,2019-10-07 22:30,1
@水瓶座夏天的风74839,,道歉有用的话，要警察干嘛,0,2019-10-07 22:21,1
@一滴水-博江湖,,也许他真的不是有意,0,2019-10-07 21:58,1
@机智boi,,道歉没用，但是必须道歉,1,2019-10-07 21:57,1
@茫茫然的人,,为什么总要搞些这样无聊的民调？有意思吗？,0,2019-10-07 21:51,1
@Ye未央华灯初上,,不接受 必须解雇 永不录用,0,2019-10-07 21:50,1
@鹤九九特别积极吖,,我参与了@成都高新 发起的投票【你觉得莫雷道歉有用吗？】，我投给了“没用”这个选项，你也快来表态吧~中国人要有志气，不看NBA不会死去，不用苹果不会死去，有些超越底线的事情不可原谅。,0,2019-10-07 21:40,1
@小哥学英文,,道歉只是做个仪式，其实他的心就黑的了，他的心已经扎根了,0,2019-10-07 21:29,1
@来来--我是一颗菠菜,,道歉是必须的，不原谅也是必须的。,0,2019-10-07 21:24,1
@wang恶x,,道歉有用还要警察干嘛,1,2019-10-07 21:17,1
@Arch长安,,没用但是要道歉,0,2019-10-07 21:09,1
@地瓜和蜜瓜,,不需要道歉，我们需要他从中国人视野中消失,0,2019-10-07 20:49,1
@支持老中医特靠谱,,莫雷代表自己请不要扯上火箭，甚至nba可以吗？我是个球迷想看球，他个人的言论我不评论，跟工作有啥关系，太霸道了你们，不让我们看球很无耻。这就是天朝的株连九族吗？还是有选择性的欺负外国人……,3,2019-10-07 20:47,1
@米兰是晓琳的真粉丝呀,,让他以死谢罪吧,0,2019-10-07 20:38,1
@因特拉肯水牛,,这不是我觉得，这需要有关部门觉得,2,2019-10-07 20:30,1
@手手可爱吧,,关键他有道歉么？更本没有啊。,0,2019-10-07 20:26,1
@五措,,不不不不不，没用，怎么道歉都没有，还能给我们国旗磕一个不成。就直接让他们的吸金筒子彻底死一个，其他的才能长记性,0,2019-10-07 20:26,1
@小金小金两百多斤,,5000多,0,2019-10-07 20:23,1
@Bo0lean,,哈哈哈哈 既然没用为什么还要求他道歉,0,2019-10-07 19:47,1
@媳妇我是傻蛋呐,,狗雷还要解释说他这不是道歉,0,2019-10-07 19:39,1
@EveningGlow,,没有用,0,2019-10-07 19:32,1
@懒懒的气质,,我希望美国黑人早晚把那帮白皮猪弄下台,0,2019-10-07 19:32,1
@叫我大渣渣吧,,他道歉了吗？？？,0,2019-10-07 19:27,1
@Cxssssssss,,道不道歉都要永远抵制！,0,2019-10-07 19:27,1
@王小虎SYD,,我们真没必要逼他道歉啊，看他不爽直接停止合作就完了。他说什么是他的自由，说错了话他自己会付出代价。,2,2019-10-07 19:24,1
@奉主名求,,道歉有用，要警察干嘛？,0,2019-10-07 19:24,1
@韭菜蛋炒饭C,,我抽他一嘴巴子，道歉有用不？,0,2019-10-07 19:23,1
@七月末的围脖,,即使道歉了也是言不由衷的，何必执着于他的面子活呢。不是发自内心的道歉也没必要强求,1,2019-10-07 19:20,1
@功夫茂,,道歉有用的话要警察干嘛,2,2019-10-07 18:42,1
@Wbaked,,连着两篇没道歉了，晚了,1,2019-10-07 18:39,1
@咩_AKIQerr,,绝对不会原谅！但是，歉必须道！,0,2019-10-07 18:38,1
@路过蜻蜓在这里,,我觉得不需要道歉,2,2019-10-07 18:37,1
@多情的suiyue,,就算道歉了，骨子里还是如此啊，这个是价值观认知问题,1,2019-10-07 18:35,1
@缘亦兰,,就好像打一巴掌 还问疼不疼。这种人真的不能容忍,0,2019-10-07 18:34,1
@低调军哥959,,道歉有用，要警察来干什么,0,2019-10-07 18:29,1
@MY的星语星愿,,他道歉了吗？不好意思，没看出来。,0,2019-10-07 18:26,1
@年少轻狂RZ,,没用，道歉不道歉都无所谓。我根本不在意憨比的看法，我只知道香港是中国的，废青和支持港独的都是孤儿就可以了,0,2019-10-07 17:59,1
@快乐吹星,,4000多个人是憨批么,0,2019-10-07 17:59,1
@Powerful_Kiki,,他都没道歉，谈什么道歉有没有用,0,2019-10-07 17:53,1
@敏敏要瘦瘦瘦,,没用，但必须得道,0,2019-10-07 17:48,1
@零灵凌0,,话既然说了!就要对自己说的话负责!,1,2019-10-07 17:47,1
@没文化不浪漫,,不是所有的对不起都能换一句没关系的，他zz就让他付出代价，我就是他爹我也不能他犯了错说句对不起就原谅他，何况我是他祖宗！如果没有停职等处罚决不能原谅！想想川普说了这样的话然后他说他只代表个人观点，你会原谅他吗？！,0,2019-10-07 17:46,1
@老太太街舞联盟19级练习生桃白白,,3984个脑残？,0,2019-10-07 17:45,1
@你这浓眉大眼的家伙也叛变了,,这是全国废青和有志之士的投票统计吧？,2,2019-10-07 17:44,1
@江西市民刘先生,,火箭队要嗝屁了，哦豁…,1,2019-10-07 17:43,1
@llf881007,,莫雷什么玩意,0,2019-10-07 17:43,1
@安语v,,应该跟劳资滚克美国,0,2019-10-07 17:42,1
@咩某某,,3900？？？能实名一下吗,0,2019-10-07 17:42,1
@dan--,,道歉没有，而且他没道歉,0,2019-10-07 17:42,1
@毒辣辣辣辣,,必须道歉但是没用,0,2019-10-07 17:41,1
@少爱红尘泪,,好,1,2019-10-07 17:41,1
@东楼踏雪,,与其虚伪的道歉继续赚中国人的钱，还不如就一直不道歉，然后圆润的滚开！你有你的自由，我们也有我们的自由,0,2019-10-07 17:41,1
@Miss_Lv__,,这是一种态度,0,2019-10-07 17:40,1
@熙宁_1993,,,3,2019-10-07 17:39,1
@一杯奶茶不加奶谢谢,,没用但是必须道歉,0,2019-10-07 17:38,1
@孤独患者之Kevin,,就大嘴巴子抽，就管用,0,2019-10-07 17:37,1
@忠艾一生-悦飞越高,,道歉有用的话，还要警察干什么！！！,2,2019-10-07 17:37,1
@超级霹雳无敌大橙子,,他道不道歉无所谓，打死他妈就好了。,1,2019-10-07 17:37,1
@黎某人03126,,道歉有用的话，要警察干嘛？,2,2019-10-07 17:35,1
@缘罄泠Jacaranda楹,,首先，他没有道歉。第二，前一段时间的各大牌，到今天NBA事件，如果没有牵涉到自己的利益，我觉得他们不会道歉。第三，我尊重言论自由，但是必须尊重我的国家。既然伤害了我的国家，就必须道歉。第四，国家面前无小事。,0,2019-10-07 17:34,1
@依依妖妖娆娆,,那句话道歉了？,0,2019-10-07 17:31,1
@丶冫氵丶,,篮球是一种美国至上的运动，美国拥有百分之百的运动，中国和其他国家全部是陪衬，提倡这种美国利益最大化的运动，中国是自讨苦吃，应该大力发展足球运动，足球才是全世界的，很多国家都有优秀球员，由于中国中了美国圈套，拼命发展篮球，而不管足球，导致中国在足球上陷入尴尬的局面。。。,0,2019-10-07 17:31,1
@等等等等等等等你妹啊,,开除就好了。,0,2019-10-07 17:31,1
@元旦圆的娘亲,,他道歉有没有用不敢说 但是不看火箭 停止合作有用,0,2019-10-07 17:29,1
@我是30号30号,,道歉有用还要警察干嘛,0,2019-10-07 17:28,2
@经历千万次摇摆才能长大成人,,我觉得这个事情已经不只是莫雷道歉那么简单。而是中美两国的相互试探和博弈了。,0,2019-10-07 17:24,1
@-九月的鸵鸟-,,问题是他没有道歉啊,0,2019-10-07 17:21,1
@momo86102,,道歉不一定是真心实意的…,0,2019-10-07 17:19,1
@KeenKing-,,客观的说是没用，已经造成恶劣影响。但道歉是必须的。,0,2019-10-07 17:19,1
@我要去见Emma,,狗,1,2019-10-07 17:19,1
@CJ-Clarence,,我还是会支持火箭队的，无论你们怎么诋毁他们，毕竟他们是我从小的信仰，他们一次次惨痛失败但又一次次爬起来向梦想挑战，激励了我无数个奋斗的日日夜夜。谢谢你，武藏，小次郎，喵喵怪 评论配图,0,2019-10-07 17:19,1
@根本不想写作业,,他连道歉都没有，我在这投有用没用干嘛,0,2019-10-07 17:18,1
@李俊辰lucky,,道歉有用、要人民做什么,0,2019-10-07 17:17,1
@摘星圆梦m,,。,0,2019-10-07 17:15,1
@喜欢二次元的大龄青年,,道歉有用那还要警察干什么,1,2019-10-07 17:15,1
@坐亭看枫,,道不道歉我们都不可能原谅他，但第一时间道歉了他还有机会包住饭碗,0,2019-10-07 17:13,1
@丶未写完的信,,任何道歉都没用了，无视中国，支持港独，这影响太恶劣了。支持中国篮协，抵制火箭，直至火箭开除莫雷。,1,2019-10-07 17:12,1
@小川同学i,,如果道歉有用的话这世界都得毁灭，他也是为了维护世界和平。,0,2019-10-07 17:10,1
@Fall邱天,,有用，虽然用途不大，但是至少我会舒服一点。,2,2019-10-07 17:08,1
@Gcourt,,只有自己强大了，别人才没屁话。道歉也只是表面功夫，要么就政府发话禁止nba，不然到最后都是真香。不跟以前那些奢侈品牌辱华一样么，一打折立马买买买。自强,1,2019-10-07 17:00,1
@-气质的男人-,,都从这瞎高潮啥,1,2019-10-07 16:56,1
@我要魂穿朱正廷怀中的五百万,,且不说有用没用，我们接受不接受还是一回事，再有，他们并没有真正的道歉,0,2019-10-07 16:55,1
@李伶bei颖lei,,有没有用都要道歉,0,2019-10-07 16:54,1
@燕_yan,,伤害就是伤害了，道歉必须道歉，原不原谅是另外一回事,0,2019-10-07 16:54,1
@LAIqianhui,,咋说呢，应该道歉，但是道完歉反正这话你都说完了，咱也不知道你道歉是真的道歉还是图啥。,0,2019-10-07 16:54,2
@OceanStar丶,,道歉有用的话，要东风41干嘛,0,2019-10-07 16:53,1
@唐三没有彩,,这里不是日本，我们不需要莫雷的道歉，只想让他受到惩罚，做错了事总要付出代价，虽然他是一个美国人，但很抱歉我们中国人不高兴了。,0,2019-10-07 16:53,1
@一只坚强的女汉纸,,他必须道歉！但绝不原谅！！,0,2019-10-07 16:49,1
@花心小萝卜XX,,他有道歉吗？,0,2019-10-07 16:48,1
@aaaa雕,,有的东西道歉也是没有用的,1,2019-10-07 16:47,1
@俞小~--,,道歉了也没用 只能说言论您自由 但我们立场对立 你无视我们 那我们无视也你们,0,2019-10-07 16:46,1
@斑点热狗,,人家持有什么观点是人家的事情，我们不需要逼迫人家，但是我们自己心里要有一个底线，不要沉迷于此无法自拔，漠视真相就可以了，到了我们中国人该撤离nba的时候我们走就可以了，不要一边去看的火热一边叫人家道歉,0,2019-10-07 16:41,1
@上帝是只异想天开的猫,,他不需要道歉，他爱怎样怎样，他不怕中国法律，来HK或者XJ参与其中都是他自己的事儿。我们决心隔断与火箭队的关系，已经不可逆转，这是民心所向，是我们的事儿。,0,2019-10-07 16:40,1
@lsnaini,,道歉有用，还要警察干嘛,0,2019-10-07 16:40,1
@库里小迷妹--,,道歉没用火箭滚出中国，永久封杀,0,2019-10-07 16:39,1
@a凛冬,,道歉有用还要警察干嘛,0,2019-10-07 16:37,1
@爱咋咋lovezaza,,没用，老外就是用这种方法激怒你，认真你就输了,0,2019-10-07 16:37,1
@_Libralogo,,道歉有用的话要警察干嘛？,0,2019-10-07 16:36,1
@江户川在哪里,,道歉有用海燕警察干嘛,0,2019-10-07 16:36,1
