User,Reter,Comment,Votes,Time,Count
@水祭祀,,看到了35年后的自己,0,2019-09-16 16:13,1
@青阳湖大材哥,,说天朝快的你们哪儿来的自信能活到那天？,1,2019-09-16 16:11,1
@诶拉黑,,我朝在人口上积极迈进,0,2019-09-16 16:10,1
@饿了一天该睡觉了,,80岁的爸爸打工养着60岁的儿子,1,2019-09-16 16:07,1
@十九画生Christine,,@123远走高飞321,0,2019-09-16 15:54,1
@基金豆,,老龄化社会，老龄社会，超高龄社会，日本已经过渡到第三个阶段了,0,2019-09-17 11:56,2
@h,,机械带人解决问题,0,2019-09-17 08:41,2
@蜗得天,,超高龄,0,2019-09-17 08:25,2
@馨於瞬间,,中国现在生育率也低，要步入后尘啊,0,2019-09-17 07:38,2
@桉桦树想3,,啦啦,0,2019-09-17 07:01,2
@奈斯兔蜜特油,,证明人家医疗水平人民健康水平高啊,0,2019-09-17 06:59,2
@f众多韭菜中的一个,,日本真惨。老年人都不能享清福,0,2019-09-17 05:58,2
@爱学习的何师影,,日本人65岁真的不算老，电视里报刑事案的时候，很多人加害人都6、70岁,0,2019-09-17 05:26,3
@鲜的无聊,,现在大学生去日本打工不错,0,2019-09-17 01:58,2
@Miko_Chan,,一定要撑到70，很多景区都免票，所以养好身体，阅遍祖国大好河山。,0,2019-09-17 00:48,2