User,Reter,Comment,Votes,Time,Count
@别吻我臭流氓,,这也是以后的中国，我一定要健健康康。等老了以后蹲在广场旁边看一群大妈跳广场舞，做一个精致的骚老头,1910,2019-09-16 14:28,7
@iBingo,,老人退不了休，年轻人就不了业,496,2019-09-16 15:34,6
@圣堂之佑98876,,开始了……他们又开始围中了。,238,2019-09-16 15:35,1
@P木,,我们也快了,90,2019-09-16 08:00,1
@今天的晚安呢,,看到新加坡有一个新闻 说2018年统计数据，印度18岁的人口是中国18岁人口的两倍。中国老龄化速度也不可小看啊,74,2019-09-16 15:21,9
@tamama7788,,只有生活的超级富足才可能带来超老龄。。。我朝。。呵呵哒,43,2019-09-16 15:37,1
@吴依仁,,别急，马上就来了！没几年了,38,2019-09-16 08:41,1
@航叔ii,,人家只是报道了一条新闻，又没有说日本不好，你们急切的进行比较是有多巴不得中国更差？,25,2019-09-16 16:05,1
@JayCarney,,中国到时候比日本严重,30,2019-09-16 15:31,1
@江户川柯鸭,,再过30年，这3588万人差不多都要去世了,13,2019-09-16 16:22,1
@Fieoi,,他妈的，领舞的最骚的那个老头是我,14,2019-09-16 15:43,1
@最辣的生姜,,那时候是不是钱玄同说的，人到四十岁以上就该死，不死也要枪毙,11,2019-09-16 15:49,7
@TianShuin9102,,中国也快了，这是社会发展的必经之路吗？,13,2019-09-16 15:30,1
@肉给你吃,,评论里真的是“先知”多，一口一个中国更严重，说计划生育的说体制的，真不知道是真心担忧国家未来的发展还是跪久了站不起来,9,2019-09-16 16:47,1
@天涯行客SWZ,,难道中国六十五的人都闲在家里？我身边很多六十多到七十岁的都在干活啊，大部分做的还都是苦力，比如环卫工人，瓦工，小工，还有绿化带工作的,7,2019-09-16 16:37,2
@少语嗯,,记得刚到日本的时候，看见机场有个老头，满头白发，弯着腰慢慢的整理行李车，后来在亚马逊上买东西，那个快递员少说得有六十了，扛着个大箱子给我们送上了3楼,7,2019-09-16 15:48,1
@M阿萨德张,,谁让人家活的寿命长！,5,2019-09-16 07:47,1
@财经杰观,,老龄化是现代社会的产物，没有借鉴只有探索，相信人类的智慧吧！,9,2019-09-16 15:46,1
@小隋先生,,病态社会 只想说qtmd,1,2019-09-16 16:34,1
@甜奶粥,,给老子笑,1,2019-09-16 16:15,4
@METEOR姚潇冉,,,0,2019-09-16 16:17,1
@甜的冰儿,,继续计划生育啊。干嘛开放二胎呢。,1,2019-09-16 16:04,1
@荣欢90141,,中国老年人口老龄化,0,2019-09-16 16:00,7
@顾耐早睡早起,,我们也是，好担心，我老了后干点啥呢,3,2019-09-16 15:58,1
@NIUNIUNIUC,,不是要沉了吗,1,2019-09-16 15:33,1
@阳young666,,那是不是以后只能看老年人演的爱情动作武打片了,1,2019-09-16 16:31,1
@麻醉杠把子,,不攻自破太好了。,2,2019-09-16 15:38,1
@蜗得天,,超高龄,0,2019-09-17 08:25,2
@余亚南GG,,十年后的中国,0,2019-09-16 21:32,1
@传说中的女网警,,#女网警说# #女网警说[超话]# 所以 社会发展到不同的阶段 会有不同的问题 希望我们都能耐心的找到解决问题的方法[good],0,2019-09-16 18:52,2
@讨厌被查,,我去日本玩的时候，都是八十多岁的奶奶当服务员，手脚乐麻利了,0,2019-09-16 18:50,2
@CCMrC,,@GoGoGoGoGoGou 老是老了 还得上班,0,2019-09-16 18:30,1
@秋碧连天的下午茶,,和寿命最长环环相扣,0,2019-09-16 18:01,1
@肉哥爱吃饭,,我婆婆50岁内退 身体超级好 每天没事干就来烦我们 真希望她也能工作到65岁啊....,0,2019-09-16 18:01,1
@玛咔巴咔123,,中国体制外的农民七十多还在干活呢,0,2019-09-16 17:18,1
@仙女风格,,为啥每次看到日本的新闻，评论都是在说中国更惨。  日本鬼子,1,2019-09-16 16:59,9
@纵横水流,,……好心酸……但？为什么会到这个地步？,0,2019-09-16 16:46,1
@不安分的安小白,,别推迟退休年龄就行，推迟了我怕我活不到退休，那之前交了几十年的钱我可就一分享受不了了,0,2019-09-16 16:45,1
@天空树日本留学,,转发微博,0,2019-09-16 16:43,1
@锦年yuy,,老日本,1,2019-09-16 16:32,1
@你女朋友又亲我了,,香港日本现在七八十岁还要工作,0,2019-09-16 16:26,4
@羽道Xuan,,感觉自己喜欢的声优都四五十，希望他们不要退休,0,2019-09-16 16:21,1
@Pinpindorothy,,天啊，几年之前NHK的《老后破产》如今已经这么严重了吗？安倍不是之前出台了延期退休吗？虽然高龄人口成为现实，但还是希望日本能够稳定下来...我第一次感受到语言的贫瘠无力... ...,0,2019-09-16 16:08,1
@搞黄色bot,,,0,2019-09-16 16:04,1
@穷的想叮当dph,,漂亮，希望天朝也能这样,2,2019-09-16 15:47,1
@Mr_Fan___,,是时候进攻日本了,3,2019-09-16 15:41,1
@读云舒墨,,转发微博,0,2019-09-16 15:40,6
@longge14315,,日本要亡国了,3,2019-09-16 15:38,1
@川贝枇杷-,,好的，看来我以后读完研找工作很好找了,1,2019-09-16 15:37,1
@一个好人啦啦啦,,到时人工智能普及  需要的劳动力也少了,3,2019-09-16 15:36,1
@小章愉,,我国大龄剩男怎么不报道一下,1,2019-09-16 15:36,2
@灰涩墨,,微博人口学家上线,5,2019-09-16 15:35,1
@snoopyZY,,感觉日本后面会降低劳动力准入门槛 吸引全球劳工,4,2019-09-16 15:30,1
@Amour沅澧,,中国60岁以上老龄人口全球最多，最重要的是未富先老。没有发达国家的收入与社会保障福利制度，确得了发达国家的病，而且越来越严重。,2,2019-09-16 22:08,1
@做一个甜甜的姑娘吧,,不知道为啥，有点羡慕封建社会,2,2019-09-16 16:59,1
@八神_太一,,等我60的时候，中国的老龄化一定是最重的,2,2019-09-16 16:14,1
@腹愁者MaoMao,,我现在要好好锻炼身体，以后老了精神抖擞，争取当上广场舞的领舞，老有所为，老有所用，好好享受我的老年生活！,2,2019-09-16 15:33,1
@imUniShine,,评论里好多人担心自己得延迟退休啊，其实想太多了，三十年后的中国路上走的车是无人驾驶车，农业高度机械化，餐厅也不再需要服务员，不但你们早就失业，你们的孙子也会失业。。。,1,2019-09-16 20:11,2
@鸳鸯不双飞丶,,还是当公务员和在事业单位里上班舒服，进去了就等于养老，老了以后待遇还比年轻时候更高。体制外的就惨咯。,1,2019-09-16 17:55,1
@小名儿是你猜呀,,我看现在天天吃外卖的中国年轻人不一定能活到70,1,2019-09-16 16:56,1
@凉凉朋友,,,1,2019-09-16 16:25,1
@卜晓星,,最怕看到这种新闻，仿佛是铺垫，然后退休年龄延到70,1,2019-09-16 16:19,1
@njfchrfnkhfvj,,我们中国到30岁以下都不要人了，想说超过三十岁怎么就不能上班了,1,2019-09-16 16:10,1
@骑士铁十字121,,哇！每当这种新闻出来，就是大型围中救日/美/韩等等现场。围中也许会迟到，但绝不会缺席。,1,2019-09-16 16:06,1
@湖光山N,,自己稀饭吹凉没有哦,1,2019-09-16 15:58,2
@T吉儿,,当年经历了全民皆兵，然而晚年并没有多闲散，高龄了依然在为自己国家埋头苦干,1,2019-09-16 15:57,1
@网友张某人,,AV中怪不得有很多老头,1,2019-09-16 15:56,1
@Yomaris陈,,我在日本真的见到特别多年纪大的人在工作！！真的！弯腰驼背走路不稳 但是还要端盘子洗碗干杂活,1,2019-09-16 15:35,1
@滚你妹的嘟噜屁,,,1,2019-09-16 15:30,2
@基金豆,,老龄化社会，老龄社会，超高龄社会，日本已经过渡到第三个阶段了,0,2019-09-17 11:56,2
@h,,机械带人解决问题,0,2019-09-17 08:41,2
@馨於瞬间,,中国现在生育率也低，要步入后尘啊,0,2019-09-17 07:38,2
@奈斯兔蜜特油,,证明人家医疗水平人民健康水平高啊,0,2019-09-17 06:59,2
@f众多韭菜中的一个,,日本真惨。老年人都不能享清福,0,2019-09-17 05:58,2
@爱学习的何师影,,日本人65岁真的不算老，电视里报刑事案的时候，很多人加害人都6、70岁,0,2019-09-17 05:26,3
@Miko_Chan,,一定要撑到70，很多景区都免票，所以养好身体，阅遍祖国大好河山。,0,2019-09-17 00:48,2
@叫我小王_ACE,,@想静静就静静,0,2019-09-16 23:40,1
@皮蛋john,,日本要完犊子了,0,2019-09-16 21:02,1
@耄耋而,,是时候去日本旅游了,0,2019-09-16 20:04,1
@一个搬砖机器的独白,,我外公70岁了也在工作，我妈今年45岁了，说要工作到70岁,0,2019-09-16 19:19,1
@不卖萌会死星菟,,事业单位带头，只要35岁以下的，真不知道以后失业怎么办,0,2019-09-16 19:02,1
@Liu_刘_,,天朝也快了,0,2019-09-16 18:17,1
@随机打劫补课,,老人多，首先就可以看出日本医疗水平高，社会发达，福利好，占比较多，只能说明新生人口太少,0,2019-09-16 18:14,1
@糖堂line,,但他们明明好多宅在家的年轻人，为毛不想办法解决,0,2019-09-16 18:09,1
@BigDee_,,养儿防老，老祖宗都看透了套路,0,2019-09-16 18:08,2
@凛云,,我国的明天,0,2019-09-16 18:02,1
@怎么起个名字这么难ice,,年轻人都快找不到工作了  老了谁要？,0,2019-09-16 18:00,1
@我在等r,,来给我们洗脑了,0,2019-09-16 17:52,1
@肥宅犯法,,还是中国好,0,2019-09-16 17:46,1
@Maybe_Mebius,,上海也差不多,0,2019-09-16 17:31,1
@不能放弃啊啊,,是的，就是铺垫,0,2019-09-16 17:27,1
@竹就是竹竹的竹,,日本老头子身体起码还好，各行各业看他们干劲，精神劲棒棒的…想想三十年后我差不多65岁…估计走楼梯的大喘气了…倒是想就业想为国家社会分担咯…条件允许吗？现在开始强健体魄，望他日不要占用过多的国家医保资源…,0,2019-09-16 17:21,1
@极度缺水的hh,,我朋友的父亲63了也还在赚钱啊，家里三个孩子都还没结婚，不敢停，她说她怕她父亲享不到福,0,2019-09-16 17:20,1
@鸦掌柜,,90后老了就是这样,0,2019-09-16 17:19,1
@Well0930_,,这日本是防止老年痴呆吗,0,2019-09-16 17:13,1
@大叔丶再见,,65岁在工作的老人需要去关注日本么，看看普罗大众，中国最底层的70岁还在背井离乡的在工作的我见太多，建筑、输电工程下面的普工比比皆是,0,2019-09-16 17:12,1
@LA雾A,,我们90一代是跑不了咯,0,2019-09-16 17:08,1
@___小世界,,不仅仅是日本而是各个国家都会面临老龄化。以前是一百个人养五十个人。现在成五十养一百。没有年轻血液 经济发展下行 所以推进二胎政策 是未雨绸缪。因为结婚率跟生育率都在下降  再这样下去 社会就发展不起来。购房压力是导致这年轻一代都不敢结婚 所以国家现在才有了不以房地产刺激经济的这一手段。,0,2019-09-16 17:08,1
@HamburgerLiang,,老头子们今晚开黑,0,2019-09-16 17:07,1
@zhou小八,,意思是可能我以后65岁还不能拿退休工资咯,0,2019-09-16 17:06,1
@刷微博喜欢看评论,,发达国家,0,2019-09-16 17:04,2
@刘唱suho,,不愿意将这样的生活带给下一代，宁可不生,0,2019-09-16 16:59,1
@lady_25,,坚决反对延迟退休，相信党的承诺是算数的！,0,2019-09-16 16:59,1
@香港高端客纛,,人口老龄化越来越严重，你为你的未来准备好没有呢。退休只能靠自己呀！,0,2019-09-16 16:56,1
@攀岩-22,,看着28%的数字还是很触目惊心的,0,2019-09-16 16:56,1
@Dalin大琳子,,太难了吧,0,2019-09-16 16:56,1
@mushroomcoming,,长命百岁 长生不老的好处到底是什么？,0,2019-09-16 16:53,2
@孙雪姣,,日本百岁不是梦，不说的有那种针了嘛,0,2019-09-16 16:52,1
@Maia想拿学位,,都别着急我们马上就能赶上来了,0,2019-09-16 16:52,1
@我们是害虫777,,和我朝完全不一样，这标题真会带偏读者。一、人均寿命长说明生活水平高；二、65岁以上老人工作并不是经济压力大所致，那是一边拿着退休金一边赚点零花钱。很多人老了就是怕闲着，对有些人来说闲着就意味着自己没用了，太闲更容易老。,0,2019-09-16 16:50,1
@二B青年的二B青春,,超级病毒 貌似有这个电影  背景是委内瑞拉 其实也可以是天国,0,2019-09-16 16:50,1
@仗剑走天涯1230,,疯狂暗示,0,2019-09-16 16:50,1
@RainGirlNoMelon,,这是未来的90后吗,0,2019-09-16 16:49,1
@・赵一坨・,,我要去留学，去挣日本人的钱，很多很多钱,0,2019-09-16 16:48,1
@呸你一脸啊,,中国没得很吧，怎么就快了,0,2019-09-16 16:48,1
@杨村第一帅,,照这么发展下去…是不是以后小日本就没人拍电影了,0,2019-09-16 16:46,1
@七里香iu,,美国新闻谈中国没有什么，日本新闻有谈中国不好笑死我了 怎么不喜欢中国，移民去呀,0,2019-09-16 16:45,1
@怀念逼哥,,我就猜到评论区是什么样的,0,2019-09-16 16:44,1
@DCDYA,,看中国现在的发现，和国际影响力，我觉得今后几十年还有一个吸引国外移民或者廉价劳动力的趋势。可能老龄化影响没有日本那么大。个人观点，不喜勿喷,0,2019-09-16 16:44,1
@Z-M-Jing,,日本机场帮助登记的都是老人，手脚利索干点力所能及的也不错，总比碰瓷，抢座，扰民的好。,0,2019-09-16 16:44,1
@本宫就是喜欢唱戏,,最大问题不是老龄化 不是生活贫困 最大的问题是年轻人越来越颓废 老年人却越来越忙碌 真不知道这个社会没有给年轻人机会也没有给老年人机会 那么那么多机会到底都去哪里了？？？钱到底都到去哪里了,0,2019-09-16 16:43,1
@不给糖就咬人,,昨天今天明天,0,2019-09-16 16:43,1
@Dex_X,,高人工高通胀高年龄，似曾相识,0,2019-09-16 16:42,1
@古丽娜扎尔・拜合缇亚尔,,希望我们不会变成这样……,0,2019-09-16 16:42,1
@汪汪酱和她的喵喵酱,,中国已经是这样了 我爷我奶都快70了 照样在做事 不过话说回来 主要是我爸妈没啥本事(挣不了啥钱) 有点本事的也不会让自己爸妈七老八十的还操劳 不过看看我自己 以后可能也没那本事让我爸妈五六十岁就开始颐养天年了,0,2019-09-16 16:41,1
@长长的路上,,老年化一过，是不是就幼年化？一个轮回又是一个圈吧,0,2019-09-16 16:40,1
@老夏不会画,,中国慢慢老龄化。我的加快设计，开发，生产，销售老龄化产品。我要暴富@ZH-啊,0,2019-09-16 16:40,1
@阳台上的小猫儿,,少子化，丁克，草食男子，同性恋，所以你知道的，日本人会越来越少,0,2019-09-16 16:39,1
@Mr_Sandman--_--,,有人问我要不要去日本工作,0,2019-09-16 16:37,1
@CN紫苑,,中国医疗也能像日本发达就好了 顺便把卖假药的打死,0,2019-09-16 16:37,1
@啊啊啊啊啊我来了,,我们这好多60多岁的在菜市场卖菜。,0,2019-09-16 16:36,1
@阳光很幸福,,现在社会越来越智能化！手机费电费水费煤气费，包括暖气费，手机就可以缴费！连超市都上无人售货机！用人地方越来越少！国家又放宽让生二胎！年轻人口越来越多，老的不退，新的没单位！再说，女人40岁以上，就很难找工作！坚决反对延长退休！,0,2019-09-16 16:33,1
@此昵称已被承包,,仿佛看到了我们的未来。。。,0,2019-09-16 16:32,1
@洛传梁,,这批老人手握巨额社会财富却没有消费，难搞哦,0,2019-09-16 16:32,2
@文氓,,暗示我们要做好心理准备,0,2019-09-16 16:31,1
@吃土兔子呀,,做什么工作？,0,2019-09-16 16:28,1
@属于夏目我的33,,@两两_10969,0,2019-09-16 16:28,1
@骑白马的啊凡提,,德田重男八十多了还在工作。,0,2019-09-16 16:27,1
@GG莱斯利,,所以日本体力活工资会高对吗,0,2019-09-16 16:27,1
@滚你妹的嘟噜屁,,别天天五十步笑百步了,0,2019-09-16 16:26,2
@元祖同学,,在侵略中国的时候，就使劲生，现在报应来了,0,2019-09-16 16:24,1
@WENGER-OUT,,再过两代人，日本社会又是个年轻化的社会。,0,2019-09-16 16:24,1
@陈家公子初长成LOVE,,中国的30年的计划生育，彻底打乱了人口结构，加入老龄化正在快速驶来，养老问题越来越难,0,2019-09-16 16:24,2
@当年行人,,以后中国也会这样，未富先老,0,2019-09-16 16:23,1
@老麻麻与小软软,,朱门酒肉臭，路有冻死骨,0,2019-09-16 16:23,1
@夕丿丶,,过不了多久就是中国了,0,2019-09-16 16:23,1
@乐观的小编辑,,这就是我们要二胎的原因吧,0,2019-09-16 16:23,1
@果粒儿_grace,,我们的父母也在工作，帮我们带孩子。,0,2019-09-16 16:23,1
@陈家公子初长成LOVE,,中国典型的未富先老，老后破产，和发达国家进入老龄化社会差的不是一点半点，这个问题会越来越严重，正如马云所说，以后最值钱的永远是人，尤其是年轻人，只要是能创造价值的劳动力都是稀缺资源，抓紧生吧,0,2019-09-16 16:22,2
@易辙要永远开心幸福,,农村的爷爷奶奶很大年龄也在下地干活啊，不更苦更累？,0,2019-09-16 16:22,1
@翱翔于天际的雀儿,,快了.我天朝也是一样的路数，人口太多，繁衍速度下降，最终老龄化，最后毁灭自己，灭霸的政策绝逼是对的,0,2019-09-16 16:21,1
@一个好名字非常重要,,五年，最多五年中国也会是这样,0,2019-09-16 16:20,1
@巫A------,,日本人均寿命很高的…,0,2019-09-16 16:20,1
@KoroZ1,,长寿国家,0,2019-09-16 16:20,2
@您说这个谁懂啊,,无缘社会,0,2019-09-16 16:19,1
@顽劣595,,长寿，环境好，锻炼，年轻人30多也不结婚……,0,2019-09-16 16:19,1
@莫忘那分离,,之前同事还说日本人就是热爱工作，特别有匠心精神，退休了还在工作！我内心想的是他要是不工作日本还有人上班么,0,2019-09-16 16:18,1
@扬鹰九月,,我们中国农村，哪个65岁的老人不在工作?帮他们瞎操什么心,0,2019-09-16 16:18,1
@the_craft_of_selfteaching,,-(//@今天的晚安呢:看到新加坡有一个新闻 说2018年统计数据，印度18岁的人口是中国18岁人口的两倍。中国老龄化速度也不可小看啊,0,2019-09-16 16:18,1
@我是一颗秋天的树tree,,幸亏我生了两个孩子,0,2019-09-16 16:17,1
@Dreamer_空想,,中国早着呢好吗。。。。。,0,2019-09-16 16:16,1
@柜台管账的,,媒体吹吹风，改天就讨论延迟退休可行性,0,2019-09-16 16:16,1
@意趣人生m,,医学昌明，社会保障完善都是长寿的必然,0,2019-09-16 16:16,1
@_suki_,,65岁算老人？？？,0,2019-09-16 16:16,1
@喝口奶茶告诉自己要坚强,,中国农村大把的过了65的老人还在工作,0,2019-09-16 16:15,1
@醉卧凌霄,,我在日本这边住的，周围的工人很多都是白发苍苍起码六十岁的，老龄化问题真的不容小觑了，中国要是不控制老龄化趋势的话这就是咱们的范本,0,2019-09-16 16:15,1
@耶啵超有钱呀,,老的死不掉，小的生不出来 真惨,0,2019-09-16 16:15,1
@皱眉寡言,,,0,2019-09-16 16:14,1
@点点豆豆皮一下,,我妈还说，太心疼我了，想着白发苍苍还要上班，不像她，，，,0,2019-09-16 16:14,1
@唐大人Town,,我们不仅也快了，而且到时候可能还不如日本,0,2019-09-16 16:14,1
@Time_七,,,0,2019-09-16 16:13,1
@兰色无聊,,不是，我总感觉我周边二胎，三胎，四胎的都有，没这么严重吧！,0,2019-09-16 16:12,1
@ROCKBROS洛克兄弟,,老人能抵半边天！,0,2019-09-16 16:10,2
@半球怪人,,日本人会养生？,0,2019-09-16 16:10,1
@乔克欧巴哦,,可怜，为什么国家发达了人都不愿生孩子了？压力大吗？中国还好人口基数大。其实地球上人少一半环境应该会好很多吧？,0,2019-09-16 16:09,1
@疾风野草,,我在想作为一个90后，老了以后我教的养老金能正常享受不哟,0,2019-09-16 16:09,1
@金牛座的嘟嘟哔哔,,中国完全放开生育,0,2019-09-16 16:07,1
@湖光山N,,中国应该不会吧，生病的人就好多，医疗，养老都跟不上，不可能大家运气这么好都能活到70以上,0,2019-09-16 16:00,2
@iam阳哥,,日本空气环境太好。这个不得不承认。食物油脂也不高。,0,2019-09-16 15:59,1
@串串与小狗,,@Barcelonalulu,0,2019-09-16 15:59,1
@星星心意圆满,,转发微博,0,2019-09-16 15:58,1
@你知不知道的事我不知道,,想多了，我们国家不会的，压力，环境，食品不允许我们活那么长。,0,2019-09-16 15:57,2
@_Chubby,,感觉日本80%以上的出租车司机都是六七十岁的老爷爷。,0,2019-09-16 15:54,1
@墨小呆在这里,,20年后中国也这样,0,2019-09-16 15:52,1
@海地树袋熊,,知道人家岁数越大。。。。工资越高否。。。。,0,2019-09-16 15:52,1
@双鱼KIKI,,主要是长寿,0,2019-09-16 15:52,1
@大葱妹子Red-eyeRabbit,,嘿嘿，以后天朝怕是超超超超超超超高龄社会！,0,2019-09-16 15:51,1
@萝莉我是行者,,管的太宽了,0,2019-09-16 15:50,1
@班长陈,,六十路七十路。。。。,0,2019-09-16 15:49,1
@豫窝w,,转发微博,0,2019-09-16 15:49,2
@阳光ooi,,五十步笑百步,0,2019-09-16 15:49,1
@格拉斯MM,,悲催的中国80后,0,2019-09-16 15:47,1
@宰头牛给你,,去日本打工咯,0,2019-09-16 15:45,1
@脚背长毛胸不长毛的帅琦,,天啊太恐怖了,0,2019-09-16 15:45,1
@xjtu1993,,所以不要再去研究先进的医疗技术了,0,2019-09-16 15:45,1
@yuki的小小圈子,,太长寿了,0,2019-09-16 15:43,1
@红红_拒绝次大餐,,那又怎样，35岁告诉你失业了,0,2019-09-16 15:41,1
@手牵手去跳楼,,很明显，父母那代人没家生3-5个孩子，到了我这代就是独生子女。我的下一代才开二胎,0,2019-09-16 15:40,1
@风花无雪im,,我们到时候啥样还不知道呢,0,2019-09-16 15:40,1
@父爱如山高路险,,心里一直有个梦，日本覆灭,0,2019-09-16 15:39,1
@我就叫你黄黄,,我朝估计以后也这样儿,0,2019-09-16 15:36,1
@励恩国际少儿英语,,转发微博,0,2019-09-16 15:36,1
@小章愉,,这种也上热搜,0,2019-09-16 15:35,2
@脾气很怪的直男,,咱们也快,0,2019-09-16 15:34,1
@AkumaYamato,,中国也快 大家加油,0,2019-09-16 15:31,1
@吃螃蟹找我哈哈哈,,他们的今天就是我们的明天,0,2019-09-16 15:31,1
@你敢亲我一下吗,,反正再过几十年日本就沉了，无所谓了,1,2019-09-16 08:43,1
@樱井莉亚-z,,俺爷爷奶奶七十五了还干农活呢,0,2019-09-16 17:10,1
@扣唧唧重开王,,那些优优越来越年轻了呢，00后都有了，好嫩啊,0,2019-09-16 16:35,1
@只因为我叫啊曼,,美帝人民，日本人民每天都生活在水深火热中啊，还是我大天朝幸福，听说65退休？,0,2019-09-16 16:34,1
@自在野犀,,弹丸之地仅代表弹丸之地,0,2019-09-16 16:27,1
@ardmssstscakfefn,,日本的今天就是中国的明天,0,2019-09-16 16:25,1
@随心随意感恩之心,,我32岁糖尿病了，哎，不知道还能活几年,0,2019-09-16 15:53,1
@一介锅盖,,你们也太小看我国二胎政策了。,0,2019-09-16 15:51,1
@httggyovrgv,,生育率下降加上平均寿命增加的结果……说不定将来医学发展到人类平均寿命120，65相当于只是中年啊,0,2019-09-16 15:42,1
@老大无成678,,天朝有多少？比例多大？,2,2019-09-16 07:48,1
@机智的程子,,人口老龄化  结婚率再创新低 结婚成本二胎成本都是可观因素,0,2019-09-16 17:12,1
@莫负好时光today,,该国家操心的事，大众担心再多能解决吗？国家肯定会出台相应政策！自己多存点养老钱，买些养老保险！,0,2019-09-16 17:05,1
@ikun一爽6533080029,,哈哈哈 怎么感觉没有别人，自己也能给自己灭了,0,2019-09-16 16:51,1
@Zengtaoof丶ficial,,我要是能活过100岁，我宁愿前60年都在工作,0,2019-09-16 16:40,1
@猪猪侠爱吃朱古力,,开始铺垫了吗,0,2019-09-16 16:39,1
@乐是平安喜乐的乐,,我可以去日本打工吗,0,2019-09-16 16:38,1
@不是fan圈人,,大家加油以后去日本工作,1,2019-09-16 16:34,1
@北子6651247,,65还在上班啊，我的天，生而为人到底是为了什么,0,2019-09-16 16:28,1
@玉通仙,,中国老人比这惨，年轻人压力太大，很多家庭又是独生子女，想一想一对夫妻要管双方的父母和奶奶爷爷姥姥姥爷，压力山大，过去政府强行计划生育，口号是宁可血流成河，不能多生一个，现在问题来了，]人管了，现在年轻人不生孩子或者只生一个，就是自私自利，中国人是人是活生生的人，不是牲口，,0,2019-09-16 16:24,1
@桃花源处水云间,,中国紧随其后，但现在还未为进入老龄社会做好准备吧，担忧！,0,2019-09-16 16:23,1
@俊采星驰0826,,这一代日本老人，年轻时拼命工作，却老无所依。对应中国应该正好是8090一代，哎,0,2019-09-16 16:20,1
@冷寿司不吃,,@喷烟子,0,2019-09-16 16:15,1
@迪亚斯的,,中国要警惕人口老龄化问题,0,2019-09-16 16:13,1
@面带巍笑2020,,中国也快了,0,2019-09-16 16:10,1
@破产姐妹802050,,天朝老人惨多了,0,2019-09-16 15:44,1
@桉桦树想3,,啦啦,0,2019-09-17 07:01,2
@鲜的无聊,,现在大学生去日本打工不错,0,2019-09-17 01:58,2
@知知复知知y,,@卜Linlin,0,2019-09-16 21:22,1
@月咏蝶归_,,人家平均寿命八十多岁呀,0,2019-09-16 18:01,1
@侠心交友小火儿,,甲级战犯岸信介为日本规划的军国主义复活之路已成为一条通往灭亡的死路了,0,2019-09-16 17:41,1
@摆起你的舞姿,,我姥爷70了，一个月4000+退休金，还去绿化做工作呢～身体很硬朗～,0,2019-09-16 17:13,1
@吃饭小猫,@kkaiyue-,因为年纪大的找不到工作,0,2019-09-16 17:05,1
@zennya,,65岁以上身体也棒，中国的我就,0,2019-09-16 16:41,1
@淡忘8989,,中国退休职工可能65 岁已退休，农村65岁还不是一样的在工作，要工作到动不了才能退休,0,2019-09-16 16:20,1
@右手烟拿左手,,口袋助理签到 云之家签到 企业微信签到 签到通打卡 等 咨询 方式方法   有任何问题或需要 在线咨询,0,2019-09-16 16:13,1
