User,Reter,Comment,Votes,Time
@冲线鸭,,原来是这样 评论配图,19,2019-09-27 17:20
@你说得世界不再有,,不能上传图片表示很悲哀,14,2019-09-27 17:12
@是谁的杨枝甘露啦,,话说，鸭鸭，你们这不是也有考研英语二吗？http://t.cn/Ain8wJzC,4,2019-09-27 17:28
@WGNEHC,,搜不到你想要的，搜个秋冬美甲，出来的都是画画和猫,14,2019-09-27 17:18
@宿宁馨,,小编一定不是女孩纸,7,2019-09-27 17:14
@哩小狸呀,,可能搜的都不是想要的,6,2019-09-27 17:16
@走出喵心,,就是bug啊,6,2019-09-27 17:16
@可爱猪没了,,有没有姐妹最近用觉得很卡什么的 还是我手机问题,9,2019-09-27 17:22
@六顶思考帽-,,刚刚试了  没问题啊,0,2019-09-27 17:42
@Cherry-yyf,,没有声音,0,2019-09-27 17:36
@电竞布衣神相,,新浪给了你多少钱   刚刚推出绿洲 小红书就出事  干的太明显了吧,1,2019-09-27 17:39
@谢依霖老公,,,4,2019-09-27 17:21
@哆啦君xi,,而且搜啥都搜不到了，还以为自己拼错了单词,3,2019-09-27 17:22
@小郝冉-,,为什么我的好好的。。,0,2019-09-27 18:11
@将失眠进行到底,,我今天也是这样,0,2019-09-27 17:57
@烤薯角,,搜啥都是出现画画的。。,1,2019-09-27 17:54
@胡小鱼mua,,小红书app上线了吗？,1,2019-09-27 17:50
@姬梦雪_Zy,,我的一直不显示图片,0,2019-11-04 18:09
@毋风杰wfj,,有谁知道小红书上的东西是正品不？,0,2019-10-05 10:03
@TT家的小猫咪,,为啥我没有,0,2019-09-27 18:13
@_嗯嗯好的呢,,居然是我姘的高级face,0,2019-09-27 18:02
@林俊杰的关键词是王文文,,我刚还搜了半天 没毛病呀,0,2019-09-27 17:51
@_梦Elaine_,,我以为只有我是这样,0,2019-09-27 17:45
@木偶人8636,,不可否认，小红书还是很好用的！,1,2019-09-27 18:09
@姬梦雪_Zy,,我的一直不显示图片,0,2019-11-04 18:09
@毋风杰wfj,,有谁知道小红书上的东西是正品不？,0,2019-10-05 10:03
@TT家的小猫咪,,为啥我没有,0,2019-09-27 18:13
@小郝冉-,,为什么我的好好的。。,0,2019-09-27 18:11
@将失眠进行到底,,我今天也是这样,0,2019-09-27 17:57
@姬梦雪_Zy,,我的一直不显示图片,0,2019-11-04 18:09
@毋风杰wfj,,有谁知道小红书上的东西是正品不？,0,2019-10-05 10:03
@TT家的小猫咪,,为啥我没有,0,2019-09-27 18:13
@小郝冉-,,为什么我的好好的。。,0,2019-09-27 18:11
@木偶人8636,,不可否认，小红书还是很好用的！,1,2019-09-27 18:09
@_嗯嗯好的呢,,居然是我姘的高级face,0,2019-09-27 18:02
@将失眠进行到底,,我今天也是这样,0,2019-09-27 17:57
@烤薯角,,搜啥都是出现画画的。。,1,2019-09-27 17:54
@林俊杰的关键词是王文文,,我刚还搜了半天 没毛病呀,0,2019-09-27 17:51
@胡小鱼mua,,小红书app上线了吗？,1,2019-09-27 17:50
