User,Reter,Comment,Votes,Time
@张f里,,过于真实 我真的很讨厌这种旅行 我觉得旅行就应该坐在吉普里 盘着腿 听着歌 吃着零食 ,0,2019-09-15 10:04
@青无_,,能有车，我都不会做徒步这个决定,0,2019-09-15 10:02
@Newyear_Pan,,我光想想就很累了,0,2019-09-15 10:01
@RAUL-sandy,,是我的话还没到就想着，我上去了下来咋办,0,2019-09-15 10:01
@RAUL-sandy,,我能理解，之前去旅游，遇到高反，真的心门头涨，好辛苦的……能坚持不容易,1,2019-09-15 10:00
@糖莲子T,,高反确实很难受啊！！,0,2019-09-15 09:57
@C子C啦啦啦,,其实每个人说的都好真实，突然想看看这个综艺,0,2019-09-15 09:52
@橘子味卫兰,,不是粉，但我说下高反真的很难受的严重进医院打点滴别问我怎么知道,0,2019-09-15 09:52
@阿秃说,,转发微博,0,2019-09-15 09:51
@斓,,很理解这种感觉，今年去拉萨的时候，那里风景很美，但是刚去前几天因为因为轻微的高反，头疼失眠，整个人就很崩溃，特别后悔，很抑郁，去西藏真的需要很大的勇气，同时心理素质也很重要！！！,0,2019-09-15 09:51
@南音格子i,,,0,2019-09-15 09:50
@张十三嗯,,我也很喜欢旅游，但是也讨厌徒步啊，因为真的很累啊就和我不喜欢爬山一样，但是我就挺喜欢出去玩儿的，说什么无知的人，才是最low的,0,2019-09-15 09:49
@德星昭衍,,我也是！我完全理解不了徒步的意义！娜比很真实啊！,0,2019-09-15 09:49
@午分熟,,大多数人都是这样的 我也不太明白这样做有什么意义 就算当时你真的感受或者想明白了生活 可当遇到生活中的问题时 这些毫无用处,0,2019-09-15 09:49
@灵魂好重,,@一半大西瓜-,0,2019-09-15 09:45
@98cz,,我也徒步过 整整32公里 有人说不参加会后悔 其实参加了才会后悔 徒步完整条腿都不是自己的了 后面两天上下楼梯都不行  整个过程中也没发现个啥 反正就是累瘫痪 这辈子都不想徒步了,0,2019-09-15 09:44
@Q闲庭漫步Q,,当你说“好＂的娜一声就象打了鸡血，当你征服了中国的高山世界上的高山就不算什么了，因为你在世界屋脊之上；这样的难关你都能克服而屹立不倒，世上还有什么困难你不能战胜,1,2019-09-15 09:43
@练出马甲线再改昵称,,娜娜是个很真实的姑娘,1,2019-09-15 09:42
@某小邪的YiBoooo,,唔…我其实一直很纳闷…为什么一定要征服珠穆朗玛峰……征服的意义是什么？…因为自己的私欲而破坏环境还总被说的很伟大…我有点理解无能…,0,2019-09-15 09:41
@一战小星尘,,那要是光徒，也没什么好风景呢？[手],0,2019-09-15 09:32
@是小迪耶,,高原反应真的难受，头疼而且全身无力,0,2019-09-15 09:32
@爱旅行的小猴Jade,,平地徒步10公里都很累了更何况高原，我在海拔3600爬个坡都喘，有次从西藏回来耳鸣了2个星期,0,2019-09-15 09:31
@逐梦演艺,,没去的时候，特别想去，去了爬的时候瞬间后悔。是我没错了,2,2019-09-15 09:26
@他较夜色美,,我没那么伟大  我在玩累了都会想我为什么要出来遭罪,2,2019-09-15 09:24
@刘同学小同学,,我去西藏高反一个礼拜才敢出去玩，太难受了，胸口大门喘不上气还感冒了，不过后面玩儿了一个月，哈哈,1,2019-09-15 09:24
@Clara75802,,每次都说下次不来了 然后还是在继续//@Road1221小九:作为一名徒步爱好者，我不敢说徒步的意义，因为每一次徒步都会经历累，每一次累的时候都会问问自己为什么徒步，但是每一次走向山顶，看到一些轻易看不到的景色，看到日出日落，看到自己，都觉得很值。,2,2019-09-15 09:24
@摩羯座的至安,,正常，我每次去爬山的路上都在想我为什么要爬山，都在后悔，可是下一次我还是继续去徒步,2,2019-09-15 09:23
@口娘三三,,这个节目啥时候录的…我暑假也去了贡嘎，沿途确实看到好多好多黄色帐篷…,1,2019-09-15 09:23
@不练成马甲线不改名-,,主要是这种运动和朋友家人一起去就很有意义,1,2019-09-15 09:22
@F小仙,,所以我，能骑车能坐车绝不走路,0,2019-09-15 09:22
@chchch宝宝,,娜娜从来都是很真实的人，会说出自己真实的感受。爱你，加油！#欧阳娜娜[超话]#,1,2019-09-15 09:20
@奶伦的kathy阿姨,,欣赏美景就好,0,2019-09-15 09:19
@一夕一颜一诺,,娃娃音是谁？,0,2019-09-15 09:06
@nostalgia花花女子张玉婷,,哇哇哇喜欢袋鼠！,0,2019-09-15 09:04
@叉烧君君君君,,徒步这种东西……不喜欢就是不喜欢……,0,2019-09-15 08:54
@爱吃橙子的南野时光,,这个是正常反应啊，我每次爬山到山脚就开始后悔 ，下山就想再也不来了。,0,2019-09-15 08:49
@风翩翩影芊芊,,娜娜的反应很真实吧，十几岁的小姑娘而已啊,1,2019-09-15 08:47
@大胃王不再是吃货,,刚开始的一两天都会问自己为啥受这罪，风景越来越好的时候，就会为了自己牛逼闪闪的举动越来越兴奋，那种自我释放出让自己都诧异的力量，在徒步之后会让自己维持在一个很好的精神状态，我喜欢徒步,0,2019-09-15 08:47
@潮流依旧,,我只是觉得欧阳娜娜很真实，一个普通小女孩的反应而已,1,2019-09-15 08:45
@世俗Sco,,这是什么节目？？,0,2019-09-15 08:35
@____Waldeinsamkeit,,去稻城亚丁我才感受到高原徒步是多么艰难的一件事,0,2019-09-15 08:32
@Sss美霖儿,,@辣椒小姊 那女的说话就跟这个视频里余小蜜差不多…你感受一下。,0,2019-09-15 08:30
@严霭翰,,//@要叫我女王大人好的大王: 说实话，我也不明白，去西藏徒步的意义是什么，遭了罪，能得到什么呢？,0,2019-09-29 16:50
