User,Reter,Comment,Votes,Time,Count
@Joesachs,,5000以上集合,0,2019-09-01 09:41,1
@yuki云仔仔,,居然有没400的选项，差评,0,2019-09-01 09:36,1
@YsalMonH,,这个投票区间什么东西……,0,2019-09-01 09:35,1
@一会儿再和您联系,,多了没有，1000 花完了自己想办法,0,2019-09-01 09:29,1
@笛子什么时候能嫁给阿云嘎呀,,我们1200的没有排面是不是！,0,2019-09-01 09:27,1
@卷耳的匣子,,我大学一月400,0,2019-09-01 09:26,1
@藏在果汁里的,,分地区分学校。有些学校食堂有补贴超级便宜，一个月伙食费就超级节省。其他消费，其实网购价格都差不多。,0,2019-09-01 09:17,1
@米尔蓝色的奋斗,,哪有那么贵 不谈恋爱不出去吃 平时的饭加上牛奶啥的 900绝对够..,0,2019-09-01 09:00,1
@微笑的约书亚,,不泡妞的话1500足够了，我01年到05年大学的时候才500块一个月,0,2019-09-01 08:59,1
@我是你得不到的小猫咪,,供得起大学却供不足生活费,0,2019-09-01 08:56,2
@哎呦呦呦妈呀,,2014年我上大学，我爸去食堂陪我吃饭，看了一下价格，总结出来一个月给我600块够花。,0,2019-09-01 08:56,1
@韶华唯与清风,,看来我达不到正常水平了,0,2019-09-01 08:53,1
@牵城DZJ,,虽然我妈平时都是每月1000块给我，但一学期平均下来有1500,0,2019-09-01 08:52,1
@bjcyrm,,我那会上学，一个月800,0,2019-09-01 08:52,1
@W子星,,要去广州的我，手里拿着1000块钱在瑟瑟发抖,0,2019-09-01 08:52,1
@辣椒妹儿柠,,看城市，和个人家庭经济,0,2019-09-01 08:51,1
@子君好逑,,我一个月就600生活费，足够,0,2019-09-01 08:51,1
@小黑屋你走开,,八百管够五千还少,0,2019-09-01 08:50,1
@铅笔草莓仔77,,1500平均一天50就够了,0,2019-09-01 08:49,1
@T6T嘻嘻哈哈,,女孩子，不买化妆品，很少买衣服，一直打工赚钱，学费生活费没和家里要过,0,2019-09-01 08:48,1
@聚光灯始终蒙恩丶,,我五年前大一的时候1500一个月，食堂，外卖，都是6.7块钱左右一餐。到了大三，都变成了12左右一餐。生活费涨到2000一个月，紧巴巴的,0,2019-09-01 08:46,1
@JYX-晶,,1000-1200,0,2019-09-01 08:45,1
@妙鹿的地盘,,想知道成都大概多少足够,0,2019-09-01 08:43,1
@--曾被锦鲤附体过的二丫,,一月一千，多了没有。所以我妹妹除了吃，还抠抠搜搜的留了一点。我参与了@颜王爷 发起的投票【大一每个月多少生活费合适】，我投给了“500到1000”这个选项，你也快来表态吧~,0,2019-09-01 08:42,1
@龙家粉hj,,看所在城市的物价，反正我是每个月1000,0,2019-09-01 08:39,1
@幽游的魂,,穷有穷的过法，我大学一同学2周花了17元,0,2019-09-01 08:34,2
@林希西,,我大学每个月只有500，我是如何坚强的活着的……,0,2019-09-01 08:29,1
@无糖维C,,只吃饭加基本生活用品的800足矣，但一个人一个月什么也不买也太憋了吧......生活用品护肤品化妆品衣服一个月买一点加起来就1500左右了，随心所欲一点也在2000以下，二线城市。父母给多少花多少吧，自己有存款也行，只要不是超额消费都没什么问题。,0,2019-11-01 16:54,2
@张--老师,,500一个月大家都觉得不可思议，搞得我叔叔经常给我打钱，问我怎么活下来的，都是自己挣钱啦，最多的一个月两份家教，还有其他的，一个月挣四五千,0,2019-09-22 16:04,2
@家中有个小冤家,,想问问大家，你们生活费是日常开销，包不包括衣服鞋子？,0,2019-09-18 09:20,2
@Nothing_V_,,1,0,2019-09-16 14:24,1
@我用开水洗手,,真是不当家不知柴米油盐贵 按这个水准不知道你第一份工作的工资能养活自己吗,0,2019-09-10 19:41,2