User,Reter,Comment,Votes,Time,Count
@GHKEEF,,作为云南人真的特别感谢你，我读大学的时候虽然跟我室友介绍云南有多好，但都只是贫瘠的描述，没有让他们亲眼看到很多我无法带去的东西，后来看了你的视频然后安利给了她们，她们也都被你吸引了，被云南吸引力哈哈哈！你就有云南美食文化推广大使,1421,2019-09-29 18:03,1
@我愿用一生头发换银魂永不完结,,超棒!想看更多，一周周三更新不满足啊，平时发现啥也好，文字也好呀,249,2019-09-29 18:05,1
@李-小-I,,怎N感X又l了一次,90,2019-09-29 18:01,1
@纳兰翠凤,,真好，大学时去云南玩了半个月，太美了。有机会好想再去一次,79,2019-09-29 18:01,2
@筱筱含嫣焦无忧,,图一的蘑菇都能吃吗？,45,2019-09-29 18:56,1
@Lin林薇薇,,什么时候去旅游是最好的时候？,5,2019-09-29 22:35,1
@Daisy66是我,,因为你越来越对云南感兴趣了！明年暑假打算去避暑呢！,5,2019-09-29 21:55,1
@坦荡散淡,,超级棒，身边好多人都很喜欢你，你走出了自己的路。希望小哥越来越好～,12,2019-09-29 20:45,1
@Totoro吖,,西北娃在云南，好喜欢这里呀,6,2019-09-29 21:41,1
@Rhona_,,感谢有小哥 让更多人知道了咱们云南这片土地的美好！,6,2019-09-29 21:26,2
@呵一气,,一直看你视频，觉得云南是个特别美好的地方！,6,2019-09-29 20:13,1
@Yukikiki喵,,想多看看小哥的日常！,4,2019-09-29 19:00,1
@星球肆肆,,我怎觉得看到过,2,2019-09-29 18:00,1
@MilkyAnnine,,前排,2,2019-09-29 18:00,1
@小绿的柠檬蜜柚,,好喜欢云南,0,2019-10-03 18:33,1
@我是乔安安呀,,好喜欢图八的篮子,3,2019-09-29 21:47,1
@小珂珂啊西,,去云南的时候看到那些民房就在想这是不是小哥的家，还想要是一直住在这里就好了。开家客栈喝杯小酒种些花儿草儿的，和来自天南地北的朋友谈天说地快意人生，简直太美好了叭！！,3,2019-09-29 20:34,1
@深情于你i,,你真的很棒，也许很坎坷，但是结果很好，让大家认识了更美好的云南，有时间一定要去转转，能去你那更好了,3,2019-09-29 20:15,1
@樟木头M,,这次去云南吃到了很多阿盆姐视频里的云南特色美食，真的鲜美，而且在别的地方吃不到的。云南真的是一个宜居的地方，有机会一定要第四次拜访。,2,2019-09-30 23:35,1
@南墙523,,我原来都没有机会出过我们云南，直到今年上大学来到了哈尔滨。周围的同学都是四面八方来的，对于我们云南的美丽和他们口述得很无力，而且我也发现在外面的人眼里对云南的了解不是很多。希望你能继续坚持  把云南文化，更广的传播下去,1,2019-12-21 09:35,3
@Katie-Star,,真后悔现在才关注你的微博，一直在补视频，真的很喜欢多彩云南啊！,1,2019-10-17 20:19,1
@咦慧容耶,,满满的正能量,1,2019-10-02 21:40,1
@喜Z紫,,博主是我们云南保山人吗？,1,2019-09-30 21:40,1
@尹尹姑娘,,好喜欢那些编织的东西,1,2019-09-30 13:29,1
@水心馨桉,,有幸去过云南，小住了半年，云南四季如春，风景很美，现在回家结婚生子了，真希望再有机会可以去,1,2019-09-30 12:14,1
@姐是个认真人儿,,真希望你能看看我给你发的私聊,1,2019-09-30 00:00,1
@青衫故人88,,以前在我的认知里云南人都是不美好的象征，自从看了你的视频，关注了你这么些年，我觉得你完全刷新了我的认知，在我心里，云南人都是像盆姐这样厉害持家的好女孩，加油，希望你以后越做越好，永远关注你[加油][加油][加油][加油],1,2019-09-29 23:43,2
@Hey月光宝盒,,加油！！！永远支持你,1,2019-09-29 23:27,1
@Muelche,,喜欢云南这个城市，向往云南这个城市，都是因为小哥!,1,2019-09-29 22:56,1
@嗯是空空,,谢谢你给我们呈现了一个生动立体的云南，遍地是宝，四季如春，风景如画，成为了一个我心之向往之地。,1,2019-09-29 22:31,1
@无花的蔷薇-FY,,新起之秀,1,2019-09-29 18:58,1
@琴棋书画诗酒花柴米油盐酱醋茶辣,,看这条微博的时候我脑子里面都是小哥的声音,1,2019-09-29 18:52,1
@希希希宝贝er,,嗯？？？？,1,2019-09-29 18:50,1
@浮殇倾城,,阿盆姐，我很喜欢你的视频哦，挺早之前就关注你了呀，请你继续加油鸭，我会一直支持你的,1,2019-09-29 18:18,1
@Bling_Bling_雪儿,,小哥，棒棒哒,1,2019-09-29 18:07,1
@番茄你个马铃薯vvv,,加油，看好你,1,2019-09-29 18:01,1
@阿梦还是个孩子,,好酒不怕巷子深，加油,1,2019-09-29 18:01,1
@椰几又,,加油鸭,0,2019-12-27 17:45,3
@不哭_C-929,,无意中看到你的视频，也成为你粉丝中的一员，你让我见识到了不曾去过的云南，云南真的好美，小哥加油啊,0,2019-12-26 18:52,3
@1号拿铁,,小村庄生活安逸闲适，岁月静好哦,0,2019-11-09 07:39,1
@Dear_H_Z,,特别想去你家玩,0,2019-10-26 22:23,1
@喵喵的猫小喵,,厉害的盆姐,0,2019-10-24 09:52,1
@舞文弄墨wen,,老师不是说颜色鲜艳的蘑菇有毒不能吃的吗？,0,2019-10-23 12:59,1
@胡桃夹子biu-,,真的很棒 会一如既往支持的,0,2019-10-16 23:22,1
@十里燃绛树,,你可能不知道，我是在Facebook上看到你，然后才来微博关注你的,0,2019-10-16 21:13,1
@小麻雀Poppy,,,0,2019-10-12 14:46,1
@Z鱼小姐,,虽然没吃过，但是隔着屏让我爱上了云南菜。,0,2019-10-08 21:29,1
@吉达gilda,,我也是德宏的 图三是我们景颇姑娘,0,2019-10-07 21:51,1
@爱着王立志_only,,特别喜欢云南,0,2019-10-04 21:24,1
@九歌与月,,加油，小盆盆,0,2019-10-04 20:45,1
@Day总铁粉1,,加油，姐妹,0,2019-10-04 10:01,1
@滑屯鼓滑cw,,小哥，一直在关注你，把你所有的视频都看了不止3遍，喜欢你,0,2019-10-03 20:22,1
@啤酒西瓜小番茄,,好想去云南啊  有美景还有好多好吃的,0,2019-10-03 18:08,1
@一只骄傲的小猫咪,,加油[加油],0,2019-10-02 20:06,1
@桔梗火鹤,,图八真的好心灵手巧啊，那个鸭子箩筐绝了,0,2019-10-02 15:15,1
@眼镜大咖张鹏,,向往的生活,0,2019-10-02 12:59,1
@致命假敌,,为小哥打call 为祖国打call,3,2019-09-30 12:53,1
@四会林o老细,,我真的好喜欢云南，去过一次云南，真的就想留在云南不想回来。我想着以后的婚纱照都要去云南拍。谢谢你带我看到云南更多的美食，文化。,0,2019-09-30 10:04,1
@_给吃屁,,图五好美呀 我也是少数民族 可惜从小都没穿过民族服装,0,2019-09-30 00:56,2
@很想你啊m,,阿盆姐真的很厉害啦！,0,2019-09-30 00:30,1
@某糖2,,很治愈我,0,2019-09-30 00:28,1
@割据,,我好喜欢看你的视频啊！！要是能再长一点就好啦,0,2019-09-29 23:27,1
@张易瑶,,加油鸭,0,2019-09-29 23:20,1
@每天都在找大U,,小哥很棒！,0,2019-09-29 22:52,1
@爱烊烊的星星,,棒,0,2019-09-29 22:49,1
@冷秋思,,想看妹妹做烤乳扇,0,2019-09-29 22:36,1
@星海的宇宙电波,,每次看都会想要自己试,0,2019-09-29 20:53,1
@仇柒个燕-,,去过一次云南，真的是我想留下的地方呀，很美很自由，找到男朋友就一起再去一次，哈哈,0,2019-09-29 20:35,1
@梓灵爱奶茶,,是啊，我好喜欢你,0,2019-09-29 20:16,1
@夹克女孩lingling,,特别喜欢小哥和大王,0,2019-09-29 20:08,1
@哎呀呀加油鸭,,好想去玩，但自从新闻报道云南黑社会打人，感觉这个目的地遗憾搁浅了,0,2019-09-29 19:56,1
@我是缩珂吖,,关注小哥好多年了，好像从刚开始没有那么多粉后来慢慢成为大网红,0,2019-09-29 19:54,1
@依霖今天开心吗,,所以小哥这次十一目瑙纵歌去嘛,0,2019-09-29 19:45,1
@kiki1087-,,南方人想吃云南的烤豆腐！！！,0,2019-09-29 19:40,1
@一只怂松,,云南人表示云南真的很神奇,0,2019-09-29 19:17,1
@苏漫Suman_,,,0,2019-09-29 19:08,1
@星烛火,,小哥，这个国庆我要去云南吃吃吃了！,0,2019-09-29 19:05,1
@bluebell-yy,,,0,2019-09-29 18:55,1
@竹竿__小姐,,让更多人了解了我们云南,0,2019-09-29 18:49,1
@小丸子同学xx,,云南人的骄傲！,0,2019-09-29 18:33,1
@Niu8544,,图八,0,2019-09-29 18:28,1
@稀饭要加油啊,,我不一样，我是在B站看了很多视频后反而安利给了我云南室友,0,2019-09-29 18:27,1
@奶昔Jersy,,喜欢！超棒！,0,2019-09-29 18:26,1
@yyice,,我真的喜欢云南，喜欢昆明这座我生活了八年的城市,0,2019-09-29 18:25,1
@左大傻呀,,我只会吃..,0,2019-09-29 18:24,1
@小五食记,,彩云之南，一片想重复去无数次的土地,0,2019-09-29 18:21,1
@姜米茶-,,同意 云南真的是一个很神奇的地方 ,0,2019-09-29 18:19,1
@潇洒走一遭的墨,,小哥棒棒哒,0,2019-09-29 18:18,1
@obsht,,大美云南,0,2019-09-29 18:18,1
@渣渣圆一啵超甜,,可能小哥不晓得其实微博还有个编辑原微博的功能啦,0,2019-09-29 18:05,1
@遥望星河DW,,你真的好棒啊,0,2019-12-23 04:45,3
@下一次烟火,,很佩服你，真的，你在做一件非常有意义的事，加油！,0,2019-12-23 02:47,3
@归来兮复兴,,保山老乡，厉害咯厉害,0,2019-12-18 20:01,3
@theSouthernwind,,从小我爸妈也是这样教育我的，哎，但做饭技术真的,0,2019-12-13 17:48,1
@再见萤火虫J,,勤劳善良的人最可敬,0,2019-12-05 18:21,1
@angell白羊,,云南美，人心更美,0,2019-12-05 09:58,1
@咿咿呀呀小太阳,,啊啊啊 简直太棒了,0,2019-12-03 18:25,1
@雪梨Shirley的世界,,好棒的视频！好美的女孩子，我每期都看！,0,2019-11-30 15:35,1
@flyyanziyanzi,,特别向往这种生活，回归最朴实的生活,0,2019-11-25 00:15,1
@冰糖小红帽,,小哥的视频都是自己录的吗,0,2019-11-20 15:58,1
@殊少年,,山水好美，空气好好哦,0,2019-11-19 12:21,1
@画板dlwxn,,你怕不是保山的，卡斯？施甸？？,0,2019-11-15 16:06,1
@吃猪蹄的路飞,,长得好漂亮，视频也好好看，粉了粉了,0,2019-11-15 14:00,1
@Oliend,,你真的优秀鸭。,0,2019-11-14 21:57,1
@LZX婷,,你真的很棒，加油！,0,2019-11-11 16:56,1
@EeeeEeee90,,德宏,0,2019-11-08 23:48,1
@绦绦绦绦,,支持你哦,0,2019-11-08 18:50,1
@TherealpearLee,,从papi的视频开始认识你的，当时就觉得好专业的团队，画面这么美，但是又这么真实，不像有的一看就是摆拍。真实才是最打动人的，了解到背后的故事真是特别佩服，希望有一天能够去小哥的家乡看看，支持你,0,2019-11-03 21:11,1
@WaltzNo19,,小姐姐，你是哪里的。我是大理的,0,2019-11-03 08:08,1
@佳美香柏树,,喜欢云南的气候和天！,0,2019-11-02 21:43,1
@小幸福_lfcswry,,妹妹你很棒，我们一家人都喜欢看呢,0,2019-11-01 09:52,1
@v起个名怎么这么难,,小哥  竹制品卖吗,0,2019-11-01 00:55,1
@18岁的罗小小,,一直关注你，觉得你很棒！@滇西小哥,0,2019-10-31 14:38,1
@何小木的木吉他,,小哥加油！等着你出一期酸笋炒牛肉,0,2019-10-29 15:29,1
@右眼鸡啄过,,我恋爱了,0,2019-10-28 01:47,1
@Rock-谭覃,,好喜欢你的视频，也好喜欢你，让我了解到一个世外桃源般的云南保山。,0,2019-10-28 01:23,1
@你脸长腚上啊,,我大学云南读的，我很喜欢云南。云南是我第二故乡。所以很早前关注是因为拍摄云南美食，我很喜欢。,0,2019-10-27 14:22,1
@西南猎鹰96412CPLASF,,你真的很棒、漂亮贤惠传递正能量,0,2019-10-27 13:28,1
@不可触摸的温度,,这种编的箩筐哪里可以买啊，感觉很有意思,0,2019-10-25 22:11,1
@执手凝眸199104,,每次看你的美食视频让我更加想去云南了，好想生在云南,0,2019-10-25 20:22,1
@想要个游乐园,,一切都那么平凡而自然  笑死我了,0,2019-10-25 10:52,1
@一六末日,,看到你，我才发现原来真的有向往的生活的存在！,0,2019-10-25 08:00,1
@小心别着迷,,很棒哦,0,2019-10-25 02:20,1
@花爱糖三角,,我就不是很会做家务，感觉在技能方面完犊子了,0,2019-10-24 22:39,1
@宣妞姐姐,,一直默默喜欢，每个视频看好几遍,0,2019-10-24 22:25,1
@爱梦爱疯的nana酱,,盆鸡，继续走下去啊！！支持你！！！,0,2019-10-24 20:28,1
@Connie895,,非常喜欢小哥拍的视频，同样也非常喜欢你的为人，淳朴善良，真心希望你工作顺利，生活美满，健康快乐！,0,2019-10-24 17:39,1
@廖小廖MonKey,,好有食欲,0,2019-10-24 11:37,1
@沐若茯兮,,,0,2019-10-23 23:53,1
@脾气炸裂的怪物史迪仔-_-,,，， 你，n，。，你，。， ， ，那你，，，，你，你，那你，。i，， ，,0,2019-10-23 19:47,1
@想做考拉的人类,,地址发一下吧，假期去玩，真的太美啦,0,2019-10-20 19:43,1
@东风入律y,,美丽的女孩儿加油！,0,2019-10-20 12:47,1
@Sue机器人,,你真实多了,0,2019-10-19 11:48,1
@洁哥家的罗甜甜,,我很喜欢云南,0,2019-10-19 00:51,1
@天之蓝海之源,,好漂亮，有卖的么？ 评论配图,0,2019-10-18 21:54,1
@DE,,又骗我去云南,0,2019-10-17 23:39,1
@暴露id算我输,,继续加油呀，很喜欢看这样的视频！！！,0,2019-10-17 19:57,1
@Peain_,,优秀的是近乎完美的声效和真实 比科班生还要优秀！！棒！,0,2019-10-16 23:15,1
@茶茶的厨房,,为你点赞，喜欢你,0,2019-10-16 18:07,1
@扭屁股肥妞妞,,想多看看你们地方上的东西。出门的时候可以拍拍vlog介绍一下当地民俗啥的,0,2019-10-16 16:02,1
@请回答2013Echo,,加油,0,2019-10-16 07:37,1
@~[兮,,老早就发了 又发  文字像论文 挑不出一丝毛病 国外谁知道你了,0,2019-10-16 00:44,2
@~[兮,,说的跟唱的似的,0,2019-10-16 00:43,2
@还清,,我都想去云南了，因为你,0,2019-10-15 20:20,1
@盆盆0123,,很喜欢云南还有云南的美食,0,2019-10-15 18:45,1
@魔道全是刀,,我想成为铁粉,0,2019-10-14 20:17,1
@舒心呀-Sunny,,因为你的视频喜欢上了做饭,0,2019-10-14 19:00,1
@姚三土老师,,二则你说的你的人生其实和大家是一样的，经历了所谓的中考、高考、大学、工作，但只有回到那个生养你的地方你才最终找到了你自己！真想把你的故事讲给学生听（因为我是一个老师）人生还是要和大家一起经历很多共同的事情而后可能才能找到自我！谢谢你的分享！很喜欢！,0,2019-10-14 17:11,2
@姚三土老师,,我和婆婆在国庆期间每天看你的视频，感触颇深。一则我们每天都在进行做饭这事，只有你想到把它记录下来并且呈现在大家面前，说明生活需要有心人。,0,2019-10-14 17:11,2
@一日之际在于吃,,好美啊！真想去一次云南,0,2019-10-13 19:14,1
@小惠萍apple,,很喜欢你分享的内容,0,2019-10-13 19:12,1
@sheya007,,特别棒,0,2019-10-12 22:55,1
@南鱼兮,,索尼机身,0,2019-10-12 22:53,1
@小小妈妈911,,超级喜欢你做菜的样子,0,2019-10-12 22:43,1
@dearppppppppenny,,继续坚持，喜欢你的视频，喜欢云南美食！如果以后小哥开个云南餐馆，肯定成为网红店！,0,2019-10-12 19:58,1
@nomatter5622,,超级喜欢你，啊盆姐,0,2019-10-12 17:03,1
@hopoyoyo,,太喜欢你做的视频了,0,2019-10-12 00:25,1
@可乐请多加冰,,小哥超棒的！从大一关注你到现在大三，真的觉得你的视频非常真诚，小哥肯定是个很棒的女孩子，加油！,0,2019-10-11 20:43,1
@suuie66,,我一直以为背后有个人在帮你拍摄,0,2019-10-11 13:00,1
@xintyan88,,想去盆姐家，想去云南,0,2019-10-11 09:51,1
@Max丿莹,,身在海外、每次都定期观看YouTube的你,0,2019-10-11 07:44,1
@trew4r43,,视频是你自己一个人拍的吗？,0,2019-10-10 14:19,1
@不绿的草儿,,,0,2019-10-10 11:44,1
@十七Ailce,,很棒！加油盆鸡,0,2019-10-09 22:53,1
@玩世泥人,,彩云之南，太美了,0,2019-10-09 22:02,1
@脱颖而出的坤儿,,小姐姐，你家这个地方潮湿吗？或者说一年四季有那种梅雨季吗？好像去一个没有梅雨季的地方,0,2019-10-09 21:48,1
@Elsa的mm乔伊J,,想做你邻居来,0,2019-10-09 17:05,1
@剑桥肉博士,,大理人真的好爱好爱你,0,2019-10-09 16:54,1
@超级阳光316,,爱你!,0,2019-10-09 16:34,1
@糖小果爱阿胶,,我想知道小哥是云南哪里的,0,2019-10-09 12:16,1
@阿园520YUyy,,第五张照片拍的地方好像黄草坝！,0,2019-10-08 23:05,1
@winnie0910,,图八的篮子篓子好精致啊，很喜欢,0,2019-10-08 22:41,1
@yx梦里梦到醒不来的梦,,加油小哥,0,2019-10-08 22:12,1
@西瓜汁UU,,加油呀，默默无闻的看你视频两年多了，每次看你的视频都觉得这样的生活好真实也好羡慕，通过你的视频对云南也有了很多了解。每次都好像尝尝你做的那些菜啊,0,2019-10-08 21:39,1
@一颗绿皱豌豆,,你是我身在异乡想家时的光啊,0,2019-10-08 15:52,1
@大猫咪爱吃鱼05,,云南真的炒鸡美丽,0,2019-10-08 10:50,1
@懒虫595_306,,,0,2019-10-08 07:28,1
@时不时去做个异乡人,,去过五次云南的人表示真的喜欢云南,0,2019-10-07 22:57,1
@丶淡离_349,,只要半夜别用电棒照我 然后扣篓子里 你说啥都行,0,2019-10-07 22:20,1
@一个人发疯leona,,图一手上的菌我们四川也有，叫九月香。超好吃的,0,2019-10-07 20:42,1
@果然淘气HCY,,没去过云南，但印象里就是天蓝水清景色美。看你视频之前，我对云南美食唯一的印象是云南白族肉串,0,2019-10-07 16:55,1
@eeggmm,,最喜欢的地方就是云南大理,0,2019-10-07 01:23,1
@Justinyangy,,图三景颇族小姐姐太美了,0,2019-10-06 23:29,1
@_MiSsNi,,竹制品 有淘宝店吗 想买,0,2019-10-06 21:35,1
@眉毛太高,,保山人民会为你自豪！加油！,0,2019-10-06 17:19,1
@┘,,想去云南旅游,0,2019-10-06 16:40,1
@谭鑫潼,,好美哦  你的家乡  好想去旅游看看,0,2019-10-06 13:41,1
@\de呀俊,,很喜欢看到慈祥的奶奶,0,2019-10-06 10:33,1
@前年的去年,,加油,0,2019-10-06 02:02,1
@尼奥森林,,身为云南人，为你感到自豪，一路支持你阿盆姐!,0,2019-10-05 21:42,1
@春野花枝,,小哥，我是腾冲的呀,0,2019-10-05 20:06,1
@Dantes001,,很美腻，图1一下就看出是野生菌,0,2019-10-05 19:04,1
@子兔耳,,好喜欢吃云南菜,0,2019-10-05 17:22,1
@nimaime,,云南真的是个好地方，喜欢你的分享！,0,2019-10-05 16:38,1
@用户Deila,,,0,2019-10-05 15:43,1
@高海一桥,,你是哪位儿滴？我来找你玩好不好！,0,2019-10-05 13:58,1
@温柔女杀手333,,从四十几万粉丝的时候就关注你啦，到现在的两百多万，这一路看着你过来的，视频的质量也越来越好了，加油呀,0,2019-10-05 13:38,1
@柿子牛奶冰,,看了你的视频很想去云南,0,2019-10-05 13:34,1
@猕猴桃娘亲,,你真的很棒，一直默默地关注,0,2019-10-05 12:37,1
@小栩子DF,,超喜欢云南，多彩云南,0,2019-10-05 11:31,1
@优城购物商业招商,,竹篮子有卖的吗？,0,2019-10-05 10:36,1
@酸秆子,,感谢你让更多人认识云南，了解云南的美丽,0,2019-10-05 09:26,1
@Dora-ra,,真棒！！,0,2019-10-05 03:20,1
@Kui-In,,我的妈耶，图一的蘑菇怎么那么多颜色呢,0,2019-10-05 00:49,1
@happy欢461002123,,我很想买图8那些竹编藤编的东西,0,2019-10-05 00:46,1
@宝藏女孩文霞,,你很棒，欢迎你来郴州玩,0,2019-10-05 00:37,1
@白风夕兮,,姐姐你也是少数民族吗？,0,2019-10-04 23:48,1
@惠姐姐喔哦,,感谢你一直坚守初心，带给我们更多美好的作品和故事！,0,2019-10-04 22:49,1
@橙子姑凉LOVE,,加油啊盆姐我永远都支持你呢,0,2019-10-04 22:42,1
@宁LX远,,喜欢大王,0,2019-10-04 21:46,1
@间歇性积极向上coco,,加油～云南美食真的很多,0,2019-10-04 20:17,1
@赵小妮儿_,,云南是我最美好的记忆,0,2019-10-04 20:07,1
@淮相大人,,,0,2019-10-04 19:49,1
@是尹夏妍啊,,宝宝到底是不是我们德宏的呀,0,2019-10-04 19:24,1
@一啵赞赞一起吃火锅,,长大后发现会做饭还是好重要的，毕竟美好的生活从吃饭开始,0,2019-10-04 13:02,1
@hbksmcks,,特别喜欢看你的视频，每次看都有种暂时脱离现实沉浸在世外桃源的感觉,0,2019-10-04 12:20,1
@宁成卓越,,,0,2019-10-04 11:54,1
@他叫她二小姐,,感谢你带我们认识这么好的云南,0,2019-10-04 06:22,1
@中华田园单身狗,,已在昆明，盆姐报地址 我想去觅食,0,2019-10-04 02:05,1
@十二朔,,厉害！我是湖南人，在学校西苑吃过云南菜觉得云南菜也太好吃了吧！看到小姐姐用心做的视频觉得小姐姐真的是太棒了！加油噢！,0,2019-10-04 00:01,1
@福团儿duo,,一个字一个字看完，深有感触。,0,2019-10-03 22:41,1
@陈肥泥,,这个国庆在你家乡度过,0,2019-10-03 22:15,1
@tswize,,我很羡慕你 加油！,0,2019-10-03 21:49,1
@你最珍贵lmb,,民族的才是世界的，说得真好。希望你能带着中华民族的文化，让世界了解中国，爱上中国。爱你,0,2019-10-03 13:58,1
@小澄溪,,为你点赞，传播云南文化,0,2019-10-03 13:42,1
@Lu小小小小Xi,,支持你，通过关注你对云南有了无线的向往,0,2019-10-02 21:53,1
@椰几又,,加油鸭,0,2019-12-27 17:45,3
@不哭_C-929,,无意中看到你的视频，也成为你粉丝中的一员，你让我见识到了不曾去过的云南，云南真的好美，小哥加油啊,0,2019-12-26 18:52,3
@加油卢77,,喜欢你,0,2019-12-23 22:24,2
@遥望星河DW,,你真的好棒啊,0,2019-12-23 04:45,3
@下一次烟火,,很佩服你，真的，你在做一件非常有意义的事，加油！,0,2019-12-23 02:47,3
@怡然之心田,,竹器好漂亮！网店有卖吗？,0,2019-12-22 22:48,2
@南墙523,,我原来都没有机会出过我们云南，直到今年上大学来到了哈尔滨。周围的同学都是四面八方来的，对于我们云南的美丽和他们口述得很无力，而且我也发现在外面的人眼里对云南的了解不是很多。希望你能继续坚持  把云南文化，更广的传播下去,1,2019-12-21 09:35,3
@归来兮复兴,,保山老乡，厉害咯厉害,0,2019-12-18 20:01,3
@毛蛋六号,,@让我成为有钱人 可以关注一下这个姐姐，她专门做云南美食视频，不过口味偏向西双版纳那边的多一些,1,2019-12-16 08:19,2
@椰几又,,加油鸭,0,2019-12-27 17:45,3
@不哭_C-929,,无意中看到你的视频，也成为你粉丝中的一员，你让我见识到了不曾去过的云南，云南真的好美，小哥加油啊,0,2019-12-26 18:52,3
@加油卢77,,喜欢你,0,2019-12-23 22:24,2
@遥望星河DW,,你真的好棒啊,0,2019-12-23 04:45,3
@下一次烟火,,很佩服你，真的，你在做一件非常有意义的事，加油！,0,2019-12-23 02:47,3
@怡然之心田,,竹器好漂亮！网店有卖吗？,0,2019-12-22 22:48,2
@南墙523,,我原来都没有机会出过我们云南，直到今年上大学来到了哈尔滨。周围的同学都是四面八方来的，对于我们云南的美丽和他们口述得很无力，而且我也发现在外面的人眼里对云南的了解不是很多。希望你能继续坚持  把云南文化，更广的传播下去,1,2019-12-21 09:35,3
@归来兮复兴,,保山老乡，厉害咯厉害,0,2019-12-18 20:01,3
@毛蛋六号,,@让我成为有钱人 可以关注一下这个姐姐，她专门做云南美食视频，不过口味偏向西双版纳那边的多一些,1,2019-12-16 08:19,2
@coolkid7,,喜欢你的视频,0,2019-12-15 11:19,1