User,Reter,Comment,Votes,Time,Count
@猪大思,,#韩东君飞行员制服# 最帅飞行员韩东君带给大家最燃征兵大片！,165,2019-09-30 12:56,2
@整形君,,特地赶来支持博主！！,163,2019-09-30 12:51,3
@甜甜圈BowDonut,,敬礼干净利落！太帅了！,160,2019-09-30 13:36,2
@把送你的辣条还给我,,帅就一个字，我可以说好多次,125,2019-09-30 13:55,2
@洋葱圈和柠檬茶,,这个动作很帅气啊，真的是越来越喜欢他了,113,2019-09-30 14:03,2
@扎小辫子戳你,,穿制服的韩东君是真的帅！真的真的帅！,104,2019-09-30 13:52,2
@DQQ萌萌哒,,穿飞行员制服的韩东君更加帅气，迷人，真的很有魅力。,93,2019-09-30 13:45,3
@球球怎么这么好看,,韩东君这一身飞行员制服真的帅，简直就是行走的荷尔蒙，我又恋爱了,85,2019-09-30 14:09,3
@小咕咕咕咕咕噜,,敬礼的那一刻，心里有种说不出来的感觉,83,2019-09-30 13:59,2
@骑着蜗牛闯红灯呀,,看韩东君穿飞行制服，哪哪儿都帅啊,74,2019-09-30 13:57,2
@苍蓝星LL,,自从中了名为韩东君的毒，就上瘾了戒不掉了，被一身飞行员制服的韩东君电到了，满满的正气,24,2019-09-30 14:15,3
@哒哒的马蹄声L,,啊啊啊啊啊啊韩东君哥哥这个敬礼真的在线杀我,15,2019-09-30 14:13,3
@馨朵dE世界,,太帅了，真的颜值爆表哦…怎么看都看不够,14,2019-09-30 14:16,3
@坩,,敲敲敲，看制服系韩东君，又A又酷我可以,9,2019-09-30 15:44,3
@阿樱小花花,,韩东君这颜值爆表啊！,7,2019-09-30 15:19,2
@夏夜冬溪,,穿制服的韩东君我爱了,5,2019-09-30 15:17,2
@Anni蓝安,,感觉穿上制服真的很帅气啊！特别喜欢这样的,4,2019-09-30 14:12,3
@可爱老胡,,都说男神帅不帅，剃个平头就知道了，小韩可谓是真的帅,4,2019-09-30 14:05,2
@L爱猫咪L,,血槽空了，韩东君这完全是犯规啊，要不要这么帅，承包他的飞行员制服造型，简直就是制服控的春天 评论配图,3,2019-09-30 14:13,2
@柚子蜜先生啊,,这个敬礼也太帅了,1,2019-09-30 16:01,2
@今天的理想66,,荷尔蒙爆棚,0,2019-09-30 23:06,6
@破浪无畏之矛,,他来了他来了，他穿着飞行员制服向我们帅气的走来了！哥哥太飒了 评论配图,0,2019-09-30 16:42,3
@有勇有某的鱼,,穿飞行员制服的韩东君更加帅气，迷人，真的很有魅力，走起路来都满满的正气,0,2019-09-30 16:35,2
@月亮怎么,,韩东君的制服诱惑，太迷人了，敬礼的动作很man，太刷帅了。 评论配图,0,2019-09-30 16:30,3
@尖叫了路人,,真的特别帅气，已经被圈粉了啊,0,2019-09-30 14:44,3
@郑柏旭的粉丝团,,今日“最帅男飞行员”非小韩莫属啦,0,2019-09-30 14:25,3
@开到荼靡的你,,韩东君真的好帅啊！飞行员制服不要太拉风,1,2019-09-30 14:16,2
@住在太阳上的蓝精灵,,敬礼的动作，是迷倒了多少人的帅气,1,2019-09-30 14:16,2
@养了二只龟,,真的太man了，满满的正气,2,2019-09-30 14:23,2
@酒窝很酷,,穿上制服的小韩越看越帅气，真的是太喜欢他了,2,2019-09-30 14:22,2
@剁椒鱼头头_,,哇这也太太太太帅了吧！怎么能这么帅！太吸引我了！,1,2019-09-30 14:38,3
@帅的掉炸包,,韩东君这个飞行员造型真的是帅炸了。 评论配图,1,2019-09-30 14:29,2
@什么时候才能瘦十斤,,对于穿制服的男生完全抵挡不住 评论配图,1,2019-09-30 14:27,2
@儒雅的我就是静静,,很喜欢穿制服的小哥哥们呀，,1,2019-09-30 14:25,2
@你有你的安排wu,,真的是制服诱惑，这谁能受得了啊，awsl 评论配图,1,2019-09-30 14:16,2
@赵大佳s,,哇这男人穿制服也太帅了吧！,2,2019-09-30 14:06,2
@向往阳光的一天,,爱一个人有时候是因为他的一首歌，有时候是因为他的一个眼神儿，我爱你是因为你的制服。,0,2019-09-30 16:46,2
@刘哲彤本人,,好帅一男的！小韩好适合这种英姿飒爽的造型,0,2019-09-30 16:43,3
@稚迩,,看完之后我只想大喊三声哥哥我可以,0,2019-09-30 16:41,2
@京城已无大爱,,韩东君走起路来都是满满的正气感,1,2019-09-30 16:10,2
@新番还没更完,,厉害了我的哥，这制服穿搭太帅了,1,2019-09-30 16:09,4
@北秋的夏季,,喜欢军人的正气。,1,2019-09-30 16:09,2
@南瓜小公主啊,,这是电影，还是电视剧啊？好像很好看，韩东君帅帅的！,1,2019-09-30 15:59,2
@你是人间星光啊,,想要这样一个男朋友啊,0,2019-09-30 15:58,2
@一份酱汁鸡肉卷,,就喜欢这种干净利落的样子,0,2019-09-30 15:55,2
@告白气球在等你,,制服诱惑啊,0,2019-09-30 15:43,2
@泡芙小姐没有猫,,敬礼很标准也很利落，简直不要太帅啊,0,2019-09-30 15:40,2
@抹茶小姐爱可乐,,最帅飞行员已上线，敬礼真的帅到我了,0,2019-09-30 15:39,2
@两只乌龟-,,一定会去支持中国机长的，肯定很给力啊,0,2019-09-30 14:47,3
@蓉ren1,,韩东君的这个造型简直太帅了，好A呀,0,2019-09-30 14:17,2
@就让你知道我叫啥,,这大概是妥妥的制服诱惑了,0,2019-09-30 14:17,2
@勤俭小菇娘,,韩东君真的好帅啊！飞行员制服真的太拉风了。,2,2019-09-30 14:26,2
@刘大梦me,,真是帅,0,2019-09-30 17:51,6
@我得好好学习努力赚钱呀,,为最帅男飞行员韩东君疯狂打call,0,2019-09-30 17:28,6
@没有公主的命我有女王,,穿制服的韩东君还是很帅气的 评论配图,0,2019-09-30 17:04,2
@我的遥远的你,,今天去电影院看我们的大帅哥了,0,2019-09-30 17:04,2
@都怪骆驼压死了稻草,,怎么可以连敬礼都这么帅,0,2019-09-30 17:04,2
@楠楠是一只小懒虫,,敬礼的时候，要不要那么酷啊,1,2019-09-30 17:00,2
@黄小鸭的么么哒,,今天在电影院有被韩东君给帅到啊,1,2019-09-30 16:54,2
@儿监,,韩东君这完全是犯规啊，要不要这么帅啊,1,2019-09-30 16:48,2
@一天的美好记忆,,一遍又一遍的看，深深地被你这个敬礼的动作所感染。,1,2019-09-30 16:47,2
@曾经的昨天是明天,,这完全是上演的制服的诱惑啊！,0,2019-09-30 16:45,2
@中二少女皮卡丘,,韩东君好帅气！飞行员制服杀一身正气 评论配图,0,2019-09-30 16:41,3
@不吃糖超甜,,太帅了吧！制服诱惑我经受不住,0,2019-09-30 16:36,2
@子迁201904,,穿制服的韩东君真的超级man，真的超级帅啊喜欢喜欢,0,2019-09-30 16:34,3
@北在北方等你,,韩东君的制服是很不错的啊！,0,2019-09-30 16:30,4
@麻麻心疼小芒果,,哇哦，这样看着你们都很帅气啊…… 评论配图,0,2019-09-30 16:26,4
@不瞎---,,制服最的韩东君，这小寸头喜欢,0,2019-09-30 16:23,2
@贝塔single,,喜欢这样的制服硬汉,0,2019-09-30 16:13,2
@三生烟火乱云端,,穿制服的韩东君你可真厉害，整个人帅帅哒。,0,2019-09-30 15:54,2
@颜富朗敬轮,,穿制服的哥哥帅呆了，我已经把这个视频看了很多遍了,0,2019-09-30 15:47,3
@小短羞,,帅到没朋友啊 评论配图,0,2019-09-30 15:44,2
@日月与卿mua,,超级帅的韩东君，在我和我的祖国里面真的超级霸气,0,2019-09-30 15:22,2
@卑微小付吖,,敬礼的动作真的很man，满满的正气，最帅男飞行员非他莫属！,0,2019-09-30 15:21,2
@制冷少女非我莫属,,韩东君是最帅的飞行员，迷死了,0,2019-09-30 15:16,2
@不及厮你,,真的是我被韩东君帅一脸怎么能这么好看,0,2019-09-30 15:15,2
@i糊童,,哥，你是吃啥长大的，怎么能长得这么帅呢 评论配图,0,2019-09-30 15:14,3
@在原地转圈圈么,,我觉得韩东君真的超级帅哦，笔芯,0,2019-09-30 14:58,2
@牛奶味的大可爱,,韩东君的制服诱惑也太撩人了吧，心动的感觉啊,0,2019-09-30 14:35,2
@轻烟凉梦,,韩东君飞行员的造型太好看了吧，爱了爱了,1,2019-09-30 14:26,2
@知否知否不可求呀,,#韩东君飞行员制服# 敬礼的动作很man，满满的正气,1,2019-09-30 14:25,3
@璃篱漓,,穿制服的韩东君真的帅死了,0,2019-09-30 14:13,2
@布什陈,,这都是高颜值的军哥哥们啊,1,2019-09-30 16:21,2
@榆邹城佳,,对于穿制服的韩东君完全抵挡不住，真的太man了。,1,2019-09-30 14:31,2
@超级撩人,,穿上制服的韩东君哥哥真帅呀！好喜欢满满的正气。,1,2019-09-30 14:29,4
@我的发带拉风,,韩东君这样穿制服真的是让我心动不已啊,1,2019-09-30 14:28,4
@ohhokok,,摧枯拉朽之力席卷全身！！！,0,2019-09-30 22:19,6
@明月何时有q,,喜欢,0,2019-09-30 17:50,8
@女汉子Monologue婧婧婧,,哇塞真帅,0,2019-09-30 17:49,7
@K裘,,马上就可以在影院看到帅气的韩飞行员啦,0,2019-09-30 17:30,6
@鲸,,这个敬礼干净利落真的太帅了，我好喜欢啊,0,2019-09-30 17:26,2
@许我十里,,超级帅的韩东君,0,2019-09-30 17:13,2
@安吉的老阿姨,,对穿制服的韩东君毫无抵抗力,0,2019-09-30 17:11,2
@山野田间徘徊,,给我们满满的正能量,0,2019-09-30 17:11,2
@站在远处想你,,戴墨镜超酷的韩东君,0,2019-09-30 17:09,2
@萌面超人很厉害,,敬礼的动作非常有气质,0,2019-09-30 17:09,2
@捧场君,,最帅气的飞行员非他莫属,0,2019-09-30 17:07,2
@老师我送的是挂历,,当然是非他莫属,0,2019-09-30 17:05,2
@吃瓜群豆,,优秀啊谁能抵挡这种魅力啊韩东君走帅哒啊！喜欢,0,2019-09-30 16:43,3
@灌木小乔木,,爱了爱了穿制服的韩东君真令人着迷，真的真的帅炸了,0,2019-09-30 16:41,3
@小芒果呀小芒果妈妈爱你哟,,确实很帅气啊，我也上头了,0,2019-09-30 16:34,3
@一风之音随你,,这个飞行员有点酷，是真的哦！,0,2019-09-30 16:29,4
@离你最远我,,也太帅了吧！没办法不看的帅哥,0,2019-09-30 16:25,2
@摁-牛妞的匡威,,这一刻都是一身正气最帅的,0,2019-09-30 16:24,2
@C牛走走,,我觉得颜值都是最高的啊！,0,2019-09-30 16:23,2
@月亮怎么回事,,韩东君好帅啊，敬礼干脆利落，太喜欢了。,0,2019-09-30 16:19,3
@埃菲尔上的铁塔i,,韩东君穿起制服也太棒了，好帅气,0,2019-09-30 16:13,3
@室语渊芳,,韩东君太帅了，我想要一个这样的男朋友,0,2019-09-30 16:11,3
@紫色的优雅神秘,,哇塞，韩东君敬礼的动作真的超帅，超man的，好喜欢。,0,2019-09-30 15:57,2
@明眉C,,敬礼的动作真的太A了！吹爆韩东君的制服装,0,2019-09-30 15:56,2
@禄辉风德康伯义,,啊啊啊，尖叫起来这也太帅了太迷人了吧,0,2019-09-30 15:53,2
@怀艺凝希环,,无心法师的时候就喜欢你了，现在你又被更多人知道了,0,2019-09-30 15:49,3
@天青色等烟雨oppa,,帅的一匹啊,0,2019-09-30 15:44,2
@日光倾城咪,,这个动作确实帅气十足啊，我都被迷住了。圈粉了,0,2019-09-30 15:42,2
@暴风雨yyyyyy,,满满的正气感，超级man，这个制服装，我爱了！,0,2019-09-30 15:41,2
@达琳酱酱,,看了这个电影真的感动，热血，韩东君超级帅气,0,2019-09-30 15:36,2
@要瘦五斤呀,,这个制服太帅了！主要是韩东君长的帅呀。,0,2019-09-30 15:29,2
@一只行走的佩奇,,韩东君的制服诱惑来了，非常帅,0,2019-09-30 15:21,2
@以扫欢乐,,敬礼时的样子真的是帅爆了相信大家都很喜欢,0,2019-09-30 15:19,2
@西瓜味的春秋天,,制服诱惑，最帅的飞行员没有之一,0,2019-09-30 15:18,2
@道理我都懂可我,,韩东君真的是最帅飞行员没错了被制服帅到了,0,2019-09-30 15:17,2
@我四小阔爱,,韩东君确实很帅，而且演技也很在线,0,2019-09-30 15:04,2
@南街你好呀,,韩东君哥哥这个敬礼真的是很有感觉了，制服控的我真的是控制不住自己了,0,2019-09-30 15:02,2
@噜噜噜和啦啦,,喜欢最帅飞行员，简直被圈粉了啊,0,2019-09-30 15:01,2
@我有止疼药,,这制服穿上很有模有样，不亏身材那么好,0,2019-09-30 15:00,2
@杨延昭小迷弟,,哇偶，我觉得韩东君这个飞行员造型真的帅炸了,0,2019-09-30 14:59,2
@呜呜小仙女v,,最帅飞行员，简直是没谁了，笔芯,0,2019-09-30 14:53,3
@是我呀大哥-,,挺优秀的，简直是颜值爆表啊，帅呆了,0,2019-09-30 14:51,2
@今天也在恰柠檬惹,,我也觉得最帅的飞机员是小韩了，太可以了。,0,2019-09-30 14:45,2
@甜酒气泡橙子,,韩东君怎么这么帅呀，我都要爱上他了。,0,2019-09-30 14:43,2
@甜到蛀牙啦,,真的是颜值爆！超级帅气了呢。,0,2019-09-30 14:37,2
@曾小璇璇璇璇,,韩东君这一身也太好看了吧。真是哪都好好看,0,2019-09-30 14:36,2
@奶堡桃圆,,哇塞，真的太帅了吧，我爱韩东君。,0,2019-09-30 14:35,2
@天空飘来彩虹,,真的最帅非他莫属了，真的气质绝了,0,2019-09-30 14:34,2
@辣条爱好者是我啦,,今日最帅飞行员就是小韩没错了,0,2019-09-30 14:32,2
@待夏初临,,敬礼的样子真的是正气满满，必须要支持韩东君,0,2019-09-30 14:31,2
@茴形针,,这样的韩东君我爱了，太帅了,0,2019-09-30 14:25,2
@思绎陆,,真的很飒，看起来好酷啊，连我都觉得帅了！,0,2019-09-30 14:24,2
@粉红豹的魅力,,韩东君还是这么帅气，身材那么好,0,2019-09-30 14:23,2
@用户龙的超越,,一个字帅两个字太帅，三个字特别帅,1,2019-09-30 14:20,2
@啊何小辫子,,我从小就想当警察跟飞行员，然后都没实现！看起来就是帅,0,2019-09-30 14:20,2
@安稳的小鼠酱,,这个称号他绝对是担当得起的,0,2019-09-30 14:19,2
@敖mm_,,有一种痞痞的帅气是怎么回事,0,2019-09-30 14:18,2
@奶茶不加奶j,,穿上这身制服就是帅气了不少啊,0,2019-09-30 14:17,2
@清风扬伊木,,这个敬礼真的好标准啊，我爱死韩东君了,0,2019-09-30 14:17,2
@冯悦卿茗婉桂,,韩东君真的是太帅了吧，谁能拒绝制服诱惑呢,0,2019-09-30 14:17,2
@变变变变成小富婆,,这敬礼干净利落 真的太帅气了 怎么会这么帅呢！,0,2019-09-30 14:15,2
@疯人院里的疯言疯语咩,,啊啊啊，韩东君这是要搞事情啊，帅的一批,0,2019-09-30 14:12,2
@可爱的静m,,穿制服的男人真帅气最帅飞行员,0,2019-09-30 14:09,2
@想做个好妈妈为什么那么难呢,,简直没谁了，对你太上头的感觉,0,2019-09-30 16:37,3
@给你一个煎蛋,,这简直是最帅的飞行员了,1,2019-09-30 17:01,2
@娇羞的小谷粒,,果然当兵的人就是帅，这制服穿的，太精神了,0,2019-09-30 16:45,3
@南有海草,,这制服太有气质了,0,2019-09-30 16:10,2
@wuchibo波波羽,,期待最帅飞行员韩东君带来的最燃征兵大片！在线支持，这个男人太man了姐妹们安排上,0,2019-09-30 15:20,2
@葛林民钧彬承雄,,穿制服的韩东君颜值要逆天了啊！这太有男人味了，满满的正气凛然，太爱这造型了,0,2019-09-30 15:11,2
@柠檬茶水呦,,感觉韩东君穿上制服真的很帅气啊，很适合他,0,2019-09-30 15:07,2
@柠檬不甜不腻么,,穿飞行员制服的韩东君真的是太帅了，而且很有魅力,0,2019-09-30 15:04,2
@Designer李可,,韩东君好帅啊，我最喜欢飞行员了，感觉好酷,0,2019-09-30 14:14,2
@一只独立行走的猪猪侠,,撩人呀啊,0,2019-09-30 17:53,6
@夏日里的勿忘我,,太帅了,0,2019-09-30 17:48,6
@你叫月亮,,想要嫁给韩东君，这也太帅了,0,2019-09-30 17:25,2
@小鱼儿与花孔雀,,因为韩东君的这个制服诱惑，特此来支持博主,0,2019-09-30 17:21,2
@彘美人的美人痣,,从小我们羡慕当警察的,0,2019-09-30 17:13,2
@小宋的爆炸生活,,这样一群人走出来一下就把我给镇住了，个个都很飒。,1,2019-09-30 16:57,2
@小星球的宇宙,,对穿制服的男人真的是毫无抵抗力，太帅了。,1,2019-09-30 16:55,2
@象厂咕噜球,,我和我的祖国最喜欢的就是这个part!又养眼又很燃!,1,2019-09-30 16:54,3
@来了恶露么,,我的天哪！真的特别帅气，已经被圈粉了啊,1,2019-09-30 16:49,2
@派大星lxlx,,必须是最帅男飞行员，瞬间成为了我男神,0,2019-09-30 16:46,3
@大瑾瑾利泽,,这也太帅了吧！哈哈哈我爱了，帅爆了真的,0,2019-09-30 16:43,2
@榴莲味冰淇淋哦哦哦,,哇，韩东君穿上制服也太帅了吧，迷倒我了,0,2019-09-30 16:42,3
@瓜皮本瓜呀,,韩东君真的好帅啊，很适合穿这种制服的,0,2019-09-30 16:42,2
@蓝依呼啦啦小魔仙,,满满的正气，满满的稳重，满满的正义，着制服的韩东君太帅了。你是最棒的飞行员,1,2019-09-30 16:36,2
@攒一屋的巧克力,,韩东君太有魅力了太喜欢他了干净利落,0,2019-09-30 16:32,2
@龙缺水火火,,今朝最帅飞行员韩东君让人着迷啊，太帅气了，气质超好，沉稳大气，真棒！,1,2019-09-30 16:32,2
@随风随你随我随她,,最帅的飞行员韩东君,0,2019-09-30 16:28,2
@爱吃雪糕的小仙女i,,韩东君太帅气了到处散发着魅力,0,2019-09-30 16:28,2
@雨滋万物欣,,韩东君穿制服真帅气，颜值爆表啦。好想自己也有一身制服啊,1,2019-09-30 16:27,2
@清泪美伊人,,最帅飞行员韩东君，颜值爆表，太帅了，为你疯狂打call。,0,2019-09-30 16:23,2
@柠萌树上,,超级喜欢这种正气的韩东君啊,0,2019-09-30 16:14,2
@陨恋自殇,,满满的一身正气，穿起制服来太帅气了,0,2019-09-30 16:13,2
@遇见的最好,,这姿势太帅了。,0,2019-09-30 16:11,2
@馋嘴的香蕉皮,,这身制服显得真的是太帅了,0,2019-09-30 16:11,2
@体面的主义,,韩东君的飞行服装太帅气，男子气概十足,0,2019-09-30 16:10,2
@柠檬树上的橘子耶,,啊啊啊我喜欢韩东君这帅帅的样子,0,2019-09-30 16:10,2
@荣兰飞娅,,我也是醉了，敬礼的动作太迷人了,2,2019-09-30 16:08,2
@请叫我小阿新啊,,韩东君真的帅炸了，太有魅力了,1,2019-09-30 16:08,2
@良辰美景和你共享,,韩东君的飞行员制服干净利落，简直酷炫,0,2019-09-30 16:08,2
@樊凡ert,,这一堆小哥哥都想抱走 敬礼的时候真的超有感觉 帅气,0,2019-09-30 16:07,2
@焦迈奇的猫-,,韩东君真的帅爆了！,0,2019-09-30 16:07,2
@遇见是多么美丽,,颜值爆表，喜欢。,0,2019-09-30 16:07,2
@取撒子昵称捏,,支持韩东君的作品呢，很帅气的，很想去看看。,0,2019-09-30 15:59,2
@芒果奶昔甜卷妹,,韩东君也太帅了吧，很适合演军人，真的很man！ 评论配图,0,2019-09-30 15:50,2
@小柒柒柒II,,韩东君也太man了吧，这个敬礼帅气到没朋友,0,2019-09-30 15:42,2
@是雩风Ya,,韩东君穿制服敬礼也太帅气了吧，一秒入坑,0,2019-09-30 15:38,2
@七尺女孩儿,,最帅的飞行员以上线，敬礼的姿势太帅了,0,2019-09-30 15:23,2
@一只流浪的乔治,,满满的正气，最帅的飞行员，迷死个人,0,2019-09-30 15:19,2
@东北滴滴叭叭,,穿制服的韩东君真的太帅了！！,0,2019-09-30 15:18,2
@古蓉宜枝婵静枝,,被这敬礼的动作帅到了，满满的正气！韩东君真是颜值超高一男的，“最帅飞行员”！,0,2019-09-30 15:15,2
@姐姐今天],,穿飞行员制服的韩东君好帅，被他迷住了,1,2019-09-30 14:59,2
@姐姐今天没化妆,,最帅男飞行员非小韩莫属，超飒,1,2019-09-30 14:59,2
@撸羊毛的小鹦鹉,,韩东君敬礼的动作太A了，满满的正气,1,2019-09-30 14:58,2
@酷爱三叶草a,,中国机长厉害了，大家一定要来支持啊,0,2019-09-30 14:49,2
@谁偷吃了我的葡萄z,,韩东君真的很帅，敬礼的动作真的很像个军人一样，干净利落。,1,2019-09-30 14:37,3
@答怒,,敬礼，干净利落。简直是帅爆。太喜欢了。非常期待。,0,2019-09-30 14:30,2
@琦琦的爷,,你就说我心目中最帅的飞行员非你莫属。,2,2019-09-30 14:25,2
@婕妈咪宝贝,,穿制服的韩东君好帅啊！真是最帅飞行员。 评论配图,2,2019-09-30 14:25,2
@柠萌柒水,,这个敬礼的动作我爱了,0,2019-09-30 14:24,2
@燕归巢YD,,真的是太帅了，太迷人了，爱了爱了,1,2019-09-30 14:24,2
@拾年一品温如颜,,表白韩东君，真的太帅了,0,2019-09-30 14:23,2
@我要甜果子,,你真的可以看称得上是最帅的飞行员了,1,2019-09-30 14:23,2
@小菇娘很拽,,飞行员韩东君敬礼干净利落！太帅了！,2,2019-09-30 14:22,2
@祝宁珠凡颖,,真的太帅了吧，敬礼真的太man了，我沉沦了！,1,2019-09-30 14:22,2
@学科目二,,制服的诱惑，太帅了,1,2019-09-30 14:22,2
@我的宝贝小琦,,真的没有抵抗力的呀，这种帅太帅了,1,2019-09-30 14:22,2
@申慧嘉青雅,,我觉得韩东君这个飞行员造型真的是帅炸了,0,2019-09-30 14:20,2
@一片纯净之下,,是我们心目中优秀的样子了，喜欢,0,2019-09-30 14:20,2
@罗逸啊,,这个男人帅气的没办法了， 评论配图,0,2019-09-30 14:19,2
@一口吃成猪头啦,,配的上“最帅飞行员”称号 敬礼都这么有魅力,0,2019-09-30 14:19,2
@娃哈哈哈哈哈哈超好喝啊,,从今天开始我就是韩东君的粉丝了，太有魅力了,0,2019-09-30 14:18,2
@超rent,,这个造型简直A爆了，太帅了，不光造型帅演技也非常好,0,2019-09-30 14:18,2
@time猫小喵,,能扛得住寸头的都是颜值杠杠的，两个字好看就对了，韩东君的制服视频可以再长点，完全磕不够,0,2019-09-30 14:17,2
@心灵存放的地方,,带上墨镜就是最帅的仔,0,2019-09-30 14:17,2
@哒哒的LR,,韩东君的硬汉形象深入人心，真的太man了。很适合这个角色。,0,2019-09-30 14:16,2
@LL一切都会那么好,,推荐大家去看这部电影。好的作品大家都会喜欢的。,0,2019-09-30 14:15,2
@自我的类型,,韩东君就是我心目中最帅的飞行员,0,2019-09-30 14:14,2
@AiLL哒哒,,粉上了韩东君，特别man的男人，硬汉形象,0,2019-09-30 14:14,2
@嗷熬敖傲獒,,承包一身飞行员制服的韩东君，要不要这么帅，小心心都给你还不行吗，为他点赞,0,2019-09-30 14:12,2
@御姐控玩物,,韩东君真的是帅到我了！！电影必须安排上,0,2019-09-30 14:11,3
@啊远xrs,,这个造型真的是没人能驾驭得了，非常的可啊,0,2019-09-30 14:10,2
@段子手罗wi,,穿上空军军服的韩东君太帅了,0,2019-09-30 14:09,2
@猫七菇凉的胡同小巷啊,,这样的制服诱惑，我是真的抵抗不了,0,2019-09-30 14:08,2
@今生有你有深度,,我觉得韩东君这个飞行员造型真的帅炸了,0,2019-09-30 14:08,2
@妙脆角哦,,感觉很不错的韩东君很帅气,1,2019-09-30 14:05,2
@恬碎乡心梦不成,,这个制服真的是为你量身制作的一样,1,2019-09-30 14:04,2
@真正农民,,#韩东君飞行员制服# 这样的男人好帅惹,5,2019-09-30 12:39,2
@今天的理想66,,荷尔蒙爆棚,0,2019-09-30 23:06,6
@ohhokok,,摧枯拉朽之力席卷全身！！！,0,2019-09-30 22:19,6
@一只独立行走的猪猪侠,,撩人呀啊,0,2019-09-30 17:53,6
@刘大梦me,,真是帅,0,2019-09-30 17:51,6
@明月何时有q,,喜欢,0,2019-09-30 17:50,8
@女汉子Monologue婧婧婧,,哇塞真帅,0,2019-09-30 17:49,7
@夏日里的勿忘我,,太帅了,0,2019-09-30 17:48,6
@K裘,,马上就可以在影院看到帅气的韩飞行员啦,0,2019-09-30 17:30,6
@我得好好学习努力赚钱呀,,为最帅男飞行员韩东君疯狂打call,0,2019-09-30 17:28,6
@今天的理想66,,荷尔蒙爆棚,0,2019-09-30 23:06,6
@ohhokok,,摧枯拉朽之力席卷全身！！！,0,2019-09-30 22:19,6
@一只独立行走的猪猪侠,,撩人呀啊,0,2019-09-30 17:53,6
@刘大梦me,,真是帅,0,2019-09-30 17:51,6
@明月何时有q,,喜欢,0,2019-09-30 17:50,8
@女汉子Monologue婧婧婧,,哇塞真帅,0,2019-09-30 17:49,7
@夏日里的勿忘我,,太帅了,0,2019-09-30 17:48,6
@K裘,,马上就可以在影院看到帅气的韩飞行员啦,0,2019-09-30 17:30,6
@我得好好学习努力赚钱呀,,为最帅男飞行员韩东君疯狂打call,0,2019-09-30 17:28,6